A1: 8:00 D1 GIRLS VARSITY | B1: 10:00 D II GIRLS VARSITY
A2: 8:20 D1 BOYS VARSITY | B2: 10:20 D II BOYS VARSITY
A3: 8:40 D1 GIRLS JV/FROSH | B3: 10:40 D II GIRLS JV/FROSH
A4: 9:00 D1 BOYS JV/FROSH | B4: 11:00 D II BOYS JV/FROSH
A5: 9:20 D1 GIRLS 10/12 | B5: 11:20 D II GIRLS 10/12
A6: 9:40 D1 BOYS 10/12 | B6: 11:40 D II BOYS 10/12

A1: 1 | B1: KATY ANDREWS | C1: LCC | D1: 0.48541666666666666
A2: 2 | B2: ERIN GILLINGHAM | C2: TP | D2: 0.4909722222222222
A3: 3 | B3: CAROLINE DRAPER | C3: RB | D3: 0.49652777777777779
A4: 4 | B4: ANA PRIM | C4: TP | D4: 0.49791666666666667
A5: 5 | B5: JESSIE BODENHAMER | C5: TP | D5: 0.50694444444444442
A6: 6 | B6: KATIE RENTZ | C6: MC | D6: 0.50902777777777775
A7: 7 | B7: ASHLIN YAHR | C7: TP | D7: 0.50972222222222219
A8: 8 | B8: EMILY OSGA | C8: PH | D8: 0.50972222222222219
A9: 9 | B9: MEGAN MORGAN | C9: TP | D9: 0.51041666666666663
A10: 10 | B10: JOANNA WHEATON | C10: PWY | D10: 0.51111111111111107
A11: 11 | B11: ALICIA TRUJILLO | C11: WV | D11: 0.51180555555555551
A12: 12 | B12: SAMANTHA ADAIR | C12: MC | D12: 0.51249999999999996
A13: 13 | B13: ELISE RANKIN | C13: WV | D13: 0.5131944444444444
A14: 14 | B14: CASEY LEAVITT | C14: POW | D14: 0.51597222222222228
A15: 15 | B15: AMANDA MOORE | C15: TP | D15: 0.51666666666666672
A16: 16 | B16: LEAH ELKIND | C16: LCC | D16: 0.51736111111111116
A17: 17 | B17: STEPHANIE COOK | C17: E CAP | D17: 0.51736111111111116
A18: 18 | B18: KATIE MARTIN | C18: E CAP | D18: 0.5180555555555556
A19: 19 | B19: COURTNEY CLARK | C19: LCC | D19: 0.52013888888888893
A20: 20 | B20: KIRSTEN MOORE | C20: CBAD | D20: 0.52083333333333337
A21: 21 | B21: SHELBY SIMS | C21: TP | D21: 0.52430555555555558
A22: 22 | B22: KATIE WICKS | C22: LCC | D22: 0.52500000000000002
A23: 23 | B23: RACHEL OHMAN | C23: TP | D23: 0.52569444444444446
A24: 24 | B24: ALICIA BLACK | C24: SP | D24: 0.52708333333333335
A25: 25 | B25: JANA DRAKE | C25: RB | D25: 0.52777777777777779
A26: 26 | B26: PHOEBE HARTNETT | C26: PH | D26: 0.52916666666666667
A27: 27 | B27: KERRY SIMMONDS | C27: TP | D27: 0.53333333333333333
A28: 28 | B28: NICOLE AURIGEMIMA | C28: CBAD | D28: 0.53680555555555554
A29: 29 | B29: CHELSEA MUMBY | C29: WV | D29: 0.53749999999999998
A30: 30 | B30: HAIDEE ORTIZ | C30: PWY | D30: 0.53749999999999998
A31: 31 | B31: MICHELLE BLACK | C31: RB | D31: 0.53749999999999998
A32: 32 | B32: CHELSEY HILL | C32: PH | D32: 0.53819444444444442
A33: 33 | B33: DIANA BENDER | C33: ECAM | D33: 0.54097222222222219
A34: 34 | B34: JENNY ZHUANG | C34: RB | D34: 0.54166666666666663
A35: 35 | B35: STEPHANIE CONSIGLIO | C35: E CAM | D35: 0.54374999999999996
A36: 36 | B36: CASSIE WICOFF | C36: RB | D36: 0.5444444444444444
A37: 37 | B37: LAUREN OERTIE | C37: CBAD | D37: 0.54652777777777772
A38: 38 | B38: KIM TAYLOR | C38: LCC | D38: 0.54652777777777772
A39: 39 | B39: CARLI KIERSTEAD | C39: PH | D39: 0.54861111111111116
A40: 40 | B40: RACHEL HARRINGTON | C40: LCC | D40: 0.55138888888888893
A41: 41 | B41: SARA STUDER | C41: E CAM | D41: 0.55208333333333337
A42: 42 | B42: SARA NAJAFI | C42: MC | D42: 0.55277777777777781
A43: 43 | B43: DANI MATONIS | C43: PWY | D43: 0.55277777777777781
A44: 44 | B44: JAMIE FERGUSON | C44: E CAP | D44: 0.55347222222222225
A45: 45 | B45: EMILY PARKER | C45: PH | D45: 0.5541666666666667
A46: 46 | B46: LAURA GONZALES | C46: MC | D46: 0.55763888888888891
A47: 47 | B47: MONICA CARRILLO | C47: MC | D47: 0.55902777777777779
A48: 48 | B48: NATALIE UDUWELLA | C48: PB | D48: 0.56111111111111112
A49: 49 | B49: LILIANA INIEGSTRA | C49: SP | D49: 0.56180555555555556
A50: 50 | B50: KIM TURNER | C50: SP | D50: 0.5625
A51: 51 | B51: CARLY BLISS | C51: RB | D51: 0.56319444444444444
A52: 52 | B52: ALEX MORGAN | C52: MC | D52: 0.56597222222222221
A53: 53 | B53: KELSEY PEPIN | C53: PH | D53: 0.56736111111111109
A54: 54 | B54: ROBIN KOTOW | C54: WV | D54: 0.5708333333333333
A55: 55 | B55: TONI AZVEDO | C55: PWY | D55: 0.57222222222222219
A56: 56 | B56: ANA NABOR | C56: PWY | D56: 0.57291666666666663
A57: 57 | B57: SARAH GEORGE | C57: MC | D57: 0.56597222222222221
A58: 58 | B58: KELSEY MOYER | C58: CBAD | D58: 0.57361111111111107
A59: 59 | B59: KELSIE RAMSEY | C59: E CAP | D59: 0.57777777777777772
A60: 60 | B60: MEGAN WALLER | C60: PWY | D60: 0.57847222222222228
A61: 61 | B61: KATIE LORENTZ | C61: PWY | D61: 0.58125000000000004
A62: 62 | B62: RACHEL RUPIE | C62: CBAD | D62: 0.56805555555555554
A63: 63 | B63: ASHLEY KEARNEY | C63: E CAP | D63: 0.58333333333333337
A64: 64 | B64: TARA SHOECRAFT | C64: WV | D64: 0.58402777777777781
A65: 65 | B65: LEIGHA SAUSSER | C65: PWY | D65: 0.58472222222222225
A66: 66 | B66: HOLLY NGUYEN | C66: PH | D66: 0.58472222222222225
A67: 67 | B67: VICTORIA NGUYEN | C67: PH | D67: 0.61527777777777781
A68: 68 | B68: JESSICA MIKIASKI | C68: WV | D68: 0.6381944444444444
A69: 69 | B69: MICHELLE ZHANG | C69: WV | D69: 0.65555555555555556

A1: 1 | B1: TRAVIS KUHLMAN | C1: WV | D1: 0.41180555555555554
A2: 2 | B2: MARK THOMAS | C2: PWY | D2: 0.42152777777777778
A3: 3 | B3: CRAIG LOVE | C3: MC | D3: 0.42291666666666666
A4: 4 | B4: KYLE PHIPPS | C4: E CAP | D4: 0.42638888888888887
A5: 5 | B5: ZACH PARIS | C5: TP | D5: 0.42708333333333331
A6: 6 | B6: GREGOR LLOYD SMITH | C6: TP | D6: 0.4284722222222222
A7: 7 | B7: SAMUEL ST.LAURENT | C7: E CAM | D7: 0.42986111111111114
A8: 8 | B8: RUS MONDAE | C8: SP | D8: 0.43125000000000002
A9: 9 | B9: JAKE WERTNER | C9: RB | D9: 0.43263888888888891
A10: 10 | B10: DILLON JACK | C10: TP | D10: 0.43472222222222223
A11: 11 | B11: RYAN BAIRD | C11: SP | D11: 0.4375
A12: 12 | B12: JARED FENLASON | C12: RB | D12: 0.4375
A13: 13 | B13: SEAN PROEHL | C13: RB | D13: 0.43819444444444444
A14: 14 | B14: PATRICK SHEEHAN | C14: SP | D14: 0.43819444444444444
A15: 15 | B15: BRYCE HOLEWINSKI | C15: RB | D15: 0.44027777777777777
A16: 16 | B16: DREW FLOOD | C16: RB | D16: 0.44166666666666665
A17: 17 | B17: GRANT QUACKENBUSH | C17: LCC | D17: 0.44305555555555554
A18: 18 | B18: PATRICK GREEN | C18: E CAP | D18: 0.44444444444444442
A19: 19 | B19: MIKE PAFFENBARGER | C19: E CAP | D19: 0.44513888888888886
A20: 20 | B20: NICK BEDROSIAN | C20: E CAP | D20: 0.44513888888888886
A21: 21 | B21: CHRIS TORRES | C21: E CAP | D21: 0.44583333333333336
A22: 22 | B22: TY HINES | C22: SP | D22: 0.44722222222222224
A23: 23 | B23: RYAN BUTLER | C23: SP | D23: 0.44861111111111113
A24: 24 | B24: CASPER JAKOBSEN | C24: CBAD | D24: 0.44861111111111113
A25: 25 | B25: DAVID MCEACHERN | C25: MC | D25: 0.44930555555555557
A26: 26 | B26: MILES SEGNI | C26: E CAP | D26: 0.44930555555555557
A27: 27 | B27: MICHAEL WESENDORG | C27: E CAM | D27: 00.45
A28: 28 | B28: JORDAN TEEPLES | C28: PWY | D28: 00.45
A29: 29 | B29: JARED ATKINSON | C29: E CAP | D29: 0.4513888888888889
A30: 30 | B30: ERIK FIGGE | C30: PH | D30: 0.4513888888888889
A31: 31 | B31: BRIAN LANE | C31: TP | D31: 0.45277777777777778
A32: 32 | B32: MICHAEL | C32: TP | D32: 0.45277777777777778
A33: 33 | B33: JEREMY BLACK | C33: TP | D33: 0.45277777777777778
A34: 34 | B34: COSTNER MCINTOSH | C34: PH | D34: 0.45347222222222222
A35: 35 | B35: RYAN MOURY | C35: PWY | D35: 0.45555555555555555
A36: 36 | B36: SHANE SKELLY | C36: LCC | D36: 0.45624999999999999
A37: 37 | B37: TIM BLACK | C37: TP | D37: 0.45624999999999999
A38: 38 | B38: OLIVER ORTLICH | C38: SP | D38: 0.45694444444444443
A39: 39 | B39: BRIAN MITCHELL | C39: WV | D39: 0.4597222222222222
A40: 40 | B40: PEACE | C40: CBAD | D40: 0.46111111111111114
A41: 41 | B41: MATT LENEHAN | C41: TP | D41: 0.46250000000000002
A42: 42 | B42: RYAN KEEGAN | C42: CBAD | D42: 0.46319444444444446
A43: 43 | B43: JESUS PASQUAL | C43: E CAM | D43: 0.46319444444444446
A44: 44 | B44: KYLE STEPHAN | C44: WV | D44: 0.46388888888888891
A45: 45 | B45: FELIX MARTINEZ | C45: PH | D45: 0.46458333333333335
A46: 46 | B46: RYAN BRINIGAR | C46: MC | D46: 0.46527777777777779
A47: 47 | B47: NATE DANCHER | C47: TP | D47: 0.46597222222222223
A48: 48 | B48: C CABALLERO | C48: PH | D48: 0.46736111111111112
A49: 49 | B49: NICK HOLLON | C49: PWY | D49: 0.47083333333333333
A50: 50 | B50: DAVID CARLSON | C50: RB | D50: 0.47152777777777777
A51: 51 | B51: DAN MALONE | C51: MC | D51: 0.47152777777777777
A52: 52 | B52: ANDREW MCCLANAHAN | C52: MC | D52: 0.47222222222222221
A53: 53 | B53: MATTHEW VETTEL | C53: CBAD | D53: 0.47222222222222221
A54: 54 | B54: PHILIP KINDER | C54: PH | D54: 0.47499999999999998
A55: 55 | B55: DANIEL GOMEZ | C55: E CAM | D55: 0.47569444444444442
A56: 56 | B56: ISSAC LEW | C56: WV | D56: 0.4777777777777778
A57: 57 | B57: COCHRAN | C57: CBAD | D57: 0.4777777777777778
A58: 58 | B58: GRANT RINEHART | C58: LCC | D58: 0.47847222222222224
A59: 59 | B59: M. JGUYEN | C59: PH | D59: 0.47916666666666669
A60: 60 | B60: HUSSEIN ALASADY | C60: WV | D60: 0.47916666666666669
A61: 61 | B61: DANA WALTERS | C61: LCC | D61: 0.47986111111111113
A62: 62 | B62: NATH NAREVSKY | C62: PWY | D62: 0.48055555555555557
A63: 63 | B63: WILL MUMBY | C63: WV | D63: 0.48194444444444445
A64: 64 | B64: DANIEL CLARK | C64: CBAD | D64: 0.48402777777777778
A65: 65 | B65: CHRISTOPHER EGGETT | C65: PH | D65: 0.48680555555555555
A66: 66 | B66: D TOSTODO | C66: PH | D66: 0.48819444444444443
A67: 67 | B67: MIKE LAZAREZ | C67: PWY | D67: 0.49236111111111114
A68: 68 | B68: CHRIS NOBLE | C68: E CAM | D68: 0.49791666666666667
A69: 69 | B69: JOE CONNOLLY | C69: MC | D69: 0.50138888888888888
A70: 70 | B70: JOHN MAHEU | C70: WV | D70: 0.50486111111111109
A71: 71 | B71: MARK CHAN | C71: PWY | D71: 0.5083333333333333
A72: 72 | B72: SAM MUELLER | C72: LCC | D72: 0.51249999999999996
A73: 73 | B73: COLTON BRAZIER | C73: LCC | D73: 0.51875000000000004
A74: 74 | B74: MATT NEWMAN | C74: LCC | D74: 0.53472222222222221
A75: 75 | B75: TROY EDWARDS | C75: LCC | D75: 0.55555555555555558

B1: NAME | C1: SCHOOL | D1: TIME
A2: 1 | B2: MCKENNA PLANT | C2: SAN PASQUAL | D2: 0.52777777777777779
A3: =A2+1 -> 2 | B3: ERIN MENEFEE | C3: MT. CARMEL | D3: 0.53819444444444442
A4: =A3+1 -> 3 | B4: ALYSSA ZAFUTA | C4: TP | D4: 0.54166666666666663
A5: =A4+1 -> 4 | B5: NINA SCHEEPERS | C5: RANCHO BERNARDO | D5: 0.56874999999999998
A6: =A5+1 -> 5 | B6: EMMA ARCHULETA | C6: POWAY | D6: 0.57291666666666663
A7: =A6+1 -> 6 | B7: HILARY HALL | C7: WESTVIEW | D7: 0.57430555555555551
A8: =A7+1 -> 7 | B8: COURTNEY HEDGECOCK | C8: MT. CARMEL | D8: 0.57499999999999996
A9: =A8+1 -> 8 | B9: MICHELLE RUGG | C9: RANCHO BERNARDO | D9: 0.57708333333333328
A10: =A9+1 -> 9 | B10: PATRICE WATSON | C10: TP | D10: 0.57777777777777783
A11: =A10+1 -> 10 | B11: MADELINE GOLDKAMP | C11: MT. CARMEL | D11: 0.58611111111111114
A12: =A11+1 -> 11 | B12: CHELSEA MAURER | C12: PHHS | D12: 0.59166666666666667
A13: =A12+1 -> 12 | B13: MELANIE CONSIGLIO | C13: EL CAMINO | D13: 0.59513888888888888
A14: =A13+1 -> 13 | B14: CASEY BURGESS | C14: RANCHO BERNARDO | D14: 0.59583333333333333
A15: =A14+1 -> 14 | B15: CARLY PFIZENMELER | C15: PHHS | D15: 0.59861111111111109
A16: =A15+1 -> 15 | B16: ANNE DIHENANS | C16: TP | D16: 0.59861111111111109
A17: =A16+1 -> 16 | B17: LEAH STAMER | C17: TP | D17: 0.60069444444444442
A18: =A17+1 -> 17 | B18: SUSI BLASIEO | C18: TP | D18: 0.60416666666666663
A19: =A18+1 -> 18 | B19: CAROLYN PONTING | C19: PHHS | D19: 0.60486111111111118
A20: =A19+1 -> 19 | B20: SYDNIE GREENFIELD | C20: SAN PASQUAL | D20: 0.60555555555555551
A21: =A20+1 -> 20 | B21: KIMBERLY MCNULLEY | C21: TP | D21: 0.60624999999999996
A22: =A21+1 -> 21 | B22: MELISSA POPEJOY | C22: POWAY | D22: 0.6069444444444444
A23: =A22+1 -> 22 | B23: HANNAH COONEY | C23: SAN PASQUAL | D23: 0.60902777777777783
A24: =A23+1 -> 23 | B24: DEBORAH DORKO | C24: POWAY | D24: 0.60972222222222217
A25: =A24+1 -> 24 | B25: ERIKA VAN SICKEL | C25: MT. CARMEL | D25: 0.61041666666666672
A26: =A25+1 -> 25 | B26: MEGAN WILLIS | C26: EL CAP | D26: 0.6118055555555556
A27: =A26+1 -> 26 | B27: KATHLEEN MACGREGOR | C27: POWAY | D27: 0.61458333333333337
A28: =A27+1 -> 27 | B28: AMY BLELLOCH | C28: POWAY | D28: 0.61458333333333337
A29: =A28+1 -> 28 | B29: ELIZABETH LORENTZ | C29: POWAY | D29: 0.61736111111111114
A30: =A29+1 -> 29 | B30: JESSICA IBARRA | C30: POWAY | D30: 0.61805555555555558
A31: =A30+1 -> 30 | B31: KRISTIE BAER | C31: PHHS | D31: 0.62013888888888891
A32: =A31+1 -> 31 | B32: GENEVIEVA STONE | C32: POWAY | D32: 0.62222222222222223
A33: =A32+1 -> 32 | B33: ERIN FINK | C33: PHHS | D33: 0.62222222222222223
A34: =A33+1 -> 33 | B34: JORDYN MOORE | C34: LCC | D34: 0.62291666666666667
A35: =A34+1 -> 34 | B35: KACIE KENTON | C35: POWAY | D35: 0.62361111111111112
A36: =A35+1 -> 35 | B36: SHERRA HALL | C36: WESTVIEW | D36: 0.62638888888888888
A37: =A36+1 -> 36 | B37: MICHELLE CHOW | C37: TP | D37: 0.62708333333333333
A38: =A37+1 -> 37 | B38: CHELCIE PAYTON | C38: TP | D38: 0.62708333333333333
A39: =A38+1 -> 38 | B39: JESSA TREMBLAY | C39: POWAY | D39: 0.62777777777777777
A40: =A39+1 -> 39 | B40: HANNAHA CLEMENTS | C40: POWAY | D40: 0.62847222222222221
A41: =A40+1 -> 40 | B41: NICOLE WPYCHOWSKI | C41: TP | D41: 0.62847222222222221
A42: =A41+1 -> 41 | B42: AMANDA BLUME | C42: MT. CARMEL | D42: 0.63055555555555554
A43: =A42+1 -> 42 | B43: SUSAN REDLINGER | C43: PHHS | D43: 0.63194444444444442
A44: =A43+1 -> 43 | B44: HANNAH BEEDE | D44: 0.63263888888888886
A45: =A44+1 -> 44 | B45: BROOKE HARTLEY | C45: CARLSBAD | D45: 0.63888888888888895
A46: =A45+1 -> 45 | B46: CELIA MACPHAL | C46: TP | D46: 0.63888888888888895
A47: =A46+1 -> 46 | B47: AMANDA ALDERTON | C47: RANCHO BERNARDO | D47: 0.64027777777777783
A48: =A47+1 -> 47 | B48: JESSIAC TAMAYO | C48: EL CAMINO | D48: 0.64027777777777783
A49: =A48+1 -> 48 | B49: SARA ORFIELD | C49: TP | D49: 0.64166666666666672
A50: =A49+1 -> 49 | B50: JENNY BLACK | C50: TP | D50: 0.6430555555555556
A51: =A50+1 -> 50 | B51: OLIVA KRZEMINSKI | C51: RANCHO BERNARDO | D51: 0.64375000000000004
A52: =A51+1 -> 51 | B52: HILLARY HEINAN | C52: TP | D52: 0.64375000000000004
A53: =A52+1 -> 52 | B53: KELSEY ERSKIN | C53: RANCHO BERNARDO | D53: 0.64444444444444449
A54: =A53+1 -> 53 | B54: HANNAH KOTKOV | C54: TP | D54: 0.64513888888888882
A55: =A54+1 -> 54 | B55: CHANTAE REDEN | C55: RANCHO BERNARDO | D55: 0.65277777777777779
A56: =A55+1 -> 55 | B56: KIMBERLY BAER | C56: PHHS | D56: 0.65277777777777779
A57: =A56+1 -> 56 | B57: JORDAN SWEEZEY | C57: WESTVIEW | D57: 0.65555555555555556
A58: =A57+1 -> 57 | B58: LACEY VERHALEN | C58: LCC | D58: 0.65833333333333333
A59: =A58+1 -> 58 | B59: KATIE BELL WHEELOCK | C59: SAN PASQUAL | D59: 0.65902777777777777
A60: =A59+1 -> 59 | B60: CALLIE AZAR | C60: WESTVIEW | D60: 0.65902777777777777
A61: =A60+1 -> 60 | B61: JAIME HILL | C61: PHHS | D61: 0.65902777777777777
A62: =A61+1 -> 61 | B62: CUALLI HERNANDEZ | C62: EL CAP | D62: 0.66111111111111109
A63: =A62+1 -> 62 | B63: HANNAH LIECHT | C63: EL CAMINO | D63: 0.66388888888888886
A64: =A63+1 -> 63 | B64: WILMERS COURTNEY | C64: PHHS | D64: 0.66527777777777775
A65: =A64+1 -> 64 | B65: TAYLOR DEISINGER | C65: CARLSBAD | D65: 0.66597222222222219
A66: =A65+1 -> 65 | B66: SHELBY ONEAL | C66: PHHS | D66: 0.66736111111111107
A67: =A66+1 -> 66 | B67: BARBARA SUGARMAN | C67: WESTVIEW | D67: 0.66805555555555562
A68: =A67+1 -> 67 | B68: ERIN ESTER | C68: PHHS | D68: 0.66874999999999996
A69: =A68+1 -> 68 | B69: LAURA REDLINGER | C69: PHHS | D69: 0.68263888888888891
A70: =A69+1 -> 69 | B70: CHRISTINE CARSON | C70: CARLSBAD | D70: 0.68402777777777779
A71: =A70+1 -> 70 | B71: JULIET MURDOCH | C71: PHHS | D71: 0.68611111111111101
A72: =A71+1 -> 71 | B72: CAROLINE REYES | C72: EL CAP | D72: 0.6875
A73: =A72+1 -> 72 | B73: MICHELA MONET | C73: RANCHO BERNARDO | D73: 0.68958333333333333
A74: =A73+1 -> 73 | B74: ALLISON BRANCH | C74: PHHS | D74: 0.69444444444444453
A75: =A74+1 -> 74 | B75: MAGGIE MCCORMIKC | C75: PHHS | D75: 00.7
A76: =A75+1 -> 75 | B76: SHANNON JUPENA-GARIBAY | C76: PHHS | D76: 0.70972222222222225
A77: =A76+1 -> 76 | B77: ANDREA HOWE | C77: LCC | D77: 0.7104166666666667
A78: =A77+1 -> 77 | B78: HALIE ALBERTSON | C78: WESTVIEW | D78: 0.71597222222222223
A79: =A78+1 -> 78 | B79: MIMI NISHIBUCHI | C79: LCC | D79: 0.72083333333333333
A80: =A79+1 -> 79 | B80: B. LU | C80: PHS | D80: 0.72916666666666663
A81: =A80+1 -> 80 | B81: REAGAN ORME | C81: LCC | D81: 0.72916666666666663
A82: =A81+1 -> 81 | B82: NOEMI RAMIREZ | C82: EL CAMINO | D82: 0.73055555555555562
A83: =A82+1 -> 82 | B83: TRAN LE | C83: PHHS | D83: 0.73055555555555562
A84: =A83+1 -> 83 | B84: RUBY RIVERA | C84: LCC | D84: 0.7319444444444444
A85: =A84+1 -> 84 | B85: MICHELLE NICOLAS | C85: CARLSBAD | D85: 0.74930555555555556
A86: =A85+1 -> 85 | B86: CARLY DUDER | C86: LCC | D86: 0.76180555555555562
A87: =A86+1 -> 86 | B87: STACY ROOME | C87: PHHS | D87: 0.77500000000000002
A88: =A87+1 -> 87 | B88: MACKINZIE MCMANUS | C88: LCC | D88: 0.77916666666666667
A89: =A88+1 -> 88 | B89: EMILY ELKIND | C89: LCC | D89: 0.78125
A90: =A89+1 -> 89 | B90: LILI EAN | C90: PHHS | D90: 0.80347222222222225
A91: =A90+1 -> 90 | B91: KRISTINE PARRA | C91: LCC | D91: 0.87569444444444444

A1: 1 | B1: PARKER STINSON | C1: RANCHO BERNARDO | D1: 0.44305555555555554
A2: 2 | B2: ADRIAN RAFIEE | C2: PATRICK HENRY | D2: 0.45902777777777781
A3: 3 | B3: DYLAN WINGROVE | C3: SAN PASQUAL | D3: 0.46458333333333335
A4: 4 | B4: ALEX JAFEK | C4: TORREY PINES | D4: 0.47569444444444442
A5: 5 | B5: JOSEPH LYON | C5: TORREY PINES | D5: 0.4770833333333333
A6: 6 | B6: KEVIN SCHUBERT | C6: RANCHO BERNARDO | D6: 0.47847222222222219
A7: 7 | B7: STE[HAN MOSS | C7: POWAY | D7: 0.47916666666666669
A8: 8 | B8: ALEC WEBSTER | C8: TORREY PINES | D8: 0.48055555555555557
A9: 9 | B9: KELLEN BLUMBERG | C9: PATRICK HENRY | D9: 0.48125000000000001
A10: 10 | B10: NICK HAINES | C10: PATRICK HENRY | D10: 0.4826388888888889
A11: 11 | B11: ULISES MARIN | C11: EL CAMINO | D11: 0.4826388888888889
A12: 12 | B12: CHRIS WALKER | C12: EL CAPITAN | D12: 0.48402777777777778
A13: 13 | B13: ADAM SMITH | C13: POWAY | D13: 0.48472222222222222
A14: 14 | B14: CONNOR KUHLMAN | C14: WESTVIEW | D14: 0.48472222222222222
A15: 15 | B15: JACOB WOOD | C15: MT. CARMEL | D15: 0.4861111111111111
A16: 16 | B16: KYLE MORAN | C16: EL CAPITAN | D16: 0.48958333333333331
A17: 17 | B17: DYLAN MAX | C17: TORREY PINES | D17: 0.4909722222222222
A18: 18 | B18: MICHAEL ROMERO | C18: POWAY | D18: 0.49236111111111108
A19: 19 | B19: DAVID VASKO | C19: MT. CARMEL | D19: 0.49444444444444446
A20: 20 | B20: BRETT GUTIERREZ | C20: PATRICK HENRY | D20: 0.49444444444444446
A21: 21 | B21: KYLE PLUTCHAK | C21: WESTVIEW | D21: 0.49513888888888885
A22: 22 | B22: MARK EDSTROM | C22: POWAY | D22: 0.49583333333333335
A23: 23 | B23: ROSCOE MILNER | C23: TORREY PINES | D23: 0.49791666666666662
A24: 24 | B24: JAMES PATTERSON | C24: TORREY PINES | D24: 0.4993055555555555
A25: 25 | B25: NOAH RESTO | C25: RANCHO BERNARDO | D25: 0.4993055555555555
A26: 26 | B26: ROBERT SMITH | C26: WESTVIEW | D26: 0.50138888888888888
A27: 27 | B27: JOSH SHELINE | C27: TORREY PINES | D27: 0.50277777777777777
A28: 28 | B28: CASEY DUGAN | C28: PATRICK HENRY | D28: 0.50555555555555554
A29: 29 | B29: MICHAEL DEAN | C29: PATRICK HENRY | D29: 0.50972222222222219
A30: 30 | B30: NICK TAYLOR | C30: PATRICK HENRY | D30: 0.51041666666666663
A31: 31 | B31: TODD DILLION | C31: TORREY PINES | D31: 0.51041666666666663
A32: 32 | B32: TAYLOR TURNER | C32: CARLSBAD | D32: 0.51041666666666663
A33: 33 | B33: SEAN MULDERIG | C33: PATRICK HENRY | D33: 0.51180555555555551
A34: 34 | B34: ALEX THOMAS | C34: PATRICK HENRY | D34: 0.51388888888888895
A35: 35 | B35: MIKE BISHOP | C35: EL CAPITAN | D35: 0.51597222222222217
A36: 36 | B36: NICK TAMMADGE | C36: PATRICK HENRY | D36: 0.51666666666666672
A37: 37 | B37: LIAM ACOSTA | C37: EL CAMINO | D37: 0.51666666666666672
A38: 38 | B38: SPENCER EVERETT | C38: PATRICK HENRY | D38: 0.51875000000000004
A39: 39 | B39: BLAIR LOVE | C39: MT. CARMEL | D39: 0.51944444444444449
A40: 40 | B40: CONNER SCHWARDIFEGER | C40: CARLSBAD | D40: 0.52013888888888882
A41: 41 | B41: GABE BERKLAND | C41: POWAY | D41: 0.52013888888888882
A42: 42 | B42: TODD CLARKE | C42: EL CAPITAN | D42: 0.52083333333333337
A43: 43 | B43: TONY GARDELLA | C43: PATRICK HENRY | D43: 0.52152777777777781
A44: 44 | B44: RODRIGO CHAVEZ | C44: SAN PASQUAL | D44: 0.52152777777777781
A45: 45 | B45: CODY WHITE | C45: WESTVIEW | D45: 0.52152777777777781
A46: 46 | B46: MATT JOHNSON | C46: MT. CARMEL | D46: 0.52222222222222225
A47: 47 | B47: MICHAEL LOVE | C47: WESTVIEW | D47: 0.5229166666666667
A48: 48 | B48: GREG HAMMAR | C48: LA COSTA CANYON | D48: 0.5229166666666667
A49: 49 | B49: DEREK HOLDEN | C49: POWAY | D49: 0.5229166666666667
A50: 50 | B50: CORY MACDONALD | C50: TORREY PINES | D50: 0.52361111111111114
A51: 51 | B51: AARON BARRANCO | C51: PATRICK HENRY | D51: 0.52361111111111114
A52: 52 | B52: VINCENT HENG | C52: MT. CARMEL | D52: 0.52430555555555558
A53: 53 | B53: RYLEY WEBB | C53: RANCHO BERNARDO | D53: 0.52500000000000002
A54: 54 | B54: CHASE CABRERA | C54: PATRICK HENRY | D54: 0.52569444444444446
A55: 55 | B55: SCOTT ROBISON | C55: RANCHO BERNARDO | D55: 0.52847222222222223
A56: 56 | B56: MICHAEL BUSH | C56: POWAY | D56: 0.53055555555555556
A57: 57 | B57: ANDREW GORDON | C57: PATRICK HENRY | D57: 0.53125
A58: 58 | B58: LUKE DIEDRICH | C58: PATRICK HENRY | D58: 0.53194444444444444
A59: 59 | B59: MATT KUCHARSKI | C59: PATRICK HENRY | D59: 0.53263888888888888
A60: 60 | B60: KEVIN KEMMERRER | C60: WESTVIEW | D60: 0.53263888888888888
A61: 61 | B61: AUSTIN GRAY | C61: POWAY | D61: 0.53333333333333333
A62: 62 | B62: COLE OROSS | C62: MT. CARMEL | D62: 0.53402777777777777
A63: 63 | B63: KEVIN HAN | C63: CARLSBAD | D63: 0.53472222222222221
A64: 64 | B64: JOSH BLESSING | C64: WESTVIEW | D64: 0.53680555555555554
A65: 65 | B65: NICHOLAS KOURIS | C65: WESTVIEW | D65: 0.53680555555555554
A66: 66 | B66: CASEY SUMNER | C66: RANCHO BERNARDO | D66: 0.53749999999999998
A67: 67 | B67: ERIC SHEN | C67: WESTVIEW | D67: 0.53819444444444442
A68: 68 | B68: DUANE PALMER | C68: PATRICK HENRY | D68: 0.53819444444444442
A69: 69 | B69: DYLAN FERNANDEZ | C69: POWAY | D69: 0.54027777777777775
A70: 70 | B70: CONNOR WYNVEEN | C70: PATRICK HENRY | D70: 0.54027777777777775
A71: 71 | B71: CASEY OLSON | C71: WESTVIEW | D71: 0.54027777777777775
A72: 72 | B72: JARED MOORE | C72: TORREY PINES | D72: 0.54097222222222219
A73: 73 | B73: JONCARLO PUTMAN | C73: PATRICK HENRY | D73: 0.54236111111111118
A74: 74 | B74: JARED SERVANTEZ | C74: MT. CARMEL | D74: 0.54305555555555551
A75: 75 | B75: MATT SMITH | C75: MT. CARMEL | D75: 0.54374999999999996
A76: 76 | B76: TYLER STEMLEY | C76: EL CAMINO | D76: 0.54513888888888895
A77: 77 | B77: DERRICK ALTRINGER | C77: EL CAPITAN | D77: 0.54722222222222217
A78: 78 | B78: BRENDAN LUND | C78: SAN PASQUAL | D78: 0.54722222222222217
A79: 79 | B79: BRETT OSMUS | C79: POWAY | D79: 0.54861111111111105
A80: 80 | B80: CONNOR MCBRIDE | C80: TORREY PINES | D80: 0.54861111111111105
A81: 81 | B81: RICARDO RIVAS | C81: EL CAMINO | D81: 0.55138888888888882
A82: 82 | B82: KEVIN MERIWETHER | C82: PATRICK HENRY | D82: 0.55277777777777781
A83: 83 | B83: STEVEN GAGNIERE | C83: PATRICK HENRY | D83: 0.55347222222222225
A84: 84 | B84: TRAVIS PARKER | C84: EL CAMINO | D84: 0.55347222222222225
A85: 85 | B85: ERIC STUCK | C85: PATRICK HENRY | D85: 0.5541666666666667
A86: 86 | B86: JASON MORPETH | C86: POWAY | D86: 0.5541666666666667
A87: 87 | B87: WESLEY JORDAN | C87: POWAY | D87: 0.55486111111111114
A88: 88 | B88: KEVIN HARRIS | C88: POWAY | D88: 0.55486111111111114
A89: 89 | B89: KEVIN PORTER | C89: SAN PASQUAL | D89: 0.55555555555555558
A90: 90 | B90: SHANE MAHER | C90: EL CAMINO | D90: 0.55625000000000002
A91: 91 | B91: THOMAS BARRETT | C91: EL CAPITAN | D91: 0.55694444444444446
A92: 92 | B92: JAMES SANUMAN | C92: EL CAPITAN | D92: 0.55763888888888891
A93: 93 | B93: CALEB HARLEY | C93: PATRICK HENRY | D93: 0.56041666666666667
A94: 94 | B94: DEREK MELZER | C94: SAN PASQUAL | D94: 0.56111111111111112
A95: 95 | B95: MATT MCMARTHY | C95: WESTVIEW | D95: 0.56180555555555556
A96: 96 | B96: TYLER SALAS | C96: MT. CARMEL | D96: 0.56180555555555556
A97: 97 | B97: PHILIP WALTERS | C97: LA COSTA CANYON | D97: 0.5625
A98: 98 | B98: JOHNNY WILLIAMS | C98: POWAY | D98: 0.56319444444444444
A99: 99 | B99: CODY SUTTON | C99: PATRICK HENRY | D99: 0.56319444444444444
A100: 100 | B100: TOM BRUIRE | C100: CARLSBAD | D100: 0.56319444444444444
A101: 101 | B101: DAVID RUBIN | C101: LA COSTA CANYON | D101: 0.56458333333333333
A102: 102 | B102: DEREK KAY | C102: MT. CARMEL | D102: 0.56736111111111109
A103: 103 | B103: LEHVI BARNETT | C103: PATRICK HENRY | D103: 0.56805555555555554
A104: 104 | B104: JACK RENTZ | C104: MT. CARMEL | D104: 0.56874999999999998
A105: 105 | B105: AARON JOHNSON | C105: PATRICK HENRY | D105: 0.5708333333333333
A106: 106 | B106: NOAH TYE | C106: WESTVIEW | D106: 0.57291666666666663
A107: 107 | B107: SAMUEL POND | C107: POWAY | D107: 0.57361111111111118
A108: 108 | B108: REGGIE SUNG | C108: WESTVIEW | D108: 0.57430555555555551
A109: 109 | B109: JAMES JORDAN | C109: EL CAMINO | D109: 0.57430555555555551
A110: 110 | B110: DEAN MURDOCH | C110: PATRICK HENRY | D110: 0.5756944444444444
A111: 111 | B111: BRIAN IE | C111: MT. CARMEL | D111: 0.57638888888888895
A112: 112 | B112: TONY YANG | C112: WESTVIEW | D112: 0.57708333333333328
A113: 113 | B113: ERIC TSAI | C113: TORREY PINES | D113: 0.57777777777777783
A114: 114 | B114: BRANDON MITZUTANI | C114: LA COSTA CANYON | D114: 0.57986111111111105
A115: 115 | B115: SHAUGHN REILLY | C115: PATRICK HENRY | D115: 0.58194444444444449
A116: 116 | B116: BRETT COTTAM | C116: LA COSTA CANYON | D116: 0.5854166666666667
A117: 117 | B117: ZACH LEIGHTON | C117: MT. CARMEL | D117: 0.58611111111111114
A118: 118 | B118: DANIEL QU | C118: TORREY PINES | D118: 0.58680555555555558
A119: 119 | B119: TREVOR HAYNES | C119: LA COSTA CANYON | D119: 0.59166666666666667
A120: 120 | B120: NICK ROY | C120: LA COSTA CANYON | D120: 0.59166666666666667
A121: 121 | B121: BEN WANCEWICZ | C121: RANCHO BERNARDO | D121: 0.59652777777777777
A122: 122 | B122: RYAN DAVIS | C122: RANCHO BERNARDO | D122: 0.59722222222222221
A123: 123 | B123: CALVIN HENDRIX | C123: SAN PASQUAL | D123: 0.59791666666666665
A124: 124 | B124: JOHN LY | C124: PATRICK HENRY | D124: 0.59930555555555554
A125: 125 | B125: RAMON CID | C125: EL CAMINO | D125: 0.60138888888888886
A126: 126 | B126: RYAN COOK | C126: EL CAMINO | D126: 0.60555555555555551
A127: 127 | B127: MATHOUCHANH MANDARIN | C127: PATRICK HENRY | D127: 0.60902777777777783
A128: 128 | B128: RYAN HUDGING | C128: RANCHO BERNARDO | D128: 0.61041666666666672
A129: 129 | B129: ZACH EASTER | C129: SAN PASQUAL | D129: 0.61944444444444446
A130: 130 | B130: BRYCE WHITE | C130: SAN PASQUAL | D130: 0.62361111111111112
A131: 131 | B131: SKYLAR WARREN | C131: RANCHO BERNARDO | D131: 0.62569444444444444
A132: 132 | B132: ADRIAN LEDESMA | C132: EL CAMINO | D132: 0.63263888888888886
A133: 133 | B133: VINCENT WONG | C133: WESTVIEW | D133: 0.63263888888888886
A134: 134 | B134: JOSH DUTTON | C134: TORREY PINES | D134: 0.6333333333333333
A135: 135 | B135: JOHN O'BRIEN | C135: PATRICK HENRY | D135: 0.64097222222222217
A136: 136 | B136: ERIC SMITH | C136: LA COSTA CANYON | D136: 0.64444444444444449
A137: 137 | B137: ERICK ZSUTTY | C137: EL CAMINO | D137: 0.64583333333333337
A138: 138 | B138: JEREMY LEONARD | C138: SAN PASQUAL | D138: 0.64722222222222225
A139: 139 | B139: DEVON AGUILA | C139: PATRICK HENRY | D139: 0.66388888888888886
A140: 140 | B140: JAMES LOGAN | C140: MT. CARMEL | D140: 0.68680555555555556

A1: 1 | B1: SARAH GILL | C1: TP | D1: 0.55972222222222223
A2: =A1+1 -> 2 | B2: TAYLOR PARKER | C2: RANCHO BERNARDO | D2: 0.56041666666666667
A3: =A2+1 -> 3 | B3: MICHELLE THOMPSON | C3: MT. CARMEL | D3: 0.56527777777777777
A4: =A3+1 -> 4 | B4: LAURA DUENSING | C4: MT. CARMEL | D4: 0.56874999999999998
A5: =A4+1 -> 5 | B5: KAITLIN DANSSAERT | C5: TP | D5: 0.56944444444444442
A6: =A5+1 -> 6 | B6: BECKY ROLYPH | C6: TP | D6: 0.57986111111111105
A7: =A6+1 -> 7 | B7: TARA COWEN | C7: RANCHO BERNARDO | D7: 0.58125000000000004
A8: =A7+1 -> 8 | B8: ALYSSA SEMERDJIAN | C8: TP | D8: 0.58125000000000004
A9: =A8+1 -> 9 | B9: MIMI LOPEZ | C9: LCC | D9: 0.58750000000000002
A10: =A9+1 -> 10 | B10: LEAH SANDOVAL | C10: SAN PASQUAL | D10: 0.58958333333333335
A11: =A10+1 -> 11 | B11: MACKENZIE CARTIN | C11: EL CAMINO | D11: 0.59166666666666667
A12: =A11+1 -> 12 | B12: CINDY PERALTA | C12: MT. CARMEL | D12: 0.59861111111111109
A13: =A12+1 -> 13 | B13: BROOKE BROWN | C13: EL CAMINO | D13: 0.59930555555555554
A14: =A13+1 -> 14 | B14: ASHLEY SCHMIT | C14: POWAY | D14: 0.60138888888888886
A15: =A14+1 -> 15 | B15: THERESE REDLINGER | C15: PHHS | D15: 0.60347222222222219
A16: =A15+1 -> 16 | B16: LINDSEY BAUER | C16: POWAY | D16: 0.6069444444444444
A17: =A16+1 -> 17 | B17: CORRINA HEIBERG | C17: WESTVIEW | D17: 0.60763888888888895
A18: =A17+1 -> 18 | B18: CARA YAP | C18: RANCHO BERNARDO | D18: 0.60833333333333328
A19: =A18+1 -> 19 | B19: STEPHANIE DAO | C19: LCC | D19: 0.60902777777777783
A20: =A19+1 -> 20 | B20: BLAIR WILLIAMS | C20: TP | D20: 0.60972222222222217
A21: =A20+1 -> 21 | B21: MERIEL MELENDREZ | C21: POWAY | D21: 0.61041666666666672
A22: =A21+1 -> 22 | B22: SERENA KAJI | C22: POWAY | D22: 0.61111111111111105
A23: =A22+1 -> 23 | B23: SARAH SCHNALL | C23: LCC | D23: 0.61388888888888882
A24: =A23+1 -> 24 | B24: JASMINE BUINS | C24: SAN PASQUAL | D24: 0.6166666666666667
A25: =A24+1 -> 25 | B25: CANDACE DALEY | C25: POWAY | D25: 0.6166666666666667
A26: =A25+1 -> 26 | B26: KARINA GRACIA | C26: EL CAMINO | D26: 0.61875000000000002
A27: =A26+1 -> 27 | B27: NICOLE MANSOUR | C27: MT. CARMEL | D27: 0.62013888888888891
A28: =A27+1 -> 28 | B28: MEGAN REINER | C28: CARLSBAD | D28: 0.62222222222222223
A29: =A28+1 -> 29 | B29: DANA M-Z | C29: RANCHO BERNARDO | D29: 0.62361111111111112
A30: =A29+1 -> 30 | B30: ASHLEY NICHOLS | C30: TP | D30: 0.62361111111111112
A31: =A30+1 -> 31 | B31: ABBY FRISCH | C31: POWAY | D31: 0.62430555555555556
A32: =A31+1 -> 32 | B32: CLAIRE MARTIN | C32: CARLSBAD | D32: 0.62430555555555556
A33: =A32+1 -> 33 | B33: ANNIE SZAFRANSKI | C33: PHHS | D33: 0.62708333333333333
A34: =A33+1 -> 34 | B34: MEGHIE TABAR | C34: RANCHO BERNARDO | D34: 0.62986111111111109
A35: =A34+1 -> 35 | B35: LINDSAY SERHAN | C35: RANCHO BERNARDO | D35: 0.62986111111111109
A36: =A35+1 -> 36 | B36: BONNIE OPLIGER | C36: PHHS | D36: 0.63263888888888886
A37: =A36+1 -> 37 | B37: JESSICA BOYLE | C37: SAN PASQUAL | D37: 0.63402777777777775
A38: =A37+1 -> 38 | B38: BRITTANEY BELLGARDL | C38: EL CAP | D38: 0.63541666666666663
A39: =A38+1 -> 39 | B39: ELENA LAZO | C39: LCC | D39: 0.63958333333333328
A40: =A39+1 -> 40 | B40: NATALIE LUNA | C40: MT. CARMEL | D40: 0.6430555555555556
A41: =A40+1 -> 41 | B41: CAILA PILO | C41: SAN PASQUAL | D41: 0.64513888888888882
A42: =A41+1 -> 42 | B42: BRIDGET BURLEY | C42: POWAY | D42: 0.64652777777777781
A43: =A42+1 -> 43 | B43: BROOKE TAYLOR | C43: LCC | D43: 0.65416666666666667
A44: =A43+1 -> 44 | B44: ANNE OLSON | C44: SAN PASQUAL | D44: 0.66597222222222219
A45: =A44+1 -> 45 | B45: RACHEL HOELSCHER | C45: WESTVIEW | D45: 0.67013888888888884
A46: =A45+1 -> 46 | B46: CAITLIN MEAGHER | C46: SAN PASQUAL | D46: 0.6743055555555556
A47: =A46+1 -> 47 | B47: JESSICA LINARES | C47: EL CAMINO | D47: 0.67500000000000004
A48: =A47+1 -> 48 | B48: KATIE THOMPSON | C48: LCC | D48: 0.6777777777777777
A49: =A48+1 -> 49 | B49: JEN HALL | C49: WESTVIEW | D49: 0.6777777777777777
A50: =A49+1 -> 50 | B50: MELISSA COYLE | C50: RANCHO BERNARDO | D50: 0.67847222222222225
A51: =A50+1 -> 51 | B51: JESSICA SCHROEDER | C51: TP | D51: 0.69305555555555554
A52: =A51+1 -> 52 | B52: JUSTINE SCHOTT | C52: LCC | D52: 0.69305555555555554
A53: =A52+1 -> 53 | B53: KATIE PAIGE | C53: RANCHO BERNARDO | D53: 0.69861111111111107
A54: =A53+1 -> 54 | B54: JAMIE SECRIST | C54: MT. CARMEL | D54: 0.70347222222222217
A55: =A54+1 -> 55 | B55: KATIE RISSER | C55: PHHS | D55: 0.70416666666666661
A56: =A55+1 -> 56 | B56: MARY KLAP | C56: PHHS | D56: 0.70486111111111116
A57: =A56+1 -> 57 | B57: RACHEL BURGESS | C57: RANCHO BERNARDO | D57: 0.70625000000000004
A58: =A57+1 -> 58 | B58: LINDA JIN | C58: WESTVIEW | D58: 0.70972222222222225
A59: =A58+1 -> 59 | B59: EMILY FRISCH | C59: POWAY | D59: 0.71111111111111114
A60: =A59+1 -> 60 | B60: BRITTANY GRACIA | C60: MT. CARMEL | D60: 0.71111111111111114
A61: =A60+1 -> 61 | B61: LAUREN AROS | C61: SAN PASQUAL | D61: 0.71875
A62: =A61+1 -> 62 | B62: ALY HAMILTON | C62: LCC | D62: 0.72083333333333333
A63: =A62+1 -> 63 | B63: ERICA SCHOTT | C63: LCC | D63: 0.72430555555555554
A64: =A63+1 -> 64 | B64: MARA FUHRMAN | C64: POWAY | D64: 0.72777777777777775
A65: =A64+1 -> 65 | B65: LAUREN WILLIAMS | C65: CARLSBAD | D65: 0.73958333333333337
A66: =A65+1 -> 66 | B66: JILLIAN MOLIN | C66: EL CAMINO | D66: 0.7402777777777777
A67: =A66+1 -> 67 | B67: KELSEY GRANQUIST | C67: WESTVIEW | D67: 0.76527777777777783
A68: =A67+1 -> 68 | B68: BRYNNA TUSSEY | C68: TP | D68: 0.77638888888888891
A69: =A68+1 -> 69 | B69: THORNBER | C69: PHHS | D69: 0.78472222222222221
A70: =A69+1 -> 70 | B70: ALEJANDRA RAMOS | C70: SAN PASQUAL | D70: 0.83680555555555547

A1: 1 | B1: MORGAN HARPENAU | C1: MT. CARMEL | D1: 0.46388888888888885
A2: =A1+1 -> 2 | B2: ZAC COMER | C2: EL CAMINO | D2: 0.46736111111111112
A3: =A2+1 -> 3 | B3: CHRAS ERTZ | C3: EL CAP | D3: 0.47013888888888888
A4: =A3+1 -> 4 | B4: JEFFREY HEMPHILL | C4: PHHS | D4: 0.47499999999999998
A5: =A4+1 -> 5 | B5: CHRIS LIBERTO | C5: SAN PASQUAL | D5: 0.47569444444444442
A6: =A5+1 -> 6 | B6: BRANDON FIX | C6: SAN PASQUAL | D6: 0.47638888888888892
A7: =A6+1 -> 7 | B7: JON BLUE | C7: MT. CARMEL | D7: 0.48055555555555557
A8: =A7+1 -> 8 | B8: JOSH SETTLERS | C8: CARLSBAD | D8: 0.48055555555555557
A9: =A8+1 -> 9 | B9: NATHAN LUKE | C9: MT. CARMEL | D9: 0.48125000000000001
A10: =A9+1 -> 10 | B10: MIKE HUXHOLD | C10: SAN PASQUAL | D10: 0.4826388888888889
A11: =A10+1 -> 11 | B11: MIKE DEVAN | C11: EL CAP | D11: 0.48333333333333334
A12: =A11+1 -> 12 | B12: MATT ORLANDO | C12: PHHS | D12: 0.48402777777777778
A13: =A12+1 -> 13 | B13: TYLER DAVIS | C13: RANCHO BERNARDO | D13: 0.48541666666666666
A14: =A13+1 -> 14 | B14: JARED MIMMS | C14: POWAY | D14: 0.48541666666666666
A15: =A14+1 -> 15 | B15: PHILIP SONG | C15: MT. CARMEL | D15: 0.49236111111111108
A16: =A15+1 -> 16 | B16: CHRIS PERFILI | C16: SAN PASQUAL | D16: 0.48749999999999999
A17: =A16+1 -> 17 | B17: EDWIND GONZALEX | C17: EL CAMINO | D17: 0.4909722222222222
A18: =A17+1 -> 18 | B18: MICHAEL CLOW | C18: POWAY | D18: 0.49305555555555558
A19: =A18+1 -> 19 | B19: VASTAL SHAH | C19: RANCHO BERNARDO | D19: 0.49722222222222223
A20: =A19+1 -> 20 | B20: BRIAN DANQUE | C20: SAN PASQUAL | D20: 0.49861111111111112
A21: =A20+1 -> 21 | B21: STEVEN KAMEN | C21: RANCHO BERNARDO | D21: 0.49861111111111112
A22: =A21+1 -> 22 | B22: RYAN HEGSTAD | C22: POWAY | D22: 0.4993055555555555
A23: =A22+1 -> 23 | B23: KEVIN YANG | C23: TP | D23: 0.5
A24: =A23+1 -> 24 | B24: VLADIMIR E. MEDENICA | C24: PHHS | D24: 0.5
A25: =A24+1 -> 25 | B25: MATT RAMON | C25: EL CAP | D25: 0.50208333333333333
A26: =A25+1 -> 26 | B26: RYAN PAUR | C26: POWAY | D26: 0.50347222222222221
A27: =A26+1 -> 27 | B27: MATT GILK | C27: CARLSBAD | D27: 0.50416666666666665
A28: =A27+1 -> 28 | B28: TAYLOR ANDERSON | C28: EL CAP | D28: 0.50486111111111109
A29: =A28+1 -> 29 | B29: KYLE UEYAMA | C29: MT. CARMEL | D29: 0.50555555555555554
A30: =A29+1 -> 30 | B30: KENNY STEVENSON | C30: EL CAP | D30: 0.50694444444444442
A31: =A30+1 -> 31 | B31: STEVEN STERRETT | C31: MT. CARMEL | D31: 0.50763888888888886
A32: =A31+1 -> 32 | B32: DEXTER WOOD | C32: EL CAMINO | D32: 0.5083333333333333
A33: =A32+1 -> 33 | B33: MATT COOK | C33: EL CAMINO | D33: 0.50902777777777775
A34: =A33+1 -> 34 | B34: CHRIS POTTERSON | C34: EL CAMINO | D34: 0.50902777777777775
A35: =A34+1 -> 35 | B35: YI WANG | C35: WESTVIEW | D35: 0.51111111111111118
A36: =A35+1 -> 36 | B36: NICK PEW | C36: SAN PASQUAL | D36: 0.51180555555555551
A37: =A36+1 -> 37 | B37: CHARLIE RUDOLPH | C37: POWAY | D37: 0.51249999999999996
A38: =A37+1 -> 38 | B38: JESUS NARVAEZ | C38: EL CAMINO | D38: 0.51388888888888895
A39: =A38+1 -> 39 | B39: ZACH PERRY | C39: PHHS | D39: 0.51527777777777783
A40: =A39+1 -> 40 | B40: SEAN LETTS | C40: CARLSBAD | D40: 0.51527777777777783
A41: =A40+1 -> 41 | B41: GREGORY MONROE | C41: POWAY | D41: 0.51666666666666672
A42: =A41+1 -> 42 | B42: RHYS GAMBOA | C42: SAN PASQUAL | D42: 0.51736111111111105
A43: =A42+1 -> 43 | B43: JEFF WURZBACH | C43: TP | D43: 0.5180555555555556
A44: =A43+1 -> 44 | B44: ERIC MANSOUR | C44: MT. CARMEL | D44: 0.51875000000000004
A45: =A44+1 -> 45 | B45: ARMANDO GONZOLEZ | C45: EL CAMINO | D45: 0.51944444444444449
A46: =A45+1 -> 46 | B46: KARL LEIDER | C46: CARLSBAD | D46: 0.52013888888888882
A47: =A46+1 -> 47 | B47: O'MIN KWON | C47: RANCHO BERNARDO | D47: 0.52083333333333337
A48: =A47+1 -> 48 | B48: BRIAN PIERSALL | C48: POWAY | D48: 0.52152777777777781
A49: =A48+1 -> 49 | B49: CAMERON NOLASCO | C49: WESTVIEW | D49: 0.52222222222222225
A50: =A49+1 -> 50 | B50: JAKE LEASURE | C50: EL CAP | D50: 0.52222222222222225
A51: =A50+1 -> 51 | B51: ERIC GARCIA | C51: EL CAP | D51: 0.5229166666666667
A52: =A51+1 -> 52 | B52: SO ADACHI | C52: RANCHO BERNARDO | D52: 0.52430555555555558
A53: =A52+1 -> 53 | B53: CRAIG WILSON | C53: POWAY | D53: 0.52500000000000002
A54: =A53+1 -> 54 | B54: SOHA JAFARZADE | C54: RANCHO BERNARDO | D54: 0.52638888888888891
A55: =A54+1 -> 55 | B55: MOTOK NAKAMAR | C55: TP | D55: 0.52916666666666667
A56: =A55+1 -> 56 | B56: KATZ SKYLER | C56: PHHS | D56: 0.52986111111111112
A57: =A56+1 -> 57 | B57: JUSTIN DAVIS | C57: EL CAMINO | D57: 0.53125
A58: =A57+1 -> 58 | B58: JUSTIN HERMANN | C58: SAN PASQUAL | D58: 0.53125
A59: =A58+1 -> 59 | B59: LUKE MIDDLEBROOK | C59: EL CAP | D59: 0.53333333333333333
A60: =A59+1 -> 60 | B60: JOSE FELIX | C60: SAN PASQUAL | D60: 0.53402777777777777
A61: =A60+1 -> 61 | B61: DANIEL THAN | C61: MT. CARMEL | D61: 0.53402777777777777
A62: =A61+1 -> 62 | B62: KENNETH ALTOVEROS | C62: MT. CARMEL | D62: 0.53472222222222221
A63: =A62+1 -> 63 | B63: SHANE O'SULLIVAN | C63: MT. CARMEL | D63: 0.53472222222222221
A64: =A63+1 -> 64 | B64: RANDY STUCK | C64: PHHS | D64: 0.53541666666666665
A65: =A64+1 -> 65 | B65: ANT NOREN | C65: RANCHO BERNARDO | D65: 0.53541666666666665
A66: =A65+1 -> 66 | B66: JEFF TSAO | D66: 0.53611111111111109
A67: =A66+1 -> 67 | B67: DANNY STEFFY | C67: CARLSBAD | D67: 0.53611111111111109
A68: =A67+1 -> 68 | B68: TATE HARDESKY | C68: CARLSBAD | D68: 0.53680555555555554
A69: =A68+1 -> 69 | B69: JAMES BONNER | C69: SAN PASQUAL | D69: 0.53749999999999998
A70: =A69+1 -> 70 | B70: DAVE PARESH | C70: MT. CARMEL | D70: 0.53888888888888886
A71: =A70+1 -> 71 | B71: BLACKE HARWELL | C71: WESTVIEW | D71: 0.54097222222222219
A72: =A71+1 -> 72 | B72: SEAN WILBURN | C72: EL CAMINO | D72: 0.5444444444444444
A73: =A72+1 -> 73 | B73: ANDREW HALL | C73: WESTVIEW | D73: 0.54513888888888895
A74: =A73+1 -> 74 | B74: JOSH SOMEDA | C74: TP | D74: 0.54652777777777783
A75: =A74+1 -> 75 | B75: RYOSUKE SAIKA | C75: RANCHO BERNARDO | D75: 0.54791666666666672
A76: =A75+1 -> 76 | B76: SCOTT JOHNSTON | C76: SAN PASQUAL | D76: 0.54861111111111105
A77: =A76+1 -> 77 | B77: BRENT EDMUNDS | C77: TP | D77: 0.54861111111111105
A78: =A77+1 -> 78 | B78: JULIAN BLASEIO | C78: TP | D78: 0.55138888888888882
A79: =A78+1 -> 79 | B79: DOUG ZUILL | C79: POWAY | D79: 0.55138888888888882
A80: =A79+1 -> 80 | B80: GARRETT YAGADE | C80: RANCHO BERNARDO | D80: 0.55208333333333337
A81: =A80+1 -> 81 | B81: ROGER EARL | C81: POWAY | D81: 0.55347222222222225
A82: =A81+1 -> 82 | B82: ARIC CARRARINO | C82: CARLSBAD | D82: 0.5541666666666667
A83: =A82+1 -> 83 | B83: PETER BENITO | C83: RANCHO BERNARDO | D83: 0.55694444444444446
A84: =A83+1 -> 84 | B84: DANIEL NELSON | C84: RANCHO BERNARDO | D84: 0.55833333333333335
A85: =A84+1 -> 85 | B85: BRYANT URRY | C85: SAN PASQUAL | D85: 0.55833333333333335
A86: =A85+1 -> 86 | B86: CHRIS TORRES | C86: POWAY | D86: 0.55833333333333335
A87: =A86+1 -> 87 | B87: ALEX BESSER | C87: TP | D87: 0.55902777777777779
A88: =A87+1 -> 88 | B88: RICHARD ZEPEDA | C88: EL CAP | D88: 0.55902777777777779
A89: =A88+1 -> 89 | B89: SAM BAIRD | C89: CARLSBAD | D89: 0.55972222222222223
A90: =A89+1 -> 90 | B90: HARRISON HOLTZINGER | C90: TP | D90: 0.56319444444444444
A91: =A90+1 -> 91 | B91: HANSEN CHANG | C91: TP | D91: 0.56805555555555554
A92: =A91+1 -> 92 | B92: MARIANO MOSQUE | C92: CHS | D92: 0.56805555555555554
A93: =A92+1 -> 93 | B93: BRENT HARVEY | C93: RANCHO BERNARDO | D93: 0.56874999999999998
A94: =A93+1 -> 94 | B94: TOR HEXEBERG | C94: RANCHO BERNARDO | D94: 0.5708333333333333
A95: =A94+1 -> 95 | B95: JEFF GUTHRIE | C95: MT. CARMEL | D95: 0.57361111111111118
A96: =A95+1 -> 96 | B96: CHARLES YANG | C96: WESTVIEW | D96: 0.5756944444444444
A97: =A96+1 -> 97 | B97: BRYCE OUTCAULT | C97: CARLSBAD | D97: 0.58819444444444446
A98: =A97+1 -> 98 | B98: BRETT RAMIN | C98: RANCHO BERNARDO | D98: 0.58888888888888891
A99: =A98+1 -> 99 | B99: JAE SANG OH | C99: RANCHO BERNARDO | D99: 0.59097222222222223
A100: =A99+1 -> 100 | B100: JUSTIN COOK | C100: PHHS | D100: 0.59305555555555556
A101: =A100+1 -> 101 | B101: GARRETT LOW | C101: CARLSBAD | D101: 0.59375
A102: =A101+1 -> 102 | B102: GERALD GOLDEN | C102: RANCHO BERNARDO | D102: 0.59583333333333333
A103: =A102+1 -> 103 | B103: ROBERT KLAP | C103: PHHS | D103: 0.60069444444444442
A104: =A103+1 -> 104 | B104: MATT HAAS | C104: PHHS | D104: 0.60833333333333328
A105: =A104+1 -> 105 | B105: DOUG THORNBER | C105: PHHS | D105: 0.61736111111111114
A106: =A105+1 -> 106 | B106: JOHN TIPTAN | C106: CARLSBAD | D106: 0.62777777777777777
A107: =A106+1 -> 107 | B107: BEN SILVERWOOD | C107: TP | D107: 0.66736111111111107
A108: =A107+1 -> 108 | B108: NICK HERBERT | C108: SAN PASQUAL | D108: 0.68055555555555547
A109: =A108+1 -> 109 | B109: HARRISAN YANG | C109: TP | D109: 0.71319444444444446

A1: 1 | B1: Lauren | C1: Pischel | D1: LJCD | E1: 12:00
A2: 2 | B2: Jacalyn | C2: Christopher | D2: SFC | E2: 0.5
A3: 3 | B3: Brittany | C3: Balcom | E3: 0.5
A4: 4 | B4: Elizabeth | C4: Apgar | D4: calvary chr | E4: 0.5180555555555556
A5: 5 | B5: K | C5: Hall | D5: west hills | E5: 0.52222222222222225
A6: 6 | B6: Kelsey | C6: Shields | E6: 0.53541666666666665
A7: 7 | B7: S | C7: Espindola | D7: west hills | E7: 0.54027777777777775
A8: 8 | B8: C | C8: Saccone | D8: west hills | E8: 0.5541666666666667
A9: 9 | B9: Alexa | C9: Presar | D9: CCHS | E9: 0.56041666666666667
A10: 10 | B10: S | C10: Timanus | D10: west hills | E10: 0.56388888888888888
A11: 11 | B11: k | C11: McNulty | D11: west hills | E11: 0.56458333333333333
A12: 12 | B12: Tarah | C12: Kading | D12: SFC | E12: 0.56736111111111109
A13: 13 | B13: Sablle | C13: Scheppmann | D13: Grossmont | E13: 0.57013888888888886
A14: 14 | B14: Nicole | C14: Labriola | D14: SHS | E14: 0.57291666666666663
A15: 15 | B15: Ariel | C15: Abbott | D15: LJcd | E15: 0.57638888888888895
A16: 16 | B16: Alexis | C16: Samuels | D16: LJCD | E16: 0.58125000000000004
A17: 17 | B17: Jenny | C17: Cavellier | D17: CCHS | E17: 0.58194444444444449
A18: 18 | B18: Krissi | C18: Secciani | D18: Grossmont | E18: 0.58472222222222225
A19: 19 | B19: Jessica | C19: Russo | E19: 0.58472222222222225
A20: 20 | B20: Jackie | C20: Spivey | E20: 0.58611111111111114
A21: 21 | B21: M | C21: Iavelli | D21: west hills | E21: 0.58680555555555558
A22: 22 | B22: Rowan | C22: Dionisopoulos | D22: Grossmont | E22: 0.58958333333333335
A23: 23 | B23: Tessa | C23: Balcom | D23: Ramona | E23: 0.59444444444444444
A24: 24 | B24: Holly | C24: Bennett | D24: Grossmont | E24: 0.59513888888888888
A25: 25 | B25: Kinsey | C25: Shelby | E25: 0.59583333333333333
A26: 26 | B26: B. | C26: Houck | D26: west hills | E26: 0.59722222222222221
A27: 27 | B27: Theresa | C27: Calderon | D27: Mira Mesa | E27: 0.60069444444444442
A28: 28 | B28: Maureen | C28: Truxton | D28: CCHS | E28: 0.6020833333333333
A29: 29 | B29: Jackie | C29: Reinagel | D29: CCHS | E29: 0.60486111111111118
A30: 30 | B30: Kylie | C30: Cook | E30: 0.6069444444444444
A31: 31 | B31: Taylor | C31: Rahlfs | D31: CCHS | E31: 0.61250000000000004
A32: 32 | B32: Lyndsie | C32: Artis | E32: 0.6166666666666667
A33: 33 | B33: Kim | C33: Franklin | E33: 0.61805555555555558
A34: 34 | B34: Raquel | C34: Burgett | D34: Mira Mesa | E34: 0.62152777777777779
A35: 35 | B35: Elena | C35: Hower | D35: CCHS | E35: 0.62152777777777779
A36: 36 | B36: Sasha | C36: Binderow | D36: LJCD | E36: 0.62222222222222223
A37: 37 | B37: Jasmine | C37: Junnarkar | D37: LJCD | E37: 0.62222222222222223
A38: 38 | B38: AnnMarie | C38: Harrs | D38: Mira Mesa | E38: 0.62361111111111112
A39: 39 | B39: katrina | C39: Toll | E39: 0.62847222222222221
A40: 40 | B40: Julia | C40: Searie | D40: SFC | E40: 0.63402777777777775
A41: 41 | B41: Janai | C41: Kerwin | D41: CCHS | E41: 0.63749999999999996
A42: 42 | B42: Cassandra | C42: VanDyne | D42: Grossmont | E42: 0.64236111111111105
A43: 43 | B43: Brooke | C43: Weisenberger | D43: SFC | E43: 0.64652777777777781
A44: 44 | B44: Nikki | C44: Destefano | E44: 0.64652777777777781
A45: 45 | B45: Katie | C45: Brown | D45: SFC | E45: 0.64652777777777781
A46: 46 | B46: Amelia | C46: Roland | D46: Grossmont | E46: 0.64722222222222225
A47: 47 | B47: Sarah | C47: Paulson | D47: SHS | E47: 0.64861111111111114
A48: 48 | B48: kate | C48: Homer | D48: SFC | E48: 0.65277777777777779
A49: 49 | B49: Nicole | C49: Basham | D49: Mira Mesa | E49: 0.65347222222222223
A50: 50 | B50: Leiza | C50: Abad | D50: Mira Mesa | E50: 0.65763888888888888
A51: 51 | B51: Shantall | C51: Armenta | D51: MV | E51: 0.67361111111111116
A52: 52 | B52: Cassie | C52: Miranda | D52: Mira Mesa | E52: 0.67986111111111114
A53: 53 | B53: Jessie | C53: Scott | D53: Mira Mesa | E53: 0.6875
A54: 54 | B54: Emily | C54: Gilje | D54: SHS | E54: 0.72291666666666676
A55: 55 | B55: Sarina | C55: Fritz | D55: LJCD | E55: 0.73819444444444438
A56: 56 | B56: Melissa | C56: Ochoa | D56: MV | E56: 0.7416666666666667

A1: 1 | B1: Dean | C1: Manley | D1: Ramona | E1: 0.43055555555555558
A2: 2 | B2: Tristan | C2: Corson | D2: Ramona | E2: 0.43263888888888885
A3: 3 | B3: Miguel | C3: Vega | D3: Orange Glen | E3: 0.43541666666666662
A4: 4 | B4: Travis | C4: Pederson | D4: Sdieguito Academy | E4: 0.43611111111111112
A5: 5 | B5: Diego | C5: Vega | D5: Orange Glen | E5: 0.4375
A6: 6 | B6: Jon | C6: Patino, | D6: Mira Mesa | E6: 0.44236111111111115
A7: 7 | B7: Dustin | C7: Diven | D7: Ramona | E7: 0.44791666666666669
A8: 8 | B8: Alex | C8: Poyhonen | D8: LJCD | E8: 0.45069444444444445
A9: 9 | C9: Dolan | D9: West Hills | E9: 0.4513888888888889
A10: 10 | B10: Tilley | C10: Barrett | D10: Grossmont | E10: 0.4513888888888889
A11: 11 | B11: Chris | C11: Fabian | D11: Ramona | E11: 0.45208333333333334
A12: 12 | C12: Caricato | D12: West Hills | E12: 0.45277777777777778
A13: 13 | B13: Chris | C13: Root | D13: Grossmont | E13: 0.46250000000000002
A14: 14 | B14: Ricardo | C14: Cruz | D14: Orange Glen | E14: 0.46319444444444446
A15: 15 | C15: Novaro | D15: Ramona | E15: 0.46319444444444446
A16: 16 | B16: Josh | C16: Hoffman | D16: Canyon Crest | E16: 0.46527777777777773
A17: 17 | B17: Kent | C17: Morgan | D17: Sdieguito Academy | E17: 0.46527777777777773
A18: 18 | B18: Michael | C18: Gonia | D18: West Hills | E18: 0.46527777777777773
A19: 19 | B19: Anthony | C19: DeBarrowns | D19: SHS | E19: 0.46597222222222223
A20: 20 | B20: Mitchel | C20: Dominguez | D20: Grossmont | E20: 0.46666666666666662
A21: 21 | B21: M | C21: Nelson | D21: West Hills | E21: 0.46666666666666662
A22: 22 | B22: Dennis | C22: Roth | D22: LJCD | E22: 0.46736111111111112
A23: 23 | B23: Sam | C23: Amano | D23: Sdieguito Academy | E23: 0.4680555555555555
A24: 24 | B24: Parry | C24: Thorton | D24: Grossmont | E24: 0.47291666666666665
A25: 25 | B25: Brooks | C25: Nardi | D25: Canyon Crest | E25: 0.47569444444444442
A26: 26 | B26: Jason | C26: Gordon | D26: SHS | E26: 0.47847222222222219
A27: 27 | B27: Josh | C27: Hager | D27: Ramona | E27: 0.47916666666666669
A28: 28 | B28: Geoff | C28: Ainslie | D28: Sdieguito Academy | E28: 0.47986111111111113
A29: 29 | B29: Alex | C29: Fleischhacker | D29: LJCD | E29: 0.47986111111111113
A30: 30 | B30: Jake | C30: Greve | D30: Sdieguito Academy | E30: 0.48194444444444445
A31: 31 | B31: Zack | C31: Brown | D31: Mira Mesa | E31: 0.48472222222222222
A32: 32 | B32: Matt | C32: Schulteis | D32: Canyon Crest | E32: 0.48680555555555555
A33: 33 | B33: mason | C33: Westphal | D33: Ramona | E33: 0.48680555555555555
A34: 34 | B34: Nathan | C34: Nelson | D34: Canyon Crest | E34: 0.48749999999999999
A35: 35 | B35: S | C35: Donnellani, | D35: West Hills | E35: 0.48749999999999999
A36: 36 | B36: Daniel | C36: Price | D36: SHS | E36: 0.48749999999999999
A37: 37 | B37: Derek | C37: Gill | D37: Canyon Crest | E37: 0.48819444444444443
A38: 38 | B38: Rhett | C38: Fraticelli | D38: Canyon Crest | E38: 0.48888888888888887
A39: 39 | B39: Tommy | C39: Kroll | D39: Canyon Crest | E39: 0.48888888888888887
A40: 40 | B40: Evan | C40: Brown | D40: Canyon Crest | E40: 0.4916666666666667
A41: 41 | B41: Cole | C41: Holcomb | D41: Sdieguito Academy | E41: 0.49236111111111108
A42: 42 | B42: Paul | C42: Reynolds | D42: Ramona | E42: 0.49236111111111108
A43: 43 | B43: Ben | C43: Stillinger | D43: Sdieguito Academy | E43: 0.49375000000000002
A44: 44 | B44: Ryan | C44: Harry | D44: Canyon Crest | E44: 0.49375000000000002
A45: 45 | B45: Adam | C45: Rolph | D45: Canyon Crest | E45: 0.49861111111111112
A46: 46 | B46: Kyle | C46: Granali | D46: Mira Mesa | E46: 0.49861111111111112
A47: 47 | B47: Stephen | C47: Migdal | D47: LJCD | E47: 0.50069444444444444
A48: 48 | B48: Jacob | C48: Barlow | D48: Calvary Christian Academy | E48: 0.50486111111111109
A49: 49 | B49: Jorge | C49: Ibarra | D49: Calvary Christian Academy | E49: 0.50555555555555554
A50: 50 | B50: B | C50: Koci | D50: West Hills | E50: 0.50763888888888886
A51: 51 | B51: AJ | C51: Spradlin | D51: West Hills | E51: 0.5083333333333333
A52: 52 | B52: Jason | C52: McCollum | D52: LJCD | E52: 0.5083333333333333
A53: 53 | B53: Andy | C53: Schoepp | E53: 0.51180555555555551
A54: 54 | B54: John | C54: Amman | E54: 0.51249999999999996
A55: 55 | B55: Brett | C55: Vigil | E55: 0.51597222222222217
A56: 56 | B56: Vinny | C56: Dujji | E56: 0.51666666666666672
A57: 57 | B57: Josh | C57: Howard | E57: 0.51666666666666672
A58: 58 | B58: Vinny | C58: Battaglia | E58: 0.51736111111111105
A59: 59 | B59: Santiago | C59: Montano | E59: 0.51944444444444449
A60: 60 | C60: Moacanin | E60: 0.52013888888888882
A61: 61 | B61: Jake | C61: Rucker | E61: 0.52013888888888882
A62: 62 | B62: Chris | C62: Rabiachaud | E62: 0.52083333333333337
A63: 63 | B63: Chris | C63: de la Torre | E63: 0.52083333333333337
A64: 64 | B64: Max | C64: Borrono | E64: 0.52083333333333337
A65: 65 | B65: Matt | C65: Kozei | E65: 0.52152777777777781
A66: 66 | B66: Michael | C66: Harrigan | E66: 0.52222222222222225
A67: 67 | B67: Garrett | C67: Close | E67: 0.52222222222222225
A68: 68 | B68: Eric | C68: Naire | E68: 0.52222222222222225
A69: 69 | B69: Owen | C69: Lord | E69: 0.52638888888888891
A70: 70 | B70: Hubert | C70: Huyuh | E70: 0.52708333333333335
A71: 71 | B71: Scott | C71: Leonard | E71: 0.53333333333333333
A72: 72 | B72: Joe | C72: Hauser | E72: 0.53402777777777777
A73: 73 | B73: Isaac | C73: Zafuta | E73: 0.53541666666666665
A74: 74 | B74: Steven | C74: Sarth | E74: 0.54097222222222219
A75: 75 | B75: Gerry | C75: Rapelo | E75: 0.54097222222222219
A76: 76 | B76: Anthony | C76: Jereza | E76: 00.55
A77: 77 | B77: Jeff | C77: Meilander | E77: 0.55208333333333337
A78: 78 | B78: Ben | C78: Fleishchacker | E78: 0.55347222222222225
A79: 79 | B79: Phillip | C79: Ruiz | E79: 0.55555555555555558
A80: 80 | B80: Brad | C80: Burton | E80: 0.56041666666666667
A81: 81 | B81: Sean | C81: Radak | E81: 0.56111111111111112
A82: 82 | B82: Juan | C82: Lopez | E82: 0.57430555555555551
A83: 83 | B83: Daniel | C83: Reynolds | E83: 0.58402777777777781
A84: 84 | B84: Daniel | C84: McDermott | E84: 0.59861111111111109
A85: 85 | B85: Brian | C85: Moseley | E85: 0.62361111111111112
A86: 86 | B86: Chris | C86: Schaffer | E86: 0.67361111111111116

A1: 1 | B1: J. THOMAS | C1: WEST HILLS | D1: 0.57152777777777775
A2: =A1+1 -> 2 | B2: K. FINNEY | C2: WEST HILLS | D2: 0.60069444444444442
A3: =A2+1 -> 3 | B3: L. ARCE | C3: WEST HILLS | D3: 0.61388888888888882
A4: =A3+1 -> 4 | B4: VANESSA VINCENT | C4: CCHS | D4: 0.625
A5: =A4+1 -> 5 | B5: ERIKA LUQUIN | C5: OG | D5: 0.62569444444444444
A6: =A5+1 -> 6 | B6: CHELSEY CORTEZ | D6: 0.62847222222222221
A7: =A6+1 -> 7 | B7: MARNEY O'TOOLE | C7: CCHS | D7: 0.6381944444444444
A8: =A7+1 -> 8 | B8: TARA BODMAN | C8: CCHS | D8: 0.6381944444444444
A9: =A8+1 -> 9 | B9: V. LOZANO | C9: WEST HILLS | D9: 0.63888888888888895
A10: =A9+1 -> 10 | B10: A. MCCONNELL | C10: WEST HILLS | D10: 0.63888888888888895
A11: =A10+1 -> 11 | B11: BRID RILEY | C11: WEST HILLS | D11: 0.64027777777777783
A12: =A11+1 -> 12 | B12: MARIAH ARON | C12: ESCONDIDO CHARTER | D12: 0.64236111111111105
A13: =A12+1 -> 13 | B13: BRI RILEY | C13: WEST HILLS | D13: 0.64513888888888882
A14: =A13+1 -> 14 | B14: LUCY BLUSON | C14: CCHS | D14: 0.64652777777777781
A15: =A14+1 -> 15 | B15: E. RAMEN | C15: WEST HILLS | D15: 0.64722222222222225
A16: =A15+1 -> 16 | B16: BRIDGET MURPHY | C16: CCHS | D16: 0.6479166666666667
A17: =A16+1 -> 17 | B17: MCKENNA TAYLOR | C17: SDA | D17: 00.65
A18: =A17+1 -> 18 | B18: THERESA PALAFOX | C18: MIRA MESA | D18: 0.65277777777777779
A19: =A18+1 -> 19 | B19: COURTNEY SWAN | C19: SDA | D19: 0.65625
A20: =A19+1 -> 20 | B20: A. WILLIAM | C20: WEST HILLS | D20: 0.65763888888888888
A21: =A20+1 -> 21 | B21: PHYLICIA HISEL | C21: MIRA MESA | D21: 0.65833333333333333
A22: =A21+1 -> 22 | B22: BRANDI ANTR | D22: 0.66249999999999998
A23: =A22+1 -> 23 | B23: MADELEINE HEARST | C23: CCHS | D23: 0.66319444444444442
A24: =A23+1 -> 24 | B24: MELANIE HOLOHAN | C24: CCHS | D24: 0.66805555555555562
A25: =A24+1 -> 25 | B25: K. DECRESENTE | C25: WEST HILLS | D25: 0.67013888888888884
A26: =A25+1 -> 26 | B26: DUVAN BEATRIZ | C26: BORREGO SPRINGS | D26: 0.67222222222222217
A27: =A26+1 -> 27 | B27: KATHERINE BACINO | C27: CCHS | D27: 0.68055555555555547
A28: =A27+1 -> 28 | B28: CATLIN CAMPBELL | C28: SDA | D28: 0.68333333333333324
A29: =A28+1 -> 29 | B29: LENA ANCLARSON | C29: SDA | D29: 0.68611111111111101
A30: =A29+1 -> 30 | B30: SARAH WESTWOOD | C30: CCHS | D30: 0.68819444444444444
A31: =A30+1 -> 31 | B31: J. VOLL | C31: WEST HILLS | D31: 0.69236111111111109
A32: =A31+1 -> 32 | B32: NATALIE PARAISO | C32: GROSSMONT | D32: 0.6972222222222223
A33: =A32+1 -> 33 | B33: J. DOWITT | C33: WEST HILLS | D33: 0.69930555555555562
A34: =A33+1 -> 34 | B34: CARLY STIVERSON | C34: CCHS | D34: 0.71111111111111114
A35: =A34+1 -> 35 | B35: KAREN LOPEZ | C35: GROSSMONT | D35: 0.71458333333333324
A36: =A35+1 -> 36 | B36: REBECCA WARD | C36: GROSSMONT | D36: 0.71875
A37: =A36+1 -> 37 | B37: KELSEY HJALMARSON | C37: GROSSMONT | D37: 0.72638888888888886
A38: =A37+1 -> 38 | B38: LEXIS LEDESMA | C38: GROSSMONT | D38: 0.7270833333333333
A39: =A38+1 -> 39 | B39: TINA NGUYEN | C39: MIRA MESA | D39: 0.72916666666666663
A40: =A39+1 -> 40 | B40: D. RAMOS | C40: WEST HILLS | D40: 0.73055555555555562
A41: =A40+1 -> 41 | B41: SHERWIN | C41: WEST HILLS | D41: 0.73055555555555562
A42: =A41+1 -> 42 | B42: LAUREL | C42: GROSSMONT | D42: 0.73958333333333337
A43: =A42+1 -> 43 | B43: LAUREL VOCELY | C43: GROSSMONT | D43: 0.74097222222222225
A44: =A43+1 -> 44 | B44: ALEX JACKS | C44: GROSSMONT | D44: 0.75069444444444444
A45: =A44+1 -> 45 | B45: MONICA JIMENEZ | C45: CALVARY | D45: 0.76180555555555562
A46: =A45+1 -> 46 | B46: TANYA KIM | C46: MIRA MESA | D46: 0.76875000000000004
A47: =A46+1 -> 47 | B47: IRASEMA GARCIA | C47: MV | D47: 0.76875000000000004
A48: =A47+1 -> 48 | B48: SHELBY CUMMINGS | C48: CCHS | D48: 0.77083333333333337
A49: =A48+1 -> 49 | B49: BRIDGET MCELHAREY | C49: CCHS | D49: 0.77083333333333337
A50: =A49+1 -> 50 | B50: MICHELLE ABLES | C50: CCHS | D50: 0.7729166666666667
A51: =A50+1 -> 51 | B51: S. GRIMM | C51: WEST HILLS | D51: 0.77916666666666667
A52: =A51+1 -> 52 | B52: MADELEINE THERICULT | C52: BORREGO SPRINGS | D52: 0.79374999999999996
A53: =A52+1 -> 53 | B53: DENE PRYOR | C53: CCHS | D53: 0.79374999999999996
A54: =A53+1 -> 54 | B54: JESSICA TAMES | C54: MV | D54: 0.80138888888888893
A55: =A54+1 -> 55 | B55: BRIANNA MANLEY | C55: SDA | D55: 0.80763888888888891
A56: =A55+1 -> 56 | B56: VALERIA GARESA DE ALBA | C56: MV | D56: 0.8354166666666667
A57: =A56+1 -> 57 | B57: ISABEL LAYOZ | C57: CALVARY | D57: 0.84444444444444444
A58: =A57+1 -> 58 | B58: JESSICA LUU | C58: MIRA MESA | D58: 0.8569444444444444
A59: =A58+1 -> 59 | B59: ALISHA AKER | D59: 0.86736111111111114
A60: =A59+1 -> 60 | B60: ERIKA BADIT | C60: CALVARY | D60: 0.87430555555555556
A61: =A60+1 -> 61 | B61: MAYRA RIOS | C61: SHS | D61: 0.87708333333333333

A1: 1 | B1: JESSE TORES | C1: ESCONDIDO CHARTER | D1: 0.48680555555555555
A2: =A1+1 -> 2 | B2: BRENDON JUNGE | C2: SAN DIEGUITO ACADEMY | D2: 0.50694444444444442
A3: =A2+1 -> 3 | B3: DREW DIACHENKO | C3: CCHS | D3: 0.5083333333333333
A4: =A3+1 -> 4 | B4: NATIQ BAKER | C4: MIRA MESA | D4: 0.51249999999999996
A5: =A4+1 -> 5 | B5: TYLER LAMPE | C5: CANYON CREST | D5: 0.51527777777777783
A6: =A5+1 -> 6 | B6: CHRIS STEINKE | C6: MIRA MESA | D6: 0.5180555555555556
A7: =A6+1 -> 7 | B7: TOM NEVILE | C7: CALVARY CHRISTIAN ACAD. | D7: 0.52500000000000002
A8: =A7+1 -> 8 | B8: AARON HAITIN | C8: CANYON CREST | D8: 0.52638888888888891
A9: =A8+1 -> 9 | B9: TOM FIECHTENR | C9: CCHS | D9: 0.52638888888888891
A10: =A9+1 -> 10 | B10: K. SAXER | C10: WEST HILLS | D10: 0.53194444444444444
A11: =A10+1 -> 11 | B11: QUINTIS DAVISON | C11: GROSSMONT | D11: 0.53402777777777777
A12: =A11+1 -> 12 | B12: ULYSSES SAVAGE | C12: MIRA MESA | D12: 0.53472222222222221
A13: =A12+1 -> 13 | B13: KHASHY HAKAMIAN | C13: CANYON CREST | D13: 0.53749999999999998
A14: =A13+1 -> 14 | B14: DREW VOLPE | C14: GROSSMONT | D14: 0.53819444444444442
A15: =A14+1 -> 15 | B15: JAKE ELIASBERG | C15: LJCD | D15: 0.5395833333333333
A16: =A15+1 -> 16 | B16: JACK DIGGS | C16: GROSSMONT | D16: 0.54305555555555551
A17: =A16+1 -> 17 | B17: ADAM KALDOR | C17: LJCD | D17: 0.54583333333333328
A18: =A17+1 -> 18 | B18: MICHAEL LANOISELEE | C18: CANYON CREST | D18: 0.54652777777777783
A19: =A18+1 -> 19 | B19: D. GOLDBERG | C19: WEST HILLS | D19: 0.55069444444444449
A20: =A19+1 -> 20 | B20: DAVID QUINTERO | C20: ORANGE GLEN | D20: 0.55208333333333337
A21: =A20+1 -> 21 | B21: S. GOLDBERG | C21: WEST HILLS | D21: 0.5541666666666667
A22: =A21+1 -> 22 | B22: JUAN REYNOSO | C22: ORANGE GLEN | D22: 0.55555555555555558
A23: =A22+1 -> 23 | B23: ABDULLAH PAUL | C23: CANYON CREST | D23: 0.55694444444444446
A24: =A23+1 -> 24 | B24: SAMIR JUNNARKAR | C24: LJCD | D24: 0.55833333333333335
A25: =A24+1 -> 25 | B25: ANTOINE LOPEZ-PALM | C25: LJCD | D25: 0.55902777777777779
A26: =A25+1 -> 26 | B26: RJ SHANKS | C26: CCHS | D26: 0.5625
A27: =A26+1 -> 27 | B27: LON BENNETT | C27: WEST HILLS | D27: 0.56597222222222221
A28: =A27+1 -> 28 | B28: S. GREGORY | C28: WEST HILLS | D28: 0.56666666666666665
A29: =A28+1 -> 29 | B29: S. WALDMAN | C29: WEST HILLS | D29: 0.56736111111111109
A30: =A29+1 -> 30 | B30: J. GARCIA | C30: WEST HILLS | D30: 0.56944444444444442
A31: =A30+1 -> 31 | B31: BRETT YOUNG | C31: CCHS | D31: 0.57013888888888886
A32: =A31+1 -> 32 | B32: MATT DEAL | C32: SHS | D32: 0.5708333333333333
A33: =A32+1 -> 33 | B33: ARMAND HARB | C33: LJCD | D33: 0.57152777777777775
A34: =A33+1 -> 34 | B34: LOGAN GALLAGHER | C34: SAN DIEGUITO ACADEMY | D34: 0.57291666666666663
A35: =A34+1 -> 35 | B35: M. RUSSO | C35: WEST HILLS | D35: 0.57291666666666663
A36: =A35+1 -> 36 | B36: P. MILLER | C36: WEST HILLS | D36: 0.57361111111111118
A37: =A36+1 -> 37 | B37: TRACY NEWBERRY | C37: CALVARY CHRISTIAN ACAD. | D37: 0.57361111111111118
A38: =A37+1 -> 38 | B38: MARTIN BOYLES | C38: CANYON CREST | D38: 0.57430555555555551
A39: =A38+1 -> 39 | B39: NICK BARTHEL | C39: CCHS | D39: 0.57708333333333328
A40: =A39+1 -> 40 | B40: GUNNER GALLOWAY | C40: SAN DIEGUITO ACADEMY | D40: 0.58125000000000004
A41: =A40+1 -> 41 | B41: JOHN BLACK | C41: MIRA MESA | D41: 0.58194444444444449
A42: =A41+1 -> 42 | B42: TRAVIS NORTON | C42: SAN DIEGUITO ACADEMY | D42: 0.58402777777777781
A43: =A42+1 -> 43 | B43: QUDRIAN SANTOS | C43: WEST HILLS | D43: 0.58472222222222225
A44: =A43+1 -> 44 | B44: NATHAN CARR | C44: MIRA MESA | D44: 0.58611111111111114
A45: =A44+1 -> 45 | B45: DAVID DINKNEY | C45: LJCD | D45: 0.58611111111111114
A46: =A45+1 -> 46 | B46: PARKER BARRETT | C46: CCHS | D46: 0.59305555555555556
A47: =A46+1 -> 47 | B47: TANNER HODGSON | C47: CANYON CREST | D47: 0.59375
A48: =A47+1 -> 48 | B48: DEVIN DAHLBERG | C48: MIRA MESA | D48: 0.59583333333333333
A49: =A48+1 -> 49 | B49: LUKE REYNOLDS | C49: CCHS | D49: 0.59791666666666665
A50: =A49+1 -> 50 | B50: D. GONZALEZ | C50: WEST HILLS | D50: 0.59861111111111109
A51: =A50+1 -> 51 | B51: SEAN RITCHEY | C51: GROSSMONT | D51: 0.59930555555555554
A52: =A51+1 -> 52 | B52: CHRIS SAUQUILLO | C52: CCHS | D52: 0.6020833333333333
A53: =A52+1 -> 53 | B53: DONALD CASEY | C53: CCHS | D53: 0.6020833333333333
A54: =A53+1 -> 54 | B54: PATRICK TILLEY | C54: GROSSMONT | D54: 0.60486111111111118
A55: =A54+1 -> 55 | B55: RYAN ZERKLE | C55: SHS | D55: 0.60555555555555551
A56: =A55+1 -> 56 | B56: ELLIOT ADAMS | C56: CANYON CREST | D56: 0.60833333333333328
A57: =A56+1 -> 57 | B57: S. DRAKE | C57: WEST HILLS | D57: 0.60902777777777783
A58: =A57+1 -> 58 | B58: ANGEL VARGAS | C58: MIRA MESA | D58: 0.61041666666666672
A59: =A58+1 -> 59 | B59: C. CONSTANTINE | C59: WEST HILLS | D59: 0.61111111111111105
A60: =A59+1 -> 60 | B60: TENDERI MUKAN | C60: LJCD | D60: 0.61250000000000004
A61: =A60+1 -> 61 | B61: KEVIN KAZOVROUNI | C61: LJCD | D61: 0.61388888888888882
A62: =A61+1 -> 62 | B62: KYLE WILSON | C62: SHS | D62: 0.61527777777777781
A63: =A62+1 -> 63 | B63: JOSH REDHAIR | C63: SAN DIEGUITO ACADEMY | D63: 0.61597222222222225
A64: =A63+1 -> 64 | B64: NICK SARIF | C64: CANYON CREST | D64: 0.61736111111111114
A65: =A64+1 -> 65 | B65: TYLER HARMON | C65: ESCONDIDO CHARTER | D65: 0.61805555555555558
A66: =A65+1 -> 66 | B66: WILLIAM MAZZEI | C66: CCHS | D66: 0.62013888888888891
A67: =A66+1 -> 67 | B67: BLISS | C67: WEST HILLS | D67: 0.62222222222222223
A68: =A67+1 -> 68 | B68: M. CROSS | C68: WEST HILLS | D68: 0.62638888888888888
A69: =A68+1 -> 69 | B69: NICK IRZA | C69: CANYON CREST | D69: 0.62847222222222221
A70: =A69+1 -> 70 | B70: COLIN SAVAGE | C70: GROSSMONT | D70: 0.6333333333333333
A71: =A70+1 -> 71 | B71: ERIC MCROSKEY | C71: CCHS | D71: 0.63402777777777775
A72: =A71+1 -> 72 | B72: SEAN HOLCOMB | C72: SAN DIEGUITO ACADEMY | D72: 0.63402777777777775
A73: =A72+1 -> 73 | B73: R. DANIELS | C73: WEST HILLS | D73: 0.63749999999999996
A74: =A73+1 -> 74 | B74: COREY NEHMITZ | C74: CCHS | D74: 0.64027777777777783
A75: =A74+1 -> 75 | B75: TYLER JIMENO | C75: MIRA MESA | D75: 0.64375000000000004
A76: =A75+1 -> 76 | B76: C. SCHOONOVER | C76: WEST HILLS | D76: 0.64513888888888882
A77: =A76+1 -> 77 | B77: ALEC TORRES | C77: ORANGE GLEN | D77: 0.64583333333333337
A78: =A77+1 -> 78 | B78: GARRETT SCHNEIDER | C78: LJCD | D78: 0.64930555555555558
A79: =A78+1 -> 79 | B79: R. LAVARNWAY | C79: WEST HILLS | D79: 0.65416666666666667
A80: =A79+1 -> 80 | B80: MICHAEL KAPLAN | C80: LJCD | D80: 0.65763888888888888
A81: =A80+1 -> 81 | B81: PAXTON DEBOLT | C81: GROSSMONT | D81: 0.66319444444444442
A82: =A81+1 -> 82 | B82: C. BORRERO | C82: WEST HILLS | D82: 0.66736111111111107
A83: =A82+1 -> 83 | B83: B. PHILLIPS | C83: WEST HILLS | D83: 0.66736111111111107
A84: =A83+1 -> 84 | B84: ANDY POPESCU | C84: SHS | D84: 0.66736111111111107
A85: =A84+1 -> 85 | B85: ANDY DUNN | C85: SAN DIEGUITO ACADEMY | D85: 0.67569444444444438
A86: =A85+1 -> 86 | B86: DANIEL BILOTTA | C86: SAN DIEGUITO ACADEMY | D86: 00.7
A87: =A86+1 -> 87 | B87: L. GEDEON | C87: WEST HILLS | D87: 0.70833333333333337
A88: =A87+1 -> 88 | B88: JAKE RAWITZ | C88: SAN DIEGUITO ACADEMY | D88: 0.70972222222222225
A89: =A88+1 -> 89 | B89: MATTHEW BURBAUM | C89: CANYON CREST | D89: 0.73055555555555562
A90: =A89+1 -> 90 | B90: BILLY BUSTER | C90: SAN DIEGUITO ACADEMY | D90: 0.73750000000000004
A91: =A90+1 -> 91 | B91: ROBBIE DUNN | C91: SAN DIEGUITO ACADEMY | D91: 0.77986111111111101
A92: =A91+1 -> 92 | B92: COLE WILSON | C92: SAN DIEGUITO ACADEMY | D92: 0.81666666666666676
A93: =A92+1 -> 93 | B93: J. BONHAM | C93: WEST HILLS | D93: 0.82430555555555562
A94: =A93+1 -> 94 | B94: EMELIO CUADRAS | C94: CCHS | D94: NT

A1: 1 | B1: CHELSEY GARCIA | C1: SAN DIEGUITO ACAD. | D1: 0.57291666666666663
A2: =A1+1 -> 2 | B2: ANABEL ARREDONDO | C2: CANYON CREST | D2: 0.58819444444444446
A3: =A2+1 -> 3 | B3: NICOLE STORROW | C3: SAN DIEGUITO ACAD. | D3: 0.60972222222222217
A4: =A3+1 -> 4 | B4: J. PEREZ | C4: WEST HILLS | D4: 0.61527777777777781
A5: =A4+1 -> 5 | B5: CARLA KOSUT | C5: CCHS | D5: 0.61597222222222225
A6: =A5+1 -> 6 | B6: LAURA DUSHKIN | C6: SAN DIEGUITO ACAD. | D6: 0.61875000000000002
A7: =A6+1 -> 7 | B7: KAYTLIN BAKUN | D7: 0.62083333333333335
A8: =A7+1 -> 8 | B8: G. OZUNA | C8: WEST HILLS | D8: 0.62430555555555556
A9: =A8+1 -> 9 | B9: SARA ZLOTNIK | C9: CANYON CREST | D9: 0.62569444444444444
A10: =A9+1 -> 10 | B10: SARAH RAWI | C10: CANYON CREST | D10: 0.63680555555555551
A11: =A10+1 -> 11 | B11: J. ROBBINS | C11: WEST HILLS | D11: 0.63680555555555551
A12: =A11+1 -> 12 | B12: EMILY WEAVER | D12: 0.63888888888888895
A13: =A12+1 -> 13 | B13: S. HENDRIX | C13: WEST HILLS | D13: 0.64027777777777783
A14: =A13+1 -> 14 | B14: KAILEY ALETO | C14: GROSSMONT | D14: 0.64166666666666672
A15: =A14+1 -> 15 | B15: CLAIRE PETTENGILL | C15: CCHS | D15: 0.64236111111111105
A16: =A15+1 -> 16 | B16: STEPHANIE TUCKER | C16: CCHS | D16: 0.64444444444444449
A17: =A16+1 -> 17 | B17: LILY RAGIMOUA | C17: GROSSMONT | D17: 0.64513888888888882
A18: =A17+1 -> 18 | B18: MARRISA NAVARRO | C18: ESCONDIDO CHARTER | D18: 0.64652777777777781
A19: =A18+1 -> 19 | B19: ALISSA ROLAND | C19: GROSSMONT | D19: 00.65
A20: =A19+1 -> 20 | B20: ASHLEY ARMSTRONG | C20: SAN DIEGUITO ACAD. | D20: 0.65069444444444446
A21: =A20+1 -> 21 | B21: KALODIAH TOMA | C21: GROSSMONT | D21: 0.65208333333333335
A22: =A21+1 -> 22 | B22: RACHEL THOMPSON | C22: CANYON CREST | D22: 0.65694444444444444
A23: =A22+1 -> 23 | B23: K. OTTO | C23: WEST HILLS | D23: 0.65694444444444444
A24: =A23+1 -> 24 | B24: CAITY FAGER | C24: CCHS | D24: 0.66249999999999998
A25: =A24+1 -> 25 | B25: CAITLIN RYAN | C25: CANYON CREST | D25: 0.66527777777777775
A26: =A25+1 -> 26 | B26: MONIQUE BURRIOS | D26: 0.67083333333333339
A27: =A26+1 -> 27 | B27: B. LACHUSA | C27: WEST HILLS | D27: 0.67569444444444438
A28: =A27+1 -> 28 | B28: MEREDITH BREWSTER | C28: CCHS | D28: 0.67708333333333337
A29: =A28+1 -> 29 | B29: K. CLARK | C29: WEST HILLS | D29: 0.6777777777777777
A30: =A29+1 -> 30 | B30: NICKY RUMBAWA | C30: ESCONDIDO CHARTER | D30: 0.67986111111111114
A31: =A30+1 -> 31 | B31: MICHELLE CAMARCHO | C31: SAN DIEGUITO ACAD. | D31: 0.68472222222222223
A32: =A31+1 -> 32 | B32: J. MUSSON | C32: WEST HILLS | D32: 0.68680555555555556
A33: =A32+1 -> 33 | B33: SPENCER GABAR | C33: CCHS | D33: 0.6875
A34: =A33+1 -> 34 | B34: ALEX HOLDMAN | C34: CCHS | D34: 0.68888888888888899
A35: =A34+1 -> 35 | B35: TESSA WESTWOOD | C35: CCHS | D35: 0.69027777777777777
A36: =A35+1 -> 36 | B36: VIVIAN PHAM | C36: CCHS | D36: 0.69166666666666676
A37: =A36+1 -> 37 | B37: CAROLYN REYNOLDS | C37: GROSSMONT | D37: 0.69236111111111109
A38: =A37+1 -> 38 | B38: KELSEY SOAKE | C38: SAN DIEGUITO ACAD. | D38: 0.69444444444444453
A39: =A38+1 -> 39 | B39: HAYLEY FLEISCHMAN | C39: CCHS | D39: 0.6972222222222223
A40: =A39+1 -> 40 | B40: SHELBY ROSS | C40: MIRA MESA | D40: 0.7006944444444444
A41: =A40+1 -> 41 | B41: RYANN POLLOCK | C41: SAN DIEGUITO ACAD. | D41: 0.70277777777777783
A42: =A41+1 -> 42 | B42: SHELBY TAYLOR | C42: SAN DIEGUITO ACAD. | D42: 0.70763888888888893
A43: =A42+1 -> 43 | B43: MONICA NAVARRO | C43: ESCONDIDO CHARTER | D43: 0.71319444444444446
A44: =A43+1 -> 44 | B44: K. ARCE | C44: WEST HILLS | D44: 0.71388888888888891
A45: =A44+1 -> 45 | B45: CASSANDRA WADE | C45: GROSSMONT | D45: 0.71736111111111101
A46: =A45+1 -> 46 | B46: CASSIE CUNNIGHAM | C46: MIRA MESA | D46: 0.71805555555555556
A47: =A46+1 -> 47 | B47: SARAI MORA | C47: MIRA MESA | D47: 0.72222222222222221
A48: =A47+1 -> 48 | B48: ANGELA SOUTHYDETH | C48: MIRA MESA | D48: 0.72291666666666676
A49: =A48+1 -> 49 | B49: ELISE FORNACA | C49: CCHS | D49: 0.72361111111111109
A50: =A49+1 -> 50 | B50: ELIZABETH SCOTT | C50: MIRA MESA | D50: 0.72569444444444453
A51: =A50+1 -> 51 | B51: STACY WILKINSON | C51: MIRA MESA | D51: 0.72638888888888886
A52: =A51+1 -> 52 | B52: ADHI SMITH | C52: MIRA MESA | D52: 0.73124999999999996
A53: =A52+1 -> 53 | B53: KATIE PACKER | C53: GROSSMONT | D53: 0.7402777777777777
A54: =A53+1 -> 54 | B54: NICOLE DIAZ | C54: CALVARY CHRISTIAN ACAD. | D54: 0.74097222222222225
A55: =A54+1 -> 55 | B55: ALICIA PERCY | C55: MIRA MESA | D55: 0.74305555555555547
A56: =A55+1 -> 56 | B56: SARAH WOZNIDK | C56: CCHS | D56: 0.74444444444444446
A57: =A56+1 -> 57 | B57: QUINN HARMON | C57: ESCONDIDO CHARTER | D57: 0.7597222222222223
A58: =A57+1 -> 58 | B58: YOLANDA DE LA TORRE | C58: GROSSMONT | D58: 0.76597222222222217
A59: =A58+1 -> 59 | B59: ALICE WILSON | C59: GROSSMONT | D59: 0.76736111111111116
A60: =A59+1 -> 60 | B60: CHERYL NAUMAN | C60: ESCONDIDO CHARTER | D60: 0.77083333333333337
A61: =A60+1 -> 61 | B61: NIKKI DENTONI | C61: ESCONDIDO CHARTER | D61: 0.77083333333333337
A62: =A61+1 -> 62 | B62: CLAIRE ASARO | C62: GROSSMONT | D62: 0.78055555555555556
A63: =A62+1 -> 63 | B63: ARIEL BEILSUN | C63: CALVARY CHRISTIAN ACAD. | D63: 0.78263888888888899
A64: =A63+1 -> 64 | B64: VIRGINIA SCOTT | C64: CANYON CREST | D64: 0.79513888888888884
A65: =A64+1 -> 65 | B65: CAROL MANISOUK | C65: MIRA MESA | D65: 0.79513888888888884
A66: =A65+1 -> 66 | B66: KIM NICHOLS | C66: MIRA MESA | D66: 0.79652777777777783
A67: =A66+1 -> 67 | B67: LAURA KNIGHT | C67: MIRA MESA | D67: 0.79722222222222217
A68: =A67+1 -> 68 | B68: E. DELUCA | C68: WEST HILLS | D68: 0.80208333333333337
A69: =A68+1 -> 69 | B69: MADELYN RAINEY | C69: GROSSMONT | D69: 0.81527777777777777
A70: =A69+1 -> 70 | B70: ROBYN HASS | C70: ESCONDIDO CHARTER | D70: 0.82013888888888886
A71: =A70+1 -> 71 | B71: RAQUEL ABAD | C71: MIRA MESA | D71: 0.8305555555555556
A72: =A71+1 -> 72 | B72: SHERI FAYAL | C72: CALVARY CHRISTIAN ACAD. | D72: 0.875
A73: =A72+1 -> 73 | B73: KALI FAULWETTER | C73: GROSSMONT | D73: 0.91736111111111107
A74: =A73+1 -> 74 | B74: KRISTINA DAVILA | C74: CALVARY CHRISTIAN ACAD. | D74: 0.92152777777777783
A75: =A74+1 -> 75 | B75: KAYLA OBERLA | C75: ESCONDIDO CHARTER | D75: 0.92361111111111116
A76: =A75+1 -> 76 | B76: VIVIANA GARCIA | C76: CALVARY CHRISTIAN ACAD. | D76: 0.92708333333333337
A77: =A76+1 -> 77 | B77: JACKIE HO | C77: GROSSMONT | D77: 0.93263888888888891

A1: 1 | B1: KYLE BROXTERMAN | C1: ESCONDIDO CHARTER | D1: 0.48333333333333334
A2: =A1+1 -> 2 | B2: K. JORGE | C2: WEST HILLS | D2: 0.48541666666666666
A3: =A2+1 -> 3 | B3: BLAED DEVEL | C3: CCHS | D3: 0.49791666666666662
A4: =A3+1 -> 4 | B4: JACINTO DOMINGUEZ | C4: ESCONDIDO CHARTER | D4: 0.50069444444444444
A5: =A4+1 -> 5 | B5: C. CABRAL | C5: WEST HILLS | D5: 0.50416666666666665
A6: =A5+1 -> 6 | B6: T. DERVANTES | C6: WEST HILLS | D6: 0.50694444444444442
A7: =A6+1 -> 7 | B7: D. FRITZ | C7: WEST HILLS | D7: 0.50694444444444442
A8: =A7+1 -> 8 | B8: JOSH SALMERON | C8: CCHS | D8: 0.50694444444444442
A9: =A8+1 -> 9 | B9: JARED GATES | C9: CCHS | D9: 0.5083333333333333
A10: =A9+1 -> 10 | B10: WILL FORTINI | C10: SAN DIEGUITO ACADEMY | D10: 0.50972222222222219
A11: =A10+1 -> 11 | B11: N. PIERCE | C11: WEST HILLS | D11: 0.51111111111111118
A12: =A11+1 -> 12 | B12: ALEX ADELSON | D12: 0.51388888888888895
A13: =A12+1 -> 13 | B13: CHARLES SEAT | D13: 0.51944444444444449
A14: =A13+1 -> 14 | B14: ERIK ANDERSON | C14: SAN DIEGUITO ACADEMY | D14: 0.52083333333333337
A15: =A14+1 -> 15 | B15: MATT BOEHMER | C15: CCHS | D15: 0.52083333333333337
A16: =A15+1 -> 16 | B16: J. WHIPPS | C16: WEST HILLS | D16: 0.52152777777777781
A17: =A16+1 -> 17 | B17: KYLE KEARNEY | C17: CCHS | D17: 0.52152777777777781
A18: =A17+1 -> 18 | B18: M. NINTEMAN | C18: WEST HILLS | D18: 0.52361111111111114
A19: =A18+1 -> 19 | B19: CESAR CELIS | C19: SAN DIEGUITO ACADEMY | D19: 0.52361111111111114
A20: =A19+1 -> 20 | B20: CASEY WU | C20: CANYON CREST | D20: 0.52569444444444446
A21: =A20+1 -> 21 | B21: PATRICK HEARST | C21: CCHS | D21: 0.52708333333333335
A22: =A21+1 -> 22 | B22: SEAN PUTNAM | C22: GROSSMONT | D22: 0.52777777777777779
A23: =A22+1 -> 23 | B23: R. BOZELLE | C23: WEST HILLS | D23: 0.52777777777777779
A24: =A23+1 -> 24 | B24: MAX HUGHES | D24: 0.52847222222222223
A25: =A24+1 -> 25 | B25: B. KRUMENACKER | C25: WEST HILLS | D25: 0.52916666666666667
A26: =A25+1 -> 26 | B26: BRYCE NORTON | C26: SAN DIEGUITO ACADEMY | D26: 0.53055555555555556
A27: =A26+1 -> 27 | B27: WILLIAM WOESLE | C27: CCHS | D27: 0.53819444444444442
A28: =A27+1 -> 28 | B28: MAX SIEGEL | C28: CCHS | D28: 0.5395833333333333
A29: =A28+1 -> 29 | B29: ALEX CALTA | C29: CCHS | D29: 0.54027777777777775
A30: =A29+1 -> 30 | B30: BLACKE NOBLE | C30: CANYON CREST | D30: 0.54305555555555551
A31: =A30+1 -> 31 | B31: DANE SHIGLEY | C31: CANYON CREST | D31: 0.54305555555555551
A32: =A31+1 -> 32 | B32: BRYAN GRUNER | C32: MIRA MESA | D32: 0.54374999999999996
A33: =A32+1 -> 33 | B33: K. SMITH | C33: WEST HILLS | D33: 0.54374999999999996
A34: =A33+1 -> 34 | B34: M. PITIMAN | C34: WEST HILLS | D34: 0.54513888888888895
A35: =A34+1 -> 35 | B35: J. THOMAS | C35: WEST HILLS | D35: 0.54652777777777783
A36: =A35+1 -> 36 | B36: JIMMY GREENBLATT | C36: GROSSMONT | D36: 0.54652777777777783
A37: =A36+1 -> 37 | B37: CRIC COOK | C37: SAN DIEGUITO ACADEMY | D37: 0.5493055555555556
A38: =A37+1 -> 38 | B38: STEVE ESCALERA | C38: SAN DIEGUITO ACADEMY | D38: 00.55
A39: =A38+1 -> 39 | B39: ANDRE MACKENZI | C39: WEST HILLS | D39: 0.55138888888888882
A40: =A39+1 -> 40 | B40: BRIAN DWYER | C40: CCHS | D40: 0.5541666666666667
A41: =A40+1 -> 41 | B41: MATT MAZZOLA | C41: RAMONA | D41: 0.55486111111111114
A42: =A41+1 -> 42 | B42: NICK ARMSTRONG | C42: SAN DIEGUITO ACADEMY | D42: 0.55555555555555558
A43: =A42+1 -> 43 | B43: STEPHEN WETHERELL | C43: CCHS | D43: 0.55694444444444446
A44: =A43+1 -> 44 | B44: T. AULT | C44: WEST HILLS | D44: 0.55902777777777779
A45: =A44+1 -> 45 | B45: DAVID CRUZ | C45: CALVARY CHRISTIAN ACAD. | D45: 0.56111111111111112
A46: =A45+1 -> 46 | B46: CORY TAYLOR | C46: ESCONDIDO CHARTER | D46: 0.56111111111111112
A47: =A46+1 -> 47 | B47: RYAN MURPHY | C47: CCHS | D47: 0.56180555555555556
A48: =A47+1 -> 48 | B48: B. READ | C48: WEST HILLS | D48: 0.56319444444444444
A49: =A48+1 -> 49 | B49: IAN STANLEY | C49: ESCONDIDO CHARTER | D49: 0.56666666666666665
A50: =A49+1 -> 50 | B50: BRIAN COOK | C50: SAN DIEGUITO ACADEMY | D50: 0.56736111111111109
A51: =A50+1 -> 51 | B51: JACOB KALICHMAN | C51: SAN DIEGUITO ACADEMY | D51: 0.5708333333333333
A52: =A51+1 -> 52 | B52: ALEXANDER CHAFFEE | C52: ESCONDIDO CHARTER | D52: 0.57152777777777775
A53: =A52+1 -> 53 | B53: ALBERTO GUZMAN | C53: MIRA MESA | D53: 0.57222222222222219
A54: =A53+1 -> 54 | B54: EDWARD CHIN | C54: MIRA MESA | D54: 0.57499999999999996
A55: =A54+1 -> 55 | B55: MATT SKERRITT | C55: CANYON CREST | D55: 0.58611111111111114
A56: =A55+1 -> 56 | B56: SHAWN ROBERTS | C56: CANYON CREST | D56: 0.58611111111111114
A57: =A56+1 -> 57 | B57: GREG HOOKER | C57: CANYON CREST | D57: 0.58958333333333335
A58: =A57+1 -> 58 | B58: MICHAEL HANDY | C58: ESCONDIDO CHARTER | D58: 0.59097222222222223
A59: =A58+1 -> 59 | B59: MAX MAISEL | C59: SAN DIEGUITO ACADEMY | D59: 0.59236111111111112
A60: =A59+1 -> 60 | B60: SEAN HARDEBECK | C60: CCHS | D60: 0.59305555555555556
A61: =A60+1 -> 61 | B61: ADAM ALLEY | C61: MIRA MESA | D61: 0.59305555555555556
A62: =A61+1 -> 62 | B62: ARIEL LETT | C62: MIRA MESA | D62: 0.59722222222222221
A63: =A62+1 -> 63 | B63: ANTON | C63: ESCONDIDO CHARTER | D63: 0.59930555555555554
A64: =A63+1 -> 64 | B64: MATT GUERRERO | C64: GROSSMONT | D64: 0.59930555555555554
A65: =A64+1 -> 65 | B65: JONAH PARAISO | C65: GROSSMONT | D65: 0.60347222222222219
A66: =A65+1 -> 66 | B66: ZACH BRUNS | C66: SAN DIEGUITO ACADEMY | D66: 0.60347222222222219
A67: =A66+1 -> 67 | B67: MOVA YING | C67: MIRA MESA | D67: 0.61111111111111105
A68: =A67+1 -> 68 | B68: JAMES EBENTIER | C68: SAN DIEGUITO ACADEMY | D68: 0.6166666666666667
A69: =A68+1 -> 69 | B69: C. LAZELL | C69: WEST HILLS | D69: 0.61944444444444446
A70: =A69+1 -> 70 | B70: ALBERTO GONZALEZ | C70: CANYON CREST | D70: 0.62083333333333335
A71: =A70+1 -> 71 | B71: TYLER DAVIDSON | D71: 0.62291666666666667
A72: =A71+1 -> 72 | B72: PHI TON | C72: MIRA MESA | D72: 0.63472222222222219
A73: =A72+1 -> 73 | B73: A.J. ELLIS | C73: CANYON CREST | D73: 0.6381944444444444
A74: =A73+1 -> 74 | B74: JACOB HANDY | C74: ESCONDIDO CHARTER | D74: 0.63958333333333328
A75: =A74+1 -> 75 | B75: JACOB LAROCCA | C75: CANYON CREST | D75: 0.64513888888888882
A76: =A75+1 -> 76 | B76: ROBERT FISHER | C76: CANYON CREST | D76: 0.65486111111111112
A77: =A76+1 -> 77 | B77: NICK GUERRORO | C77: GROSSMONT | D77: 0.65625
A78: =A77+1 -> 78 | B78: ZACHARY IRWIN | C78: ESCONDIDO CHARTER | D78: 0.65833333333333333
A79: =A78+1 -> 79 | B79: JUSTIN LATIMER | C79: CANYON CREST | D79: 0.66249999999999998
A80: =A79+1 -> 80 | B80: SCOTT SALZBERG | C80: CANYON CREST | D80: 0.68541666666666667
A81: =A80+1 -> 81 | B81: MATTHEW CHANEY | C81: CALVARY CHRISTIAN ACAD. | D81: 0.68541666666666667
A82: =A81+1 -> 82 | B82: LOI NGO | C82: MIRA MESA | D82: 0.68680555555555556
A83: =A82+1 -> 83 | B83: ALEC FLANAGAN | C83: CALVARY CHRISTIAN ACAD. | D83: 0.73263888888888884
A84: =A83+1 -> 84 | B84: ANTHONY TONG | C84: MIRA MESA | D84: 0.75277777777777777