B1: BOYS | C1: GIRLS
A2: VARSITY | B2: W 23 - 36 | C2: W 26 - 33
A3: JV | B3: W 15 - 49 | C3: W 15 - 49
A4: F | B4: no score

A1: 1 | B1: PARKER STINSON | C1: 0.7006944444444444 | D1: 1 | E1: CAROLINE DRAPER | F1: 0.66249999999999998
A2: =A1+1 -> 2 | B2: JAKE WERTNER | C2: 0.70138888888888884 | D2: =E1+1 -> 2 | E2: KRISTA EGENSE | F2: 0.69166666666666665
A3: =A2+1 -> 3 | B3: DREW FLOOD | C3: 0.70763888888888893 | D3: =E2+1 -> 3 | E3: JENNY ZHUANG | F3: 0.7104166666666667
A4: =A3+1 -> 4 | B4: SEAN PROEHL | C4: 0.71388888888888891 | D4: =E3+1 -> 4 | E4: JANA DRAKE | F4: 0.72013888888888888
A5: =A4+1 -> 5 | B5: JARED FENLASON | C5: 0.71805555555555556 | D5: =E4+1 -> 5 | E5: MICHELLE BLACK | F5: 0.72569444444444442
A6: =A5+1 -> 6 | B6: BRYCE HOLEWINSKI | C6: 0.72638888888888886 | D6: =E5+1 -> 6 | E6: TAYLOR PARKER | F6: 0.73263888888888884
A7: =A6+1 -> 7 | B7: KEVIN SCHUBERT | C7: 0.73888888888888893 | D7: =E6+1 -> 7 | E7: CASSIE WICOFF | F7: 0.74583333333333335
A8: =A7+1 -> 8 | B8: AARON FENLASON | C8: 0.75347222222222221 | D8: =E7+1 -> 8 | E8: NINA SCHEEPERS | F8: 0.74930555555555556
A9: =A8+1 -> 9 | B9: DAVID CARLSON | C9: 0.7583333333333333 | D9: =E8+1 -> 9 | E9: CARLY BLISS | F9: 0.75486111111111109
A10: =A9+1 -> 10 | B10: NOAH RESTO | C10: 0.77430555555555558 | D10: =E9+1 -> 10 | E10: TARA CONNELL | F10: 0.76041666666666663
A11: =A10+1 -> 11 | B11: ROSS CANDELORE | C11: 0.77777777777777779 | D11: =E10+1 -> 11 | E11: NATALIE UDUWELA | F11: 0.77847222222222223
A12: =A11+1 -> 12 | B12: STEVEN KAMEN | C12: 0.77847222222222223 | D12: =E11+1 -> 12 | E12: TARA COWEN | F12: 0.78194444444444444
A13: =A12+1 -> 13 | B13: O'MIN KWON | C13: 0.78611111111111109 | D13: =E12+1 -> 13 | E13: CASEY BURGESS | F13: 0.80208333333333337
A14: =A13+1 -> 14 | B14: RILEY WEBB | C14: 0.81180555555555556 | D14: =E13+1 -> 14 | E14: KARA YAP | F14: 0.8041666666666667
A15: =A14+1 -> 15 | B15: VASTAL SHAH | C15: 0.81319444444444444 | D15: =E14+1 -> 15 | E15: MICHELLE RUGG | F15: 0.80486111111111114
A16: =A15+1 -> 16 | B16: SCOTT ROBISON | C16: 0.84097222222222223 | D16: =E15+1 -> 16 | E16: CHANTAE REDEN | F16: 0.82222222222222219
A17: =A16+1 -> 17 | B17: SO ADACHI | C17: 0.84375 | D17: =E16+1 -> 17 | E17: KELSEY ERSKINE | F17: 0.8305555555555556
A18: =A17+1 -> 18 | B18: SOHA JAFASZADE | C18: 0.87986111111111109 | D18: =E17+1 -> 18 | E18: DANA MOHAMMAD ZADEH | F18: 0.83750000000000002
A19: =A18+1 -> 19 | B19: CASEY SUMNER | C19: 0.88263888888888886 | D19: =E18+1 -> 19 | E19: LINDSAY SERHAN | F19: 0.84861111111111109
A20: =A19+1 -> 20 | B20: TYLER DAVIS | C20: 0.88402777777777775 | D20: =E19+1 -> 20 | E20: OLIVA KRZEMINSKI | F20: 0.85138888888888886
A21: =A20+1 -> 21 | B21: BRENT HARVEY | C21: 0.90902777777777777 | D21: =E20+1 -> 21 | E21: MICHELA MONETA | F21: 0.87013888888888891
A22: =A21+1 -> 22 | B22: RYOSUKE SAIKA | C22: 0.91388888888888886 | D22: =E21+1 -> 22 | E22: CHLOE LEFFAS-LOPES | F22: 0.88541666666666663
A23: =A22+1 -> 23 | B23: DANIEL NELSON | C23: 0.92152777777777772 | D23: =E22+1 -> 23 | E23: RACHAEL BURGESS | F23: 0.89166666666666672
A24: =A23+1 -> 24 | B24: GARRETT YAGADE | C24: 0.93472222222222223 | D24: =E23+1 -> 24 | E24: KATIE PAIGE | F24: 25:55
A25: =A24+1 -> 25 | B25: JAE SANG OH | C25: 0.95833333333333337
A26: =A25+1 -> 26 | B26: BRETT RAMIN | C26: 0.9604166666666667
A27: =A26+1 -> 27 | B27: BEN WANCEWICZ | C27: 0.99722222222222223
A28: =A27+1 -> 28 | B28: SKYLER WARREN | C28: 24:10
A29: =A28+1 -> 29 | B29: RYAN HUDGINS | C29: 26:11

A1: NAME | B1: PL | C1: 1 MILE | D1: FINISH | E1: PACE
A2: Varsity Girls
A4: CAROLINE DRAPER | B4: 1 | C4: 0.25347222222222221 | D4: 0.66249999999999998 | E4: 0.25480769230769229
A5: KRISTA EGENSE | B5: 4 | C5: 0.25347222222222221 | D5: 0.69166666666666665 | E5: 0.26602564102564102
A6: JENNY ZHUANG | B6: 6 | C6: 0.25763888888888886 | D6: 0.7104166666666667 | E6: 0.27323717948717952
A7: JANA DRAKE | B7: 7 | C7: 0.25763888888888886 | D7: 0.72013888888888888 | E7: 0.27697649572649574
A8: CARLY BLISS | B8: 11 | C8: 0.25833333333333336 | D8: 0.75486111111111109 | E8: 0.29033119658119655
A9: MICHELLE BLACK | B9: 8 | C9: 0.25833333333333336 | D9: 0.72569444444444442 | E9: 0.27911324786324787
A10: CASSIE WICOFF | B10: 10 | C10: 0.26597222222222222 | D10: 0.74583333333333335 | E10: 0.28685897435897434
A11: TAYLOR PARKER | B11: 9 | C11: 0.26458333333333334 | D11: 0.73263888888888884 | E11: 0.28178418803418803
A12: NATALIE UDUWELA | B12: 14 | C12: 0.27500000000000002 | D12: 0.77847222222222223 | E12: 0.29941239316239315
A13: LINDSAY SERHAN | B13: 18 | C13: 0.31180555555555556 | D13: 0.84861111111111109 | E13: 0.3263888888888889
A14: KATIE PAIGE | B14: 19 | C14: 0.33541666666666664 | D14: 25:55 | E14: 0.4152777777777778
A16: JV Girls
A18: NINA SCHEEPERS | B18: 1 | C18: 0.2722222222222222 | D18: 0.74930555555555556 | E18: 0.28819444444444442
A19: TARA COWEN | B19: 3 | C19: 0.29097222222222224 | D19: 0.78194444444444444 | E19: 0.30074786324786323
A20: CASEY BURGESS | B20: 4 | C20: 0.28472222222222221 | D20: 0.80208333333333337 | E20: 0.30849358974358976
A21: MICHELLE RUGG | B21: 6 | C21: 0.29166666666666669 | D21: 0.80486111111111114 | E21: 0.30956196581196582
A22: KARA YAP | B22: 5 | C22: 0.2902777777777778 | D22: 0.8041666666666667 | E22: 0.30929487179487181
A23: TARA CONNELL | B23: 2 | C23: 0.28263888888888888 | D23: 0.76041666666666663 | E23: 0.29246794871794868
A24: DANA MOHAMMAD ZADEH | B24: 10 | C24: 0.29097222222222224 | D24: 0.83750000000000002 | E24: 0.32211538461538464
A25: OLIVA KRZEMINSKI | B25: 11 | C25: 0.28958333333333336 | D25: 0.85138888888888886 | E25: 0.32745726495726496
A26: CHANTAE REDEN | B26: 8 | C26: 0.28888888888888886 | D26: 0.82222222222222219 | E26: 0.31623931623931623
A27: MICHELA MONETA | B27: 14 | C27: 0.30972222222222223 | D27: 0.87013888888888891 | E27: 0.3346688034188034
A28: KELSEY ERSKINE | B28: 9 | C28: 0.31041666666666667 | D28: 0.8305555555555556 | E28: 0.31944444444444448
A29: RACHAEL BURGESS | B29: 18 | C29: 0.31111111111111112 | D29: 0.89166666666666672 | E29: 0.34294871794871795
A30: CHLOE LEFFAS-LOPES | B30: 15 | C30: 0.31111111111111112 | D30: 0.88541666666666663 | E30: 0.34054487179487175

A1: NAME | B1: PL | C1: 1 MILE | D1: FINISH | E1: PACE
A2: Varsity Boys
A4: JARED FENLASON | B4: 7 | C4: 0.22222222222222221 | D4: 0.71805555555555556 | E4: 0.23542805100182151
A5: SEAN PROEHL | B5: 6 | C5: 0.22222222222222221 | D5: 0.71388888888888891 | E5: 0.23406193078324228
A6: JAKE WERTNER | B6: 3 | C6: 0.22222222222222221 | D6: 0.70138888888888884 | E6: 0.22996357012750454
A7: PARKER STINSON | B7: 2 | C7: 0.22222222222222221 | D7: 0.7006944444444444 | E7: 0.22973588342440801
A8: DREW FLOOD | B8: 5 | C8: 0.22222222222222221 | D8: 0.70763888888888893 | E8: 0.23201275045537342
A9: BRYCE HOLEWINSKI | B9: 8 | C9: 0.22222222222222221 | D9: 0.72638888888888886 | E9: 0.23816029143897996
A10: DAVID CARLSON | B10: 11 | C10: 0.22708333333333333 | D10: 0.7583333333333333 | E10: 0.24863387978142076
A11: SO ADACHI | B11: 17 | C11: 0.25138888888888888 | D11: 0.84375 | E11: 0.27663934426229508
A12: SOHA JAFASZADE | B12: 18 | C12: 0.26250000000000001 | D12: 0.87986111111111109 | E12: 0.28847905282331515
A13: BRETT RAMIN | B13: 19 | C13: 0.28402777777777777 | D13: 0.9604166666666667 | E13: 0.31489071038251371
A15: Frosh Boys
A16: KEVIN SCHUBERT | B16: 1 | C16: 0.23194444444444445 | D16: 0.73888888888888893 | E16: 0.2422586520947177
A17: ROSS CANDELORE | B17: 4 | C17: 0.24166666666666667 | D17: 0.77777777777777779 | E17: 0.25500910746812389
A18: NOAH RESTO | B18: 3 | C18: 0.24097222222222223 | D18: 0.77430555555555558 | E18: 0.25387067395264118
A19: RILEY WEBB | B19: 8 | C19: 0.24861111111111112 | D19: 0.81180555555555556 | E19: 0.26616575591985431
A20: BEN WANCEWICZ | B20: 32 | D20: 0.99722222222222223 | E20: 0.32695810564663025
A21: RYAN HUDGINS | B21: 34 | C21: 0.30555555555555558 | D21: 26:11 | E21: 0.35555555555555557
A22: SKYLER WARREN | B22: 33 | C22: 0.30208333333333331 | D22: 24:10 | E22: 0.32847222222222222
A24: JV Boys
A25: AARON FENLASON | B25: 2 | C25: 0.22569444444444445 | D25: 0.75347222222222221 | E25: 0.247040072859745
A26: TYLER DAVIS | B26: 19 | C26: 0.25069444444444444 | D26: 0.88402777777777775 | E26: 0.28984517304189433
A27: STEVEN KAMEN | B27: 5 | D27: 0.77847222222222223 | E27: 0.25523679417122042
A28: VASTAL SHAH | B28: 9 | D28: 0.81319444444444444 | E28: 0.26662112932604737
A29: O'MIN KWON | B29: 6 | D29: 0.78611111111111109 | E29: 0.25774134790528236
A30: CASEY SUMNER | B30: 18 | C30: 0.30833333333333335 | D30: 0.88263888888888886 | E30: 0.28938979963570127
A31: RYOSUKE SAIKA | B31: 25 | C31: 0.2673611111111111 | D31: 0.91388888888888886 | E31: 0.29963570127504552
A32: BRENT HARVEY | B32: 24 | C32: 0.27430555555555558 | D32: 0.90902777777777777 | E32: 0.29804189435336975
A33: GARRETT YAGADE | B33: 27 | C33: 0.2951388888888889 | D33: 0.93472222222222223 | E33: 0.30646630236794176
A34: DANIEL NELSON | B34: 26 | C34: 0.27569444444444446 | D34: 0.92152777777777772 | E34: 0.30214025500910746
A35: JAE SANG OH | B35: 29 | C35: 0.30069444444444443 | D35: 0.95833333333333337 | E35: 0.31420765027322406
A36: SCOTT ROBISON | B36: 13 | C36: 0.25069444444444444 | D36: 0.84097222222222223 | E36: 0.27572859744990896