B1: BOYS | C1: GIRLS
A2: VARSITY | B2: W 21 - 35 | C2: W 26 - 29
A3: JV | B3: W 18 - 37 | C3: W 28 - 28
A4: F | B4: W 25 - 32

A1: 1 | B1: CAROLINE DRAPER | C1: 0.67152777777777772 | E1: 1 | F1: JARED FENLASON | G1: 17:14.8
A2: =A1+1 -> 2 | B2: KRISTA EGENSE | C2: 0.6875 | E2: =E1+1 -> 2 | F2: SEAN PROEHL | G2: 17:17.4
A3: =A2+1 -> 3 | B3: JENNY ZHUANG | C3: 0.71597222222222223 | E3: 3 | F3: JAKE WERTNER | G3: 17:18.6
A4: =A3+1 -> 4 | B4: JANA DRAKE | C4: 0.71597222222222223 | E4: 4 | F4: DREW FLOOD | G4: 17:21.5
A5: =A4+1 -> 5 | B5: CARLY BLISS | C5: 0.72152777777777777 | E5: 5 | F5: BRYCE HOLEWINSKI | G5: 17:24.9
A6: =A5+1 -> 6 | B6: MICHELLE BLACK | C6: 0.73263888888888884 | E6: 6 | F6: DAVID CARLSON | G6: 18:51.6
A7: =A6+1 -> 7 | B7: CASSIE WICOFF | C7: 0.74097222222222225 | E7: 7 | F7: SO ADACHI | G7: 20:32.0
A8: =A7+1 -> 8 | B8: TAYLOR PARKER | C8: 0.75069444444444444 | E8: 8 | F8: SOHA JAFASZADE | G8: 21:40.4
A9: =A8+1 -> 9 | B9: NINA SCHEEPERS | C9: 0.75763888888888886
A10: =A9+1 -> 10 | B10: TARA COWEN | C10: 0.77083333333333337 | F10: JV/Frosh
A11: =A10+1 -> 11 | B11: CASEY BURGESS | C11: 0.7895833333333333 | E11: =1 -> 1 | F11: PARKER STINSON | G11: 15:03.0
A12: =A11+1 -> 12 | B12: MICHELLE RUGG | C12: 0.79097222222222219 | E12: =E11+1 -> 2 | F12: KEVIN SCHUBERT | G12: 15:03.3
A13: =A12+1 -> 13 | B13: KARA YAP | C13: 0.79166666666666663 | E13: =E12+1 -> 3 | F13: AARON FENLASON | G13: 15:21.4
A14: =A13+1 -> 14 | B14: TARA CONNELL | C14: 0.80347222222222225 | E14: =E13+1 -> 4 | F14: TYLER DAVIS | G14: 15:24.5
A15: =A14+1 -> 15 | B15: NATALIE UDUWELA | C15: 0.8125 | E15: =E14+1 -> 5 | F15: ROSS CANDELORE | G15: 15:32.6
A16: =A15+1 -> 16 | B16: DANA MOHAMMAD ZADEH | C16: 0.81666666666666665 | E16: =E15+1 -> 6 | F16: NOAH RESTO | G16: 15:43.1
A17: =A16+1 -> 17 | B17: OLIVA KRZEMINSKI | C17: 0.85902777777777772 | E17: =E16+1 -> 7 | F17: STEVEN KAMEN | G17: 15:49.2
A18: =A17+1 -> 18 | B18: CHANTAE REDEN | C18: 0.8666666666666667 | E18: =E17+1 -> 8 | F18: VASTAL SHAH | G18: 15:57.8
A19: =A18+1 -> 19 | B19: LINDSAY SERHAN | C19: 0.89375000000000004 | E19: =E18+1 -> 9 | F19: O'MIN KWON | G19: 16:20.0
A20: =A19+1 -> 20 | B20: MICHELA MONETA | C20: 0.90833333333333333 | E20: =E19+1 -> 10 | F20: CASEY SUMNER | G20: 17:21.2
A21: =A20+1 -> 21 | B21: KELSEY ERSKINE | C21: 0.91597222222222219 | E21: =E20+1 -> 11 | F21: RYOSUKE SAIKA | G21: 17:56.4
A22: =A21+1 -> 22 | B22: RACHAEL BURGESS | C22: 0.93125000000000002 | E22: =E21+1 -> 12 | F22: BRENT HARVEY | G22: 18:03.8
A23: =A22+1 -> 23 | B23: CHLOE LEFFAS-LOPES | C23: 0.94236111111111109 | E23: =E22+1 -> 13 | F23: GARRETT YAGADE | G23: 18:25.6
A24: =A23+1 -> 24 | B24: AMANDA ALDERTON | C24: 0.94652777777777775 | E24: =E23+1 -> 14 | F24: DANIEL NELSON | G24: 18:38.6
A25: =A24+1 -> 25 | B25: LILY MALEK | C25: 0.97916666666666663 | E25: =E24+1 -> 15 | F25: RILEY WEBB | G25: 19:20.2
E26: =E25+1 -> 16 | F26: BEN WANCEWICZ | G26: 19:47.4
E27: =E26+1 -> 17 | F27: RYAN HUDGINS | G27: 21:20.6
E28: =E27+1 -> 18 | F28: SKYLER WARREN | G28: 21:28.8

A1: NAME | B1: PL | C1: 1 MILE | D1: 2 MILE | E1: FINISH | F1: PACE
A2: Varsity Girls
A4: CAROLINE DRAPER | B4: 1 | C4: 0.24722222222222223 | D4: 0.53333333333333333 | E4: 0.67152777777777772 | F4: 0.26861111111111108
A5: KRISTA EGENSE | B5: 3 | C5: 0.24930555555555556 | D5: 0.55138888888888893 | E5: 0.6875 | F5: 0.27500000000000002
A6: MICHELLE BLACK | C6: 0.25624999999999998 | D6: 0.5708333333333333 | E6: 0.73263888888888884 | F6: 0.29305555555555551
A7: CASSIE WICOFF | C7: 0.2673611111111111 | D7: 0.58333333333333337 | E7: 0.74097222222222225 | F7: 0.29638888888888892
A8: JENNY ZHUANG | C8: 0.25833333333333336 | D8: 0.56874999999999998 | E8: 0.71597222222222223 | F8: 0.28638888888888892
A9: NATALIE UDUWELA | C9: 0.28333333333333333 | D9: 0.63402777777777775 | E9: 0.8125 | F9: 0.32500000000000001
A10: TAYLOR PARKER | C10: 0.26666666666666666 | D10: 0.59375 | E10: 0.75069444444444444 | F10: 0.30027777777777775
A11: JANA DRAKE | C11: 0.26180555555555557 | D11: 0.56666666666666665 | E11: 0.71597222222222223 | F11: 0.28638888888888892
A12: CARLY BLISS | C12: 0.26250000000000001 | D12: 0.57152777777777775 | E12: 0.72152777777777777 | F12: 0.2886111111111111
A13: MELISSA COYLE | C13: 0.35972222222222222 | E13: DNF
A14: LINDSAY SERHAN | C14: 0.33333333333333331 | D14: 0.70625000000000004 | E14: 0.89375000000000004 | F14: 0.35749999999999998
A15: KATIE PAIGE | C15: 0.35972222222222222 | E15: DNF
A17: JV Girls
A19: NINA SCHEEPERS | B19: 2 | C19: 0.27152777777777776 | D19: 0.59722222222222221 | E19: 0.75763888888888886 | F19: 0.30305555555555552
A20: MICHELLE RUGG | B20: 7 | C20: 0.28263888888888888 | D20: 0.61597222222222225 | E20: 0.79097222222222219 | F20: 0.31638888888888889
A21: TARA COWEN | B21: 5 | C21: 0.28333333333333333 | D21: 0.60555555555555551 | E21: 0.77083333333333337 | F21: 0.30833333333333335
A22: KARA YAP | B22: 8 | C22: 0.29166666666666669 | D22: 0.63194444444444442 | E22: 0.79166666666666663 | F22: 0.31666666666666665
A23: DANA MOHAMMAD ZADEH | B23: 12 | C23: 0.29305555555555557 | D23: 0.64097222222222228 | E23: 0.81666666666666665 | F23: 0.32666666666666666
A24: CASEY BURGESS | B24: 6 | C24: 0.27916666666666667 | D24: 0.61597222222222225 | E24: 0.7895833333333333 | F24: 0.3158333333333333
A25: TARA CONNELL | B25: 10 | C25: 0.29305555555555557 | D25: 0.64027777777777772 | E25: 0.80347222222222225 | F25: 0.32138888888888889
A26: AMANDA ALDERTON | B26: 24 | C26: 0.31944444444444442 | D26: 0.7416666666666667 | E26: 0.94652777777777775 | F26: 0.37861111111111112
A27: KELSEY ERSKINE | B27: 21 | C27: 0.33194444444444443 | D27: 0.72222222222222221 | E27: 0.91597222222222219 | F27: 0.36638888888888888
A28: LILY MALEK | B28: 25 | C28: 0.31944444444444442 | D28: 0.75138888888888888 | E28: 0.97916666666666663 | F28: 0.39166666666666666
A29: OLIVA KRZEMINSKI | B29: 16 | C29: 0.32569444444444445 | D29: 0.68333333333333335 | E29: 0.85902777777777772 | F29: 0.34361111111111109
A30: CHLOE LEFFAS-LOPES | B30: 23 | C30: 0.3263888888888889 | D30: 0.74444444444444446 | E30: 0.94236111111111109 | F30: 0.37694444444444442
A31: CHANTAE REDEN | B31: 17 | C31: 0.30277777777777776 | D31: 0.68194444444444446 | E31: 0.8666666666666667 | F31: 0.34666666666666668
A32: MICHELA MONETA | B32: 20 | C32: 0.32291666666666669 | D32: 0.71250000000000002 | E32: 0.90833333333333333 | F32: 0.36333333333333334
A33: RACHAEL BURGESS | B33: 22 | C33: 0.3263888888888889 | D33: 0.72361111111111109 | E33: 0.93125000000000002 | F33: 0.3725

A1: NAME | B1: PL | C1: 1 MILE | D1: 2 MILE | E1: FINISH | F1: PACE
A2: Varsity Boys
A4: JAKE WERTNER | B4: 4 | C4: 0.22638888888888889 | D4: 0.4826388888888889 | E4: 17:18.6 | F4: =E4/3*60 -> 0.24041666666666664
A5: JARED FENLASON | B5: 2 | C5: 0.22638888888888889 | D5: 0.48194444444444445 | E5: 17:14.8 | F5: =E5/3*60 -> 0.23953703703703702
A6: BRYCE HOLEWINSKI | B6: 6 | C6: 0.22638888888888889 | D6: 0.48333333333333334 | E6: 17:24.9 | F6: =E6/3*60 -> 0.24187500000000001
A7: DAVID CARLSON | C7: 0.23194444444444445 | D7: 0.51041666666666663 | E7: 18:51.6 | F7: =E7/3*60 -> 0.26194444444444442
A8: SO ADACHI | C8: 0.25208333333333333 | E8: 20:32.0 | F8: =E8/3*60 -> 0.28518518518518526
A9: SOHA JAFASZADE | C9: 0.26527777777777778 | E9: 21:40.4 | F9: =E9/3*60 -> 0.30101851851851852
A10: SEAN PROEHL | B10: 3 | C10: 0.22638888888888889 | D10: 0.48194444444444445 | E10: 17:17.4 | F10: =E10/3*60 -> 0.24013888888888887
A11: DREW FLOOD | B11: 5 | C11: 0.22638888888888889 | D11: 0.4826388888888889 | E11: 17:21.5 | F11: =E11/3*60 -> 0.24108796296296298
A15: Frosh Boys
A16: PARKER STINSON | B16: 1 | C16: 0.2388888888888889 | D16: 0.50208333333333333 | E16: 15:03.0 | F16: =E16/2.5*60 -> 0.25083333333333335
A17: KEVIN SCHUBERT | B17: 2 | C17: 0.2388888888888889 | D17: 0.50208333333333333 | E17: 15:03.3 | F17: =E17/2.5*60 -> 0.25091666666666668
A18: ROSS CANDELORE | B18: 4 | C18: 0.2388888888888889 | D18: 0.5083333333333333 | E18: 15:32.6 | F18: =E18/2.5*60 -> 0.25905555555555554
A19: NOAH RESTO | B19: 6 | C19: 0.24791666666666667 | D19: 0.51388888888888884 | E19: 15:43.1 | F19: =E19/2.5*60 -> 0.26197222222222222
A20: RILEY WEBB | B20: 12 | C20: 0.25347222222222221 | E20: 19:20.2 | F20: =E20/2.5*60 -> 0.32227777777777777
A21: BEN WANCEWICZ | C21: 0.31111111111111112 | E21: 19:47.4 | F21: =E21/2.5*60 -> 0.32983333333333331
A22: SKYLER WARREN | C22: 0.32291666666666669 | E22: 21:28.8 | F22: =E22/2.5*60 -> 0.35800000000000004
A23: RYAN HUDGINS | C23: 0.30416666666666664 | E23: 21:20.6 | F23: =E23/2.5*60 -> 0.35572222222222222
A25: JV Boys
A26: O'MIN KWON | C26: 0.24791666666666667 | E26: 16:20.0 | F26: =E26/2.5*60 -> 0.2722222222222222
A27: CASEY SUMNER | C27: 0.26180555555555557 | E27: 17:21.2 | F27: =E27/2.5*60 -> 0.28922222222222221
A28: STEVEN KAMEN | C28: 0.24652777777777779 | E28: 15:49.2 | F28: =E28/2.5*60 -> 0.26366666666666666
A29: TYLER DAVIS | C29: 0.2388888888888889 | D29: 0.50208333333333333 | E29: 15:24.5 | F29: =E29/2.5*60 -> 0.25680555555555556
A30: VASTAL SHAH | C30: 0.24583333333333332 | E30: 15:57.8 | F30: =E30/2.5*60 -> 0.26605555555555555
A31: AARON FENLASON | C31: 0.2388888888888889 | D31: 0.50208333333333333 | E31: 15:21.4 | F31: =E31/2.5*60 -> 0.25594444444444453
A32: BRENT HARVEY | C32: 0.27500000000000002 | E32: 18:03.8 | F32: =E32/2.5*60 -> 0.30105555555555558
A33: DANIEL NELSON | C33: 0.27083333333333331 | E33: 18:38.6 | F33: =E33/2.5*60 -> 0.31072222222222229
A34: RYOSUKE SAIKA | C34: 0.2638888888888889 | E34: 17:56.4 | F34: =E34/2.5*60 -> 0.29900000000000004
A35: GARRETT YAGADE | C35: 0.28402777777777777 | E35: 18:25.6 | F35: =E35/2.5*60 -> 0.30711111111111111