B1: BOYS | C1: GIRLS
A2: VARSITY | B2: L 36 - 19 | C2: L 39 - 20
A3: JV | B3: W 27 - 29 | C3: L 38 - 21
A4: F | B4: L 32 - 25

A1: 1 | B1: CAROLINE DRAPER | C1: 0.66041666666666665 | E1: 1 | F1: PARKER STINSON | G1: 0.70972222222222225
A2: =A1+1 -> 2 | B2: KRISTA EGENSE | C2: 0.70138888888888884 | E2: =E1+1 -> 2 | F2: SEAN PROEHL | G2: 0.71666666666666667
A3: =A2+1 -> 3 | B3: JENNY ZHUANG | C3: 0.70208333333333328 | E3: =E2+1 -> 3 | F3: DREW FLOOD | G3: 0.71805555555555556
A4: =A3+1 -> 4 | B4: MICHELLE BLACK | C4: 0.73055555555555551 | E4: =E3+1 -> 4 | F4: JAKE WERTNER | G4: 0.72638888888888886
A5: =A4+1 -> 5 | B5: NINA SCHEEPERS | C5: 0.74097222222222225 | E5: =E4+1 -> 5 | F5: BRYCE HOLEWINSKI | G5: 0.73124999999999996
A6: =A5+1 -> 6 | B6: JANA DRAKE | C6: 0.7416666666666667 | E6: =E5+1 -> 6 | F6: AARON FENLASON | G6: 0.73333333333333328
A7: =A6+1 -> 7 | B7: CARLY BLISS | C7: 0.74513888888888891 | E7: =E6+1 -> 7 | F7: JARED FENLASON | G7: 0.73958333333333337
A8: =A7+1 -> 8 | B8: TAYLOR PARKER | C8: 0.74861111111111112 | E8: =E7+1 -> 8 | F8: KEVIN SCHUBERT | G8: 0.74444444444444446
A9: =A8+1 -> 9 | B9: NATALIE UDUWELA | C9: 0.76944444444444449 | E9: =E8+1 -> 9 | F9: NOAH RESTO | G9: 0.75624999999999998
A10: =A9+1 -> 10 | B10: TARA COWEN | C10: 0.78263888888888888 | E10: =E9+1 -> 10 | F10: ROSS CANDELORE | G10: 0.75624999999999998
A11: =A10+1 -> 11 | B11: KARA YAP | C11: 0.79097222222222219 | E11: =E10+1 -> 11 | F11: DAVID CARLSON | G11: 0.76180555555555551
A12: =A11+1 -> 12 | B12: CHANTAE REDEN | C12: 0.81874999999999998 | E12: =E11+1 -> 12 | F12: TYLER DAVIS | G12: 0.76249999999999996
A13: =A12+1 -> 13 | B13: CASEY BURGESS | C13: 0.8208333333333333 | E13: =E12+1 -> 13 | F13: O'MIN KWON | G13: 0.78472222222222221
A14: =A13+1 -> 14 | B14: DANA MOHAMMAD ZADEH | C14: 0.8354166666666667 | E14: =E13+1 -> 14 | F14: STEVEN KAMEN | G14: 0.78541666666666665
A15: =A14+1 -> 15 | B15: KELSEY ERSKINE | C15: 0.83680555555555558 | E15: =E14+1 -> 15 | F15: VASTAL SHAH | G15: 0.80277777777777781
A16: =A15+1 -> 16 | B16: OLIVA KRZEMINSKI | C16: 0.83750000000000002 | E16: =E15+1 -> 16 | F16: SO ADACHI | G16: 0.82777777777777772
A17: =A16+1 -> 17 | B17: MICHELLE RUGG | C17: 0.84513888888888888 | E17: =E16+1 -> 17 | F17: TOR HEXEBERG | G17: 0.83263888888888893
A18: =A17+1 -> 18 | B18: MICHELA MONETA | C18: 0.86527777777777781 | E18: =E17+1 -> 18 | F18: CASEY SUMNER | G18: 0.8520833333333333
A19: =A18+1 -> 19 | B19: CHLOE LEFFAS-LOPES | C19: 0.93194444444444446 | E19: =E18+1 -> 19 | F19: GARRETT YAGADE | G19: 0.85277777777777775
E20: =E19+1 -> 20 | F20: RYLEY WEBB | G20: 0.88124999999999998
E21: =E20+1 -> 21 | F21: BRENT HARVEY | G21: 0.88680555555555551
E22: =E21+1 -> 22 | F22: DANIEL NELSON | G22: 0.8881944444444444
E23: =E22+1 -> 23 | F23: SOHA JAFASZADE | G23: 0.91527777777777775
E24: =E23+1 -> 24 | F24: PETER BENITO | G24: 0.92152777777777772
E25: =E24+1 -> 25 | F25: RYOSUKE SAIKA | G25: 0.92222222222222228
E26: =E25+1 -> 26 | F26: BRETT RAMIN | G26: 0.92569444444444449
E27: =E26+1 -> 27 | F27: JAE SANG OH | G27: 0.9458333333333333
E28: =E27+1 -> 28 | F28: ROBERT MCENTIRE | G28: 0.96527777777777779
E29: =E28+1 -> 29 | F29: RYAN HUDGINS | G29: 0.96875
E30: =E29+1 -> 30 | F30: BEN WANCEWICZ | G30: 24:49

A1: NAME | B1: PL | C1: 1 MILE | D1: FINISH | E1: PACE | F1: PREV
A2: Varsity Girls
H3: RB | I3: TP
A4: CAROLINE DRAPER | B4: 1 | D4: 0.66041666666666665 | E4: 0.25400641025641024 | F4: 0.66249999999999998 | H4: 2 | I4: 1
A5: KRISTA EGENSE | B5: 7 | D5: 0.70138888888888884 | E5: 0.26976495726495725 | F5: 0.69166666666666665 | H5: 3 | I5: 7
A6: JENNY ZHUANG | B6: 8 | D6: 0.70208333333333328 | E6: 0.27003205128205127 | F6: 0.7104166666666667 | H6: 4 | I6: 8
A7: MICHELLE BLACK | B7: 12 | D7: 0.73055555555555551 | E7: 0.28098290598290598 | F7: 0.72569444444444442 | H7: 5 | I7: 11
A8: JANA DRAKE | B8: 13 | D8: 0.7416666666666667 | E8: 0.28525641025641024 | F8: 0.72013888888888888 | H8: 6 | I8: 12
A9: CARLY BLISS | B9: 14 | D9: 0.74513888888888891 | E9: 0.28659188034188032 | F9: 0.75486111111111109 | H9: 20 | I9: 39
A10: TAYLOR PARKER | B10: 15 | D10: 0.74861111111111112 | E10: 0.2879273504273504 | F10: 0.73263888888888884
A11: NATALIE UDUWELA | B11: 16 | D11: 0.76944444444444449 | E11: 0.29594017094017094 | F11: 0.77847222222222223
A13: JV Girls
A15: NINA SCHEEPERS | B15: 1 | D15: 0.74097222222222225 | E15: 0.28498931623931623 | F15: 0.74930555555555556
A16: TARA COWEN | B16: 6 | D16: 0.78263888888888888 | E16: 0.30101495726495725 | F16: 0.78194444444444444 | H16: RB | I16: TP
A17: KARA YAP | B17: 8 | D17: 0.79097222222222219 | E17: 0.30422008547008544 | F17: 0.8041666666666667 | H17: 1 | I17: 2
A18: CHANTAE REDEN | B18: 12 | D18: 0.81874999999999998 | E18: 0.31490384615384615 | F18: 0.82222222222222219 | H18: 6 | I18: 3
A19: CASEY BURGESS | B19: 14 | D19: 0.8208333333333333 | E19: 0.31570512820512819 | F19: 0.80208333333333337 | H19: 8 | I19: 4
A20: DANA MOHAMMAD ZADEH | B20: 17 | D20: 0.8354166666666667 | E20: 0.32131410256410259 | F20: 0.83750000000000002 | H20: 11 | I20: 5
A21: KELSEY ERSKINE | B21: 18 | D21: 0.83680555555555558 | E21: 0.32184829059829062 | F21: 0.8305555555555556 | H21: 12 | I21: 7
A22: OLIVA KRZEMINSKI | B22: 19 | D22: 0.83750000000000002 | E22: 0.32211538461538464 | F22: 0.85138888888888886 | H22: 38 | I22: 21
A23: MICHELLE RUGG | B23: 20 | D23: 0.84513888888888888 | E23: 0.32505341880341881 | F23: 0.80486111111111114
A24: MICHELA MONETA | B24: 21 | D24: 0.86527777777777781 | E24: 0.33279914529914528 | F24: 0.87013888888888891
A25: CHLOE LEFFAS-LOPES | B25: 27 | D25: 0.93194444444444446 | E25: 0.35844017094017094 | F25: 0.88541666666666663

A1: NAME | B1: PL | C1: 1 MILE | D1: FINISH | E1: PACE | F1: PREV
A2: Varsity Boys
A4: PARKER STINSON | B4: 4 | C4: 0.22708333333333333 | D4: 0.70972222222222225 | E4: =D4/3.05 -> 0.23269581056466304 | F4: 0.7006944444444444
A5: SEAN PROEHL | B5: 6 | C5: 0.22708333333333333 | D5: 0.71666666666666667 | E5: =D5/3.05 -> 0.23497267759562843 | F5: 0.71388888888888891 | H5: RB | I5: TP
A6: DREW FLOOD | B6: 7 | C6: 0.22569444444444445 | D6: 0.71805555555555556 | E6: =D6/3.05 -> 0.23542805100182151 | F6: 0.70763888888888893 | H6: 4 | I6: 1
A7: JAKE WERTNER | B7: 9 | C7: 0.22777777777777777 | D7: 0.72638888888888886 | E7: =D7/3.05 -> 0.23816029143897996 | F7: 0.70138888888888884 | H7: 6 | I7: 2
A8: BRYCE HOLEWINSKI | B8: 10 | C8: 0.22777777777777777 | D8: 0.73124999999999996 | E8: =D8/3.05 -> 0.23975409836065573 | F8: 0.72638888888888886 | H8: 7 | I8: 3
A9: AARON FENLASON | B9: 11 | C9: 0.22847222222222222 | D9: 0.73333333333333328 | E9: =D9/3.05 -> 0.24043715846994534 | F9: 0.75347222222222221 | H9: 9 | I9: 5
A10: JARED FENLASON | B10: 13 | C10: 0.22777777777777777 | D10: 0.73958333333333337 | E10: =D10/3.05 -> 0.24248633879781423 | F10: 0.71805555555555556 | H10: 10 | I10: 8
A11: KEVIN SCHUBERT | B11: 14 | C11: 0.22777777777777777 | D11: 0.74444444444444446 | E11: =D11/3.05 -> 0.24408014571948999 | F11: 0.73888888888888893 | H11: 36 | I11: 19
A12: DAVID CARLSON | B12: 19 | C12: 0.23541666666666666 | D12: 0.76180555555555551 | E12: =D12/3.05 -> 0.24977231329690347 | F12: 0.7583333333333333
A13: SO ADACHI | B13: 22 | C13: 0.25 | D13: 0.82777777777777772 | E13: =D13/3.05 -> 0.27140255009107467 | F13: 0.84375
A14: SOHA JAFASZADE | B14: 24 | C14: 0.2638888888888889 | D14: 0.91527777777777775 | E14: =D14/3.05 -> 0.30009107468123863 | F14: 0.87986111111111109
A15: BRETT RAMIN | B15: 25 | C15: 0.28263888888888888 | D15: 0.92569444444444449 | E15: =D15/3.05 -> 0.30350637522768675 | F15: 0.9604166666666667
A17: Frosh Boys
H18: RB | I18: TP
A19: NOAH RESTO | B19: 1 | C19: 0.23680555555555555 | D19: 0.75624999999999998 | E19: =D19/3.05 -> 0.24795081967213115 | F19: 0.77430555555555558 | H19: 1 | I19: 3
A20: ROSS CANDELORE | B20: 2 | C20: 0.2361111111111111 | D20: 0.75624999999999998 | E20: =D20/3.05 -> 0.24795081967213115 | F20: 0.77777777777777779 | H20: 2 | I20: 4
A21: RYLEY WEBB | B21: 8 | C21: 0.25208333333333333 | D21: 0.88124999999999998 | E21: =D21/3.05 -> 0.28893442622950821 | F21: 0.81180555555555556 | H21: 8 | I21: 5
A22: ROBERT MCENTIRE | B22: 10 | C22: 0.29166666666666669 | D22: 0.96527777777777779 | E22: =D22/3.05 -> 0.31648451730418947 | H22: 10 | I22: 6
A23: RYAN HUDGINS | B23: 11 | C23: 0.28541666666666665 | D23: 0.96875 | E23: =D23/3.05 -> 0.31762295081967212 | F23: 26:11 | H23: 11 | I23: 7
A24: BEN WANCEWICZ | B24: 12 | C24: 0.32361111111111113 | D24: 24:49 | E24: =D24/3.05 -> 0.33902550091074685 | F24: 0.99722222222222223 | H24: 32 | I24: 25
A26: JV Boys
A28: TYLER DAVIS | B28: 2 | C28: 0.23958333333333334 | D28: 0.76249999999999996 | E28: =D28/3.05 -> 0.25 | F28: 0.88402777777777775
A29: O'MIN KWON | B29: 3 | C29: 0.25347222222222221 | D29: 0.78472222222222221 | E29: =D29/3.05 -> 0.25728597449908924 | F29: 0.78611111111111109 | H29: RB | I29: TP
A30: STEVEN KAMEN | B30: 4 | C30: 0.24236111111111111 | D30: 0.78541666666666665 | E30: =D30/3.05 -> 0.25751366120218583 | F30: 0.77847222222222223 | H30: 2 | I30: 1
A31: VASTAL SHAH | B31: 7 | C31: 0.24305555555555555 | D31: 0.80277777777777781 | E31: =D31/3.05 -> 0.2632058287795993 | F31: 0.81319444444444444 | H31: 3 | I31: 5
A32: TOR HEXEBERG | B32: 11 | C32: 0.24374999999999999 | D32: 0.83263888888888893 | E32: =D32/3.05 -> 0.27299635701275049 | H32: 4 | I32: 6
A33: CASEY SUMNER | B33: 12 | C33: 0.2590277777777778 | D33: 0.8520833333333333 | E33: =D33/3.05 -> 0.27937158469945356 | F33: 0.88263888888888886 | H33: 7 | I33: 8
A34: GARRETT YAGADE | B34: 13 | C34: 0.2638888888888889 | D34: 0.85277777777777775 | E34: =D34/3.05 -> 0.27959927140255009 | F34: 0.93472222222222223 | H34: 11 | I34: 9
A35: BRENT HARVEY | B35: 14 | C35: 0.26180555555555557 | D35: 0.88680555555555551 | E35: =D35/3.05 -> 0.29075591985428051 | F35: 0.90902777777777777 | H35: 27 | I35: 29
A36: DANIEL NELSON | B36: 15 | C36: 0.26041666666666669 | D36: 0.8881944444444444 | E36: =D36/3.05 -> 0.29121129326047357 | F36: 0.92152777777777772
A37: PETER BENITO | B37: 17 | C37: 0.27777777777777779 | D37: 0.92152777777777772 | E37: =D37/3.05 -> 0.30214025500910746
A38: RYOSUKE SAIKA | B38: 18 | C38: 0.2638888888888889 | D38: 0.92222222222222228 | E38: =D38/3.05 -> 0.30236794171220405 | F38: 0.91388888888888886
A39: JAE SANG OH | B39: 19 | C39: 0.28263888888888888 | D39: 0.9458333333333333 | E39: =D39/3.05 -> 0.31010928961748635 | F39: 0.95833333333333337