A1: DOUBLE DUAL LCC AND POWAY NOV 3RD 2006

A1: 1 | B1: CAROLINE DRAPER | C1: 0.66249999999999998 | D1: =1 -> 1 | E1: PARKER STINSON | F1: 0.68472222222222223
A2: =A1+1 -> 2 | B2: KRISTA EGENSE | C2: 0.68611111111111112 | D2: =D1+1 -> 2 | E2: JAKE WERTNER | F2: 0.68888888888888888
A3: =A2+1 -> 3 | B3: JANA DRAKE | C3: 0.68958333333333333 | D3: =D2+1 -> 3 | E3: JARED FENLASON | F3: 0.69444444444444442
A4: =A3+1 -> 4 | B4: NINA SCHEEPERS | C4: 0.71388888888888891 | D4: =D3+1 -> 4 | E4: SEAN PROEHL | F4: 0.69513888888888886
A5: =A4+1 -> 5 | B5: MICHELLE BLACK | C5: 0.71805555555555556 | D5: =D4+1 -> 5 | E5: DREW FLOOD | F5: 0.69513888888888886
A6: =A5+1 -> 6 | B6: CARLY BLISS | C6: 0.7319444444444444 | D6: =D5+1 -> 6 | E6: BRYCE HOLEWINSKI | F6: 0.71388888888888891
A7: =A6+1 -> 7 | B7: JENNY ZHUANG | C7: 0.73402777777777772 | D7: =D6+1 -> 7 | E7: KEVIN SCHUBERT | F7: 0.72222222222222221
A8: =A7+1 -> 8 | B8: CASSIE WICOFF | C8: 0.7416666666666667 | D8: =D7+1 -> 8 | E8: ROSS CANDELORE | F8: 0.72361111111111109
A9: =A8+1 -> 9 | B9: TAYLOR PARKER | C9: 0.7631944444444444 | D9: =D8+1 -> 9 | E9: NOAH RESTO | F9: 0.73333333333333328
A10: =A9+1 -> 10 | B10: TARA COWEN | C10: 0.7729166666666667 | D10: =D9+1 -> 10 | E10: AARON FENLASON | F10: 0.73541666666666672
A11: =A10+1 -> 11 | B11: KARA YAP | C11: 0.7729166666666667 | D11: =D10+1 -> 11 | E11: TYLER DAVIS | F11: 0.75069444444444444
A12: =A11+1 -> 12 | B12: NATALIE UDUWELA | C12: 0.78333333333333333 | D12: =D11+1 -> 12 | E12: DAVID CARLSON | F12: 0.75347222222222221
A13: =A12+1 -> 13 | B13: TARA CONNELL | C13: 0.78472222222222221 | D13: =D12+1 -> 13 | E13: STEVEN KAMEN | F13: 0.78125
A14: =A13+1 -> 14 | B14: CHANTAE REDEN | C14: 0.79861111111111116 | D14: =D13+1 -> 14 | E14: VASTAL SHAH | F14: 0.78541666666666665
A15: =A14+1 -> 15 | B15: OLIVA KRZEMINSKI | C15: 0.80902777777777779 | D15: =D14+1 -> 15 | E15: O'MIN KWON | F15: 0.79166666666666663
A16: =A15+1 -> 16 | B16: KELSEY ERSKINE | C16: 0.81111111111111112 | D16: =D15+1 -> 16 | E16: TOR HEXEBERG | F16: 0.79861111111111116
A17: =A16+1 -> 17 | B17: CASEY BURGESS | C17: 0.82499999999999996 | D17: =D16+1 -> 17 | E17: SO ADACHI | F17: 0.83611111111111114
A18: =A17+1 -> 18 | B18: MICHELLE RUGG | C18: 0.85624999999999996 | D18: =D17+1 -> 18 | E18: RYLEY WEBB | F18: 0.84513888888888888
A19: =A18+1 -> 19 | B19: MEGHIE TABAR | C19: 0.87638888888888888 | D19: =D18+1 -> 19 | E19: BRENT HARVEY | F19: 0.86111111111111116
A20: =A19+1 -> 20 | B20: MICHELA MONETA | C20: 0.88194444444444442 | D20: =D19+1 -> 20 | E20: GARRETT YAGADE | F20: 0.86597222222222225
A21: =A20+1 -> 21 | B21: DANA MOHAMMAD ZADEH | C21: 0.90902777777777777 | D21: =D20+1 -> 21 | E21: SOHA JAFASZADE | F21: 0.87638888888888888
A22: =A21+1 -> 22 | B22: LINDSAY SERHAN | C22: 0.91111111111111109 | D22: =D21+1 -> 22 | E22: DANIEL NELSON | F22: 0.89861111111111114
A23: =A22+1 -> 23 | B23: CHLOE LEFFAS-LOPES | C23: 0.93472222222222223 | D23: =D22+1 -> 23 | E23: RYOSUKE SAIKA | F23: 0.90416666666666667
D24: =D23+1 -> 24 | E24: BRETT RAMIN | F24: 0.91041666666666665
D25: =D24+1 -> 25 | E25: BEN WANCEWICZ | F25: 0.94444444444444442
D26: =D25+1 -> 26 | E26: RYAN HUDGINS | F26: 0.94513888888888886
D27: =D26+1 -> 27 | E27: ROBERT MCENTIRE | F27: 0.9458333333333333
D28: =D27+1 -> 28 | E28: JAE SANG OH | F28: 0.95625000000000004
D29: =D28+1 -> 29 | E29: SKYLER WARREN | F29: 24:17

A1: NAME | B1: PL | D1: FINISH | E1: PACE
A2: Varsity Girls
G3: RB | H3: LCC | J3: RB | K3: P
A4: CAROLINE DRAPER | B4: 2 | D4: 0.66249999999999998 | E4: 0.27680044588895975 | F4: 1 | G4: 2 | H4: 1 | I4: 1 | J4: 1 | K4: 2
A5: KRISTA EGENSE | B5: 6 | D5: 0.68611111111111112 | E5: 0.28666545129800025 | F5: 2 | G5: 5 | H5: 3 | I5: 2 | J5: 3 | K5: 6
A6: JENNY ZHUANG | B6: 19 | D6: 0.73402777777777772 | E6: 0.30668560933399419 | F6: 3 | G6: 7 | H6: 4 | I6: 3 | J6: 4 | K6: 8
A7: JANA DRAKE | B7: 8 | D7: 0.68958333333333333 | E7: 0.28811618738756506 | F7: 4 | G7: 9 | H7: 6 | I7: 4 | J7: 5 | K7: 9
A8: CARLY BLISS | B8: 17 | D8: 0.7319444444444444 | E8: 0.30581516768025535 | F8: 5 | G8: 10 | H8: 8 | I8: 5 | J8: 7 | K8: 10
A9: MICHELLE BLACK | B9: 12 | D9: 0.71805555555555556 | E9: 0.30001222332199623 | G9: 33 | H9: 22 | J9: 20 | K9: 35
A10: TAYLOR PARKER | B10: 27 | D10: 0.7631944444444444 | E10: 0.31887179248633835
A11: NATALIE UDUWELA | B11: 29 | D11: 0.78333333333333333 | E11: 0.32728606180581404
A12: MEGHIE TABAR | B12: 32 | D12: 0.87638888888888888 | E12: 0.36616578900615016
A13: LINDSAY SERHAN | B13: 33 | D13: 0.91111111111111109 | E13: 0.3806731499017979
A14: NINA SCHEEPERS | B14: 10 | D14: 0.71388888888888891 | E14: 0.29827134001451849
A17: JV Girls
A19: CASSIE WICOFF | B19: 1 | D19: 0.7416666666666667 | E19: 0.3098783810220842
A20: TARA CONNELL | B20: 13 | D20: 0.78472222222222221 | E20: 0.32786757542598793
A21: TARA COWEN | B21: 10 | D21: 0.7729166666666667 | E21: 0.32293505437975628 | G21: RB | H21: LCC | J21: RB | K21: P
A22: CASEY BURGESS | B22: 27 | D22: 0.82499999999999996 | E22: 0.3446961766425431 | G22: 1 | H22: 2 | I22: 1 | J22: 1 | K22: 2
A23: MICHELLE RUGG | B23: 36 | D23: 0.85624999999999996 | E23: 0.35775285000021517 | G23: 4 | H23: 3 | I23: 2 | J23: 8 | K23: 3
A24: KARA YAP | B24: 11 | D24: 0.7729166666666667 | E24: 0.32293505437975628 | G24: 5 | H24: 7 | I24: 3 | J24: 9 | K24: 4
A25: DANA MOHAMMAD ZADEH | B25: 42 | D25: 0.90902777777777777 | E25: 0.37980412055983914 | G25: 6 | H25: 8 | I25: 4 | J25: 11 | K25: 5
A26: OLIVA KRZEMINSKI | B26: 23 | D26: 0.80902777777777779 | E26: 0.33802276581528851 | G26: 10 | H26: 9 | I26: 5 | J26: 12 | K26: 6
A27: CHANTAE REDEN | B27: 21 | D27: 0.79861111111111116 | E27: 0.33367054136273111 | G27: 26 | H27: 29 | J27: 41 | K27: 20
A28: MICHELA MONETA | B28: 40 | D28: 0.88194444444444442 | E28: 0.36848833698319
A29: KELSEY ERSKINE | B29: 24 | D29: 0.81111111111111112 | E29: 0.33889321070579997
A30: CHLOE LEFFAS-LOPES | B30: 45 | D30: 0.93472222222222223 | E30: 0.39053960754281397

A1: NAME | B1: PL | C1: 1 MILE | D1: FINISH | E1: PACE
A2: Varsity Boys
A4: JARED FENLASON | B4: 5 | C4: 0.22638888888888889 | D4: 0.69444444444444442 | E4: 0.26205450733752622
A5: SEAN PROEHL | B5: 6 | C5: 0.22361111111111112 | D5: 0.69513888888888886 | E5: 0.26231656184486374 | G5: RB | H5: LCC | J5: RB | K5: P
A6: JAKE WERTNER | B6: 4 | C6: 0.21944444444444444 | D6: 0.68888888888888888 | E6: 0.25995807127882598 | F6: 1 | G6: 1 | H6: 2 | I6: 1 | J6: 2 | K6: 1
A7: PARKER STINSON | B7: 2 | C7: 0.21944444444444444 | D7: 0.68472222222222223 | E7: 0.25838574423480087 | F7: 2 | G7: 2 | H7: 7 | I7: 2 | J7: 3 | K7: 7
A8: DREW FLOOD | B8: 7 | C8: 0.22430555555555556 | D8: 0.69513888888888886 | E8: 0.26231656184486374 | F8: 3 | G8: 3 | H8: 9 | I8: 3 | J8: 4 | K8: 9
A9: BRYCE HOLEWINSKI | B9: 9 | C9: 0.22638888888888889 | D9: 0.71388888888888891 | E9: 0.26939203354297697 | F9: 4 | G9: 4 | H9: 10 | I9: 4 | J9: 5 | K9: 10
A10: DAVID CARLSON | B10: 18 | C10: 0.27361111111111114 | D10: 0.75347222222222221 | E10: 0.28432914046121593 | F10: 5 | G10: 5 | H10: 11 | I10: 5 | J10: 6 | K10: 11
A11: SO ADACHI | B11: 25 | C11: 0.25694444444444442 | D11: 0.83611111111111114 | E11: 0.31551362683438156 | G11: 15 | H11: 39 | J11: 20 | K11: 38
A12: SOHA JAFASZADE | B12: 26 | C12: 0.27291666666666664 | D12: 0.87638888888888888 | E12: 0.33071278825995809
A13: BRETT RAMIN | B13: 27 | C13: 0.28958333333333336 | D13: 0.91041666666666665 | E13: 0.34355345911949686
A14: AARON FENLASON | B14: 13 | C14: 0.22708333333333333 | D14: 0.73541666666666672 | E14: 0.27751572327044027
A16: Frosh Boys
G17: RB | H17: LCC | J17: RB | K17: P
A18: KEVIN SCHUBERT | B18: 1 | C18: 0.23749999999999999 | D18: 0.72222222222222221 | E18: 0.27253668763102729 | F18: 1 | G18: 1 | H18: DNR | I18: 1 | J18: 1 | K18: 3
A19: ROSS CANDELORE | B19: 4 | C19: 0.23819444444444443 | D19: 0.72361111111111109 | E19: 0.27306079664570232 | F19: 2 | G19: 2 | I19: 2 | J19: 2 | K19: 5
A20: NOAH RESTO | B20: 2 | C20: 0.23749999999999999 | D20: 0.73333333333333328 | E20: 0.27672955974842767 | F20: 3 | G20: 3 | I20: 3 | J20: 4 | K20: 6
A21: RYLEY WEBB | B21: 37 | C21: 0.25694444444444442 | D21: 0.84513888888888888 | E21: 0.31892033542976939 | F21: 4 | G21: 4 | I21: 4 | J21: 10 | K21: 7
A22: BEN WANCEWICZ | B22: 49 | C22: 0.30833333333333335 | D22: 0.94444444444444442 | E22: 0.35639412997903563 | F22: 5 | G22: 5 | I22: 5 | J22: 11 | K22: 8
A23: RYAN HUDGINS | B23: 50 | C23: 0.30069444444444443 | D23: 0.94513888888888886 | E23: 0.35665618448637315 | G23: 15 | H23: 0 | J23: 28 | K23: 29
A24: ROBERT MCENTIRE | B24: 51 | C24: 0.30555555555555558 | D24: 0.9458333333333333 | E24: 0.35691823899371067
A25: SKYLER WARREN | B25: 53 | C25: 0.30555555555555558 | D25: 24:17 | E25: 0.38194444444444442
A27: JV Boys
A29: TYLER DAVIS | B29: 9 | C29: 0.24583333333333332 | D29: 0.75069444444444444 | E29: 0.28328092243186581 | G29: RB | H29: LCC | J29: RB | K29: P
A30: STEVEN KAMEN | B30: 20 | C30: 0.24930555555555556 | D30: 0.78125 | E30: 0.294811320754717 | F30: 1 | G30: 1 | H30: 2 | I30: 1 | J30: 2 | K30: 1
A31: VASTAL SHAH | B31: 22 | C31: 0.25277777777777777 | D31: 0.78541666666666665 | E31: 0.29638364779874216 | F31: 2 | G31: 4 | H31: 3 | I31: 2 | J31: 8 | K31: 3
A32: O'MIN KWON | B32: 25 | C32: 0.25277777777777777 | D32: 0.79166666666666663 | E32: 0.29874213836477986 | F32: 3 | G32: 7 | H32: 5 | I32: 3 | J32: 9 | K32: 4
A33: CASEY SUMNER | C33: 0.27013888888888887 | D33: DNF | F33: 4 | G33: 8 | H33: 6 | I33: 4 | J33: 10 | K33: 5
A34: RYOSUKE SAIKA | B34: 46 | C34: 0.28680555555555554 | D34: 0.90416666666666667 | E34: 0.34119496855345915 | F34: 5 | G34: 12 | H34: 9 | I34: 5 | J34: 12 | K34: 6
A35: BRENT HARVEY | B35: 40 | C35: 0.27361111111111114 | D35: 0.86111111111111116 | E35: 0.3249475890985325 | G35: 32 | H35: 25 | J35: 41 | K35: 19
A36: GARRETT YAGADE | B36: 41 | C36: 0.27986111111111112 | D36: 0.86597222222222225 | E36: 0.32678197064989523
A37: DANIEL NELSON | B37: 45 | C37: 0.27361111111111114 | D37: 0.89861111111111114 | E37: 0.33909853249475891
A38: JAE SANG OH | B38: 52 | C38: 0.30555555555555558 | D38: 0.95625000000000004 | E38: 0.36084905660377359
A39: TOR HEXEBERG | B39: 28 | C39: 0.25972222222222224 | D39: 0.79861111111111116 | E39: 0.30136268343815514