A1: 1 | B1: CAROLINE DRAPER | C1: 0.6791666666666667 | E1: 1 | F1: PARKER STINSON | G1: 0.68263888888888891
A2: =A1+1 -> 2 | B2: JANA DRAKE | C2: 0.71111111111111114 | E2: =E1+1 -> 2 | F2: JARED FENLASON | G2: 0.69097222222222221
A3: =A2+1 -> 3 | B3: JENNY ZHUANG | C3: 0.73055555555555551 | E3: =E2+1 -> 3 | F3: SEAN PROEHL | G3: 0.7006944444444444
A4: =A3+1 -> 4 | B4: KRISTA EGENSE | C4: 0.74444444444444446 | E4: =E3+1 -> 4 | F4: BRYCE HOLEWINSKI | G4: 0.70416666666666672
A5: =A4+1 -> 5 | B5: TAYLOR PARKER | C5: 0.75486111111111109 | E5: =E4+1 -> 5 | F5: JAKE WERTNER | G5: 0.70625000000000004
A6: =A5+1 -> 6 | B6: NATALIE UDUWELA | C6: 0.75763888888888886 | E6: =E5+1 -> 6 | F6: DREW FLOOD | G6: 0.72152777777777777
A7: =A6+1 -> 7 | B7: CARLY BLISS | C7: 0.7583333333333333 | E7: =E6+1 -> 7 | F7: KEVIN SCHUBERT | G7: 0.73472222222222228
A8: =A7+1 -> 8 | B8: MICHELLE RUGG | C8: 0.76736111111111116 | E8: =E7+1 -> 8 | F8: AARON FENLASON | G8: 0.75069444444444444
A9: =A8+1 -> 9 | B9: NINA SCHEEPERS | C9: 0.76875000000000004 | E9: =E8+1 -> 9 | F9: ROSS CANDELORE | G9: 0.75694444444444442
A10: =A9+1 -> 10 | B10: TARA COWEN | C10: 0.79027777777777775 | E10: =E9+1 -> 10 | F10: TYLER DAVIS | G10: 0.76180555555555551
A11: =A10+1 -> 11 | B11: KARA YAP | C11: 0.81111111111111112 | E11: =E10+1 -> 11 | F11: NOAH RESTO | G11: 0.76388888888888884
A12: =A11+1 -> 12 | B12: DANA MOHAMMAD ZADEH | C12: 00.85 | E12: =E11+1 -> 12 | F12: STEVEN KAMEN | G12: 0.78749999999999998
A13: =A12+1 -> 13 | B13: CASEY BURGESS | C13: 0.85138888888888886 | E13: =E12+1 -> 13 | F13: VASTAL SHAH | G13: 0.79166666666666663
A14: =A13+1 -> 14 | B14: AMANDA ALDERTON | C14: 0.85347222222222219 | E14: =E13+1 -> 14 | F14: RILEY WEBB | G14: 0.80763888888888891
A15: =A14+1 -> 15 | B15: KELSEY ERSKINE | C15: 0.86388888888888893 | E15: =E14+1 -> 15 | F15: TOR HEXEBERG | G15: 0.84305555555555556
A16: =A15+1 -> 16 | B16: OLIVA KRZEMINSKI | C16: 0.8666666666666667 | E16: =E15+1 -> 16 | F16: O'MIN KWON | G16: 0.84375
A17: =A16+1 -> 17 | B17: LINDSAY SERHAN | C17: 0.88472222222222219 | E17: =E16+1 -> 17 | F17: SCOTT ROBISON | G17: 0.84791666666666665
A18: =A17+1 -> 18 | B18: MICHELA MONETA | C18: 0.91527777777777775 | E18: =E17+1 -> 18 | F18: SOHA JAFASZADE | G18: 0.84791666666666665
A19: =A18+1 -> 19 | B19: RACHAEL BURGESS | C19: 0.92986111111111114 | E19: =E18+1 -> 19 | F19: SO ADACHI | G19: 0.85624999999999996
A20: =A19+1 -> 20 | B20: CHLOE LEFFAS-LOPES | C20: 0.9506944444444444 | E20: =E19+1 -> 20 | F20: RYOSUKE SAIKA | G20: 0.8979166666666667
A21: =A20+1 -> 21 | B21: LILY MALEK | C21: 24:12 | E21: =E20+1 -> 21 | F21: BRETT RAMIN | G21: 0.92291666666666672
E22: =E21+1 -> 22 | F22: DANIEL NELSON | G22: 0.92986111111111114
E23: =E22+1 -> 23 | F23: BEN WANCEWICZ | G23: 0.9506944444444444
E24: =E23+1 -> 24 | F24: JAE SANG OH | G24: 0.95277777777777772
E25: =E24+1 -> 25 | F25: GERALD GOLDEN | G25: 0.96527777777777779
E26: =E25+1 -> 26 | F26: SKYLER WARREN | G26: 0.97638888888888886
E27: =E26+1 -> 27 | F27: RYAN HUDGINS | G27: 0.99444444444444446

A1: NAME | B1: PL | C1: 1 MILE | D1: 2 MILE | E1: FINISH | F1: PACE | G1: PREV 05 | H1: PREV 04
A2: Division 1 Frosh Girls 8:30
A4: NINA SCHEEPERS | B4: 31 | C4: 0.28333333333333333 | D4: 0.60624999999999996 | E4: 0.76736111111111116 | F4: =E4/2.75 -> 0.27904040404040403
A6: Division 1 Soph Girls 9:20
A8: CAROLINE DRAPER | B8: 2 | C8: 0.25 | D8: 0.52708333333333335 | E8: 0.6791666666666667 | F8: =E8/2.75 -> 0.24696969696969698 | G8: 0.69097222222222221
A9: CASEY BURGESS | B9: 77 | C9: 0.28680555555555554 | D9: 0.64166666666666672 | E9: 0.85138888888888886 | F9: =E9/2.75 -> 0.30959595959595959 | G9: 0.75555555555555554
A10: MICHELLE RUGG | B10: 25 | C10: 0.28125 | D10: 0.59375 | E10: 0.76875000000000004 | F10: =E10/2.75 -> 0.27954545454545454
A11: AMANDA ALDERTON | B11: 78 | C11: 0.30208333333333331 | E11: 0.85347222222222219 | F11: =E11/2.75 -> 0.31035353535353533 | G11: 0.90347222222222223
A12: KELSEY ERSKINE | B12: 84 | C12: 0.31388888888888888 | E12: 0.86388888888888893 | F12: =E12/2.75 -> 0.31414141414141417 | G12: 0.94374999999999998
A13: OLIVA KRZEMINSKI | B13: 86 | C13: 0.31388888888888888 | E13: 0.8666666666666667 | F13: =E13/2.75 -> 0.31515151515151518
A14: MICHELA MONETA | B14: 105 | C14: 0.32430555555555557 | E14: 0.91527777777777775 | F14: =E14/2.75 -> 0.33282828282828281
A16: Division 1 Junior Girls 10:10
A18: KRISTA EGENSE | B18: 26 | C18: 0.26319444444444445 | D18: 0.57152777777777775 | E18: 0.74444444444444446 | F18: =E18/2.75 -> 0.27070707070707073 | G18: 0.67500000000000004
A19: JENNY ZHUANG | B19: 21 | C19: 0.2673611111111111 | D19: 0.56805555555555554 | E19: 0.73055555555555551 | F19: =E19/2.75 -> 0.26565656565656565
A20: TAYLOR PARKER | B20: 29 | C20: 0.28055555555555556 | D20: 0.58680555555555558 | E20: 0.75486111111111109 | F20: =E20/2.75 -> 0.27449494949494951 | G20: 0.80277777777777781 | H20: 0.77777777777777779
A21: TARA COWEN | B21: 42 | C21: 0.29166666666666669 | D21: 0.61250000000000004 | E21: 0.79027777777777775 | F21: =E21/2.75 -> 0.28737373737373734
A22: NATALIE UDUWELA | B22: 31 | C22: 0.27361111111111114 | D22: 0.59097222222222223 | E22: 0.75763888888888886 | F22: =E22/2.75 -> 0.27550505050505047 | G22: 0.8041666666666667
A23: DANA MOHAMMAD ZADEH | B23: 67 | C23: 0.30416666666666664 | E23: 00.85 | F23: =E23/2.75 -> 0.30909090909090908 | G23: 0.90138888888888891
A24: CHLOE LEFFAS-LOPES | B24: 97 | C24: 0.34513888888888888 | E24: 0.9506944444444444 | F24: =E24/2.75 -> 0.34570707070707068 | G24: 0.94374999999999998
A25: LILY MALEK | B25: 106 | C25: 0.35972222222222222 | E25: 24:12 | F25: =E25/2.75 -> 0.36666666666666664
A26: KARA YAP | B26: 51 | C26: 0.30069444444444443 | D26: 0.63055555555555554 | E26: 0.81111111111111112 | F26: =E26/2.75 -> 0.29494949494949496
A27: RACHAEL BURGESS | B27: 89 | C27: 0.33333333333333331 | E27: 0.92986111111111114 | F27: =E27/2.75 -> 0.33813131313131312
A30: Division 1 Senior Girls 11:00
A32: JANA DRAKE | B32: 5 | C32: 0.26319444444444445 | D32: 0.55069444444444449 | E32: 0.71111111111111114 | F32: =E32/2.75 -> 0.25858585858585859 | G32: 0.72638888888888886 | H32: 0.72777777777777775
A33: CARLY BLISS | B33: 21 | C33: 0.27500000000000002 | D33: 0.58888888888888891 | E33: 0.7583333333333333 | F33: =E33/2.75 -> 0.27575757575757576 | G33: 0.72499999999999998 | H33: 0.75763888888888886
A34: LINDSAY SERHAN | B34: 63 | C34: 0.32222222222222224 | E34: 0.88472222222222219 | F34: =E34/2.75 -> 0.32171717171717168 | G34: 0.87222222222222223

A1: NAME | B1: PL | C1: 1 MILE | D1: 2 MILE | E1: FINISH | F1: PACE | G1: PREV 05 | H1: PREV 04
A2: Division 1 Frosh Boys 8:55
A4: PARKER STINSON | B4: 3 | C4: 0.22708333333333333 | D4: 0.45763888888888887 | E4: 0.68263888888888891 | F4: =E4/2.95 -> 0.2314030131826742
A5: KEVIN SCHUBERT | B5: 7 | C5: 0.24374999999999999 | D5: 0.50486111111111109 | E5: 0.73472222222222228 | F5: =E5/2.95 -> 0.24905838041431261
A6: ROSS CANDELORE | B6: 15 | C6: 0.24652777777777779 | D6: 0.51527777777777772 | E6: 0.75694444444444442 | F6: =E6/2.95 -> 0.25659133709981163
A7: NOAH RESTO | B7: 19 | C7: 0.25277777777777777 | D7: 0.5229166666666667 | E7: 0.76388888888888884 | F7: =E7/2.95 -> 0.25894538606403011
A8: RILEY WEBB | B8: 49 | C8: 0.25555555555555554 | D8: 0.5444444444444444 | E8: 0.80763888888888891 | F8: =E8/2.95 -> 0.2737758945386064
A9: BEN WANCEWICZ | B9: 132 | C9: 0.3034722222222222 | D9: 0.64027777777777772 | E9: 0.9506944444444444 | F9: =E9/2.95 -> 0.32226930320150654
A10: SKYLER WARREN | B10: 140 | C10: 0.3034722222222222 | D10: 0.64722222222222225 | E10: 0.97638888888888886 | F10: =E10/2.95 -> 0.33097928436911483
A11: RYAN HUDGINS | B11: 143 | C11: 0.30138888888888887 | D11: 0.65277777777777779 | E11: 0.99444444444444446 | F11: =E11/2.95 -> 0.33709981167608283
A13: Division 1 Soph Boys 9:45
A15: O'MIN KWON | B15: 118 | C15: 0.25694444444444442 | D15: 0.55138888888888893 | E15: 0.84375 | F15: =E15/2.95 -> 0.28601694915254233 | G15: 0.7993055555555556
A16: STEVEN KAMEN | B16: 72 | C16: 0.24722222222222223 | D16: 0.52430555555555558 | E16: 0.78749999999999998 | F16: =E16/2.95 -> 0.26694915254237284 | G16: 0.88680555555555551
A17: SCOTT ROBISON | B17: 123 | C17: 0.26111111111111113 | D17: 0.55763888888888891 | E17: 0.84791666666666665 | F17: =E17/2.95 -> 0.28742937853107342
A18: GERALD GOLDEN | B18: 177 | C18: 0.30555555555555558 | D18: 0.65069444444444446 | E18: 0.96527777777777779 | F18: =E18/2.95 -> 0.32721280602636532 | G18: 0.93611111111111112
A19: JAE SANG OH | B19: 172 | C19: 0.29583333333333334 | D19: 0.65069444444444446 | E19: 0.95277777777777772 | F19: =E19/2.95 -> 0.32297551789077211
A21: Division 1 Junior Boys 10:35
A23: SEAN PROEHL | B23: 11 | C23: 0.22152777777777777 | D23: 0.47013888888888888 | E23: 0.7006944444444444 | F23: =E23/2.95 -> 0.23752354048964217 | G23: 0.71388888888888891 | H23: 0.74583333333333335
A24: DREW FLOOD | B24: 26 | C24: 0.22152777777777777 | D24: 0.47638888888888886 | E24: 0.72152777777777777 | F24: =E24/2.95 -> 0.24458568738229752 | G24: 0.71736111111111112 | H24: 0.77152777777777781
A25: TYLER DAVIS | B25: 58 | C25: 0.2361111111111111 | D25: 0.5083333333333333 | E25: 0.76180555555555551 | F25: =E25/2.95 -> 0.25823917137476454
A26: VASTAL SHAH | B26: 89 | C26: 0.24652777777777779 | D26: 0.52777777777777779 | E26: 0.79166666666666663 | F26: =E26/2.95 -> 0.26836158192090392 | G26: 24:39
A27: AARON FENLASON | B27: 51 | C27: 0.23472222222222222 | D27: 0.50486111111111109 | E27: 0.75069444444444444 | F27: =E27/2.95 -> 0.25447269303201503 | G27: 0.76249999999999996 | H27: 0.79583333333333328
A28: DANIEL NELSON | B28: 155 | C28: 0.27638888888888891 | D28: 0.61597222222222225 | E28: 0.92986111111111114 | F28: =E28/2.95 -> 0.31520715630885121 | G28: 0.9194444444444444 | H28: 0.89583333333333337
A29: RYOSUKE SAIKA | B29: 147 | C29: 0.26874999999999999 | D29: 0.59097222222222223 | E29: 0.8979166666666667 | F29: =E29/2.95 -> 0.30437853107344631 | G29: 0.87847222222222221
A30: TOR HEXEBERG | B30: 125 | C30: 0.26874999999999999 | D30: 0.56458333333333333 | E30: 0.84305555555555556 | F30: =E30/2.95 -> 0.28578154425612051
A32: Division 1 Senior Boys 11:25
A34: JAKE WERTNER | B34: 31 | C34: 0.22083333333333333 | D34: 0.47361111111111109 | E34: 0.70625000000000004 | F34: =E34/2.95 -> 0.23940677966101695 | G34: 0.68472222222222223 | H34: 0.72152777777777777
A35: JARED FENLASON | B35: 19 | C35: 0.21875 | D35: 0.46111111111111114 | E35: 0.69097222222222221 | F35: =E35/2.95 -> 0.23422787193973632 | G35: 0.69166666666666665 | H35: 0.75416666666666665
A36: BRYCE HOLEWINSKI | B36: 30 | C36: 0.22083333333333333 | D36: 0.47013888888888888 | E36: 0.70416666666666672 | F36: =E36/2.95 -> 0.23870056497175141 | G36: 0.70694444444444449 | H36: 0.7368055555555556
A37: SO ADACHI | B37: 111 | C37: 0.2638888888888889 | D37: 0.57499999999999996 | E37: 0.85624999999999996 | F37: =E37/2.95 -> 0.29025423728813554 | G37: 0.82847222222222228 | H37: 0.83194444444444449
A38: SOHA JAFASZADE | B38: 108 | C38: 0.27291666666666664 | D38: 0.57847222222222228 | E38: 0.84791666666666665 | F38: =E38/2.95 -> 0.28742937853107342
A39: BRETT RAMIN | B39: 122 | C39: 0.29375000000000001 | D39: 0.62916666666666665 | E39: 0.92291666666666672 | F39: =E39/2.95 -> 0.31285310734463279 | G39: 0.91597222222222219 | H39: 25:37