A1: 1 | B1: CAROLINE DRAPER | C1: 0.49652777777777779 | E1: 1 | F1: JAKE WERTNER | G1: 0.43263888888888891
A2: =A1+1 -> 2 | B2: JANA DRAKE | C2: 0.52777777777777779 | E2: =E1+1 -> 2 | F2: JARED FENLASON | G2: 0.4375
A3: =A2+1 -> 3 | B3: MICHELLE BLACK | C3: 0.53749999999999998 | E3: =E2+1 -> 3 | F3: SEAN PROEHL | G3: 0.43819444444444444
A4: =A3+1 -> 4 | B4: JENNY ZHAUNG | C4: 0.54166666666666663 | E4: =E3+1 -> 4 | F4: BRYCE HOLEWINSKI | G4: 0.44027777777777777
A5: =A4+1 -> 5 | B5: CASSIE WICOFF | C5: 0.5444444444444444 | E5: =E4+1 -> 5 | F5: DREW FLOOD | G5: 0.44166666666666665
A6: =A5+1 -> 6 | B6: TAYLOR PARKER | C6: 0.56041666666666667 | E6: =E5+1 -> 6 | F6: PARKER STINSON | G6: 0.44305555555555554
A7: =A6+1 -> 7 | B7: NATALIE UDUWELA | C7: 0.56111111111111112 | E7: =E6+1 -> 7 | F7: DAVID CARLSON | G7: 0.47152777777777777
A8: =A7+1 -> 8 | B8: CARLY BLISS | C8: 0.56319444444444444 | E8: =E7+1 -> 8 | F8: KEVIN SCHUBERT | G8: 0.47847222222222224
A9: =A8+1 -> 9 | B9: NINA SCHEEPERS | C9: 0.56874999999999998 | E9: =E8+1 -> 9 | F9: TYLER DAVIS | G9: 0.48541666666666666
A10: =A9+1 -> 10 | B10: MICHELLE RUGG | C10: 0.57708333333333328 | E10: =E9+1 -> 10 | F10: VASTAL SHAH | G10: 0.49722222222222223
A11: =A10+1 -> 11 | B11: TARA COWEN | C11: 0.58125000000000004 | E11: =E10+1 -> 11 | F11: STEVEN KAMEN | G11: 0.49861111111111112
A12: =A11+1 -> 12 | B12: CASEY BURGESS | C12: 0.59583333333333333 | E12: =E11+1 -> 12 | F12: NOAH RESTO | G12: 0.49930555555555556
A13: =A12+1 -> 13 | B13: CARA YAP | C13: 0.60833333333333328 | E13: =E12+1 -> 13 | F13: O'MIN KWON | G13: 0.52083333333333337
A14: =A13+1 -> 14 | B14: DANA MOHAMMAD ZADEH | C14: 0.62013888888888891 | E14: =E13+1 -> 14 | F14: SO ADACHI | G14: 0.52430555555555558
A15: =A14+1 -> 15 | B15: MEGHIE TABAR | C15: 0.62986111111111109 | E15: =E14+1 -> 15 | F15: RYLEY WEBB | G15: 0.52500000000000002
A16: =A15+1 -> 16 | B16: LINDSAY SERHAN | C16: 0.62986111111111109 | E16: =E15+1 -> 16 | F16: SOHA JAFASZADE | G16: 0.52638888888888891
A17: =A16+1 -> 17 | B17: AMANDA ALDERTON | C17: 0.64027777777777772 | E17: =E16+1 -> 17 | F17: SCOTT ROBISON | G17: 0.52847222222222223
A18: =A17+1 -> 18 | B18: OLIVA KRZEMINSKI | C18: 0.64375000000000004 | E18: =E17+1 -> 18 | F18: ANT NOREN | G18: 0.53541666666666665
A19: =A18+1 -> 19 | B19: KELSEY ERSKINE | C19: 0.64444444444444449 | E19: =E18+1 -> 19 | F19: CASEY SUMNER | G19: 0.53749999999999998
A20: =A19+1 -> 20 | B20: CHANTAE REDEN | C20: 0.65277777777777779 | E20: =E19+1 -> 20 | F20: RYOSUKE SAIKA | G20: 0.54791666666666672
A21: =A20+1 -> 21 | B21: MELISSA COYLE | C21: 0.67847222222222225 | E21: =E20+1 -> 21 | F21: GARRETT YAGADE | G21: 0.55208333333333337
A22: =A21+1 -> 22 | B22: MICHELA MONETA | C22: 0.68958333333333333 | E22: =E21+1 -> 22 | F22: PETER BENITO | G22: 0.55694444444444446
A23: =A22+1 -> 23 | B23: KATIE PAIGE | C23: 0.69861111111111107 | E23: =E22+1 -> 23 | F23: BRENT HARVEY | G23: 0.56874999999999998
A24: =A23+1 -> 24 | B24: RACHEL BURGESS | C24: 0.70625000000000004 | E24: =E23+1 -> 24 | F24: TOR HEXEBERG | G24: 0.5708333333333333
E25: =E24+1 -> 25 | F25: DANIEL NELSON | G25: 0.5708333333333333
E26: =E25+1 -> 26 | F26: BRETT RAMIN | G26: 0.58888888888888891
E27: =E26+1 -> 27 | F27: JAE SANG OH | G27: 0.59097222222222223
E28: =E27+1 -> 28 | F28: GERALD GOLDEN | G28: 0.59583333333333333
E29: =E28+1 -> 29 | F29: BEN WANCEWICZ | G29: 0.59652777777777777
E30: =E29+1 -> 30 | F30: RYAN DAVIS | G30: 0.59722222222222221
E31: =E30+1 -> 31 | F31: RYAN HUDGING | G31: 0.61041666666666672
E32: =E31+1 -> 32 | F32: SKYLER WARREN | G32: 0.62569444444444444

A1: NAME | B1: PL | C1: MILE | D1: FINISH | E1: PACE
A2: 8:00 AM VARISTY GIRLS
A4: CAROLINE DRAPER | B4: 3 | C4: 0.24444444444444444 | D4: 0.49652777777777779 | E4: 0.2482638888888889
A5: MICHELLE BLACK | B5: 31 | C5: 0.24722222222222223 | D5: 0.53749999999999998 | E5: 0.26874999999999999
A6: JENNY ZHAUNG | B6: 34 | C6: 0.25694444444444442 | D6: 0.54166666666666663 | E6: 0.27083333333333331
A7: NATALIE UDUWELA | B7: 48 | C7: 0.26041666666666669 | D7: 0.56111111111111112 | E7: 0.28055555555555556
A8: JANA DRAKE | B8: 25 | C8: 0.24791666666666667 | D8: 0.52777777777777779 | E8: 0.2638888888888889
A9: CARLY BLISS | B9: 51 | C9: 0.26527777777777778 | D9: 0.56319444444444444 | E9: 0.28159722222222222
A10: CASSIE WICOFF | B10: 36 | D10: 0.5444444444444444 | E10: 0.2722222222222222
A12: 8:40 D-1 Frosh/Novice Girls*
A14: NINA SCHEEPERS | B14: 4 | C14: 0.26666666666666666 | D14: 0.56874999999999998 | E14: 0.28437499999999999
A15: CASEY BURGESS | B15: 13 | C15: 0.27430555555555558 | D15: 0.59583333333333333 | E15: 0.29791666666666666
A16: AMANDA ALDERTON | B16: 46 | C16: 0.28263888888888888 | D16: 0.64027777777777772 | E16: 0.32013888888888886
A17: KELSEY ERSKINE | B17: 52 | C17: 0.30416666666666664 | D17: 0.64444444444444449 | E17: 0.32222222222222224
A18: OLIVA KRZEMINSKI | B18: 50 | C18: 00.3 | D18: 0.64375000000000004 | E18: 0.32187500000000002
A19: MICHELA MONETA | B19: 72 | C19: 0.31805555555555554 | D19: 0.68958333333333333 | E19: 0.34479166666666666
A20: MICHELLE RUGG | B20: 8 | D20: 0.57708333333333328 | E20: 0.28854166666666664
A21: CHANTAE REDEN | B21: 54 | D21: 0.65277777777777779 | E21: 0.3263888888888889
A24: 9:20 D-1 10/12 GIRLS
A26: TAYLOR PARKER | B26: 2 | C26: 0.2673611111111111 | D26: 0.56041666666666667 | E26: 0.28020833333333334
A27: MEGHIE TABAR | B27: 34 | C27: 0.28472222222222221 | D27: 0.62986111111111109 | E27: 0.31493055555555555
A28: TARA COWEN | B28: 7 | C28: 0.27430555555555558 | D28: 0.58125000000000004 | E28: 0.29062500000000002
A29: CARA YAP | B29: 18 | C29: 0.28472222222222221 | D29: 0.60833333333333328 | E29: 0.30416666666666664
A30: DANA MOHAMMAD ZADEH | B30: 29 | C30: 0.28472222222222221 | D30: 0.62013888888888891 | E30: 0.31006944444444445
A31: RACHEL BURGESS | B31: 57 | C31: 0.32847222222222222 | D31: 0.70625000000000004 | E31: 0.35312500000000002
A32: MELISSA COYLE | B32: 50 | C32: 0.32083333333333336 | D32: 0.67847222222222225 | E32: 0.33923611111111113
A33: LINDSAY SERHAN | B33: 35 | C33: 0.30277777777777776 | D33: 0.62986111111111109 | E33: 0.31493055555555555
A34: KATIE PAIGE | B34: 53 | C34: 0.32083333333333336 | D34: 0.69861111111111107 | E34: 0.34930555555555554

A1: NAME | B1: PL | C1: MILE | D1: FINISH | E1: PACE
A3: 8:20 D-1 VARSITY BOYS
A5: JAKE WERTNER | B5: 9 | C5: 0.20902777777777778 | D5: 0.43263888888888891 | E5: 0.21631944444444445
A6: JARED FENLASON | B6: 12 | C6: 0.20902777777777778 | D6: 0.4375 | E6: 0.21875
A7: BRYCE HOLEWINSKI | B7: 15 | C7: 0.20972222222222223 | D7: 0.44027777777777777 | E7: 0.22013888888888888
A8: DAVID CARLSON | B8: 50 | C8: 0.21805555555555556 | D8: 0.47152777777777777 | E8: 0.23576388888888888
A9: SEAN PROEHL | B9: 13 | C9: 0.20972222222222223 | D9: 0.43819444444444444 | E9: 0.21909722222222222
A10: DREW FLOOD | B10: 16 | C10: 0.20972222222222223 | D10: 0.44166666666666665 | E10: 0.22083333333333333
A12: 9:00 D-1 Frosh/Novice Boys*
A14: PARKER STINSON | B14: 1 | C14: 0.21249999999999999 | D14: 0.44305555555555554 | E14: 0.22152777777777777
A15: KEVIN SCHUBERT | B15: 6 | C15: 0.24097222222222223 | D15: 0.47847222222222224 | E15: 0.23923611111111112
A16: RYAN DAVIS | B16: 122 | C16: 0.27500000000000002 | D16: 0.59722222222222221 | E16: 0.2986111111111111
A17: RYAN HUDGING | B17: 128 | C17: 0.27847222222222223 | D17: 0.61041666666666672 | E17: 0.30520833333333336
A18: NOAH RESTO | B18: 25 | C18: 0.24305555555555555 | D18: 0.49930555555555556 | E18: 0.24965277777777778
A19: SCOTT ROBISON | B19: 55 | C19: 0.24305555555555555 | D19: 0.52847222222222223 | E19: 0.26423611111111112
A20: CASEY SUMNER | B20: 66 | C20: 0.25416666666666665 | D20: 0.53749999999999998 | E20: 0.26874999999999999
A21: BEN WANCEWICZ | B21: 121 | C21: 0.28680555555555554 | D21: 0.59652777777777777 | E21: 0.29826388888888888
A22: SKYLER WARREN | B22: 131 | C22: 0.28680555555555554 | D22: 0.62569444444444444 | E22: 0.31284722222222222
A23: RYLEY WEBB | B23: 53 | C23: 0.24652777777777779 | D23: 0.52500000000000002 | E23: 0.26250000000000001
A26: 9:40 D-1 10/12 BOYS
A28: TYLER DAVIS | B28: 13 | C28: 0.22777777777777777 | D28: 0.48541666666666666 | E28: 0.24270833333333333
A29: STEVEN KAMEN | B29: 21 | C29: 0.23402777777777778 | D29: 0.49861111111111112 | E29: 0.24930555555555556
A30: O'MIN KWON | B30: 47 | C30: 0.24166666666666667 | D30: 0.52083333333333337 | E30: 0.26041666666666669
A31: VASTAL SHAH | B31: 19 | C31: 0.23472222222222222 | D31: 0.49722222222222223 | E31: 0.24861111111111112
A32: SOHA JAFASZADE | B32: 54 | C32: 0.25 | D32: 0.52638888888888891 | E32: 0.26319444444444445
A33: SO ADACHI | B33: 52 | C33: 0.24791666666666667 | D33: 0.52430555555555558 | E33: 0.26215277777777779
A34: ANT NOREN | B34: 65 | C34: 0.24513888888888888 | D34: 0.53541666666666665 | E34: 0.26770833333333333
A35: RYOSUKE SAIKA | B35: 75 | C35: 0.25555555555555554 | D35: 0.54791666666666672 | E35: 0.27395833333333336
A36: GARRETT YAGADE | B36: 80 | C36: 0.2638888888888889 | D36: 0.55208333333333337 | E36: 0.27604166666666669
A37: GERALD GOLDEN | B37: 102 | C37: 0.28125 | D37: 0.59583333333333333 | E37: 0.29791666666666666
A38: PETER BENITO | B38: 83 | D38: 0.55694444444444446 | E38: 0.27847222222222223
A39: BRENT HARVEY | B39: 93 | C39: 0.28194444444444444 | D39: 0.56874999999999998 | E39: 0.28437499999999999
A40: TOR HEXEBERG | B40: 94 | C40: 0.25555555555555554 | D40: 0.5708333333333333 | E40: 0.28541666666666665
A41: BRETT RAMIN | B41: 98 | C41: 0.26180555555555557 | D41: 0.58888888888888891 | E41: 0.29444444444444445
A42: DANIEL NELSON | B42: 84 | C42: 0.26458333333333334 | D42: 0.5708333333333333 | E42: 0.28541666666666665
A43: JAE SANG OH | B43: 99 | C43: 0.27500000000000002 | D43: 0.59097222222222223 | E43: 0.29548611111111112