A1: NAME | B1: PL | C1: 1 MILE | D1: FINISH | E1: PACE | F1: prev 05 | G1: prev 04
A3: CAROLINE DRAPER | B3: 2 | C3: 0.25 | D3: 14:48.9 | E3: =D3/2.5*60 -> 0.24691666666666665 | F3: 0.62291666666666667
A4: KRISTA EGENSE | B4: 2 | C4: 0.26597222222222222 | D4: 15:24.1 | E4: =D4/2.5*60 -> 0.25669444444444445 | F4: 0.61527777777777781 | G4: 0.65625
A5: JANA DRAKE | B5: 3 | C5: 0.26527777777777778 | D5: 15:38.3 | E5: =D5/2.5*60 -> 0.26063888888888892 | F5: 0.66874999999999996 | G5: 0.6430555555555556
A6: MICHELLE BLACK | B6: 5 | C6: 0.27083333333333331 | D6: 16:13.0 | E6: =D6/2.5*60 -> 0.27027777777777773 | F6: 0.64861111111111114
A7: NINA SCHEEPERS | C7: 0.28194444444444444 | D7: 16:37.4 | E7: =D7/2.5*60 -> 0.27705555555555555
A8: NATALIE UDUWELA | C8: 0.27708333333333335 | D8: 17:05.5 | E8: =D8/2.5*60 -> 0.28486111111111106
A9: TAYLOR PARKER | C9: 0.27708333333333335 | D9: 16:29.9 | E9: =D9/2.5*60 -> 0.27497222222222223
D10: 2ND | F10: 4th | G10: 2nd
D11: =D3+D4+D5+D6+D9+D7+D8 -> 7.7975694444444452E-2 | F11: 7.6099537037037035E-2 | G11: 7.5486111111111115E-2

A1: NAME | B1: PL | C1: 1 MILE | D1: 2 MILE | E1: FINISH | F1: PACE | G1: prev 05 | H1: prev 04
A3: JAKE WERTNER | B3: 11 | C3: 0.22500000000000001 | D3: 0.45208333333333334 | E3: 17:05.0 | F3: =E3/3.15*60 -> 0.22597001763668428 | G3: 0.69861111111111107 | H3: 00.7
A4: JARED FENLASON | B4: 12 | C4: 0.22708333333333333 | D4: 0.46180555555555558 | E4: 17:38.5 | F4: =E4/3.15*60 -> 0.23335537918871252 | G4: 0.74444444444444446 | H4: 0.75555555555555554
A5: PARKER STINSON | B5: 6 | C5: 0.22916666666666666 | D5: 0.4548611111111111 | E5: 17:22.3 | F5: =E5/3.15*60 -> 0.22978395061728396
A6: BRYCE HOLEWINSKI | C6: 0.23055555555555557 | D6: 0.46736111111111112 | E6: 17:51.7 | F6: =E6/3.15*60 -> 0.23626543209876549 | G6: 0.74861111111111112 | H6: 0.73333333333333328
A7: SEAN PROEHL | C7: 0.2326388888888889 | D7: 0.47291666666666665 | E7: 18:11.8 | F7: =E7/3.15*60 -> 0.24069664902998233 | G7: 0.72986111111111107
A8: DREW FLOOD | C8: 0.22222222222222221 | D8: 0.45416666666666666 | E8: 17:31.0 | F8: =E8/3.15*60 -> 0.23170194003527339 | G8: 0.74305555555555558
A9: KEVIN SCHUBERT | C9: 0.23402777777777778 | D9: 0.46736111111111112 | E9: 17:40.0 | F9: =E9/3.15*60 -> 0.23368606701940037
G10: 2nd | H10: 4th
E11: =E3+E4+E5+E6+E7+E8+E9 -> 8.5651620370370357E-2 | G11: 2:00.10 | H11: 2:02:10.9