A1: 1 | B1: JENNY ZHUANG | C1: 0.72916666666666663 | D1: 1 | E1: AARON FENLASON | F1: 0.76944444444444449
A2: =A1+1 -> 2 | B2: CARLY BLISS | C2: 0.73958333333333337 | D2: =D1+1 -> 2 | E2: NOAH RESTO | F2: 0.77500000000000002
A3: =A2+1 -> 3 | B3: TARA CONNELL | C3: 0.77361111111111114 | D3: =D2+1 -> 3 | E3: DAVID CARLSON | F3: 0.78194444444444444
A4: =A3+1 -> 4 | B4: TARA COWEN | C4: 0.79166666666666663 | D4: =D3+1 -> 4 | E4: ROSS CANDELORE | F4: 0.78472222222222221
A5: =A4+1 -> 5 | B5: CASEY BURGESS | C5: 0.80625000000000002 | D5: =D4+1 -> 5 | E5: O'MIN KWON | F5: 0.79652777777777772
A6: =A5+1 -> 6 | B6: MICHELLE RUGG | C6: 0.80972222222222223 | D6: =D5+1 -> 6 | E6: TYLER DAVIS | F6: 0.82152777777777775
A7: =A6+1 -> 7 | B7: KARA YAP | C7: 0.83472222222222225 | D7: =D6+1 -> 7 | E7: STEVEN KAMEN | F7: 0.82777777777777772
A8: =A7+1 -> 8 | B8: OLIVA KRZEMINSKI | C8: 0.83611111111111114 | D8: =D7+1 -> 8 | E8: VASTAL SHAH | F8: 0.84305555555555556
A9: =A8+1 -> 9 | B9: DANA MOHAMMAD ZADEH | C9: 0.83888888888888891 | D9: =D8+1 -> 9 | E9: SO ADACHI | F9: 0.86597222222222225
A10: =A9+1 -> 10 | B10: CHANTAE REDEN | C10: 0.85416666666666663 | D10: =D9+1 -> 10 | E10: CASEY SUMNER | F10: 0.87013888888888891
A11: =A10+1 -> 11 | B11: KELSEY ERSKINE | C11: 0.85486111111111107 | D11: =D10+1 -> 11 | E11: TOR HEXEBERG | F11: 0.88611111111111107
A12: =A11+1 -> 12 | B12: MICHELA MONETA | C12: 0.87777777777777777 | D12: =D11+1 -> 12 | E12: RILEY WEBB | F12: 0.8930555555555556
A13: =A12+1 -> 13 | B13: CHLOE LEFFAS-LOPES | C13: 0.90833333333333333 | D13: =D12+1 -> 13 | E13: GARRETT YAGADE | F13: 0.89444444444444449
A14: =A13+1 -> 14 | B14: MEGHIE TABAR | C14: 0.93402777777777779 | D14: =D13+1 -> 14 | E14: RYOSUKE SAIKA | F14: 0.92222222222222228
A15: =A14+1 -> 15 | B15: LILY MALEK | C15: 0.96319444444444446 | D15: =D14+1 -> 15 | E15: BRENT HARVEY | F15: 0.92847222222222225
A16: =A15+1 -> 16 | B16: RACHAEL BURGESS | C16: 0.96319444444444446 | D16: =D15+1 -> 16 | E16: PETER BENITO | F16: 0.93541666666666667
D17: =D16+1 -> 17 | E17: DANIEL NELSON | F17: 0.93888888888888888
D18: =D17+1 -> 18 | E18: BRETT RAMIN | F18: 0.97847222222222219
D19: =D18+1 -> 19 | E19: BEN WANCEWICZ | F19: 0.98541666666666672
D20: =D19+1 -> 20 | E20: SKYLER WARREN | F20: 0.99722222222222223

A1: NAME | B1: PL | C1: 1 MILE | D1: 2 MILE | E1: FINISH | F1: PACE | G1: prev 05 | H1: prev 04
A3: TARA COWEN | B3: 4 | C3: 0.29722222222222222 | D3: 0.60902777777777772 | E3: 0.79166666666666663 | F3: 0.31045751633986929 | G3: 0.79652777777777772
A4: CASEY BURGESS | B4: 6 | C4: 0.29652777777777778 | D4: 0.61319444444444449 | E4: 0.80625000000000002 | F4: 0.31617647058823534 | G4: 0.81180555555555556
A5: MICHELLE RUGG | B5: 7 | C5: 0.2986111111111111 | D5: 0.61736111111111114 | E5: 0.80972222222222223 | F5: 0.31753812636165579
A6: KARA YAP | B6: 10 | C6: 00.3 | D6: 0.64375000000000004 | E6: 0.83472222222222225 | F6: 0.32734204793028326
A7: TARA CONNELL | B7: 3 | C7: 0.28611111111111109 | D7: 0.58958333333333335 | E7: 0.77361111111111114 | F7: 0.30337690631808284
A8: DANA MOHAMMAD ZADEH | B8: 12 | C8: 0.30902777777777779 | D8: 0.6430555555555556 | E8: 0.83888888888888891 | F8: 0.32897603485838783 | G8: 0.87083333333333335
A9: OLIVA KRZEMINSKI | B9: 11 | C9: 0.30694444444444446 | D9: 0.64444444444444449 | E9: 0.83611111111111114 | F9: 0.32788671023965144
A10: CHANTAE REDEN | B10: 13 | C10: 00.3 | D10: 0.64375000000000004 | E10: 0.85416666666666663 | F10: 0.33496732026143794 | G10: 0.84583333333333333
A11: MICHELA MONETA | B11: 15 | C11: 0.31388888888888888 | D11: 0.67013888888888884 | E11: 0.87777777777777777 | F11: 0.34422657952069718
A12: KELSEY ERSKINE | B12: 14 | C12: 0.31041666666666667 | D12: 0.65347222222222223 | E12: 0.85486111111111107 | F12: 0.335239651416122 | G12: 0.98055555555555551
A13: RACHAEL BURGESS | B13: 23 | C13: 0.33680555555555558 | D13: 0.72777777777777775 | E13: 0.96319444444444446 | F13: 0.37772331154684097
A14: CHLOE LEFFAS-LOPES | B14: 19 | C14: 0.33541666666666664 | D14: 0.69791666666666663 | E14: 0.90833333333333333 | F14: 0.3562091503267974 | G14: 0.9145833333333333 | H14: 0.95277777777777772
A15: LILY MALEK | B15: 24 | C15: 0.33680555555555558 | D15: 0.72777777777777775 | E15: 0.72777777777777775 | F15: 0.28540305010893247
A16: JENNY ZHUANG | B16: 1 | C16: 0.27430555555555558 | D16: 0.55972222222222223 | E16: 0.72916666666666663 | F16: 0.28594771241830064
A17: CARLY BLISS | B17: 2 | C17: 0.27430555555555558 | D17: 0.56458333333333333 | E17: 0.73958333333333337 | F17: 0.29003267973856212
A18: MEGHIE TABAR | B18: 22 | C18: 0.32361111111111113 | D18: 0.71319444444444446 | E18: 0.93402777777777779 | F18: 0.36628540305010898

A1: NAME | B1: PL | C1: 1 MILE | D1: 2 MILE | E1: FINISH | F1: PACE | G1: prev 05 | H1: prev 04 | I1: prev 03
A3: AARON FENLASON | B3: 1 | C3: 0.23055555555555557 | D3: 0.48055555555555557 | E3: 0.76944444444444449 | F3: 0.25227686703096541 | G3: 0.92013888888888884 | H3: 0.8569444444444444
A4: DAVID CARLSON | B4: 4 | C4: 0.23055555555555557 | D4: 0.48749999999999999 | E4: 0.78194444444444444 | F4: 0.25637522768670312 | G4: 0.76736111111111116 | H4: 0.76736111111111116 | I4: 0.97361111111111109
A5: NOAH RESTO | B5: 3 | C5: 0.24166666666666667 | D5: 0.4909722222222222 | E5: 0.77500000000000002 | F5: 0.25409836065573771
A6: ROSS CANDELORE | B6: 6 | C6: 0.23958333333333334 | D6: 0.50138888888888888 | E6: 0.78472222222222221 | F6: 0.25728597449908924
A7: STEVEN KAMEN | B7: 14 | C7: 0.24652777777777779 | D7: 0.51458333333333328 | E7: 0.82777777777777772 | F7: 0.27140255009107467
A8: O'MIN KWON | B8: 8 | C8: 0.24652777777777779 | D8: 0.50624999999999998 | E8: 0.79652777777777772 | F8: 0.26115664845173042 | G8: 0.85486111111111107
A9: RILEY WEBB | B9: 26 | C9: 0.25416666666666665 | D9: 00.55 | E9: 0.8930555555555556 | F9: 0.29280510018214939
A10: VASTAL SHAH | B10: 16 | C10: 0.24861111111111112 | D10: 0.51944444444444449 | E10: 0.84305555555555556 | F10: 0.27641165755919855 | G10: 24:02
A11: SO ADACHI | B11: 19 | C11: 0.25763888888888886 | D11: 0.53819444444444442 | E11: 0.86597222222222225 | F11: 0.28392531876138438 | H11: 0.83819444444444446 | I11: 0.93680555555555556
A12: CASEY SUMNER | B12: 22 | C12: 0.2673611111111111 | D12: 0.55138888888888893 | E12: 0.87013888888888891 | F12: 0.28529143897996362
A13: TYLER DAVIS | B13: 12 | C13: 0.23958333333333334 | D13: 0.51388888888888884 | E13: 0.82152777777777775 | F13: 0.26935336976320584 | G13: 0.8125
A14: BRENT HARVEY | B14: 30 | C14: 0.27430555555555558 | D14: 0.58680555555555558 | E14: 0.92847222222222225 | F14: 0.30441712204007287 | G14: 24:36 | H14: 24:43
A15: RYOSUKE SAIKA | B15: 29 | C15: 0.27500000000000002 | D15: 0.5756944444444444 | E15: 0.92222222222222228 | F15: 0.30236794171220405
A16: DANIEL NELSON | B16: 32 | C16: 0.27430555555555558 | D16: 0.58819444444444446 | E16: 0.93888888888888888 | F16: 0.30783242258652094 | G16: 0.97569444444444442 | H16: 24:50
A17: GARRETT YAGADE | B17: 28 | C17: 0.27083333333333331 | D17: 0.56666666666666665 | E17: 0.89444444444444449 | F17: 0.29326047358834245 | H17: 0.86805555555555558
A18: BRETT RAMIN | B18: 34 | C18: 0.30138888888888887 | D18: 0.6166666666666667 | E18: 0.97847222222222219 | F18: 0.32081056466302371 | G18: 24:36 | H18: 25:23 | I18: 33:04
A19: BEN WANCEWICZ | B19: 35 | C19: 0.31319444444444444 | D19: 0.6333333333333333 | E19: 0.98541666666666672 | F19: 0.32308743169398912
A20: SKYLER WARREN | B20: 37 | C20: 0.29722222222222222 | D20: 0.61736111111111114 | E20: 0.99722222222222223 | F20: 0.32695810564663025
A21: TOR HEXEBERG | B21: 23 | C21: 0.26527777777777778 | D21: 0.54861111111111116 | E21: 0.88611111111111107 | F21: 0.29052823315118398
A22: PETER BENITO | B22: 31 | C22: 0.27500000000000002 | D22: 0.57986111111111116 | E22: 0.93541666666666667 | F22: 0.30669398907103829 | H22: 0.97847222222222219