A1: 1 | B1: CAROLINE DRAPER | C1: 0.4909722222222222 | E1: 1 | F1: PARKER STINSON | G1: 0.41875000000000001
A2: =A1+1 -> 2 | B2: MOLLY GRABILL | C2: 0.49375000000000002 | E2: =E1+1 -> 2 | F2: SEAN PROEHL | G2: 0.43263888888888891
A3: =A2+1 -> 3 | B3: MICHELLE BLACK | C3: 0.53055555555555556 | E3: =E2+1 -> 3 | F3: DREW FLOOD | G3: 0.44027777777777777
A4: =A3+1 -> 4 | B4: MICHELLE LEROUX | C4: 0.53680555555555554 | E4: =E3+1 -> 4 | F4: ROSS CANDELORE | G4: 0.45416666666666666
A5: =A4+1 -> 5 | B5: CASSIE WICOFF | C5: 0.53888888888888886 | E5: =E4+1 -> 5 | F5: AARON FENLASON | G5: 0.45624999999999999
A6: =A5+1 -> 6 | B6: KRISTA EGENSE | C6: 0.54166666666666663 | E6: =E5+1 -> 6 | F6: KEVIN SCHUBERT | G6: 0.46250000000000002
A7: =A6+1 -> 7 | B7: MELLISA LEROUX | C7: 0.54236111111111107 | E7: =E6+1 -> 7 | F7: TRAVIS LINDER | G7: 0.47916666666666669
A8: =A7+1 -> 8 | B8: ALLISON PROEHL | C8: 0.54861111111111116 | E8: =E7+1 -> 8 | F8: VASTAL SHAH | G8: 0.47986111111111113
A9: =A8+1 -> 9 | B9: ANNA MOHAMMAD-ZEDAH | C9: 0.55625000000000002 | E9: =E8+1 -> 9 | F9: RYLEY WEBB | G9: 0.48472222222222222
A10: =A9+1 -> 10 | B10: NINA SCHEEPERS | C10: 0.55694444444444446 | E10: =E9+1 -> 10 | F10: ANTHONY GIROLAMO | G10: 0.48472222222222222
A11: =A10+1 -> 11 | B11: OLIVIA KRZEMINSKI | C11: 0.56805555555555554 | E11: =E10+1 -> 11 | F11: O'MIN KWON | G11: 0.48749999999999999
A12: =A11+1 -> 12 | B12: TAYLOR PARKER | C12: 0.57708333333333328 | E12: =E11+1 -> 12 | F12: STEVEN KAMEN | G12: 0.48888888888888887
A13: =A12+1 -> 13 | B13: NATALIE UDUWELA | C13: 0.57847222222222228 | E13: =E12+1 -> 13 | F13: ACHILLES SCHMELZER | G13: 0.4909722222222222
A14: =A13+1 -> 14 | B14: DANA MOHAMMAD ZADEH | C14: 0.58750000000000002 | E14: =E13+1 -> 14 | F14: IAN CABLE | G14: 0.49583333333333335
A15: =A14+1 -> 15 | B15: KARA YAP | C15: 0.58888888888888891 | E15: =E14+1 -> 15 | F15: CONNER LACHENBRUCH | G15: 0.5
A16: =A15+1 -> 16 | B16: JENNY ZHAUNG | C16: 0.59930555555555554 | E16: =E15+1 -> 16 | F16: JORDAN AHOSTROM | G16: 0.50069444444444444
A17: =A16+1 -> 17 | B17: MADELINE WAHL | C17: 0.60277777777777775 | E17: =E16+1 -> 17 | F17: SCOTT ROBISON | G17: 0.50138888888888888
A18: =A17+1 -> 18 | B18: CASEY BURGESS | C18: 0.60347222222222219 | E18: =E17+1 -> 18 | F18: GARRETT YAGADE | G18: 0.5131944444444444
A19: =A18+1 -> 19 | B19: CHARLESE MATTHEWS | C19: 0.61250000000000004 | E19: =E18+1 -> 19 | F19: TODD MYERS | G19: 0.52152777777777781
A20: =A19+1 -> 20 | B20: KELSEY ERSKINE | C20: 0.63611111111111107 | E20: =E19+1 -> 20 | F20: ALEC BURGESS | G20: 0.52708333333333335
A21: =A20+1 -> 21 | B21: AMANDA ALDERTON | C21: 0.6381944444444444 | E21: =E20+1 -> 21 | F21: LOUW SCHEEPERS | G21: 0.53611111111111109
A22: =A21+1 -> 22 | B22: SANA MARZOUR | C22: 0.64027777777777772 | E22: =E21+1 -> 22 | F22: ROBERT MCENTIRE | G22: 0.53888888888888886
A23: =A22+1 -> 23 | B23: JACLYN HANSEN | C23: 00.65 | E23: =E22+1 -> 23 | F23: RYOSUKE SAIKA | G23: 0.53888888888888886
A24: =A23+1 -> 24 | B24: HANNAH QUINTO | C24: 0.66874999999999996 | E24: =E23+1 -> 24 | F24: ANDREW RHODES | G24: 0.54027777777777775
A25: =A24+1 -> 25 | B25: HALEY PETERSON | C25: 0.68472222222222223 | E25: =E24+1 -> 25 | F25: PETER BENITO | G25: 0.54583333333333328
A26: =A25+1 -> 26 | B26: CASEY CHILSOM | C26: 0.68888888888888888 | E26: =E25+1 -> 26 | F26: ZACH KAUFMAN | G26: 0.56041666666666667
A27: =A26+1 -> 27 | B27: LINDSAY PETTIJOHN | C27: 00.7 | E27: =E26+1 -> 27 | F27: ROBERT SHEEHAN | G27: 0.56041666666666667
A28: =A27+1 -> 28 | B28: RUTH MALINA | C28: 0.70486111111111116 | E28: =E27+1 -> 28 | F28: RYAN WORDAN | G28: 0.56874999999999998
A29: =A28+1 -> 29 | B29: ALYSSA WERTNER | C29: 0.72638888888888886 | E29: =E28+1 -> 29 | F29: DANIEL NELSON | G29: 0.57013888888888886
A30: =A29+1 -> 30 | B30: LILY MALEK | C30: 0.73055555555555551 | E30: =E29+1 -> 30 | F30: JAKE BROCKBANK | G30: 0.57291666666666663
A31: =A30+1 -> 31 | B31: RACHEL BURGESS | C31: 0.7319444444444444 | E31: =E30+1 -> 31 | F31: PETER STEUSLOFF | G31: 0.57847222222222228
E32: =E31+1 -> 32 | F32: ALEX FLOOD | G32: 0.59513888888888888
E33: =E32+1 -> 33 | F33: SKYLER WARREN | G33: 0.60416666666666663
E34: =E33+1 -> 34 | F34: BEN WANCEWICZ | G34: 0.61041666666666672
E35: =E34+1 -> 35 | F35: MAX JOHNSON | G35: 0.68263888888888891
E36: =E35+1 -> 36 | F36: JAE SANG OH | G36: 0.74305555555555558
E37: =E36+1 -> 37 | F37: JUSTIN TODD | G37: 0.90486111111111112

A1: NAME | B1: PL | C1: MILE | D1: FINISH | E1: PACE | F1: prev 06 | G1: improved
A2: 8:00 AM VARISTY GIRLS
A4: CAROLINE DRAPER | B4: 4 | C4: 0.24166666666666667 | D4: 0.4909722222222222 | E4: 0.2454861111111111 | F4: 0.49652777777777779 | G4: =F4-D4 -> 5.5555555555555913E-3
A5: MOLLY GRABILL | B5: 6 | C5: 0.24444444444444444 | D5: 0.49375000000000002 | E5: 0.24687500000000001
A6: MICHELLE BLACK | B6: 21 | D6: 0.53055555555555556 | E6: 0.26527777777777778 | F6: 0.53749999999999998 | G6: =F6-D6 -> 6.9444444444444198E-3
A7: CASSIE WICOFF | B7: 27 | D7: 0.53888888888888886 | E7: 0.26944444444444443 | F7: 0.5444444444444444 | G7: =F7-D7 -> 5.5555555555555358E-3
A8: KRISTA EGENSE | B8: 28 | D8: 0.54166666666666663 | E8: 0.27083333333333331
A9: NINA SCHEEPERS | B9: 45 | D9: 0.55694444444444446 | E9: 0.27847222222222223 | F9: 0.56874999999999998 | G9: =F9-D9 -> 1.1805555555555514E-2
A10: OLIVIA KRZEMINSKI | B10: 55 | C10: 0.2722222222222222 | D10: 0.56805555555555554 | E10: 0.28402777777777777
A11: KARA YAP | B11: 72 | C11: 0.2722222222222222 | D11: 0.58888888888888891 | E11: 0.29444444444444445 | F11: 0.60833333333333328 | G11: =F11-D11 -> 1.9444444444444375E-2
A13: 8:40 D-1 9/10 GIRLS
A15: MICHELLE LEROUX | B15: 1 | C15: 0.26319444444444445 | D15: 0.53680555555555554 | E15: 0.26840277777777777
A16: MELLISA LEROUX | B16: 3 | C16: 0.26319444444444445 | D16: 0.54236111111111107 | E16: 0.27118055555555554
A17: ALLISON PROEHL | B17: 5 | C17: 0.26666666666666666 | D17: 0.54861111111111116 | E17: 0.27430555555555558
A18: ANNA MOHAMMAD-ZEDAH | B18: 10 | C18: 0.27430555555555558 | D18: 0.55625000000000002 | E18: 0.27812500000000001
A19: MADELINE WAHL | B19: 31 | C19: 0.28749999999999998 | D19: 0.60277777777777775 | E19: 0.30138888888888887
A20: SANA MARZOUR | B20: 62 | D20: 0.64027777777777772 | E20: 0.32013888888888886
A21: JACLYN HANSEN | B21: 70 | D21: 00.65 | E21: 0.32500000000000001
A22: HANNAH QUINTO | B22: 87 | D22: 0.66874999999999996 | E22: 0.33437499999999998
A23: HALEY PETERSON | B23: 93 | D23: 0.68472222222222223 | E23: 0.34236111111111112
A24: CASEY CHILSOM | B24: 96 | D24: 0.68888888888888888 | E24: 0.34444444444444444
A25: LINDSAY PETTIJOHN | B25: 101 | D25: 00.7 | E25: 00.35
A26: RUTH MALINA | B26: 102 | D26: 0.70486111111111116 | E26: 0.35243055555555558
A27: ALYSSA WERTNER | B27: 111 | D27: 0.72638888888888886 | E27: 0.36319444444444443
A29: 9:20 D-1 11/12 GIRLS
A31: TAYLOR PARKER | B31: 3 | C31: 0.27083333333333331 | D31: 0.57708333333333328 | E31: 0.28854166666666664 | F31: 0.56041666666666667
A32: NATALIE UDUWELA | B32: 4 | C32: 0.27777777777777779 | D32: 0.57847222222222228 | E32: 0.28923611111111114 | F32: 0.56111111111111112
A33: DANA MOHAMMAD ZADEH | B33: 5 | D33: 0.58750000000000002 | E33: 0.29375000000000001 | F33: 0.62013888888888891 | G33: =F33-D33 -> 3.2638888888888884E-2
A34: JENNY ZHAUNG | B34: 11 | D34: 0.59930555555555554 | E34: 0.29965277777777777 | F34: 0.54166666666666663
A35: CASEY BURGESS | B35: 13 | D35: 0.60347222222222219 | E35: 0.30173611111111109 | F35: 0.59583333333333333
A36: CHARLESE MATTHEWS | B36: 19 | C36: 0.30208333333333331 | D36: 0.61250000000000004 | E36: 0.30625000000000002 | F36: 0.64375000000000004 | G36: =F36-D36 -> 3.125E-2
A37: KELSEY ERSKINE | B37: 32 | C37: 0.30208333333333331 | D37: 0.63611111111111107 | E37: 0.31805555555555554 | F37: 0.64444444444444449 | G37: =F37-D37 -> 8.3333333333334147E-3
A38: AMANDA ALDERTON | B38: 33 | D38: 0.6381944444444444 | E38: 0.3190972222222222 | F38: 0.64027777777777772 | G38: =F38-D38 -> 2.0833333333333259E-3
A39: LILY MALEK | B39: 56 | D39: 0.73055555555555551 | E39: 0.36527777777777776
A40: RACHEL BURGESS | B40: 57 | D40: 0.7319444444444444 | E40: 0.3659722222222222 | F40: 0.70625000000000004

A1: NAME | B1: PL | C1: MILE | D1: FINISH | E1: PACE | F1: prev 06 | G1: improved
A2: 8:20 D-1 VARSITY BOYS
A4: PARKER STINSON | B4: 2 | C4: 0.20208333333333334 | D4: 0.41875000000000001 | E4: 0.20937500000000001 | F4: 0.44305555555555554 | G4: =F4-D4 -> 2.4305555555555525E-2
A5: SEAN PROEHL | B5: 10 | C5: 0.20277777777777778 | D5: 0.43263888888888891 | E5: 0.21631944444444445 | F5: 0.43819444444444444 | G5: =F5-D5 -> 5.5555555555555358E-3
A6: DREW FLOOD | B6: 14 | C6: 0.21458333333333332 | D6: 0.44027777777777777 | E6: 0.22013888888888888 | F6: 0.44166666666666665 | G6: =F6-D6 -> 1.388888888888884E-3
A7: ROSS CANDELORE | B7: 32 | C7: 0.22638888888888889 | D7: 0.45416666666666666 | E7: 0.22708333333333333
A8: AARON FENLASON | B8: 38 | C8: 0.22916666666666666 | D8: 0.45624999999999999 | E8: 0.22812499999999999
A9: KEVIN SCHUBERT | B9: 54 | C9: 0.23125000000000001 | D9: 0.46250000000000002 | E9: 0.23125000000000001 | F9: 0.47847222222222224 | G9: =F9-D9 -> 1.5972222222222221E-2
A10: VASTAL SHAH | B10: 79 | C10: 0.2326388888888889 | D10: 0.47986111111111113 | E10: 0.23993055555555556 | F10: 0.49722222222222223 | G10: =F10-D10 -> 1.7361111111111105E-2
A12: 9:00 D-1 9/10 BOYS
A14: TRAVIS LINDER | B14: 11 | C14: 0.23194444444444445 | D14: 0.47916666666666669 | E14: 0.23958333333333334
A15: RYLEY WEBB | B15: 17 | C15: 0.23194444444444445 | D15: 0.48472222222222222 | E15: 0.24236111111111111 | F15: 0.52500000000000002 | G15: =F15-D15 -> 4.0277777777777801E-2
A16: ANTHONY GIROLAMO | B16: 18 | C16: 0.24097222222222223 | D16: 0.48472222222222222 | E16: 0.24236111111111111
A17: IAN CABLE | B17: 36 | D17: 0.49583333333333335 | E17: 0.24791666666666667
A18: CONNER LACHENBRUCH | B18: 41 | C18: 0.24097222222222223 | D18: 0.5 | E18: 0.25
A19: JORDAN AHOSTROM | B19: 44 | D19: 0.50069444444444444 | E19: 0.25034722222222222
A20: TODD MYERS | B20: 73 | C20: 0.25 | D20: 0.52152777777777781 | E20: 0.26076388888888891
A21: ALEC BURGESS | B21: 81 | C21: 0.26666666666666666 | D21: 0.52708333333333335 | E21: 0.26354166666666667
A22: LOUW SCHEEPERS | B22: 96 | C22: 0.27638888888888891 | D22: 0.53611111111111109 | E22: 0.26805555555555555
A23: ROBERT MCENTIRE | B23: 100 | C23: 0.27500000000000002 | D23: 0.53888888888888886 | E23: 0.26944444444444443
A24: ZACH KAUFMAN | B24: 122 | D24: 0.56041666666666667 | E24: 0.28020833333333334
A25: ROBERT SHEEHAN | B25: 121 | D25: 0.56041666666666667 | E25: 0.28020833333333334
A26: RYAN WORDAN | B26: 130 | C26: 0.27777777777777779 | D26: 0.56874999999999998 | E26: 0.28437499999999999
A27: JAKE BROCKBANK | B27: 133 | C27: 0.30625000000000002 | D27: 0.57291666666666663 | E27: 0.28645833333333331
A28: ALEX FLOOD | B28: 145 | C28: 0.28472222222222221 | D28: 0.59513888888888888 | E28: 0.29756944444444444
A29: SKYLER WARREN | B29: 151 | D29: 0.60416666666666663 | E29: 0.30208333333333331 | F29: 0.62569444444444444 | G29: =F29-D29 -> 2.1527777777777812E-2
A30: BEN WANCEWICZ | B30: 154 | D30: 0.61041666666666672 | E30: 0.30520833333333336 | F30: 0.59652777777777777
A31: JUSTIN TODD | B31: 180 | D31: 0.90486111111111112 | E31: 0.45243055555555556
A33: 9:40 D-1 11/12 BOYS
A35: O'MIN KWON | B35: 9 | C35: 0.23333333333333334 | D35: 0.48749999999999999 | E35: 0.24374999999999999 | F35: 0.52083333333333337 | G35: =F35-D35 -> 3.3333333333333381E-2
A36: STEVEN KAMEN | B36: 11 | C36: 0.23333333333333334 | D36: 0.48888888888888887 | E36: 0.24444444444444444 | F36: 0.49861111111111112 | G36: =F36-D36 -> 9.7222222222222432E-3
A37: ACHILLES SCHMELZER | B37: 14 | C37: 0.23333333333333334 | D37: 0.4909722222222222 | E37: 0.2454861111111111
A38: SCOTT ROBISON | B38: 23 | C38: 0.23333333333333334 | D38: 0.50138888888888888 | E38: 0.25069444444444444 | F38: 0.52847222222222223 | G38: =F38-D38 -> 2.7083333333333348E-2
A39: GARRETT YAGADE | B39: 35 | C39: 0.25555555555555554 | D39: 0.5131944444444444 | E39: 0.2565972222222222 | F39: 0.55208333333333337 | G39: =F39-D39 -> 3.8888888888888973E-2
A40: RYOSUKE SAIKA | B40: 55 | C40: 0.24097222222222223 | D40: 0.53888888888888886 | E40: 0.26944444444444443 | F40: 0.54791666666666672 | G40: =F40-D40 -> 9.0277777777778567E-3
A41: ANDREW RHODES | B41: 56 | C41: 0.25069444444444444 | D41: 0.54027777777777775 | E41: 0.27013888888888887
A42: PETER BENITO | B42: 63 | C42: 0.25277777777777777 | D42: 0.54583333333333328 | E42: 0.27291666666666664 | F42: 0.55694444444444446 | G42: =F42-D42 -> 1.1111111111111183E-2
A43: DANIEL NELSON | B43: 72 | C43: 0.27291666666666664 | D43: 0.57013888888888886 | E43: 0.28506944444444443
A44: PETER STEUSLOFF | B44: 76 | C44: 0.26527777777777778 | D44: 0.57847222222222228 | E44: 0.28923611111111114
A45: MAX JOHNSON | B45: 89 | D45: 0.68263888888888891 | E45: 0.34131944444444445
A46: JAE SANG OH | C46: 0.33333333333333331 | D46: 0.74305555555555558 | E46: 0.37152777777777779 | F46: 0.59097222222222223