A1: 8:00 D1 GIRLS VARSITY | B1: 10:00 D II GIRLS VARSITY
A2: 8:20 D1 BOYS FROSH | B2: 10:20 D II BOYS JV/FROSH
A3: 8:40 D1 GIRLS JV FR./SOPH | B3: 10:40 D II GIRLS JV
A4: 9:00 D1 BOYS JV | B4: 11:00 D II BOYS VARSITY
A5: 9:20 D1 GIRLS JV, JR./SR
A6: 9:40 D1 BOYS VARSITY

A1: 1 | B1: KATY ANDREWS | C1: LCC | D1: 0.46944444444444444
A2: 2 | B2: GILLIAN FITCH | C2: LCC | D2: 0.47986111111111113
A3: 3 | B3: BROOKE GIUFFRE | C3: LCC | D3: 0.48333333333333334
A4: 4 | B4: ERIN GILLINGHAM | C4: TP | D4: 0.49166666666666664
A5: 5 | B5: ASHLIN YAHR | C5: TP | D5: 0.49444444444444446
A6: 6 | B6: KATIE RENTZ | C6: MC | D6: 0.49513888888888891
A7: 7 | B7: KRISTEN PETERS | C7: WH | D7: 0.49722222222222223
A8: 8 | B8: KEENE | C8: RBV | D8: 0.49791666666666667
A9: 9 | B9: ANA PRIM | C9: TP | D9: 0.5
A10: 10 | B10: MISSY BARCLAY | C10: WV | D10: 0.50069444444444444
A11: 11 | B11: KRISTA EGENSE | C11: RB | D11: 0.50138888888888888
A12: 12 | B12: SOPHIE DAVIDSON | C12: TP | D12: 0.50138888888888888
A13: 13 | B13: PHOEBE HARTNETT | C13: PH | D13: 0.50416666666666665
A14: 14 | B14: AMANDA MOORE | C14: TP | D14: 0.50486111111111109
A15: 15 | B15: STACY PENSINGER | C15: EL CAM | D15: 0.50486111111111109
A16: 16 | B16: COURTNEY CLARK | C16: LCC | D16: 0.50486111111111109
A17: 17 | B17: CAROLINE DRAPER | C17: RB | D17: 0.50624999999999998
A18: 18 | B18: ERIN HEARN | C18: RAM. | D18: 0.50763888888888886
A19: 19 | B19: KATIE WICKS | C19: LCC | D19: 0.51527777777777772
A20: 20 | B20: KELSEY SHIELDS | C20: RAM | D20: 0.5180555555555556
A21: 21 | B21: J..FISHEROVA | C21: WH | D21: 0.5180555555555556
A22: 22 | B22: RENE EATON | C22: SAN PAS | D22: 0.51875000000000004
A23: 23 | B23: MARIANA GARCIA | C23: RAM | D23: 0.52013888888888893
A24: 24 | B24: K.. HALL | C24: WH | D24: 0.52013888888888893
A25: 25 | B25: CORI MARTE | C25: EL CAM | D25: 0.52083333333333337
A26: 26 | B26: BRITTANY BALCOM | C26: RAM | D26: 0.52430555555555558
A27: 27 | B27: BROOKE PENNY | C27: RBV | D27: 0.52638888888888891
A28: 28 | B28: ZYTHEWICZ | C28: RBV | D28: 0.52777777777777779
A29: 29 | B29: BRIGITTE DOCTOR | C29: TP | D29: 0.52916666666666667
A30: 30 | B30: S. ESPINDOLA | C30: WH | D30: 0.52916666666666667
A31: 31 | B31: KEELAN | C31: WV | D31: 0.53194444444444444
A32: 32 | B32: CARLY BLISS | C32: RB | D32: 0.53194444444444444
A33: 33 | B33: KERRY SONNENBURG | C33: RB | D33: 0.53541666666666665
A34: 34 | B34: MUMBY | C34: WV | D34: 0.53680555555555554
A35: 35 | B35: CHARLIE FUNK | C35: EL CAM | D35: 0.53680555555555554
A36: 36 | B36: M. EHLERT | C36: WH | D36: 0.53749999999999998
A37: 37 | B37: CARLI KIERSTEAD | C37: PH | D37: 0.53888888888888886
A38: 38 | B38: MICHELLE BLACK | C38: RB | D38: 0.5395833333333333
A39: 39 | B39: KAITLIN DANSSAERT | C39: TP | D39: 0.54027777777777775
A40: 40 | B40: MEG EVERETT | C40: PH | D40: 0.54166666666666663
A41: 41 | B41: CHELSEY HILL | C41: PH | D41: 0.54166666666666663
A42: 42 | B42: KIM TURNER | C42: SP | D42: 0.54166666666666663
A43: 43 | B43: PHILLIPS | C43: RBV | D43: 0.54236111111111107
A44: 44 | B44: RACHAEL HARRINGTON | C44: LCC | D44: 0.54305555555555551
A45: 45 | B45: TRUJILLO | C45: WV | D45: 0.54305555555555551
A46: 46 | B46: KELSEY KASTER | C46: RAM | D46: 0.54722222222222228
A47: 47 | B47: WENDY TURNER | C47: PH | D47: 0.5493055555555556
A48: 48 | B48: RANKIN | C48: WV | D48: 0.5493055555555556
A49: 49 | B49: BRITTANY CARSON | C49: TP | D49: 0.55069444444444449
A50: 50 | B50: SARAH SCHNALL | C50: LCC | D50: 0.55208333333333337
A51: 51 | B51: C. SACCONE | C51: WH | D51: 0.55347222222222225
A52: 52 | B52: S. TIMANNS | C52: WH | D52: 0.55347222222222225
A53: 53 | B53: TAYLOR PARKER | C53: RB | D53: 0.5541666666666667
A54: 54 | B54: LAUREN ORTEGA | C54: RAM | D54: 0.55486111111111114
A55: 55 | B55: MCADAMS | C55: RBV | D55: 0.55763888888888891
A56: 56 | B56: EMILY CARNE | C56: RAM | D56: 0.55763888888888891
A57: 57 | B57: MONICA CARILLO | C57: MC | D57: 0.55902777777777779
A58: 58 | B58: M. IAVELLI | C58: WH | D58: 0.55902777777777779
A59: 59 | B59: DUPONE | C59: RBV | D59: 0.56180555555555556
A60: 60 | B60: NIKKI NONEMURA | C60: MC | D60: 0.56597222222222221
A61: 61 | B61: JESSICA FROST | C61: LCC | D61: 0.56874999999999998
A62: 62 | B62: SARA NAJAFI | C62: MC | D62: 0.57013888888888886
A63: 63 | B63: SUNSHINE LICKNESS | C63: TP | D63: 0.57430555555555551
A64: 64 | B64: MICAELA HICHBOM | C64: TP | D64: 0.58402777777777781
A65: 65 | B65: FENTON | C65: RBV | D65: 0.58611111111111114
A66: 66 | B66: HEIDI REDLITZ | C66: TP | D66: 00.6
A67: 67 | B67: BONNIE OPLIGER | C67: PH | D67: 0.62986111111111109
A68: 68 | B68: SPENCER VARDAKIS | C68: PH | D68: 0.63055555555555554
A69: 69 | B69: AMANDA BLASS | C69: MC | D69: 0.63541666666666663

A1: 1 | B1: SAMUEL ST LAURENT | C1: EL CAMINO | D1: 0.44305555555555554
A2: =A1+1 -> 2 | B2: DANIEL GOMEZ | C2: EL CAMINO | D2: 0.47291666666666665
A3: =A2+1 -> 3 | B3: DAVID CLARK | C3: VHS | D3: 0.47291666666666665
A4: =A3+1 -> 4 | B4: ERIK FIGGE | C4: PHHS | D4: 0.4777777777777778
A5: =A4+1 -> 5 | B5: FISER | C5: WH | D5: 0.47916666666666669
A6: =A5+1 -> 6 | B6: DILLON JACK | C6: TP | D6: 0.48333333333333334
A7: =A6+1 -> 7 | B7: NASSERI | C7: POWAY | D7: 0.48402777777777778
A8: =A7+1 -> 8 | B8: NELSON | C8: WH | D8: 0.48680555555555555
A9: =A8+1 -> 9 | B9: ROSSIO | C9: ? | D9: 0.49027777777777781
A10: =A9+1 -> 10 | B10: NICK HAINES | C10: PHHS | D10: 0.4916666666666667
A11: =A10+1 -> 11 | B11: JOSH SCHALCHLIN | C11: EL CAMINO | D11: 0.49583333333333335
A12: =A11+1 -> 12 | B12: KYLE STEPHAN | C12: WV | D12: 0.49652777777777773
A13: =A12+1 -> 13 | B13: BRETT GUTIERREZ | C13: PHHS | D13: 0.49722222222222223
A14: =A13+1 -> 14 | B14: TEEPLES | C14: POWAY | D14: 0.50069444444444444
A15: =A14+1 -> 15 | B15: SHANE CARPENTER | C15: VHS | D15: 0.50208333333333333
A16: =A15+1 -> 16 | B16: BERNIER | C16: WH | D16: 0.50277777777777777
A17: =A16+1 -> 17 | B17: SEAN TEATER | C17: VHS | D17: 0.50347222222222221
A18: =A17+1 -> 18 | B18: O'MIN QWON | C18: RB | D18: 0.50416666666666665
A19: =A18+1 -> 19 | B19: JAMES PATERSCH | C19: TP | D19: 0.50486111111111109
A20: =A19+1 -> 20 | B20: ALEX PLOYE-EVANS | C20: TP | D20: 0.50555555555555554
A21: =A20+1 -> 21 | B21: CHRIS FAMIAN | C21: RAMONA | D21: 0.50763888888888886
A22: =A21+1 -> 22 | B22: STEVEN KAMEN | C22: RB | D22: 0.50763888888888886
A23: =A22+1 -> 23 | B23: NATHAN DNCHER | C23: TP | D23: 0.5083333333333333
A24: =A23+1 -> 24 | B24: JASON KURTH | C24: WV | D24: 0.50902777777777775
A25: =A24+1 -> 25 | B25: CASTELLON | C25: RBV | D25: 0.50972222222222219
A26: =A25+1 -> 26 | B26: MIKE HUXHOLD | C26: SAN PASQUAL | D26: 0.50972222222222219
A27: =A26+1 -> 27 | B27: JOSEPH LYON | C27: TP | D27: 0.51041666666666663
A28: =A27+1 -> 28 | B28: MATT COOK | C28: EL CAMINO | D28: 0.51041666666666663
A29: =A28+1 -> 29 | B29: CLOW | C29: POWAY | D29: 0.51111111111111118
A30: =A29+1 -> 30 | B30: MATT NEWMAN | C30: LCC | D30: 0.51249999999999996
A31: =A30+1 -> 31 | B31: PAUR | C31: POWAY | D31: 0.51388888888888895
A32: =A31+1 -> 32 | B32: KASEY MALCOFF | C32: PHHS | D32: 0.51458333333333328
A33: =A32+1 -> 33 | B33: PIERSALL | C33: POWAY | D33: 0.51666666666666672
A34: =A33+1 -> 34 | B34: SPENCE EVERETT | C34: PHHS | D34: 0.51736111111111105
A35: =A34+1 -> 35 | B35: CHRISS NOBLE | C35: EL CAMINO | D35: 0.5180555555555556
A36: =A35+1 -> 36 | B36: GERALD GOLDEN | C36: RB | D36: 0.51875000000000004
A37: =A36+1 -> 37 | B37: ERIC NAMSOUR | C37: MC | D37: 0.51875000000000004
A38: =A37+1 -> 38 | B38: SEAN MULDERIG | C38: PHHS | D38: 0.51944444444444449
A39: =A38+1 -> 39 | B39: JORGE | C39: WH | D39: 0.51944444444444449
A40: =A39+1 -> 40 | B40: AVI REUBEN | C40: RB | D40: 0.52013888888888882
A41: =A40+1 -> 41 | B41: GARCIN | C41: WH | D41: 0.52152777777777781
A42: =A41+1 -> 42 | B42: WILL MUMBY | C42: WV | D42: 0.52152777777777781
A43: =A42+1 -> 43 | B43: MICHAEL DEAN | C43: PHHS | D43: 0.52222222222222225
A44: =A43+1 -> 44 | B44: ELI SCANDALIS | C44: SAN PASQUAL | D44: 0.5229166666666667
A45: =A44+1 -> 45 | B45: STUART SLOAT | C45: EL CAMINO | D45: 0.52430555555555558
A46: =A45+1 -> 46 | B46: ANT NOREN | C46: RB | D46: 0.52500000000000002
A47: =A46+1 -> 47 | B47: PATRICK KRUSE | C47: RAMONA | D47: 0.52569444444444446
A48: =A47+1 -> 48 | B48: CODY WHITE | C48: WV | D48: 0.52638888888888891
A49: =A48+1 -> 49 | B49: MATT LENUHAN | C49: TP | D49: 0.52847222222222223
A50: =A49+1 -> 50 | B50: CHASE CABRERA | C50: PHHS | D50: 0.53888888888888886
A51: =A50+1 -> 51 | B51: SPENCER MACDONALD | C51: TP | D51: 0.53888888888888886
A52: =A51+1 -> 52 | B52: CHRIS PERFILI | C52: SAN PASQUAL | D52: 0.5395833333333333
A53: =A52+1 -> 53 | B53: JESS HILL | C53: PHHS | D53: 0.54097222222222219
A54: =A53+1 -> 54 | B54: HENRY | C54: WH | D54: 0.54166666666666663
A55: =A54+1 -> 55 | B55: DONOHUE | C55: WH | D55: 0.54305555555555551
A56: =A55+1 -> 56 | B56: JOHN FOSTER | C56: SAN PASQUAL | D56: 0.54305555555555551
A57: =A56+1 -> 57 | B57: MCMANUS | C57: WH | D57: 0.5444444444444444
A58: =A57+1 -> 58 | B58: DYLAN ANDERSON | C58: MC | D58: 0.54513888888888895
A59: =A58+1 -> 59 | B59: AHMED | C59: WH | D59: 0.54583333333333328
A60: =A59+1 -> 60 | B60: ALEX THOMASON | C60: PHHS | D60: 0.54652777777777783
A61: =A60+1 -> 61 | B61: MATT HARDY | C61: PHHS | D61: 0.54722222222222217
A62: =A61+1 -> 62 | B62: JEREMY RITTER | C62: VHS | D62: 0.54722222222222217
A63: =A62+1 -> 63 | B63: CHARLES YANG | C63: ? | D63: 0.54722222222222217
A64: =A63+1 -> 64 | B64: RYOSUKE SAIKA | C64: RB | D64: 0.54791666666666672
A65: =A64+1 -> 65 | B65: CHAN | C65: POWAY | D65: 0.54791666666666672
A66: =A65+1 -> 66 | B66: CALEB HARLEY | C66: PHHS | D66: 0.54861111111111105
A67: =A66+1 -> 67 | B67: JOSH BLESSING | C67: WV | D67: 0.54861111111111105
A68: =A67+1 -> 68 | B68: TYLER SOTO | C68: VHS | D68: 0.5493055555555556
A69: =A68+1 -> 69 | B69: PARLADE | C69: RBV | D69: 00.55
A70: =A69+1 -> 70 | B70: ANTHONY JENSON | C70: MC | D70: 00.55
A71: =A70+1 -> 71 | B71: JUSTIN DAVIS | C71: EL CAMINO | D71: 0.55069444444444449
A72: =A71+1 -> 72 | B72: ERIC TSAI | C72: TP | D72: 0.55208333333333337
A73: =A72+1 -> 73 | B73: ERIC SURRATT | C73: WV | D73: 0.55277777777777781
A74: =A73+1 -> 74 | B74: ERICK STUCK | C74: PHHS | D74: 0.55277777777777781
A75: =A74+1 -> 75 | B75: TAYLOR FIX | C75: SAN PASQUAL | D75: 0.55486111111111114
A76: =A75+1 -> 76 | B76: CONNER MARTIN | C76: RAMONA | D76: 0.55972222222222223
A77: =A76+1 -> 77 | B77: JESUS NARVAEZ | C77: EL CAMINO | D77: 0.5625
A78: =A77+1 -> 78 | B78: MATT NAZZOLA | C78: RAMONA | D78: 0.56388888888888888
A79: =A78+1 -> 79 | B79: BLAKE PIERCE | C79: WV | D79: 0.56458333333333333
A80: =A79+1 -> 80 | B80: RABIE | C80: RBV | D80: 0.56944444444444442
A81: =A80+1 -> 81 | B81: BRANDON COOPER | C81: EL CAMINO | D81: 0.5756944444444444
A82: =A81+1 -> 82 | B82: COOPER | C82: EL CAMINO | D82: 0.5756944444444444
A83: =A82+1 -> 83 | B83: JEREMY LEONARD | C83: SAN PASQUAL | D83: 0.5756944444444444
A84: =A83+1 -> 84 | B84: ZAC COMER | C84: EL CAMINO | D84: 0.57708333333333328
A85: =A84+1 -> 85 | B85: HENNING | C85: WH | D85: 0.5854166666666667
A86: =A85+1 -> 86 | B86: WILSON | C86: WH | D86: 0.5854166666666667
A87: =A86+1 -> 87 | B87: BRETT DORREN | C87: WV | D87: 0.59097222222222223
A88: =A87+1 -> 88 | B88: DAVE PARESH | C88: MC | D88: 0.59166666666666667
A89: =A88+1 -> 89 | B89: RYAN BRACKEN | C89: LCC | D89: 0.61111111111111105
A90: =A89+1 -> 90 | B90: GARUDADRI SURESH | C90: MC | D90: 0.61250000000000004
A91: =A90+1 -> 91 | B91: MATTHEW EATON | C91: MC | D91: 0.61388888888888882
A92: =A91+1 -> 92 | B92: AARON KASH | C92: SAN PASQUAL | D92: 0.6166666666666667
A93: =A92+1 -> 93 | B93: ANDREW GORDON | C93: PHHS | D93: 0.62152777777777779
A94: =A93+1 -> 94 | B94: CHRIS HARRIS | C94: RB | D94: 0.62361111111111112
A95: =A94+1 -> 95 | B95: SEAN WILBURN | C95: EL CAMINO | D95: 0.64027777777777783
A96: =A95+1 -> 96 | B96: TYLER HILL | C96: PHHS | D96: 0.66249999999999998
A97: =A96+1 -> 97 | B97: VATSAL SHAH | C97: RB | D97: 0.66597222222222219
A98: =A97+1 -> 98 | B98: BRYCE NICOSTRO | C98: EL CAMINO | D98: 0.6875
A99: =A98+1 -> 99 | B99: CALVIN HENDRIX | C99: SAN PASQUAL | D99: 0.72916666666666663
A100: =A99+1 -> 100 | B100: DOMINIC LUCERO | C100: RAMONA | D100: NT

A1: 1 | B1: Wheaton | C1: Poway | D1: 0.53611111111111109
A2: 2 | B2: Adair, Samantha | C2: MC | D2: 0.53680555555555554
A3: 3 | B3: Simms, Shelby | C3: TP | D3: 0.5395833333333333
A4: 4 | B4: Kotow | C4: WV | D4: 0.54374999999999996
A5: 5 | B5: Levy, Lauren | C5: TP | D5: 0.54513888888888895
A6: 6 | B6: Quach | C6: WV | D6: 0.55069444444444449
A7: 7 | B7: Matonis | C7: Poway | D7: 0.55277777777777781
A8: 8 | B8: Zhuang, Jenny | C8: RBHS | D8: 0.5541666666666667
A9: 9 | B9: Parker, Emily | C9: PHHS | D9: 0.55486111111111114
A10: 10 | B10: Baina, Taylor | C10: El Camino | D10: 0.55555555555555558
A11: 11 | B11: Belom, Sam | C11: El Camino | D11: 0.55763888888888891
A12: 12 | B12: Shaw, Christy | C12: El Camino | D12: 0.55972222222222223
A13: 13 | B13: Ruland, Brianna | C13: Ramona | D13: 0.5625
A14: 14 | B14: Sommer, Kalin | C14: TP | D14: 0.56319444444444444
A15: 15 | B15: Iniestra, Liliana | C15: San Pasqual | D15: 0.56458333333333333
A16: 16 | B16: Shelby, Kinsey | C16: Ramona | D16: 0.56597222222222221
A17: 17 | B17: Brown, Brooke | C17: El Camino | D17: 0.56736111111111109
A18: 18 | B18: Nguyen, Vicotria | C18: PHHS | D18: 0.56874999999999998
A19: 19 | B19: Burley | C19: Poway | D19: 0.56944444444444442
A20: 20 | B20: McNulty, K. | C20: WH | D20: 0.5708333333333333
A21: 21 | B21: Cowen, Tara | C21: RBHS | D21: 0.57222222222222219
A22: 22 | B22: Nichols, Ashley | C22: TP | D22: 0.57222222222222219
A23: 23 | B23: Barajas, Alisia | C23: VHS | D23: 0.57222222222222219
A24: 24 | B24: Darr, Michelle | C24: TP | D24: 0.57222222222222219
A25: 25 | B25: Kesser | C25: Poway | D25: 0.57430555555555551
A26: 26 | B26: George, Sarah | C26: MC | D26: 0.57638888888888895
A27: 27 | B27: Park, Alicia | C27: San Pasqual | D27: 0.57847222222222217
A28: 28 | B28: Fueller, Amanda | C28: MC | D28: 0.57916666666666672
A29: 29 | B29: Thompson, Michelle | C29: MC | D29: 0.57916666666666672
A30: 30 | B30: Azvedo | C30: Poway | D30: 0.57986111111111105
A31: 31 | B31: Uduwela, Natalie | C31: RBHS | D31: 0.57986111111111105
A32: 32 | B32: Waller | C32: Poway | D32: 0.58125000000000004
A33: 33 | B33: Semerdjian, Alyssa | C33: TP | D33: 0.58125000000000004
A34: 34 | B34: Cartin, Mackenzie | C34: El Camino | D34: 0.58194444444444449
A35: 35 | B35: Ozuna, G. | C35: WH | D35: 0.58194444444444449
A36: 36 | B36: Redlinger, Therese | C36: PHHS | D36: 0.58263888888888882
A37: 37 | B37: Barrios, Monique | C37: Ramona | D37: 0.58263888888888882
A38: 38 | B38: Spitsbergen, Ruth | C38: Ramona | D38: 0.58402777777777781
A39: 39 | B39: Murray, Ashley | C39: LCC | D39: 0.5854166666666667
A40: 40 | B40: Burgess, Casey | C40: RBHS | D40: 0.58611111111111114
A41: 41 | B41: Depweg | C41: Poway | D41: 0.58680555555555558
A42: 42 | B42: Hall | C42: WV | D42: 0.58750000000000002
A43: 43 | B43: Veyveris, Aubreyann | C43: VHS | D43: 0.58819444444444446
A44: 44 | B44: Blaseio, Susi | C44: TP | D44: 0.58888888888888891
A45: 45 | B45: Sandoval, Leah | C45: San Pasqual | D45: 0.58958333333333335
A46: 46 | B46: Franklin, Kim | C46: Ramona | D46: 0.58958333333333335
A47: 47 | B47: Waterhouse, A. | C47: WH | D47: 0.59236111111111112
A48: 48 | B48: Rayner | C48: RBV | D48: 0.59305555555555556
A49: 49 | B49: Baer | C49: RBV | D49: 0.59444444444444444
A50: 50 | B50: Miklaski | C50: WV | D50: 0.59513888888888888
A51: 51 | B51: Davis | C51: WV | D51: 0.59722222222222221
A52: 52 | B52: Rowe | C52: RBV | D52: 0.59861111111111109
A53: 53 | B53: Patterson | C53: RBV | D53: 0.60277777777777775
A54: 54 | B54: Walls, Krysten | C54: TP | D54: 0.60347222222222219
A55: 55 | B55: Henry, Paige | C55: RBHS | D55: 0.60486111111111118
A56: 56 | B56: Maddock | C56: WV | D56: 0.60763888888888895
A57: 57 | B57: Heiberg | C57: WV | D57: 0.61388888888888882
A58: 58 | B58: Weaver, Emily | C58: Ramona | D58: 0.61458333333333337
A59: 59 | B59: Stahl | C59: RBV | D59: 0.61527777777777781
A60: 60 | B60: Payton, Chelcie | C60: TP | D60: 0.61527777777777781
A61: 61 | B61: Borok, Jenna | C61: TP | D61: 0.61527777777777781
A62: 62 | B62: Kaillian | C62: Poway | D62: 0.61597222222222225
A63: 63 | B63: Nguyen, Holly | C63: PHHS | D63: 0.6166666666666667
A64: 64 | B64: McMullen, Victoria | C64: RBHS | D64: 0.61736111111111114
A65: 65 | B65: Burns, Jasmine | C65: San Pasqual | D65: 0.61736111111111114
A66: 66 | B66: Boyle, Jessica | C66: San Pasqual | D66: 0.61736111111111114
A67: 67 | B67: Armenta, Celina | C67: PHHS | D67: 0.61805555555555558
A68: 68 | B68: Porter, Emily | C68: PHHS | D68: 0.61805555555555558
A69: 69 | B69: Varner | C69: RBV | D69: 0.62152777777777779
A70: 70 | B70: Le | C70: WV | D70: 0.62569444444444444
A71: 71 | B71: Fuhrmann | C71: Poway | D71: 0.62847222222222221
A72: 72 | B72: Bakun, Katelyn | C72: Ramona | D72: 0.62916666666666665
A73: 73 | B73: Schott, Justine | C73: LCC | D73: 0.63124999999999998
A74: 74 | B74: Budenstadt, Kristin | C74: PHHS | D74: 0.63124999999999998
A75: 75 | B75: Muhammad-Zadeh, Dana | C75: RBHS | D75: 0.6333333333333333
A76: 76 | B76: Pepich, Adena | C76: Ramona | D76: 0.63472222222222219
A77: 77 | B77: Cannon, Kelcie | C77: El Camino | D77: 0.63958333333333328
A78: 78 | B78: Risser, Katie | C78: PHHS | D78: 0.64027777777777783
A79: 79 | B79: Voll, J. | C79: WH | D79: 0.64236111111111105
A80: 80 | B80: Frisch | C80: Poway | D80: 0.64444444444444449
A81: 81 | B81: Baltazar | C81: RBV | D81: 0.64861111111111114
A82: 82 | B82: Johnson, Sarah | C82: PHHS | D82: 0.65069444444444446
A83: 83 | B83: Decreseute, K. | C83: WH | D83: 0.65069444444444446
A84: 84 | B84: Leffas-Lopes, Chloe | C84: RBHS | D84: 0.65416666666666667
A85: 85 | B85: Thill, Kimberly | C85: PHHS | D85: 0.65763888888888888
A86: 86 | B86: Ramirez, Emma | C86: Ramona | D86: 0.66111111111111109
A87: 87 | B87: Robbins, J. | C87: WH | D87: 0.67013888888888884
A88: 88 | B88: Garcia, Karina | C88: El Camino | D88: 0.67291666666666661
A89: 89 | B89: Erskine, Kelsey | C89: RBHS | D89: 0.67291666666666661
A90: 90 | B90: Choi, Miriam | C90: TP | D90: 0.67708333333333337
A91: 91 | B91: Hopper, Marian | C91: PHHS | D91: 0.67708333333333337
A92: 92 | B92: Velez, Blanca | C92: El Camino | D92: 0.6791666666666667
A93: 93 | B93: Bacon, Libby | C93: MC | D93: 0.69652777777777775
A94: 94 | B94: Romero, Miija | C94: Ramona | D94: 0.6972222222222223
A95: 95 | B95: Linares, Jessica | C95: El Camino | D95: 0.69930555555555562
A96: 96 | B96: Alderton, Amanda | C96: RBHS | D96: 0.70277777777777783
A97: 97 | B97: Walker, Brittany | C97: TP | D97: 0.70833333333333337
A98: 98 | B98: Esten, Erin | C98: PHHS | D98: 0.7090277777777777
A99: 99 | B99: Osborn, T. | C99: WH | D99: 0.74722222222222223
A100: 10 | B100: Schnapp, Jacky | C100: Ramona | D100: 0.75486111111111109
A101: 101 | B101: Sankowski, Jessica | C101: PHHS | D101: 0.83263888888888893

A1: 1 | B1: RUS MUNDAE | C1: SAN PASQUAL | D1: 0.4375
A2: =A1+1 -> 2 | B2: DAVID CARLSON | C2: RB | D2: 0.45277777777777778
A3: =A2+1 -> 3 | B3: BRYAN LANE | C3: TP | D3: 0.45763888888888887
A4: =A3+1 -> 4 | B4: HERRILL | C4: RBV | D4: 0.45833333333333331
A5: =A4+1 -> 5 | B5: TEAL | C5: POWAY | D5: 0.45902777777777781
A6: =A5+1 -> 6 | B6: JESUS PASCUAL | C6: EL CAMINO | D6: 0.45902777777777781
A7: =A6+1 -> 7 | B7: TIM BLACK | C7: TP | D7: 0.46111111111111108
A8: =A7+1 -> 8 | B8: MICHAEL WEN | C8: TP | D8: 0.46111111111111108
A9: =A8+1 -> 9 | B9: JEREMY BLACK | C9: TP | D9: 0.46250000000000002
A10: =A9+1 -> 10 | B10: RYAN AUGST | C10: MC | D10: 0.46388888888888885
A11: =A10+1 -> 11 | B11: QUINONES | C11: RBV | D11: 0.46458333333333335
A12: =A11+1 -> 12 | B12: CARLOS CABALLERO | C12: PHHS | D12: 0.46527777777777773
A13: =A12+1 -> 13 | B13: HOLLON | C13: POWAY | D13: 0.46597222222222223
A14: =A13+1 -> 14 | B14: RYAN BRINIGAR | C14: MC | D14: 0.47152777777777777
A15: =A14+1 -> 15 | B15: GONIA M | C15: WH | D15: 0.47361111111111115
A16: =A15+1 -> 16 | B16: MATT STANISLAWSKI | C16: RB | D16: 0.4770833333333333
A17: =A16+1 -> 17 | B17: DRAKE | C17: RBV | D17: 0.4777777777777778
A18: =A17+1 -> 18 | B18: ALEX RYDEN | C18: RB | D18: 0.47847222222222219
A19: =A18+1 -> 19 | B19: OLIVER ORTLIEB | C19: SAN PASQUAL | D19: 0.47916666666666669
A20: =A19+1 -> 20 | B20: STEPHEN POOR | C20: VHS | D20: 0.47986111111111113
A21: =A20+1 -> 21 | B21: SPENCER LEVINE | C21: TP | D21: 0.48125000000000001
A22: =A21+1 -> 22 | B22: JARVIS | C22: RBV | D22: 0.48125000000000001
A23: =A22+1 -> 23 | B23: QUENTIN LAMICA | C23: RB | D23: 0.48194444444444445
A24: =A23+1 -> 24 | B24: FELIX MARTINES | C24: PHHS | D24: 0.48194444444444445
A25: =A24+1 -> 25 | B25: HERNANDEZ | C25: RBV | D25: 0.4826388888888889
A26: =A25+1 -> 26 | B26: MORGAN HARPONEAU | C26: MC | D26: 0.4826388888888889
A27: =A26+1 -> 27 | B27: BROWN | C27: RBV | D27: 0.48333333333333334
A28: =A27+1 -> 28 | B28: RYAN WALERY | C28: SAN PASQUAL | D28: 0.48402777777777778
A29: =A28+1 -> 29 | B29: VLADIMIR MIDENICA | C29: PHHS | D29: 0.48541666666666666
A30: =A29+1 -> 30 | B30: ANDY SHOEPP | C30: RAMONA | D30: 0.4861111111111111
A31: =A30+1 -> 31 | B31: JOSH HAGER | C31: RAMONA | D31: 0.4861111111111111
A32: =A31+1 -> 32 | B32: JOHN MAHEU | C32: WV | D32: 0.48680555555555555
A33: =A32+1 -> 33 | B33: ZACH WILLSON | C33: EL CAMINO | D33: 0.48680555555555555
A34: =A33+1 -> 34 | B34: TAYLOR DAVIS | C34: RB | D34: 0.48680555555555555
A35: =A34+1 -> 35 | B35: ISAAC LEW | C35: WV | D35: 0.48819444444444443
A36: =A35+1 -> 36 | B36: MASON WESTPHAL | C36: RAMONA | D36: 0.48888888888888887
A37: =A36+1 -> 37 | B37: JASON YANG | C37: WV | D37: 0.48958333333333331
A38: =A37+1 -> 38 | B38: MIMMS | C38: POWAY | D38: 0.49027777777777781
A39: =A38+1 -> 39 | B39: ERIK JEPSEN | C39: EL CAMINO | D39: 0.49236111111111108
A40: =A39+1 -> 40 | B40: VLAD TSYRKLEVICH | C40: MC | D40: 0.49375000000000002
A41: =A40+1 -> 41 | B41: CHRIS RUBADUE | C41: RB | D41: 0.49513888888888885
A42: =A41+1 -> 42 | B42: DAN MALONE | C42: MC | D42: 0.49583333333333335
A43: =A42+1 -> 43 | B43: JUSTIN CARSON | C43: TP | D43: 0.49583333333333335
A44: =A43+1 -> 44 | B44: BRANDON FIX | C44: SAN PASQUAL | D44: 0.49652777777777773
A45: =A44+1 -> 45 | B45: JON KELLEHER | C45: VHS | D45: 0.49791666666666662
A46: =A45+1 -> 46 | B46: KEVIN YANG | C46: TP | D46: 0.49791666666666662
A47: =A46+1 -> 47 | B47: CHRIS PATTERS | C47: EL CAMINO | D47: 0.49861111111111112
A48: =A47+1 -> 48 | B48: TRENT EASON | C48: EL CAMINO | D48: 0.49861111111111112
A49: =A48+1 -> 49 | B49: ELLIOT BENEDICT-PHILIPP | C49: PHHS | D49: 0.4993055555555555
A50: =A49+1 -> 50 | B50: JACOBSSEN | C50: RBV | D50: 0.5
A51: =A50+1 -> 51 | B51: BRIAN DANQUE | C51: SAN PASQUAL | D51: 0.50069444444444444
A52: =A51+1 -> 52 | B52: MONROE | C52: POWAY | D52: 0.50138888888888888
A53: =A52+1 -> 53 | B53: NAVRESKY | C53: POWAY | D53: 0.50208333333333333
A54: =A53+1 -> 54 | B54: KRAGEN | C54: RBV | D54: 0.50277777777777777
A55: =A54+1 -> 55 | B55: EDWIN GONZALEZ | C55: EL CAMINO | D55: 0.50416666666666665
A56: =A55+1 -> 56 | B56: HYMAS | C56: POWAY | D56: 0.50555555555555554
A57: =A56+1 -> 57 | B57: RYAN GRENDA | C57: VHS | D57: 0.50555555555555554
A58: =A57+1 -> 58 | B58: ZACH PERRY | C58: PHHS | D58: 0.50694444444444442
A59: =A58+1 -> 59 | B59: NINTEMAN JJ | C59: WH | D59: 0.50763888888888886
A60: =A59+1 -> 60 | B60: JOE HUNTER | C60: RB | D60: 0.50763888888888886
A61: =A60+1 -> 61 | B61: SO ADACHI | C61: RB | D61: 0.51041666666666663
A62: =A61+1 -> 62 | B62: JOSH GILL | C62: RB | D62: 0.51249999999999996
A63: =A62+1 -> 63 | B63: LUCAS MEZA | C63: EL CAMINO | D63: 0.51249999999999996
A64: =A63+1 -> 64 | B64: JOSUE AVENDANO | C64: EL CAMINO | D64: 0.5131944444444444
A65: =A64+1 -> 65 | B65: KOCI | C65: WH | D65: 0.51388888888888895
A66: =A65+1 -> 66 | B66: JEFFREY TSAO | C66: TP | D66: 0.51458333333333328
A67: =A66+1 -> 67 | B67: SEAN CLIFFORD | C67: VHS | D67: 0.51527777777777783
A68: =A67+1 -> 68 | B68: STEVEN WANCEWICZ | C68: RB | D68: 0.51527777777777783
A69: =A68+1 -> 69 | B69: NINTEMN M | C69: WH | D69: 0.51527777777777783
A70: =A69+1 -> 70 | B70: DONNELLAN | C70: WH | D70: 0.51597222222222217
A71: =A70+1 -> 71 | B71: BOBBY BEDFORD | C71: VHS | D71: 0.51666666666666672
A72: =A71+1 -> 72 | B72: WILL SOMERVELL | C72: RB | D72: 0.51736111111111105
A73: =A72+1 -> 73 | B73: WHIPS | C73: WH | D73: 0.51875000000000004
A74: =A73+1 -> 74 | B74: MATOKI NAKAMAN | C74: TP | D74: 0.51875000000000004
A75: =A74+1 -> 75 | B75: YI WANG | C75: WV | D75: 0.51875000000000004
A76: =A75+1 -> 76 | B76: ALEX ADELSON | C76: RAMONA | D76: 0.51944444444444449
A77: =A76+1 -> 77 | B77: NIC PEW | C77: SAN PASQUAL | D77: 0.52083333333333337
A78: =A77+1 -> 78 | B78: LUKE PEW | C78: SAN PASQUAL | D78: 0.52152777777777781
A79: =A78+1 -> 79 | B79: SKYLER KATE | C79: PHHS | D79: 0.52152777777777781
A80: =A79+1 -> 80 | B80: JOE CONNOLLY | C80: MC | D80: 0.52222222222222225
A81: =A80+1 -> 81 | B81: COREY BRENNAN | C81: VHS | D81: 0.52361111111111114
A82: =A81+1 -> 82 | B82: BRIAN ALFORD | C82: TP | D82: 0.52638888888888891
A83: =A82+1 -> 83 | B83: MAGNER | C83: WH | D83: 0.52708333333333335
A84: =A83+1 -> 84 | B84: JUSTIN THORNBER | C84: PHHS | D84: 0.52708333333333335
A85: =A84+1 -> 85 | B85: STEVEN STERRETT | C85: MC | D85: 0.52777777777777779
A86: =A85+1 -> 86 | B86: PIERCE | C86: WH | D86: 0.52847222222222223
A87: =A86+1 -> 87 | B87: JUSTIN KINSTLE | C87: RAMONA | D87: 0.52916666666666667
A88: =A87+1 -> 88 | B88: ALEX BESSER | C88: TP | D88: 0.52986111111111112
A89: =A88+1 -> 89 | B89: MARK HARDEE | C89: TP | D89: 0.52986111111111112
A90: =A89+1 -> 90 | B90: CHRIS RANGER | C90: PHHS | D90: 0.53055555555555556
A91: =A90+1 -> 91 | B91: AARON BERCOVITCH | C91: RB | D91: 0.53263888888888888
A92: =A91+1 -> 92 | B92: JUSTIN COOK | C92: PHHS | D92: 0.53333333333333333
A93: =A92+1 -> 93 | B93: CHRIS EGGETT | C93: PHHS | D93: 0.53402777777777777
A94: =A93+1 -> 94 | B94: KYLE CUADAL | C94: PHHS | D94: 0.53402777777777777
A95: =A94+1 -> 95 | B95: MADDEN | C95: RBV | D95: 0.53472222222222221
A96: =A95+1 -> 96 | B96: TROY EDWARDS | C96: LCC | D96: 0.53472222222222221
A97: =A96+1 -> 97 | B97: PETER BENITO | C97: RB | D97: 0.53472222222222221
A98: =A97+1 -> 98 | B98: BRENT EDMUNDS | C98: TP | D98: 0.53611111111111109
A99: =A98+1 -> 99 | B99: JULIAN BLASEO | C99: TP | D99: 0.53680555555555554
A100: =A99+1 -> 100 | B100: RIVERA | C100: WH | D100: 0.53819444444444442
A101: =A100+1 -> 101 | B101: RANDY STUCK | C101: PHHS | D101: 0.53888888888888886
A102: =A101+1 -> 102 | B102: EDWARD MACGREGOR | C102: MC | D102: 0.54027777777777775
A103: =A102+1 -> 103 | B103: COLLIN SKOUSEN | C103: TP | D103: 0.54097222222222219
A104: =A103+1 -> 104 | B104: BRANDON LAVORGNA | C104: RB | D104: 0.54236111111111118
A105: =A104+1 -> 105 | B105: DOUG THORNBER | C105: PHHS | D105: 0.54305555555555551
A106: =A105+1 -> 106 | B106: ALLEN ZARIFIAN | C106: LCC | D106: 0.54374999999999996
A107: =A106+1 -> 107 | B107: JOSH SOMACK | C107: TP | D107: 0.5444444444444444
A108: =A107+1 -> 108 | B108: JUSTIN HERMAN | C108: SAN PASQUAL | D108: 0.54513888888888895
A109: =A108+1 -> 109 | B109: BRYANT URRY | C109: SAN PASQUAL | D109: 0.54583333333333328
A110: =A109+1 -> 110 | B110: CARLOS BAZAN | C110: PHHS | D110: 0.54583333333333328
A111: =A110+1 -> 111 | B111: CAMERON SEDLAR | C111: PHHS | D111: 0.54722222222222217
A112: =A111+1 -> 112 | B112: HAVTDEGEN | C112: RBV | D112: 0.54861111111111105
A113: =A112+1 -> 113 | B113: JOHN LE | C113: PHHS | D113: 0.5493055555555556
A114: =A113+1 -> 114 | B114: DANNY NELSON | C114: RB | D114: 0.55625000000000002
A115: =A114+1 -> 115 | B115: STUART SLOAN | C115: PHHS | D115: 0.57013888888888886
A116: =A115+1 -> 116 | B116: DANIEL TOSTADO | C116: PHHS | D116: 0.5708333333333333
A117: =A116+1 -> 117 | B117: JOHN QUINN | C117: PHHS | D117: 0.5708333333333333
A118: =A117+1 -> 118 | B118: SCOTT JOHNSTON | C118: SAN PASQUAL | D118: 0.57222222222222219
A119: =A118+1 -> 119 | B119: KRAMER | C119: RBV | D119: 0.57361111111111118
A120: =A119+1 -> 120 | B120: AULT | C120: WH | D120: 0.57499999999999996
A121: =A120+1 -> 121 | B121: MILLER | C121: WH | D121: 0.57499999999999996
A122: =A121+1 -> 122 | B122: RACE UTO | C122: PHHS | D122: 0.57986111111111105
A123: =A122+1 -> 123 | B123: BRENT HARVEY | C123: RB | D123: 0.5805555555555556
A124: =A123+1 -> 124 | B124: SMITH | C124: WH | D124: 0.58194444444444449
A125: =A124+1 -> 125 | B125: GOETZ | C125: WH | D125: 0.58263888888888882
A126: =A125+1 -> 126 | B126: CARRILLO | C126: RBV | D126: 0.58402777777777781
A127: =A126+1 -> 127 | B127: ROBERT KLAP | C127: PHHS | D127: 0.58611111111111114
A128: =A127+1 -> 128 | B128: CORY ORLANSKY | C128: WV | D128: 0.58750000000000002
A129: =A128+1 -> 129 | B129: KEVIN CARRY | C129: PHHS | D129: 0.59166666666666667
A130: =A129+1 -> 130 | B130: BRETT RAMIN | C130: RB | D130: 0.59375
A131: =A130+1 -> 131 | B131: ZACH HOFFMAN | C131: PHHS | D131: 0.59722222222222221
A132: =A131+1 -> 132 | B132: KHOSHNAU | C132: WH | D132: 0.59861111111111109
A133: =A132+1 -> 133 | B133: ADAM HOWARD | C133: TP | D133: 0.6020833333333333
A134: =A133+1 -> 134 | B134: HAIDANG NGUYEN | C134: WV | D134: 0.60624999999999996
A135: =A134+1 -> 135 | B135: JEFFREY GUTHRIE | C135: MC | D135: 0.63124999999999998
A136: =A135+1 -> 136 | B136: AUDRIAN SANTOS | C136: WH | D136: 0.65763888888888888
A137: =A136+1 -> 137 | B137: ERIC LANDRUM | C137: SAN PASQUAL | D137: 0.68472222222222223

A1: 1 | B1: CAROLYN ALLEN | C1: MC | D1: 0.52986111111111112
A2: 2 | B2: KIM ANDREW | C2: TP | D2: 0.54305555555555551
A3: 3 | B3: KERRY SIMMONDS | C3: TP | D3: 0.55069444444444449
A4: 4 | B4: HANNAH PILKINGTON | C4: LCC | D4: 0.55486111111111114
A5: 5 | B5: BLAIR WILLIAMS | C5: TP | D5: 0.55694444444444446
A6: 6 | B6: BECKY ROLPH | C6: TP | D6: 0.55833333333333335
A7: 7 | B7: LAURA GONZALES | C7: MC | D7: 0.56041666666666667
A8: 8 | B8: SARAH GILL | C8: TP | D8: 1328
A9: 9 | B9: KATRINA TOLL | C9: RAM | D9: 0.56111111111111112
A10: 10 | B10: LORENA ZEPPILLI | C10: EL CAM | D10: 0.56180555555555556
A11: 11 | B11: SHARA DARR | C11: TP | D11: 0.56180555555555556
A12: 12 | B12: R. MCCORD | C12: WV | D12: 0.56736111111111109
A13: 13 | B13: KYLIE COOK | C13: RAM | D13: 0.56874999999999998
A14: 14 | B14: WOOD | C14: POW | D14: 0.56944444444444442
A15: 15 | B15: H. MCCORD | C15: WV | D15: 0.57222222222222219
A16: 16 | B16: LAURYN SHERMAN | C16: TP | D16: 0.57499999999999996
A17: 17 | B17: MELISSA KLEINBERG | C17: VISTA | D17: 0.5756944444444444
A18: 18 | B18: NABOR | C18: POW | D18: 0.5854166666666667
A19: 19 | B19: MEGHIE TABOR | C19: RB | D19: 0.58680555555555558
A20: 20 | B20: RITZMAN | C20: WV | D20: 0.58888888888888891
A21: 21 | B21: REI AYALA | C21: RB | D21: 0.58958333333333335
A22: 22 | B22: ANA CASTILLO | C22: VISTA | D22: 0.59305555555555556
A23: 23 | B23: J. URBAN | C23: WH | D23: 0.59583333333333333
A24: 24 | B24: JESSICA WALTERS | C24: LCC | D24: 0.59722222222222221
A25: 25 | B25: GABY FIERRO | C25: SP | D25: 0.59791666666666665
A26: 26 | B26: SCHWARTZ | C26: WV | D26: 0.60069444444444442
A27: 27 | B27: EMILY BOTT | C27: EL CAM | D27: 0.6069444444444444
A28: 28 | B28: L. HERRINGTON | C28: WH | D28: 0.60763888888888884
A29: 29 | B29: T. BOWNE | C29: WH | D29: 0.61250000000000004
A30: 30 | B30: E. KOUI | C30: WH | D30: 0.61250000000000004
A31: 31 | B31: CAITLIN FARNSWORTH | C31: LCC | D31: 0.61597222222222225
A32: 32 | B32: WETMORE | C32: POW | D32: 0.6166666666666667
A33: 33 | B33: LINDSAY SERHAN | C33: RB | D33: 0.62152777777777779
A34: 34 | B34: DANIELLE MARTIN | C34: TP | D34: 0.62222222222222223
A35: 35 | B35: JACQUELINE COLLINS | C35: LCC | D35: 0.62291666666666667
A36: 36 | B36: ELYCIA NELSON | C36: LCC | D36: 0.62638888888888888
A37: 37 | B37: HAI JING ZHANG | C37: RB | D37: 0.62708333333333333
A38: 38 | B38: JESSICA MIKHAIL | C38: RB | D38: 0.62777777777777777
A39: 39 | B39: N. CAMON | C39: WH | D39: 0.62847222222222221
A40: 40 | B40: ERICA SCHOTT | C40: LCC | D40: 0.62986111111111109
A41: 41 | B41: AHIZA GARCIA | C41: EL CAM | D41: 0.63124999999999998
A42: 42 | B42: KRISTINE MCKINNEY | C42: EL CAM | D42: 0.63194444444444442
A43: 43 | B43: OGDEN | C43: POW | D43: 0.63263888888888886
A44: 44 | B44: B. HOUCK | C44: WH | D44: 0.63749999999999996
A45: 45 | B45: B. LACHUSA | C45: WH | D45: 0.6381944444444444
A46: 46 | B46: KATIE THOMPSON | C46: LCC | D46: 0.63888888888888884
A47: 47 | B47: BONNIE BRIERTON | C47: RAM | D47: 0.63888888888888884
A48: 48 | B48: KANDACE YAKUTA | C48: MC | D48: 0.63958333333333328
A49: 49 | B49: ALEXIS BASALDU | C49: EL CAM | D49: 0.64097222222222228
A50: 50 | B50: REBEKAH LOGAN | C50: MC | D50: 0.64166666666666672
A51: 51 | B51: LANGFORD | C51: WH | D51: 0.6430555555555556
A52: 52 | B52: S. HENDRIX | C52: WH | D52: 0.64513888888888893
A53: 53 | B53: JAIME SECRIST | C53: MC | D53: 0.64722222222222225
A54: 54 | B54: RACHEL ROSS | C54: TP | D54: 0.6479166666666667
A55: 55 | B55: ADDY ROBERTS | C55: LCC | D55: 00.65
A56: 56 | B56: ALAINA KICKENS | C56: EL CAM | D56: 0.65138888888888891
A57: 57 | B57: LINN NGUYEN | C57: EL CAM | D57: 0.65277777777777779
A58: 58 | B58: ANA VEGA | C58: RB | D58: 0.65347222222222223
A59: 59 | B59: MELISSA COYLE | C59: RB | D59: 0.65486111111111112
A60: 60 | B60: KATY BENITO | C60: RB | D60: 0.66319444444444442
A61: 61 | B61: K. WILSON | C61: WH | D61: 0.67847222222222225
A62: 62 | B62: M SHEETS | C62: WH | D62: 0.6791666666666667
A63: 63 | B63: KOHE DICKENS | C63: EL CAM | D63: 0.68263888888888891
A64: 64 | B64: A. LUDLOW | C64: WH | D64: 0.68611111111111112
A65: 65 | B65: HALLIE SCHMIENDENBERA | C65: TP | D65: 0.70277777777777772
A66: 66 | B66: MELANIE KUCHARSKI | C66: PH | D66: 0.70277777777777772
A67: 67 | B67: EMILY ELKIND | C67: LCC | D67: 0.72013888888888888
A68: 68 | B68: ROYA BARHAGHI | C68: LCC | D68: 0.75277777777777777
A69: 69 | B69: VICTORIA EWING | C69: PH | D69: 0.75416666666666665
A70: 70 | B70: CHRISTINE GARDNER | C70: EL CAM | D70: 0.82291666666666663

A1: 1 | B1: JEREE HENRY | C1: RBV | D1: 0.40486111111111112
A2: 2 | B2: COLTON TULLY-DOYLE | C2: RB | D2: 0.40694444444444444
A3: 3 | B3: CARL DARGITZ | C3: RB | D3: 0.40763888888888888
A4: 4 | B4: MARK THOMAS | C4: POW | D4: 0.40833333333333333
A5: 5 | B5: JESSE O'BRIEN | C5: SAN PAS | D5: 0.40833333333333333
A6: 6 | B6: D. GONIA | C6: WEST HILLS | D6: 0.41041666666666665
A7: 7 | B7: ZACK PARIS | C7: TORREY | D7: 0.41180555555555554
A8: 8 | B8: SCOTT TEKESKY | C8: POW | D8: 0.41319444444444442
A9: 9 | B9: TRISON CORSON | C9: RAM. | D9: 0.41388888888888886
A10: 10 | B10: DAVID EDWARDS | C10: POW | D10: 0.4152777777777778
A11: 11 | B11: MICHAEL ST.LAURENT | C11: EL CAM. | D11: 0.41736111111111113
A12: 12 | B12: GREGOR LLOYD-SMITH | C12: TORREY | D12: 0.41736111111111113
A13: 13 | B13: DAVID WESTON | C13: SAN PAS. | D13: 0.41875000000000001
A14: 14 | B14: RYAN BAIRD | C14: SAN PAS. | D14: 0.42152777777777778
A15: 15 | B15: DEAN MANLEY | C15: RAM | D15: 0.42222222222222222
A16: 16 | B16: JAMES SMITH | C16: RAM | D16: 0.42222222222222222
A17: 17 | B17: PATRICK SHEEHAN | C17: SAN PAS. | D17: 0.42291666666666666
A18: 18 | B18: TY HINES | C18: SAN PAS | D18: 0.42430555555555555
A19: 19 | B19: BRIAN CONNER | C19: TORREY | D19: 0.42499999999999999
A20: 20 | B20: TOM HAMILTON | C20: LCC | D20: 0.42638888888888887
A21: 21 | B21: DAN ILLINGSWORTH | C21: TORREY | D21: 0.42708333333333331
A22: 22 | B22: RYAN MURPHY | C22: MT. CARM | D22: 0.42777777777777776
A23: 23 | B23: JARED FENLASON | C23: RB | D23: 0.42777777777777776
A24: 24 | B24: DAVID HERNANDEZ | C24: EL CAM | D24: 0.42916666666666664
A25: 25 | B25: SMITH | C25: POW | D25: 0.42986111111111114
A26: 26 | B26: RILEY ONEAL | C26: PAT HEN. | D26: 0.43055555555555558
A27: 27 | B27: JOHN MENDES | C27: PAT HEN | D27: 0.43472222222222223
A28: 28 | B28: BRYCE HOLEWINSKI | C28: RB | D28: 0.43541666666666667
A29: 29 | B29: JOSH OSBORNE | C29: EL CAM | D29: 0.43541666666666667
A30: 30 | B30: MONROE | C30: RBV | D30: 0.43611111111111112
A31: 31 | B31: GILSON | C31: POW | D31: 0.4375
A32: 32 | B32: GIOVANNI MORENO | C32: RAM | D32: 0.43888888888888888
A33: 33 | B33: SEAN PROEHL | C33: RB | D33: 0.44027777777777777
A34: 34 | B34: CRAIG LOVE | C34: MT. CARM | D34: 0.44097222222222221
A35: 35 | B35: ESTRADA | C35: RBV | D35: 0.44097222222222221
A36: 36 | B36: HUNTER | C36: RBV | D36: 0.44236111111111109
A37: 37 | B37: RYAN BUTLER | C37: SAN PAS | D37: 0.44305555555555554
A38: 38 | B38: ALBARRAN | C38: RBV | D38: 0.44305555555555554
A39: 39 | B39: DREW FLOOD | C39: RB | D39: 0.44305555555555554
A40: 40 | B40: ADRIAN HAYWAS | C40: EL CAM | D40: 0.44374999999999998
A41: 41 | B41: CARICATO | C41: WEST HILLS | D41: 0.44374999999999998
A42: 42 | B42: SHEA BEHWY | C42: PAT HENRY | D42: 0.44513888888888886
A43: 43 | B43: DESTEFANO | C43: RBV | D43: 0.44791666666666669
A44: 44 | B44: DOLAN | C44: WEST HILLS | D44: 00.45
A45: 45 | B45: TOMMY CAVANAUGH | C45: SAN PAS | D45: 0.4513888888888889
A46: 46 | B46: CHRIS NOREN | C46: RB | D46: 0.4513888888888889
A47: 47 | B47: ROOT | C47: WEST HILLS | D47: 0.45347222222222222
A48: 48 | B48: CHRIS SCHWEIHS | C48: PAT HEN. | D48: 0.45347222222222222
A49: 49 | B49: MIKE LOPEZ | C49: WESTVIEW | D49: 0.45555555555555555
A50: 50 | B50: COSTNER MCINTOSH | C50: PAT HEN. | D50: 0.45555555555555555
A51: 51 | B51: DEAN GUZMAN | C51: EL CAM | D51: 0.45555555555555555
A52: 52 | B52: RYAN WILLIS | C52: TORREY | D52: 0.45763888888888887
A53: 53 | B53: DUSTIN DIVEN | C53: RAM | D53: 0.45902777777777776
A54: 54 | B54: RYAN KNOWLES | C54: WESTVIEW | D54: 0.45902777777777776
A55: 55 | B55: BLAED DEUEL | C55: RAM | D55: 0.45902777777777776
A56: 56 | B56: EVAN BROWN | C56: RAM | D56: 0.4597222222222222
A57: 57 | B57: MOUREY | C57: POW | D57: 0.4597222222222222
A58: 58 | B58: SHANE SKELLY | C58: LCC | D58: 0.46041666666666664
A59: 59 | B59: MILLER | C59: RBV | D59: 0.46111111111111114
A60: 60 | B60: PAT SILVA | C60: WESTVIEW | D60: 0.46527777777777779
A61: 61 | B61: SAM CLATOR | C61: WESTVIEW | D61: 0.46597222222222223
A62: 62 | B62: SIMMONDS | C62: WEST HILLS | D62: 0.46597222222222223
A63: 63 | B63: MICHAEL NGUYEN | C63: PAT HEN. | D63: 0.46666666666666667
A64: 64 | B64: JON BLUE | C64: MT. CARM | D64: 0.46805555555555556
A65: 65 | B65: DANA WALTERS | C65: LCC | D65: 0.46944444444444444
A66: 66 | B66: DOMINIC RENTZ | C66: MC | D66: 0.47013888888888888
A67: 67 | B67: KODY PORTERFIELD | C67: LCC | D67: 0.47291666666666665
A68: 68 | B68: MITCH COOGAN | C68: LCC | D68: 0.47291666666666665
A69: 69 | B69: RUDOLPH | C69: POW | D69: 0.47499999999999998
A70: 70 | B70: PAT CONWAY | C70: WESTVIEW | D70: 0.47569444444444442
A71: 71 | B71: KO WAKABAYASHI | C71: WESTVIEW | D71: 0.47569444444444442
A72: 72 | B72: JOSEPH GARDELLA | C72: PAT HEN. | D72: 0.4777777777777778
A73: 73 | B73: GRANT HINEHART | C73: LCC | D73: 0.47847222222222224
A74: 74 | B74: TREVOR WATKINS | C74: WESTVIEW | D74: 0.48194444444444445
A75: 75 | B75: BRIAN HUFF | C75: TORREY | D75: 0.48194444444444445
A76: 76 | B76: PATRICK HARRIGAN | C76: TORREY | D76: 0.4826388888888889
A77: 77 | B77: BRYAN DWORBSKY | C77: TORREY | D77: 0.49027777777777776
A78: 78 | B78: TREVOR COUNTRYMAN | C78: TORREY | D78: 0.4909722222222222
A79: 79 | B79: DAVID MCEACHERN | C79: MC | D79: 0.49166666666666664
A80: 80 | B80: DEZA MARTIN | C80: LCC | D80: 0.49305555555555558
A81: 81 | B81: ANDREW HALL | C81: WESTVIEW | D81: 0.50208333333333333
A82: 82 | B82: STEPHAN ABDO | C82: TORREY | D82: 0.50347222222222221
A83: 83 | B83: ALEX BRAY | C83: TORREY | D83: 0.51875000000000004

A1: 1 | B1: James, Christy | C1: El Cap | D1: 0.49027777777777781
A2: 2 | B2: Reinagel, Jenny | C2: CCHS | D2: 0.4909722222222222
A3: 3 | B3: Coon, Aisha | C3: MMHS | D3: 0.50347222222222221
A4: 4 | B4: Bawkey, Mallory | C4: El Cap | D4: 0.50624999999999998
A5: 5 | B5: Pishel, Lauren | C5: LJCD | D5: 0.50902777777777775
A6: 6 | B6: Christy, Valerie | C6: LJCD | D6: 0.51111111111111118
A7: 7 | B7: Cook, Stephanie | C7: El Cap | D7: 0.51249999999999996
A8: 8 | B8: Martin, Katie | C8: El Cap | D8: 0.51597222222222217
A9: 9 | B9: Christopher, Jaclyn | C9: Santa Fe Christian | D9: 0.51597222222222217
A10: 10 | B10: Dalton, Michelle | C10: Valhalla | D10: 0.51666666666666672
A11: 11 | B11: Sandoval, Jessica | C11: Oceanside | D11: 0.52361111111111114
A12: 12 | B12: Scheppmann, Sablle | C12: Grossmont | D12: 0.52638888888888891
A13: 13 | B13: Tillery, Ashley | C13: El Cap | D13: 0.53194444444444444
A14: 14 | B14: Zambon, Erica | C14: Carlsbad | D14: 0.53402777777777777
A15: 15 | B15: Moore, Kirsten | C15: Carlsbad | D15: 0.53680555555555554
A16: 16 | B16: Bowman, Onesa | C16: San Dimas | D16: 0.53749999999999998
A17: 17 | B17: Justice, Hana | C17: LJCD | D17: 0.53888888888888886
A18: 18 | B18: Urquidi, Kayla | C18: MHHS | D18: 0.5395833333333333
A19: 19 | B19: Drake, Lindsay | C19: CCHS | D19: 0.54236111111111118
A20: 20 | B20: Ferguson, Jamie | C20: El Cap | D20: 0.54374999999999996
A21: 21 | B21: Kading, Tarah | C21: Santa Fe Christian | D21: 0.54583333333333328
A22: 22 | B22: Cavallier, Jenny | C22: CCHS | D22: 0.54583333333333328
A23: 23 | B23: Garcia | C23: SDA | D23: 0.54791666666666672
A24: 24 | B24: Bastillos, Jen | C24: San Dimas | D24: 00.55
A25: 25 | B25: Muir, Breanna | C25: LJCD | D25: 0.55208333333333337
A26: 26 | B26: Thorsell, Erin | C26: Santa Fe Christian | D26: 0.5541666666666667
A27: 27 | B27: Presar, Alexa | C27: CCHS | D27: 0.55486111111111114
A28: 28 | B28: Raple, Rachel | C28: Carlsbad | D28: 0.55694444444444446
A29: 29 | B29: Laine, Sarah | C29: Valhalla | D29: 0.56458333333333333
A30: 30 | B30: Oertle, Laargn | C30: Carlsbad | D30: 0.56666666666666665
A31: 31 | B31: Milisic, Lexis | C31: Grossmont | D31: 0.56874999999999998
A32: 32 | B32: VanUranken | C32: SDA | D32: 0.56874999999999998
A33: 33 | B33: Thorkelson, Kelsey | C33: MHHS | D33: 0.56874999999999998
A34: 34 | B34: Ward, Bailey | C34: MHHS | D34: 0.56944444444444442
A35: 35 | B35: Truxton, Maureen | C35: CCHS | D35: 0.57013888888888886
A36: 36 | B36: Weber, Ashley | C36: MHHS | D36: 0.5708333333333333
A37: 37 | B37: Rodriguez, Danielle | C37: San Dimas | D37: 0.5708333333333333
A38: 38 | B38: Armstrong, A. | C38: SDA | D38: 0.57430555555555551
A39: 39 | B39: Minor, Carly | C39: Grossmont | D39: 0.57499999999999996
A40: 40 | B40: Tucker, Amanda | C40: MHHS | D40: 0.57499999999999996
A41: 41 | B41: Elliot, Kelly | C41: Carlsbad | D41: 0.57847222222222217
A42: 42 | B42: Ferrarotti, C. | C42: SDA | D42: 0.57916666666666672
A43: 43 | B43: Leary, Talissa | C43: Grossmont | D43: 0.57916666666666672
A44: 44 | B44: Binderow, Sasha | C44: LJCD | D44: 0.5805555555555556
A45: 45 | B45: Sebeny, Roxanne | C45: Valhalla | D45: 0.58125000000000004
A46: 46 | B46: Prevost, Kim | C46: Mira Mesa | D46: 0.58125000000000004
A47: 47 | B47: Reiner, Megan | C47: Carlsbad | D47: 0.58194444444444449
A48: 48 | B48: Labriola, Nicole | C48: Santana | D48: 0.58611111111111114
A49: 49 | B49: Bennet | C49: Grossmont | D49: 0.58750000000000002
A50: 50 | B50: Paulson, Sarah | C50: Santana | D50: 0.58750000000000002
A51: 51 | B51: Dragus, Kelsey | C51: San Dimas | D51: 0.58888888888888891
A52: 52 | B52: Gomez, May | C52: San Dimas | D52: 0.59097222222222223
A53: 53 | B53: Roland, Alissa | C53: Grossmont | D53: 0.59375
A54: 54 | B54: More, Hannah | C54: MHHS | D54: 0.59444444444444444
A55: 55 | B55: Rojas, Sylvia | C55: CCHS | D55: 0.59513888888888888
A56: 56 | B56: Morrison, Tori | C56: CCHS | D56: 0.59583333333333333
A57: 57 | B57: Junnarkar, Jasmine | C57: LJCD | D57: 0.59652777777777777
A58: 58 | B58: Allison, Elizabeth | C58: Santa Fe Christian | D58: 0.59722222222222221
A59: 59 | B59: Scherer | C59: SDA | D59: 0.60138888888888886
A60: 60 | B60: Gonzalez, Janessa | C60: San Dimas | D60: 0.60416666666666663
A61: 61 | B61: Saake, Chelsea | C61: Valhalla | D61: 0.60416666666666663
A62: 62 | B62: Carlton, Lauren | C62: Valhalla | D62: 0.60486111111111118
A63: 63 | B63: Brown, Krislen | C63: MHHS | D63: 0.60486111111111118
A64: 64 | B64: Searl, Julia | C64: Santa Fe Christian | D64: 0.60555555555555551
A65: 65 | B65: Abbott, Ariel | C65: LJCD | D65: 0.60624999999999996
A66: 66 | B66: Parek, Katie | C66: Escondido Charter | D66: 0.60763888888888895
A67: 67 | B67: Van Dyne, Cassandra | C67: Grossmont | D67: 0.60833333333333328
A68: 68 | B68: Gilbreath, Jenny | C68: CCHS | D68: 0.61041666666666672
A69: 69 | B69: Weisenberger, Brooke | C69: Santa Fe Christian | D69: 0.61527777777777781
A70: 70 | B70: Basham, Nicole | C70: Mira Mesa | D70: 0.61875000000000002
A71: 71 | B71: Bennett, Sara | C71: Santa Fe Christian | D71: 0.62013888888888891
A72: 72 | B72: Homer, Kate | C72: Santa Fe Christian | D72: 0.62847222222222221
A73: 73 | B73: Duhamel, Chantel | C73: Santa Fe Christian | D73: 0.62986111111111109
A74: 74 | B74: Pollock | C74: SDA | D74: 0.65763888888888888
A75: 75 | B75: Salas | C75: SDA | D75: 0.66180555555555554
A76: 76 | B76: Casterline | C76: SDA | D76: 0.68125000000000002
A77: 77 | B77: Gilje, Emily | C77: Santana | D77: 0.68819444444444444
A78: 78 | B78: Ellingsen | C78: SDA | D78: 0.7284722222222223
A79: 79 | B79: White, Jessica | C79: San Dimas | D79: NT

A1: 1 | B1: MILES SEGNI | C1: EL CAP | D1: 0.45902777777777781
A2: =A1+1 -> 2 | B2: MARCO RAMIREZ | C2: GPA | D2: 0.47499999999999998
A3: =A2+1 -> 3 | B3: ISHMAEL ARMENTA | C3: GPA | D3: 0.4770833333333333
A4: =A3+1 -> 4 | B4: JEFF SUCHIL | C4: GHS | D4: 0.47986111111111113
A5: =A4+1 -> 5 | B5: MICHAEL ORTEGA | C5: EL CAP | D5: 0.48125000000000001
A6: =A5+1 -> 6 | B6: GEOFF AINSIE | C6: SDA | D6: 0.48125000000000001
A7: =A6+1 -> 7 | B7: STILLINGER | C7: SDA | D7: 0.48541666666666666
A8: =A7+1 -> 8 | B8: TOM GYBEN | C8: CCHS | D8: 0.4861111111111111
A9: =A8+1 -> 9 | B9: DYLAN MORRISON | C9: VALHALLA | D9: 0.4861111111111111
A10: =A9+1 -> 10 | B10: MATTHEW CURNOW | C10: MHHS | D10: 0.49027777777777781
A11: =A10+1 -> 11 | B11: RYAN DOHERTY | C11: VALHALLA | D11: 0.4909722222222222
A12: =A11+1 -> 12 | B12: CHRISTOPHER ROBERTS | C12: VALHALLA | D12: 0.49236111111111108
A13: =A12+1 -> 13 | B13: WILL FORTINI | C13: SDA | D13: 0.49444444444444446
A14: =A13+1 -> 14 | B14: TIM BISHOP | C14: EL CAP | D14: 0.49444444444444446
A15: =A14+1 -> 15 | B15: MIKE DEVAN | C15: EL CAP | D15: 0.49513888888888885
A16: =A15+1 -> 16 | B16: JEFF NAIR | C16: MHHS | D16: 0.49513888888888885
A17: =A16+1 -> 17 | B17: MIGUEL ENRIQUEZ | C17: OCEANSIDE | D17: 0.49652777777777773
A18: =A17+1 -> 18 | B18: LUCAS KEMPER | C18: VALHALLA | D18: 0.49722222222222223
A19: =A18+1 -> 19 | B19: NICK BEROSIAN | C19: EL CAP | D19: 0.49791666666666662
A20: =A19+1 -> 20 | B20: MAX ROBERTSON | C20: VALHALLA | D20: 0.49791666666666662
A21: =A20+1 -> 21 | B21: ADAM STEINERT | C21: VALHALLA | D21: 0.49861111111111112
A22: =A21+1 -> 22 | B22: SEAN LETTS | C22: CARLSBAD | D22: 0.5
A23: =A22+1 -> 23 | B23: CASPER JAKOBSEN | C23: CARLSBAD | D23: 0.50138888888888888
A24: =A23+1 -> 24 | B24: CHRIS WENDLE | C24: EL CAP | D24: 0.50277777777777777
A25: =A24+1 -> 25 | B25: JOSH SETTLES | C25: CARLSBAD | D25: 0.50347222222222221
A26: =A25+1 -> 26 | B26: MAX BERWALD | C26: CARLSBAD | D26: 0.50347222222222221
A27: =A26+1 -> 27 | B27: CAMERON PERTERSEN | C27: VALHALLA | D27: 0.50347222222222221
A28: =A27+1 -> 28 | B28: DANIEL CLARK | C28: CARLSBAD | D28: 0.50555555555555554
A29: =A28+1 -> 29 | B29: JUSTIN ARCHULETTA | C29: EL CAP | D29: 0.5083333333333333
A30: =A29+1 -> 30 | B30: ERIC GARCIA | C30: EL CAP | D30: 0.50902777777777775
A31: =A30+1 -> 31 | B31: IAN ARROYO-AVILLA | C31: GPA | D31: 0.50972222222222219
A32: =A31+1 -> 32 | B32: LUKE MIDDLEBROOK | C32: EL CAP | D32: 0.51041666666666663
A33: =A32+1 -> 33 | B33: PARRY THORTON | C33: GHS | D33: 0.51111111111111118
A34: =A33+1 -> 34 | B34: KYLE BAREFIELD | C34: VALHALLA | D34: 0.51180555555555551
A35: =A34+1 -> 35 | B35: KEITH MADSEN | C35: MIRA MESA | D35: 0.5131944444444444
A36: =A35+1 -> 36 | B36: ANDREW COCHRAN | C36: CARLSBAD | D36: 0.51458333333333328
A37: =A36+1 -> 37 | B37: JOHN KRANZ | C37: GPA | D37: 0.51736111111111105
A38: =A37+1 -> 38 | B38: GREVE | C38: SDA | D38: 0.51736111111111105
A39: =A38+1 -> 39 | B39: PATRICK HEARST | C39: CCHS | D39: 0.51875000000000004
A40: =A39+1 -> 40 | B40: MATTHEW HURRELL | C40: VALHALLA | D40: 0.51875000000000004
A41: =A40+1 -> 41 | B41: ZACK PENNOCK | C41: MHHS | D41: 0.5229166666666667
A42: =A41+1 -> 42 | B42: RICHARD ZEPEDA | C42: EL CAP | D42: 0.52569444444444446
A43: =A42+1 -> 43 | B43: TAYLOR ANDERSON | C43: EL CAP | D43: 0.52569444444444446
A44: =A43+1 -> 44 | B44: NICK BAXTER | C44: VALHALLA | D44: 0.52708333333333335
A45: =A44+1 -> 45 | B45: DANNY STEFFY | C45: CARLSBAD | D45: 0.52708333333333335
A46: =A45+1 -> 46 | B46: RYAN BARRY | C46: CCHS | D46: 0.52847222222222223
A47: =A46+1 -> 47 | B47: ERIC HOLTHAUF | C47: MHHS | D47: 0.52847222222222223
A48: =A47+1 -> 48 | B48: STEPHEN WETHERELL | C48: CCHS | D48: 0.53125
A49: =A48+1 -> 49 | B49: MAX SIEGEL | C49: CCHS | D49: 0.53194444444444444
A50: =A49+1 -> 50 | B50: TYLER GATES | C50: GHS | D50: 0.53680555555555554
A51: =A50+1 -> 51 | B51: AARON LINDAMOOD | C51: SAN MARCOS | D51: 0.53749999999999998
A52: =A51+1 -> 52 | B52: CLIFF FREEMAN | C52: EL CAP | D52: 0.53819444444444442
A53: =A52+1 -> 53 | B53: ANDREW HAYS | C53: SAN MARCOS | D53: 0.53819444444444442
A54: =A53+1 -> 54 | B54: ROWLEY | C54: SDA | D54: 0.53888888888888886
A55: =A54+1 -> 55 | B55: KYLE GRANALI | C55: MIRA MESA | D55: 0.5395833333333333
A56: =A55+1 -> 56 | B56: SPENCER HAMIGA | C56: SAN MARCOS | D56: 0.54027777777777775
A57: =A56+1 -> 57 | B57: MARK RATLEDGE | C57: SAN MARCOS | D57: 0.54027777777777775
A58: =A57+1 -> 58 | B58: BEN COHN | C58: LJCD | D58: 0.54097222222222219
A59: =A58+1 -> 59 | B59: NEREL WINTER | C59: CARLSBAD | D59: 0.54166666666666663
A60: =A59+1 -> 60 | B60: COOK | C60: SDA | D60: 0.54236111111111118
A61: =A60+1 -> 61 | B61: MATT GLIK | C61: CARLSBAD | D61: 0.54374999999999996
A62: =A61+1 -> 62 | B62: TATE HARDESTY | C62: CARLSBAD | D62: 0.5444444444444444
A63: =A62+1 -> 63 | B63: JOHN ABSTO | C63: SAN DIMAS | D63: 0.54722222222222217
A64: =A63+1 -> 64 | B64: JACK DIGGS | C64: GHS | D64: 0.54791666666666672
A65: =A64+1 -> 65 | B65: ARMSTRONG | C65: SDA | D65: 0.54791666666666672
A66: =A65+1 -> 66 | B66: MATT GUERRERO | C66: GHS | D66: 00.55
A67: =A66+1 -> 67 | B67: BARROWS | C67: SDA | D67: 0.55347222222222225
A68: =A67+1 -> 68 | B68: CELIS | C68: SDA | D68: 0.5541666666666667
A69: =A68+1 -> 69 | B69: ESCALERA | C69: SDA | D69: 0.55486111111111114
A70: =A69+1 -> 70 | B70: KOZEL | C70: SDA | D70: 0.55555555555555558
A71: =A70+1 -> 71 | B71: COREY TAYLOR | C71: MHHS | D71: 0.55555555555555558
A72: =A71+1 -> 72 | B72: MICHAEL ELWOOD | C72: CCHS | D72: 0.55555555555555558
A73: =A72+1 -> 73 | B73: BRAD BURTON | C73: MIRA MESA | D73: 0.55625000000000002
A74: =A73+1 -> 74 | B74: TYLER DIEFENBACK | C74: LJCD | D74: 0.55625000000000002
A75: =A74+1 -> 75 | B75: DEVIN WAKEFIELD | C75: VALHALLA | D75: 0.55694444444444446
A76: =A75+1 -> 76 | B76: WILLIAM WOESLE | C76: CCHS | D76: 0.55694444444444446
A77: =A76+1 -> 77 | B77: CHRIS LANGFORD | C77: CCHS | D77: 0.55694444444444446
A78: =A77+1 -> 78 | B78: TRAVIS HAMILTON | C78: VALHALLA | D78: 0.55763888888888891
A79: =A78+1 -> 79 | B79: SAMIR JUNNARKAR | C79: LJCD | D79: 0.55763888888888891
A80: =A79+1 -> 80 | B80: TREVOR BRIGGS | C80: CARLSBAD | D80: 0.55833333333333335
A81: =A80+1 -> 81 | B81: WILLIAM GARTA | C81: LJCD | D81: 0.55833333333333335
A82: =A81+1 -> 82 | B82: JAMES DOCKER | C82: GPA | D82: 0.55972222222222223
A83: =A82+1 -> 83 | B83: MICHAEL HANDY | C83: MHHS | D83: 0.56041666666666667
A84: =A83+1 -> 84 | B84: TYLER HAY | C84: CALVARY CHRISTIAN | D84: 0.5625
A85: =A84+1 -> 85 | B85: CORT AYRES | C85: VALHALLA | D85: 0.56388888888888888
A86: =A85+1 -> 86 | B86: HUBERT HUYNH | C86: MIRA MESA | D86: 0.56388888888888888
A87: =A86+1 -> 87 | B87: JEFF CREIMAN | C87: SAN DIMAS | D87: 0.56527777777777777
A88: =A87+1 -> 88 | B88: TAN HOPP | C88: LJCD | D88: 0.56527777777777777
A89: =A88+1 -> 89 | B89: NARDI BROOKS | C89: CCHS | D89: 0.56666666666666665
A90: =A89+1 -> 90 | B90: BRANDON FOGELMAN | C90: MHHS | D90: 0.56666666666666665
A91: =A90+1 -> 91 | B91: LUCUS WAKELY | C91: SAN DIMAS | D91: 0.56736111111111109
A92: =A91+1 -> 92 | B92: AVIC CARRACINO | C92: CARLSBAD | D92: 0.56805555555555554
A93: =A92+1 -> 93 | B93: GREG SCHMITT | C93: CCHS | D93: 0.56874999999999998
A94: =A93+1 -> 94 | B94: TOMMY KROLL | C94: CCHS | D94: 0.57013888888888886
A95: =A94+1 -> 95 | B95: CERILLO RAFAEL | C95: MHHS | D95: 0.57013888888888886
A96: =A95+1 -> 96 | B96: MATT OLMSTED | C96: GPA | D96: 0.5708333333333333
A97: =A96+1 -> 97 | B97: NATE BALMEDT | C97: CCHS | D97: 0.57222222222222219
A98: =A97+1 -> 98 | B98: KEVIN SPAMPINATO | C98: CARLSBAD | D98: 0.57222222222222219
A99: =A98+1 -> 99 | B99: CALVIN BOICE | C99: CARLSBAD | D99: 0.57291666666666663
A100: =A99+1 -> 100 | B100: ARMAND HARB | C100: LJCD | D100: 0.57291666666666663
A101: =A100+1 -> 101 | B101: ARTHUR CURA | C101: MHHS | D101: 0.57361111111111118
A102: =A101+1 -> 102 | B102: PETER ROMO | C102: GPA | D102: 0.57361111111111118
A103: =A102+1 -> 103 | B103: EDWARD CHIN | C103: MIRA MESA | D103: 0.57361111111111118
A104: =A103+1 -> 104 | B104: RUBEN LEYVA | C104: SAN MARCOS | D104: 0.57430555555555551
A105: =A104+1 -> 105 | B105: BILLY BIXLER | C105: VALHALLA | D105: 0.5756944444444444
A106: =A105+1 -> 106 | B106: TONY ALBERTI | C106: VALHALLA | D106: 0.5756944444444444
A107: =A106+1 -> 107 | B107: EDDY VAISBERG | C107: LJCD | D107: 0.57638888888888895
A108: =A107+1 -> 108 | B108: COOK B | C108: SDA | D108: 0.57847222222222217
A109: =A108+1 -> 109 | B109: JOEL ANDERSON | C109: EL CAP | D109: 0.57986111111111105
A110: =A109+1 -> 110 | B110: SAM MOHAN | C110: SDA | D110: 0.5805555555555556
A111: =A110+1 -> 111 | B111: BRYAN GIPUNER | C111: MIRA MESA | D111: 0.58125000000000004
A112: =A111+1 -> 112 | B112: MATT DEAL | C112: SANTANA | D112: 0.58194444444444449
A113: =A112+1 -> 113 | B113: ASHFORD | C113: SDA | D113: 0.58263888888888882
A114: =A113+1 -> 114 | B114: MARTIN SERNA | C114: SAN DIMAS | D114: 0.58472222222222225
A115: =A114+1 -> 115 | B115: SPENCER WOLCOTT | C115: VALHALLA | D115: 0.58611111111111114
A116: =A115+1 -> 116 | B116: JAMES MILLER | C116: VALHALLA | D116: 0.58680555555555558
A117: =A116+1 -> 117 | B117: TIMMY BUI | C117: MIRA MESA | D117: 0.58680555555555558
A118: =A117+1 -> 118 | B118: LANG NGUYEN | C118: MIRA MESA | D118: 0.59097222222222223
A119: =A118+1 -> 119 | B119: LUCAS PEREZ | C119: VALHALLA | D119: 0.59236111111111112
A120: =A119+1 -> 120 | B120: NICK GUERRERO | C120: GHS | D120: 0.59305555555555556
A121: =A120+1 -> 121 | B121: OWEN LORD | C121: GHS | D121: 0.59375
A122: =A121+1 -> 122 | B122: JOE KLAERICH | C122: SAN MARCOS | D122: 0.59444444444444444
A123: =A122+1 -> 123 | B123: VILLAR MARCO | C123: CCHS | D123: 0.59513888888888888
A124: =A123+1 -> 124 | B124: EBENTIER | C124: SDA | D124: 0.59791666666666665
A125: =A124+1 -> 125 | B125: KRIES | C125: SDA | D125: 0.59930555555555554
A126: =A125+1 -> 126 | B126: GARY ACENAS | C126: MIRA MESA | D126: 0.60069444444444442
A127: =A126+1 -> 127 | B127: CAMERON EIBL | C127: LJCD | D127: 0.6020833333333333
A128: =A127+1 -> 128 | B128: JAMIE TRAN | C128: MIRA MESA | D128: 0.60347222222222219
A129: =A128+1 -> 129 | B129: MARIANO MOSQUERA | C129: CARLSBAD | D129: 0.60416666666666663
A130: =A129+1 -> 130 | B130: DE LA TORRE | C130: SDA | D130: 0.6069444444444444
A131: =A130+1 -> 131 | B131: PUNJOT SING | C131: MHHS | D131: 0.60833333333333328
A132: =A131+1 -> 132 | B132: HECTOR CONTRERES | C132: MHHS | D132: 0.60972222222222217
A133: =A132+1 -> 133 | B133: ALBERTO GUZMAN | C133: MIRA MESA | D133: 0.61250000000000004
A134: =A133+1 -> 134 | B134: PHILIP NAUMAN | C134: ESCONDIDIO CHARTER | D134: 0.61458333333333337
A135: =A134+1 -> 135 | B135: JOHN GILBREATH | C135: CCHS | D135: 0.61458333333333337
A136: =A135+1 -> 136 | B136: CHRISTOPHER KUNERSH | C136: CARLSBAD | D136: 0.61458333333333337
A137: =A136+1 -> 137 | B137: JACKSON | C137: SDA | D137: 0.61597222222222225
A138: =A137+1 -> 138 | B138: PETER FRIESE | C138: CARLSBAD | D138: 0.6166666666666667
A139: =A138+1 -> 139 | B139: GARCIA | C139: SDA | D139: 0.61805555555555558
A140: =A139+1 -> 140 | B140: ADAM ALLY | C140: MIRA MESA | D140: 0.61944444444444446
A141: =A140+1 -> 141 | B141: KURT DIWA | C141: MIRA MESA | D141: 0.61944444444444446
A142: =A141+1 -> 142 | B142: KARL LEIDER | C142: CARLSBAD | D142: 0.62083333333333335
A143: =A142+1 -> 143 | B143: RYAN MURPHY | C143: CCHS | D143: 0.62152777777777779
A144: =A143+1 -> 144 | B144: ALEXANDER CHAFFEE | C144: ESCONDIDIO CHARTER | D144: 0.62430555555555556
A145: =A144+1 -> 145 | B145: MATT HUMPHREYS | C145: ESCONDIDIO CHARTER | D145: 0.62708333333333333
A146: =A145+1 -> 146 | B146: GRANT GURTIN | C146: LJCD | D146: 0.62777777777777777
A147: =A146+1 -> 147 | B147: DAVID ANDREWS | C147: GUAJOME PARK | D147: 0.64166666666666672
A148: =A147+1 -> 148 | B148: JON ADAMS | C148: CARLSBAD | D148: 0.64930555555555558
A149: =A148+1 -> 149 | B149: SAM HUNT | C149: SAN DIMAS | D149: 0.65625
A150: =A149+1 -> 150 | B150: LESAN | C150: SDA | D150: 0.66597222222222219
A151: =A150+1 -> 151 | B151: JON MINIQUE | C151: SANTANA | D151: 0.66666666666666663
A152: =A151+1 -> 152 | B152: LUIZ PEREZ | C152: MHHS | D152: 0.69166666666666676
A153: =A152+1 -> 153 | B153: TRENT RICKY | C153: SANTANA | D153: 0.69305555555555554
A154: =A153+1 -> 154 | B154: ERIC MEILANDER | C154: MIRA MESA | D154: 0.70486111111111116
A155: =A154+1 -> 155 | B155: MICHAEL PALOMBO | C155: SANTANA | D155: 0.72013888888888899
A156: =A155+1 -> 156 | B156: STEVEN TAKETA | C156: GPA | D156: 0.73611111111111116
A157: =A156+1 -> 157 | B157: MICHAEL MILLER | C157: CALVARY CHRISTIAN | D157: 0.7368055555555556
A158: =A157+1 -> 158 | B158: NICK HEBERT | C158: MHHS | D158: 0.76180555555555562
A159: =A158+1 -> 159 | B159: KURT SHUMAKER | C159: ESCONDIDIO CHARTER | D159: 0.7729166666666667

A1: 1 | B1: OLIVIA TIDD | C1: CALVARY CHRISTIAN | D1: 0.56319444444444444
A2: =A1+1 -> 2 | B2: AMANDA HOLLEY | C2: EL CAP | D2: 0.57847222222222217
A3: =A2+1 -> 3 | B3: ROWAN DIONISOPOALOS | C3: GROSSMONT | D3: 0.58402777777777781
A4: =A3+1 -> 4 | B4: ANNIKA GACNIK | C4: CARLSBAD | D4: 0.59027777777777779
A5: =A4+1 -> 5 | B5: JUSTINE LAZARE | C5: MHHS | D5: 0.59444444444444444
A6: =A5+1 -> 6 | B6: AMELIA ROLAND | C6: GROSSMONT | D6: 0.59583333333333333
A7: =A6+1 -> 7 | B7: KATELYNN COLLINS | C7: GROSSMONT | D7: 0.59722222222222221
A8: =A7+1 -> 8 | B8: ROXY MARRAJO | C8: GROSSMONT | D8: 0.60069444444444442
A9: =A8+1 -> 9 | B9: MINDY TARLING | C9: SAN MARCOS | D9: 0.60347222222222219
A10: =A9+1 -> 10 | B10: TEYLOR CAMILO | C10: GPA | D10: 0.60416666666666663
A11: =A10+1 -> 11 | B11: JACKIE SPAVEY | C11: GROSSMONT | D11: 0.60624999999999996
A12: =A11+1 -> 12 | B12: STORROW | C12: SDA | D12: 0.60833333333333328
A13: =A12+1 -> 13 | B13: JILLIAN ZAUADIL | C13: EL CAP | D13: 0.60972222222222217
A14: =A13+1 -> 14 | B14: KATIE MALINAK | C14: VALHALLA | D14: 0.61041666666666672
A15: =A14+1 -> 15 | B15: DUSHKIN | C15: SDA | D15: 0.61111111111111105
A16: =A15+1 -> 16 | B16: STEPHANIE KLINE | C16: CARLSBAD | D16: 0.61111111111111105
A17: =A16+1 -> 17 | B17: STEVEN BRIDGETTE | C17: MHHS | D17: 0.6118055555555556
A18: =A17+1 -> 18 | B18: ELENA HOWED | C18: CCHS | D18: 0.62013888888888891
A19: =A18+1 -> 19 | B19: FELICIA ASBURY | C19: CCHS | D19: 0.62291666666666667
A20: =A19+1 -> 20 | B20: IRENE AGUILAR | C20: SAN MARCOS | D20: 0.625
A21: =A20+1 -> 21 | B21: MEANS | C21: GROSSMONT | D21: 0.625
A22: =A21+1 -> 22 | B22: LILY RAGIMOVA | C22: GROSSMONT | D22: 0.63055555555555554
A23: =A22+1 -> 23 | B23: DANIELLE VERDUGO | C23: EL CAP | D23: 0.63263888888888886
A24: =A23+1 -> 24 | B24: ROSIE FARRIS | C24: VALHALLA | D24: 0.63541666666666663
A25: =A24+1 -> 25 | B25: GIOVANNA ANDRADE | C25: SAN MARCOS | D25: 0.63611111111111118
A26: =A25+1 -> 26 | B26: LAURA STRAIGHT | C26: VALHALLA | D26: 0.63680555555555551
A27: =A26+1 -> 27 | B27: KATHLEEN RAFTERY | C27: GROSSMONT | D27: 0.6381944444444444
A28: =A27+1 -> 28 | B28: ALYSSA MCWHIRLER | C28: MHHS | D28: 0.6381944444444444
A29: =A28+1 -> 29 | B29: SOAKE | C29: SDA | D29: 0.6430555555555556
A30: =A29+1 -> 30 | B30: LAUREN WILLIAM | C30: CARLSBAD | D30: 0.64652777777777781
A31: =A30+1 -> 31 | B31: TAYLOR ANDRY | C31: EL CAP | D31: 0.64722222222222225
A32: =A31+1 -> 32 | B32: ARMSTRONG | C32: SDA | D32: 0.64861111111111114
A33: =A32+1 -> 33 | B33: MURPHY | C33: SDA | D33: 0.64930555555555558
A34: =A33+1 -> 34 | B34: JESSIE SCOTT | C34: MIRA MESA | D34: 0.64930555555555558
A35: =A34+1 -> 35 | B35: JACKIE REINAGEL | C35: CCHS | D35: 00.65
A36: =A35+1 -> 36 | B36: VICTORIA THOMAS | C36: CCHS | D36: 0.65208333333333335
A37: =A36+1 -> 37 | B37: KELLER BEKAH | C37: CALVARY CHRISTIAN | D37: 0.65277777777777779
A38: =A37+1 -> 38 | B38: MARRISA NAVORRO | C38: ESCONDIDO CHARTER | D38: 0.65416666666666667
A39: =A38+1 -> 39 | B39: HAYLEY JOHNSON | C39: SAN MARCOS | D39: 0.65555555555555556
A40: =A39+1 -> 40 | B40: CECILIA BEAUCHAMP | C40: CARLSBAD | D40: 0.65694444444444444
A41: =A40+1 -> 41 | B41: NATALIE QUECION | C41: EL CAP | D41: 0.66249999999999998
A42: =A41+1 -> 42 | B42: CLAIRE MARTIN | C42: CARLSBAD | D42: 0.66249999999999998
A43: =A42+1 -> 43 | B43: CLOSE | C43: SDA | D43: 0.66597222222222219
A44: =A43+1 -> 44 | B44: CATTI ALVAREZ | C44: LJCD | D44: 0.66736111111111107
A45: =A44+1 -> 45 | B45: CLAIRE PETTENGILL | C45: CCHS | D45: 0.67013888888888884
A46: =A45+1 -> 46 | B46: SARAI MORA | C46: MIRA MESA | D46: 0.67361111111111116
A47: =A46+1 -> 47 | B47: ASHLEY GRAHAM | C47: MIRA MESA | D47: 0.67847222222222225
A48: =A47+1 -> 48 | B48: JENNY SOULIAS | C48: ESCONDIDO CHARTER | D48: 0.67986111111111114
A49: =A48+1 -> 49 | B49: BRANDI TONNE | C49: MIRA MESA | D49: 0.68194444444444446
A50: =A49+1 -> 50 | B50: LEIZA ABAD | C50: MIRA MESA | D50: 0.68194444444444446
A51: =A50+1 -> 51 | B51: LINDA COPHER | C51: GROSSMONT | D51: 0.68402777777777779
A52: =A51+1 -> 52 | B52: ERIN BRANDON | C52: EL CAP | D52: 0.68472222222222223
A53: =A52+1 -> 53 | B53: KRISTEN EYER | C53: EL CAP | D53: 0.68541666666666667
A54: =A53+1 -> 54 | B54: BRITTANEY BELLGARDT | C54: EL CAP | D54: 0.68472222222222223
A55: =A54+1 -> 55 | B55: CAMACHO | C55: SDA | D55: 0.68611111111111101
A56: =A55+1 -> 56 | B56: CASSIE CUNNINGHAM | C56: MIRA MESA | D56: 0.68819444444444444
A57: =A56+1 -> 57 | B57: KELSEY DAOUST | C57: CARLSBAD | D57: 0.70138888888888884
A58: =A57+1 -> 58 | B58: BECKY KERSTEEN | C58: EL CAP | D58: 0.70347222222222217
A59: =A58+1 -> 59 | B59: NICOLE MILLWARD | C59: MHHS | D59: 0.70694444444444438
A60: =A59+1 -> 60 | B60: JESSICA HUFF | C60: GROSSMONT | D60: 0.70833333333333337
A61: =A60+1 -> 61 | B61: ELISA CERVANTEZ | C61: SAN MARCOS | D61: 0.70972222222222225
A62: =A61+1 -> 62 | B62: FRANKI WRIGHT | C62: CARLSBAD | D62: 0.7104166666666667
A63: =A62+1 -> 63 | B63: CAPOU MANISOAK | C63: MIRA MESA | D63: 0.71319444444444446
A64: =A63+1 -> 64 | B64: HALEY FLEISEHMAN | C64: CCHS | D64: 0.71527777777777779
A65: =A64+1 -> 65 | B65: ARIANA DE LA PAZ | C65: GPA | D65: 0.71875
A66: =A65+1 -> 66 | B66: MAIRSSA DAVIS | C66: GPA | D66: 0.71875
A67: =A66+1 -> 67 | B67: OPI PETERS | C67: ESCONDIDO CHARTER | D67: 0.72499999999999998
A68: =A67+1 -> 68 | B68: NAOMI VALLEJO | C68: MIRA MESA | D68: 0.72986111111111107
A69: =A68+1 -> 69 | B69: GILES | C69: SDA | D69: 0.73819444444444438
A70: =A69+1 -> 70 | B70: CAROL SIEBERT | C70: EL CAP | D70: 0.73819444444444438
A71: =A70+1 -> 71 | B71: KIM VILAY | C71: MIRA MESA | D71: 0.74930555555555556
A72: =A71+1 -> 72 | B72: MEGAN BREKKE | C72: CARLSBAD | D72: 0.75208333333333333
A73: =A72+1 -> 73 | B73: LEAH WILLIAMSON | C73: VALHALLA | D73: 0.75416666666666676
A74: =A73+1 -> 74 | B74: JENELL HARVEY | C74: ESCONDIDO CHARTER | D74: 0.75694444444444453
A75: =A74+1 -> 75 | B75: KIM WEAVER | C75: MIRA MESA | D75: 0.7631944444444444
A76: =A75+1 -> 76 | B76: SARA BENZ | C76: SAN MARCOS | D76: 0.77569444444444446
A77: =A76+1 -> 77 | B77: ANGELICA ROBLES | C77: GPA | D77: 0.78749999999999998
A78: =A77+1 -> 78 | B78: KRYSLA BOYER | C78: ESCONDIDO CHARTER | D78: 0.78819444444444453
A79: =A78+1 -> 79 | B79: ALISHA PERCY | C79: MIRA MESA | D79: 0.78819444444444453
A80: =A79+1 -> 80 | B80: CHERY NASSIMAN | C80: ESCONDIDO CHARTER | D80: 0.7909722222222223
A81: =A80+1 -> 81 | B81: CLAIRE ASARO | C81: GROSSMONT | D81: 0.79513888888888884
A82: =A81+1 -> 82 | B82: ROBYN HASS | C82: ESCONDIDO CHARTER | D82: 0.71944444444444444
A83: =A82+1 -> 83 | B83: RACQUEL ABAD | C83: MIRA MESA | D83: 0.80972222222222223
A84: =A83+1 -> 84 | B84: JENNIFER COLEMAN | C84: LJCD | D84: 0.81458333333333333
A85: =A84+1 -> 85 | B85: TAMMY HUYNH | C85: MIRA MESA | D85: 0.8305555555555556
A86: =A85+1 -> 86 | B86: ROBIN HANEY | C86: MHHS | D86: 0.8305555555555556
A87: =A86+1 -> 87 | B87: LAURA KNIGHT | C87: MIRA MESA | D87: 0.84652777777777777
A88: =A87+1 -> 88 | B88: ANGEL CAZARES | C88: ESCONDIDO CHARTER | D88: NT
A89: =A88+1 -> 89 | B89: SHANNON MCDUFF | C89: ESCONDIDO CHARTER | D89: NT

A1: 1 | B1: T. STILLINGER | C1: SAN DIEGUITO ACADEMY | D1: 0.42152777777777778
A2: =A1+1 -> 2 | B2: JAIME CARRILLO | C2: MHHS | D2: 0.42569444444444443
A3: =A2+1 -> 3 | B3: KYLE PHIPPS | C3: EL CAP | D3: 0.42638888888888887
A4: =A3+1 -> 4 | B4: JON PATINO | C4: MIRA MESA | D4: 0.43263888888888885
A5: =A4+1 -> 5 | B5: JESUS ROMO | C5: GPA | D5: 0.4368055555555555
A6: =A5+1 -> 6 | B6: SCHEULEN | C6: SAN DIEGUITO ACADEMY | D6: 0.4368055555555555
A7: =A6+1 -> 7 | B7: BRIAN RANDLETT | C7: VALHALLA | D7: 0.4381944444444445
A8: =A7+1 -> 8 | B8: CASEY KEAR | C8: SAN DIMAS | D8: 0.44027777777777777
A9: =A8+1 -> 9 | B9: MIKE POFFENBARGER | C9: EL CAP | D9: 0.44097222222222227
A10: =A9+1 -> 10 | B10: RYAN VILAS | C10: CALVARY CHRISTIAN | D10: 0.44097222222222227
A11: =A10+1 -> 11 | B11: TONY SANCHEZ | C11: OCEANSIDE | D11: 0.44166666666666665
A12: =A11+1 -> 12 | B12: KEVIN WATTERS | C12: EL CAP | D12: 0.44305555555555554
A13: =A12+1 -> 13 | B13: JON KELLER | C13: CALVARY CHRISTIAN | D13: 0.44444444444444442
A14: =A13+1 -> 14 | B14: LOCKHEART DOMINIC | C14: CCHS | D14: 0.4465277777777778
A15: =A14+1 -> 15 | B15: KYLE GERHARD | C15: CALVARY CHRISTIAN | D15: 0.44930555555555557
A16: =A15+1 -> 16 | B16: BARRETT TILLEY | C16: GROSSMONT | D16: 0.45277777777777778
A17: =A16+1 -> 17 | B17: TRAVIS PEDERSON | C17: SDA | D17: 0.45347222222222222
A18: =A17+1 -> 18 | B18: ANTHONY DEBARROWS | C18: SANTANA | D18: 0.45416666666666666
A19: =A18+1 -> 19 | B19: CHRIS ROOT | C19: GHS | D19: 0.4548611111111111
A20: =A19+1 -> 20 | B20: PATRICK BREEN | C20: EL CAP | D20: 0.45624999999999999
A21: =A20+1 -> 21 | B21: RHETT STOUS | C21: EL CAP | D21: 0.45694444444444443
A22: =A21+1 -> 22 | B22: MORGAN | C22: SDA | D22: 0.45763888888888887
A23: =A22+1 -> 23 | B23: MARK ROBERTSON | C23: GHS | D23: 0.45763888888888887
A24: =A23+1 -> 24 | B24: JESUS CARDENAS | C24: OCEANSIDE | D24: 0.45763888888888887
A25: =A24+1 -> 25 | B25: KYLE JOHNSON | C25: CARLSBAD | D25: 0.4597222222222222
A26: =A25+1 -> 26 | B26: MIKE MEZA | C26: VALHALLA | D26: 0.4604166666666667
A27: =A26+1 -> 27 | B27: MATT KIELBASA | C27: VALHALLA | D27: 0.4604166666666667
A28: =A27+1 -> 28 | B28: SPENCER SCHWERDTFEGER | C28: CARLSBAD | D28: 0.46111111111111108
A29: =A28+1 -> 29 | B29: MATTHEW VETTEL | C29: CARLSBAD | D29: 0.46180555555555558
A30: =A29+1 -> 30 | B30: CHRIS TORRES | C30: EL CAP | D30: 0.46250000000000002
A31: =A30+1 -> 31 | B31: FIELDS | C31: SDA | D31: 0.46597222222222223
A32: =A31+1 -> 32 | B32: KEVIN THORSELL | C32: SANTE FE CHRISTIAN | D32: 0.46875
A33: =A32+1 -> 33 | B33: JHEREMY CARTER | C33: MHHS | D33: 0.47013888888888888
A34: =A33+1 -> 34 | B34: BRETT HARNISH | C34: GHS | D34: 0.47083333333333338
A35: =A34+1 -> 35 | B35: JARRED ATKINSON | C35: EL CAP | D35: 0.47222222222222227
A36: =A35+1 -> 36 | B36: HUMBERTO SANTIAGO | C36: MHHS | D36: 0.47291666666666665
A37: =A36+1 -> 37 | B37: RYAN BABERS | C37: MIRA MESA | D37: 0.47291666666666665
A38: =A37+1 -> 38 | B38: JEFF BLACK | C38: MIRA MESA | D38: 0.47361111111111115
A39: =A38+1 -> 39 | B39: BRIAN RICKARDS | C39: VALHALLA | D39: 0.47569444444444442
A40: =A39+1 -> 40 | B40: BLAINE GREGSON | C40: SANTE FE CHRISTIAN | D40: 0.47847222222222219
A41: =A40+1 -> 41 | B41: MARK KIELBASA | C41: VALHALLA | D41: 0.47986111111111113
A42: =A41+1 -> 42 | B42: FRATICELLI RHETT | C42: CCHS | D42: 0.48055555555555557
A43: =A42+1 -> 43 | B43: BILLY PUTNAM | C43: MHHS | D43: 0.48125000000000001
A44: =A43+1 -> 44 | B44: AMANO | C44: SAN DIEGUITO ACADEMY | D44: 0.48194444444444445
A45: =A44+1 -> 45 | B45: HALEY JUSTIN | C45: CCHS | D45: 0.48541666666666666
A46: =A45+1 -> 46 | B46: DAVID SOLOWAY | C46: VALHALLA | D46: 0.48680555555555555
A47: =A46+1 -> 47 | B47: GRANT LIEBERMAN | C47: GHS | D47: 0.48749999999999999
A48: =A47+1 -> 48 | B48: CHRIS VORLICECK | C48: LJCD | D48: 0.48958333333333331
A49: =A48+1 -> 49 | B49: JAMES PEASE | C49: CARLSBAD | D49: 0.4909722222222222
A50: =A49+1 -> 50 | B50: MOACANIN | C50: SDA | D50: 0.4916666666666667
A51: =A50+1 -> 51 | B51: MITCHEL DOMINGUEZ | C51: GHS | D51: 0.4916666666666667
A52: =A51+1 -> 52 | B52: FISCHER WARREN | C52: CCHS | D52: 0.49236111111111108
A53: =A52+1 -> 53 | B53: STEPHEN MIGDAL | C53: LJCD | D53: 0.49513888888888885
A54: =A53+1 -> 54 | B54: ALEX KUZARA | C54: MHHS | D54: 0.49722222222222223
A55: =A54+1 -> 55 | B55: RAUL NAVARRO | C55: MIRA MESA | D55: 0.49791666666666662
A56: =A55+1 -> 56 | B56: LEWIS BRYCE | C56: CCHS | D56: 0.49791666666666662
A57: =A56+1 -> 57 | B57: GARRET BOYER | C57: ESCONDIDIO CHARTER | D57: 0.4993055555555555
A58: =A57+1 -> 58 | B58: ANDREW SCHROEDER | C58: SAN DIMAS | D58: 0.50347222222222221
A59: =A58+1 -> 59 | B59: RYAN MORSE | C59: SAN DIMAS | D59: 0.50555555555555554
A60: =A59+1 -> 60 | B60: KEEGAN RYAN | C60: CARLSBAD | D60: 0.50694444444444442
A61: =A60+1 -> 61 | B61: GILL DEREK | C61: CCHS | D61: 0.50763888888888886
A62: =A61+1 -> 62 | B62: BRANDON GREGSON | C62: SANTE FE CHRISTIAN | D62: 0.51041666666666663
A63: =A62+1 -> 63 | B63: GABRIEL ARCE | C63: MHHS | D63: 0.51180555555555551
A64: =A63+1 -> 64 | B64: JOSH GUZMAN | C64: MHHS | D64: 0.51458333333333328
A65: =A64+1 -> 65 | B65: JIMMY GRENNBLATT | C65: GHS | D65: 0.51875000000000004
A66: =A65+1 -> 66 | B66: ANDREW VON NIEVWENZHE | C66: LJCD | D66: 0.51944444444444449
A67: =A66+1 -> 67 | B67: PHILLIP RUIZ | C67: MIRA MESA | D67: 0.5229166666666667
A68: =A67+1 -> 68 | B68: ANTHONY JEREZA | C68: MIRA MESA | D68: 0.52500000000000002
A69: =A68+1 -> 69 | B69: JIM GONZALEZ | C69: SAN DIMAS | D69: 0.52569444444444446
A70: =A69+1 -> 70 | B70: CAMERON STRAWN | C70: ESCONDIDIO CHARTER | D70: 0.52638888888888891
A71: =A70+1 -> 71 | B71: KEVIN ENGELKE | C71: SANTANA | D71: 0.52777777777777779
A72: =A71+1 -> 72 | B72: JOHN SEARL | C72: SANTE FE CHRISTIAN | D72: 0.52777777777777779
A73: =A72+1 -> 73 | B73: NICK WRIGHT | C73: SANTE FE CHRISTIAN | D73: 0.52847222222222223
A74: =A73+1 -> 74 | B74: JASON GORDON | C74: SANTANA | D74: 0.52986111111111112
A75: =A74+1 -> 75 | B75: WADE GALLIGAN | C75: LJCD | D75: 0.52986111111111112
A76: =A75+1 -> 76 | B76: NOBLET | C76: SDA | D76: 0.53055555555555556
A77: =A76+1 -> 77 | B77: BEN FLEISCHHACKER | C77: LJCD | D77: 0.53194444444444444
A78: =A77+1 -> 78 | B78: DANNY REYNOLDS | C78: MIRA MESA | D78: 0.53333333333333333
A79: =A78+1 -> 79 | B79: CHRIS SEIDEL | C79: CCHS | D79: 0.53402777777777777
A80: =A79+1 -> 80 | B80: GERRY RAPELLO | C80: MIRA MESA | D80: 0.53472222222222221
A81: =A80+1 -> 81 | B81: CHRIS FREETN | C81: SAN DIMAS | D81: 0.53680555555555554
A82: =A81+1 -> 82 | B82: CORY LEITZKE | C82: CALVARY CHRISTIAN | D82: 0.53888888888888886
A83: =A82+1 -> 83 | B83: JAKE ELIASBERG | C83: LJCD | D83: 0.54166666666666663
A84: =A83+1 -> 84 | B84: JARED CARR | C84: MIRA MESA | D84: 0.54166666666666663
A85: =A84+1 -> 85 | B85: BRETT HARRIS | C85: SANTANA | D85: 0.54583333333333328
A86: =A85+1 -> 86 | B86: MILES MCMILLAN | C86: LJCD | D86: 00.55
A87: =A86+1 -> 87 | B87: STEVEN KIRKISH | C87: SANTANA | D87: 0.55972222222222223
A88: =A87+1 -> 88 | B88: RYAN ZERKLE | C88: SANTANA | D88: 0.56111111111111112
A89: =A88+1 -> 89 | B89: DAN MCDERMOTT | C89: SANTE FE CHRISTIAN | D89: 0.57361111111111118
A90: =A89+1 -> 90 | B90: MATT LUDWIG | C90: ESCONDIDIO CHARTER | D90: 0.60069444444444442
A91: =A90+1 -> 91 | B91: JAMES WOLENSKY | C91: SANTANA | D91: NT