A1: 1 | B1: CARL DARGITZ | C1: 0.65138888888888891 | E1: RNK | F1: NAME | G1: TIME | H1: PREV.
A2: =A1+1 -> 2 | B2: COLTON TULLY-DOYLE | C2: 0.65208333333333335 | E2: 1 | F2: KRISTA EGENSE | G2: 0.67500000000000004
A3: =A2+1 -> 3 | B3: JAKE WERTNER | C3: 0.68472222222222223 | E3: 2 | F3: CAROLINE DRAPER | G3: 0.69097222222222221
A4: =A3+1 -> 4 | B4: JARED FENLASON | C4: 0.69166666666666676 | E4: 3 | F4: MICHELLE BLACK | G4: 0.71875
A5: =A4+1 -> 5 | B5: DAVID CARLSON | C5: 0.7055555555555556 | E5: 4 | F5: CARLY BLISS | G5: 0.72499999999999998 | H5: 0.75763888888888886
A6: =A5+1 -> 6 | B6: BRYCE HOLEWINSKI | C6: 0.70694444444444438 | E6: 5 | F6: JANA DRAKE | G6: 0.72638888888888886 | H6: 0.72777777777777775
A7: =A6+1 -> 7 | B7: SEAN PROEHL | C7: 0.71388888888888891 | E7: 6 | F7: KERRY SONNENBURG | G7: 0.73611111111111116 | H7: 0.73750000000000004
A8: =A7+1 -> 8 | B8: DREW FLOOD | C8: 0.71736111111111101 | E8: 7 | F8: CASEY BURGESS | G8: 0.75555555555555554
A9: =A8+1 -> 9 | B9: CHRIS NORN | C9: 0.73402777777777783 | E9: 8 | F9: TAYLOR PARKER | G9: 0.80277777777777781 | H9: 0.77777777777777779
A10: =A9+1 -> 10 | B10: AARON FENLASON | C10: 0.76249999999999996 | E10: 9 | F10: NATALIE UDUWELA | G10: 0.8041666666666667
A11: =A10+1 -> 11 | B11: MATT STANISLAWSKI | C11: 0.7715277777777777 | E11: 10 | F11: REI AYALA | G11: 0.81944444444444442
A12: =A11+1 -> 12 | B12: QUENTIN LAMICQ | C12: 0.77500000000000002 | E12: 11 | F12: PAIGE HENRY | G12: 0.84444444444444444
A13: =A12+1 -> 13 | B13: O'MIN KWON | C13: 0.7993055555555556 | E13: 12 | F13: LINDSAY SERHAN | G13: 0.87222222222222223
A14: =A13+1 -> 14 | B14: JOSH GILL | C14: 00.8 | E14: 13 | F14: HAI JING ZHANG | G14: 0.89444444444444449 | H14: 0.82847222222222228
A15: =A14+1 -> 15 | B15: WILL SOMERVELL | C15: 0.81597222222222221 | E15: 14 | F15: VICTORIA MCMULLEN | G15: 00.9
A16: =A15+1 -> 16 | B16: AVI REUBEN | C16: 0.82152777777777775 | E16: 15 | F16: DANA MOHAMMAD-ZADEH | G16: 0.90138888888888891
A17: =A16+1 -> 17 | B17: SO ADACHI | C17: 0.82847222222222217 | E17: 16 | F17: AMANDA ALDERTON | G17: 0.90347222222222223
A18: =A17+1 -> 18 | B18: AARON BERCOVITCH | C18: 0.83263888888888893 | E18: 17 | F18: KATY BENITO | G18: 0.91666666666666663
A19: =A18+1 -> 19 | B19: ANT NOREN | C19: 0.83888888888888891 | E19: 18 | F19: CHLOE LEFFAS-LOPES | G19: 0.94374999999999998
A20: =A19+1 -> 20 | B20: JOE HUNTER | C20: 0.8534722222222223 | E20: 19 | F20: KELSEY ERSKINE | G20: 0.94374999999999998
A21: =A20+1 -> 21 | B21: STEVEN WANCEWICZ | C21: 0.8534722222222223 | E21: 20 | F21: MELLISA COYLE | G21: 0.95625000000000004
A22: =A21+1 -> 22 | B22: RYOSUKE SAIKA | C22: 0.87847222222222221
A23: =A22+1 -> 23 | B23: PETER BENITO | C23: 0.88263888888888886 | G23: 2005 | H23: 2004 | I23: 2003
A24: =A23+1 -> 24 | B24: STEVEN KAMEN | C24: 0.88680555555555562 | F24: TEAM TIMES | G24: 84:52 | H24: 85:43 | I24: 85:56
A25: =A24+1 -> 25 | B25: BRANDON LAVORGNA | C25: 0.89027777777777783
A26: =A25+1 -> 26 | B26: BRETT RAMIN | C26: 0.9159722222222223 | F26: 1-5 GAPS | G26: 5.1388888888888887E-2 | H26: 9.7222222222222224E-2 | I26: 7.9861111111111105E-2
A27: =A26+1 -> 27 | B27: DANNY NELSON | C27: 0.9194444444444444
A28: =A27+1 -> 28 | B28: GERALD GOLDEN | C28: 0.93611111111111101
A29: =A28+1 -> 29 | B29: JOHN GOODRICH | C29: 0.97569444444444453
A30: =A29+1 -> 30 | B30: VATSAL SHAH | C30: 1.0270833333333333
A31: =A30+1 -> 31 | B31: CHRIS HARRIS | C31: 1.0687500000000001

B1: Name | C1: Mile | D1: 2 Mile | E1: Time | F1: Place | G1: Previous
A3: Frosh Girls | B3: Caroline Draper | C3: 617 | D3: 1255 | E3: 1635 | F3: 7
B4: Casey Burgess | C4: 641 | D4: 1404 | E4: 1808 | F4: 15
B5: Paige Henry | C5: 712 | D5: 1540 | E5: 2016 | F5: 60
B6: Victoria McMullen | C6: 725 | D6: 1647 | E6: 2136 | F6: 84
B7: Amanda Alderton | C7: 725 | D7: 1624 | E7: 2141 | F7: 86
B8: Kelsey Erskine | C8: 800 | D8: 1730 | E8: 2239 | F8: 99
A12: Soph Girls | B12: Krista Egense | C12: 607 | D12: 1247 | E12: 1612 | F12: 2
B13: Michelle Black | C13: 607 | D13: 1312 | E13: 1715 | F13: 17
B14: Tara Cowen | C14: 704 | D14: 1441 | E14: 1906 | F14: 64
B15: Natalie Uduwela | C15: 706 | D15: 1508 | E15: 1916 | F15: 68
B16: Taylor Parker | C16: 647 | D16: 1446 | E16: 1926 | F16: 73 | G16: 18:40
B17: Dana Mohammad-Zadeh | C17: 740 | D17: 1648 | E17: 2138 | F17: 121
B18: Chloe Leffas-Lopes | C18: 755 | D18: 1710 | E18: 2229 | F18: 133
A22: Jr Girls | B22: Carly Bliss | C22: 614 | D22: 1335 | E22: 1724 | F22: 15 | G22: 18:11
B23: Jana Drake | C23: 623 | D23: 1335 | E23: 1726 | F23: 16 | G23: 17:28
B24: Rei Ayala | C24: 659 | D24: 1510 | E24: 1940 | F24: 53
B25: Lindsay Serhan | C25: 732 | D25: 1615 | E25: 2056 | F25: 70
B26: Melissa Coyle | C26: 732 | D26: 1701 | E26: 2257 | F26: 86
A29: Sr Girls | B29: Kerry Sonnenburg | C29: 626 | D29: 1342 | E29: 1740 | F29: 19 | G29: 17:42
B30: Hai Jing Zhang | C30: 720 | D30: 1627 | E30: 2128 | F30: 70 | G30: 19:53
B31: Katy Benito | C31: 748 | D31: 1656 | E31: 2200 | F31: 73 | G31: 2400

A1: 8:55 FROSH BOYS | C1: 1.0 MILE | D1: 2.0 MILE | E1: FINISH | F1: PLACE | G1: PREV | H1: PLACE | I1: DIFF.
A2: 1 | B2: O'MIN KWON | C2: 0.26041666666666669 | D2: 0.53333333333333333 | E2: 0.7993055555555556 | F2: ?
A3: 2 | B3: STEVEN KAMEN | C3: 0.27708333333333335 | D3: 0.59097222222222223 | E3: 0.88680555555555562 | F3: 122
A4: 3 | B4: GERALD GOLDEN | C4: 0.28749999999999998 | D4: 0.61458333333333337 | E4: 0.93611111111111101 | F4: 148
A5: 4 | B5: AVI REUBEN | C5: 0.27638888888888885 | D5: 0.56111111111111112 | E5: 0.82152777777777775 | F5: 80
A6: 5 | B6: ANT NOREN | C6: 0.27291666666666664 | D6: 0.56805555555555554 | E6: 0.83888888888888891 | F6: 92
A7: 6 | B7: CHRIS HARRIS | C7: 0.32430555555555557 | D7: 0.70972222222222225 | E7: 1.0687500000000001 | F7: 186
A8: 7 | B8: JOHN GOODRICH | C8: 0.31111111111111112 | D8: 0.66111111111111109 | E8: 0.97569444444444453 | F8: 164
A9: 9:45 SOPH BOYS | C9: 1.0 MILE | D9: 2.0 MILE | E9: FINISH | F9: PLACE | G9: PREV | H9: PLACE
A10: 1 | B10: SEAN PROEHL | C10: 0.21805555555555556 | D10: 0.47222222222222227 | E10: 0.71388888888888891 | F10: 19 | G10: 0.74583333333333324 | H10: 11 | I10: =G10-E10 -> 3.1944444444444331E-2
A11: 2 | B11: DREW FLOOD | C11: 0.22083333333333333 | D11: 0.4770833333333333 | E11: 0.71736111111111101 | F11: 23 | G11: 0.7715277777777777 | H11: 16 | I11: =G11-E11 -> 5.4166666666666696E-2
A12: 3 | B12: AARON FENLASON | C12: 0.23749999999999999 | D12: 0.51388888888888895 | E12: 0.76249999999999996 | F12: 62 | G12: 0.79583333333333339 | H12: 33 | I12: =G12-E12 -> 3.3333333333333437E-2
A13: 4 | B13: PETER BENITO | C13: 0.26944444444444443 | D13: 0.58819444444444446 | E13: 0.88263888888888886 | F13: 166 | G13: 0.95833333333333337 | I13: =G13-E13 -> 7.5694444444444509E-2
A14: 5 | B14: DANNY NELSON | C14: 0.27083333333333331 | D14: 0.60555555555555551 | E14: 0.9194444444444444 | F14: 183
A15: 6 | B15: RYOSUKE SAIKA | C15: 0.2673611111111111 | D15: 0.58194444444444449 | E15: 0.87847222222222221 | F15: 163
A16: 7 | B16: VATSAL SHAH | C16: 0.31944444444444448 | D16: 0.68819444444444444 | E16: 1.0270833333333333 | F16: 202
A17: 10:35 JR. BOYS | C17: 1.0 MILE | D17: 2.0 MILE | E17: FINISH | F17: PLACE | G17: PREV | H17: PLACE
A18: 1 | B18: JARED FENLASON | C18: 0.21319444444444444 | D18: 0.45902777777777781 | E18: 0.69166666666666676 | F18: 21 | G18: 0.75416666666666676 | H18: 46 | I18: =G18-E18 -> 6.25E-2
A19: 2 | B19: JAKE WERTNER | C19: 0.21527777777777779 | D19: 0.46111111111111108 | E19: 0.68472222222222223 | F19: 13 | G19: 0.72152777777777777 | H19: 17 | I19: =G19-E19 -> 3.6805555555555536E-2
A20: 3 | B20: BRYCE HOLEWINSKI | C20: 0.22083333333333333 | D20: 0.47222222222222227 | E20: 0.70694444444444438 | F20: 35 | G20: 0.7368055555555556 | H20: 30 | I20: =G20-E20 -> 2.9861111111111227E-2
A21: 4 | B21: DAVID CARLSON | C21: 0.22083333333333333 | D21: 0.47222222222222227 | E21: 0.7055555555555556 | F21: 33 | G21: 0.76041666666666663 | H21: 51 | I21: =G21-E21 -> 5.4861111111111027E-2
A22: 5 | B22: SO ADACHI | C22: 0.25555555555555559 | D22: 0.5493055555555556 | E22: 0.82847222222222217 | F22: 131 | G22: 0.83194444444444438 | I22: =G22-E22 -> 3.4722222222222099E-3
A23: 6 | B23: WILL SOMERVELL | C23: 0.25694444444444448 | D23: 0.5541666666666667 | E23: 0.81597222222222221 | F23: 124 | G23: 0.9472222222222223 | I23: =G23-E23 -> 0.13125000000000001
A24: 7 | B24: BRETT RAMIN | C24: 0.28472222222222221 | D24: 0.61458333333333337 | E24: 0.9159722222222223 | F24: 166 | G24: 1.0673611111111112 | I24: =G24-E24 -> 0.15138888888888891
A25: 11:25 SR. BOYS | C25: 1.0 MILE | D25: 2.0 MILE | E25: FINISH | F25: PLACE | G25: PREV | H25: PLACE
A26: 1 | B26: COLTON TULLY-DOYLE | C26: 0.20486111111111113 | D26: 0.43194444444444446 | E26: 0.65208333333333335 | F26: 3 | G26: 0.68194444444444446 | H26: 10 | I26: =G26-E26 -> 2.9861111111111116E-2
A27: =A26+1 -> 2 | B27: CARL DARGITZ | C27: 0.2076388888888889 | D27: 0.43194444444444446 | E27: 0.65138888888888891 | F27: 2 | G27: 0.68611111111111101 | H27: 13 | I27: =G27-E27 -> 3.4722222222222099E-2
A28: =A27+1 -> 3 | B28: CHRIS NORN | C28: 0.22222222222222221 | D28: 0.4826388888888889 | E28: 0.73402777777777783 | F28: 61 | G28: 0.73750000000000004 | H28: 49 | I28: =G28-E28 -> 3.4722222222222099E-3
A29: =A28+1 -> 4 | B29: MATT STANISLAWSKI | C29: 0.23541666666666669 | D29: 0.50972222222222219 | E29: 0.7715277777777777 | G29: 0.81666666666666676 | I29: =G29-E29 -> 4.5138888888889062E-2
A30: =A29+1 -> 5 | B30: QUENTIN LAMICQ | C30: 0.23819444444444446 | D30: 0.51458333333333328 | E30: 0.77500000000000002
A31: 6 | B31: JOSH GILL | C31: 0.24374999999999999 | D31: 0.53333333333333333 | E31: 00.8
A32: 7 | B32: JOE HUNTER | C32: 0.25 | D32: 0.55069444444444449 | E32: 0.8534722222222223
A33: 8 | B33: STEVEN WANCEWICZ | C33: 0.25 | D33: 0.55347222222222225 | E33: 0.8534722222222223 | G33: 0.97499999999999998 | I33: =G33-E33 -> 0.12152777777777768
A34: =A33+1 -> 9 | B34: AARON BERCOVITCH | C34: 0.25694444444444448 | D34: 0.55347222222222225 | E34: 0.83263888888888893
A35: =A34+1 -> 10 | B35: BRANDON LAVORGNA | C35: 0.2638888888888889 | D35: 0.59305555555555556 | E35: 0.89027777777777783