A1: 1 | B1: COLTON TULLY-DOYLE | C1: 0.4069444444444445 | E1: 1 | F1: Krista Egense | G1: 0.50138888888888888
A2: =A1+1 -> 2 | B2: CARL DARGITZ | C2: 0.40763888888888888 | E2: 2 | F2: Caroline Draper | G2: 0.50624999999999998
A3: =A2+1 -> 3 | B3: JARED FENLASON | C3: 0.42777777777777781 | E3: 3 | F3: Carly Bliss | G3: 0.53194444444444444
A4: =A3+1 -> 4 | B4: BRYCE HOLEWINSKI | C4: 0.43541666666666662 | E4: 4 | F4: Kerry Sonnenburg | G4: 0.53541666666666665
A5: =A4+1 -> 5 | B5: SEAN PROEHL | C5: 0.4375 | E5: 5 | F5: Michelle Black | G5: 0.53194444444444444
A6: =A5+1 -> 6 | B6: DREW FLOOD | C6: 0.44027777777777777 | E6: 6 | F6: Taylor Parker | G6: 0.5541666666666667
A7: =A6+1 -> 7 | B7: CHRIS NOREN | C7: 0.44305555555555554 | E7: 7 | F7: Jenny Zhuang | G7: 0.5541666666666667
A8: =A7+1 -> 8 | B8: DAVID CARLSON | C8: 0.4513888888888889 | E8: 8 | F8: Tara Cowen | G8: 0.57222222222222219
A9: =A8+1 -> 9 | B9: MATT STANISLAWSKI | C9: 0.4770833333333333 | E9: 9 | F9: Natalie Uduwela | G9: 0.57986111111111105
A10: =A9+1 -> 10 | B10: ALEX RYDEN | C10: 0.47847222222222219 | E10: 10 | F10: Casey Burgess | G10: 0.58611111111111114
A11: =A10+1 -> 11 | B11: QUENTIN LAMICQ | C11: 0.48194444444444445 | E11: 11 | F11: Mehgie Tabar | G11: 0.58680555555555558
A12: =A11+1 -> 12 | B12: TAYLOR DAVIS | C12: 0.48680555555555555 | E12: 12 | F12: Rei Ayala | G12: 0.58958333333333335
A13: =A12+1 -> 13 | B13: CHRIS RUBADUE | C13: 0.49513888888888885 | E13: 13 | F13: Paige Henry | G13: 0.60486111111111118
A14: =A13+1 -> 14 | B14: O'MIN QWON | C14: 0.50416666666666665 | E14: 14 | F14: Victoria McMullen | G14: 0.61736111111111114
A15: =A14+1 -> 15 | B15: STEVEN KAMEN | C15: 0.50763888888888886 | E15: 15 | F15: Lindsay Serhan | G15: 0.62152777777777779
A16: =A15+1 -> 16 | B16: JOE HUNTER | C16: 0.50763888888888886 | E16: 16 | F16: Hai Jing Zhang | G16: 0.62708333333333333
A17: =A16+1 -> 17 | B17: SO ADACHI | C17: 0.51041666666666663 | E17: 17 | F17: Jessica Mikhail | G17: 0.62777777777777777
A18: =A17+1 -> 18 | B18: JOSH GILL | C18: 0.51249999999999996 | E18: 18 | F18: Dana Mohammad-Zadeh | G18: 0.6333333333333333
A19: =A18+1 -> 19 | B19: STEVEN WANCEWICZ | C19: 0.51527777777777783 | E19: 19 | F19: Chloe Leffas-Lopes | G19: 0.65416666666666667
A20: =A19+1 -> 20 | B20: WILL SOMERVELL | C20: 0.51736111111111105 | E20: 20 | F20: Ana Vega | G20: 0.65347222222222223
A21: =A20+1 -> 21 | B21: GERALD GOLDEN | C21: 0.51875000000000004 | E21: 21 | F21: Melissa Coyle | G21: 0.65486111111111112
A22: =A21+1 -> 22 | B22: AVI REUBEN | C22: 0.52013888888888882 | E22: 22 | F22: Katy Benito | G22: 0.66319444444444442
A23: =A22+1 -> 23 | B23: ANT NOREN | C23: 0.52500000000000002 | E23: 23 | F23: Kelsey Erskine | G23: 0.67291666666666661
A24: =A23+1 -> 24 | B24: AARON BERCOVITCH | C24: 0.53263888888888888 | E24: 24 | F24: Amanda Alderton | G24: 0.70277777777777783
A25: =A24+1 -> 25 | B25: PETER BENTIO | C25: 0.53472222222222221
A26: =A25+1 -> 26 | B26: BRANDON LAVORGNA | C26: 0.54236111111111118
A27: =A26+1 -> 27 | B27: RYOSUKE SAIKA | C27: 0.54791666666666672
A28: =A27+1 -> 28 | B28: DANNY NELSON | C28: 0.55625000000000002
A29: =A28+1 -> 29 | B29: BRENT HARVEY | C29: 0.5805555555555556
A30: =A29+1 -> 30 | B30: BRETT RAMIN | C30: 0.59375
A31: =A30+1 -> 31 | B31: CHRIS HARRIS | C31: 0.62361111111111112
A32: =A31+1 -> 32 | B32: VATSAL SHAH | C32: 0.66597222222222219

A1: Name | B1: 1500 | C1: MILE | D1: Time | E1: Place
B2: *100 meters short*
A4: Varsity Girls
A5: Krista Egense | B5: 0.23125000000000001 | C5: =B5/1500*1609 -> 0.24805416666666669 | D5: 0.50138888888888888 | E5: 11
A6: Caroline Draper | B6: 0.23958333333333334 | C6: =B6/1500*1609 -> 0.25699305555555557 | D6: 0.50624999999999998 | E6: 17
A7: Carly Bliss | B7: 0.25069444444444444 | C7: =B7/1500*1609 -> 0.26891157407407407 | D7: 0.53194444444444444 | E7: 32
A8: Kerry Sonnenburg | B8: 0.25208333333333333 | C8: =B8/1500*1609 -> 0.27040138888888887 | D8: 0.53541666666666665 | E8: 33
A9: Michelle Black | B9: 0.25 | C9: =B9/1500*1609 -> 0.26816666666666666 | D9: 0.53194444444444444 | E9: 38
A10: Taylor Parker | B10: 0.25138888888888888 | C10: =B10/1500*1609 -> 0.26965648148148147 | D10: 0.5541666666666667 | E10: 53
A13: JV 9/10 Girls
A14: Jenny Zhuang | B14: 0.25416666666666665 | C14: =B14/1500*1609 -> 0.27263611111111108 | D14: 0.5541666666666667 | E14: 8
A15: Tara Cowen | B15: 0.2673611111111111 | C15: =B15/1500*1609 -> 0.28678935185185184 | D15: 0.57222222222222219 | E15: 21
A16: Natalie Uduwela | B16: 0.27083333333333331 | C16: =B16/1500*1609 -> 0.29051388888888885 | D16: 0.57986111111111105 | E16: 31
A17: Casey Burgess | B17: 0.26666666666666666 | C17: =B17/1500*1609 -> 0.28604444444444443 | D17: 0.58611111111111114 | E17: 40
A18: Paige Henry | B18: 0.27916666666666667 | C18: =B18/1500*1609 -> 0.29945277777777779 | D18: 0.60486111111111118 | E18: 55
A19: Victoria McMullen | B19: 0.27916666666666667 | C19: =B19/1500*1609 -> 0.29945277777777779 | D19: 0.61736111111111114 | E19: 64
A20: Dana Mohammad-Zadeh | B20: 0.28541666666666665 | C20: =B20/1500*1609 -> 0.30615694444444441 | D20: 0.6333333333333333 | E20: 75
A21: Chloe Leffas-Lopes | B21: 0.31041666666666667 | C21: =B21/1500*1609 -> 0.33297361111111112 | D21: 0.65416666666666667 | E21: 84
A22: Kelsey Erskine | B22: 0.31319444444444444 | C22: =B22/1500*1609 -> 0.33595324074074073 | D22: 0.67291666666666661 | E22: 89
A23: Amanda Alderton | B23: 0.2951388888888889 | C23: =B23/1500*1609 -> 0.31658564814814816 | D23: 0.70277777777777783 | E23: 96
A26: JV 11/12 Girls
A27: Mehgie Tabar | B27: 0.26666666666666666 | C27: =B27/1500*1609 -> 0.28604444444444443 | D27: 0.58680555555555558 | E27: 19
A28: Rei Ayala | B28: 0.27291666666666664 | C28: =B28/1500*1609 -> 0.29274861111111106 | D28: 0.58958333333333335 | E28: 21
A29: Lindsay Serhan | B29: 0.28541666666666665 | C29: =B29/1500*1609 -> 0.30615694444444441 | D29: 0.62152777777777779 | E29: 33
A30: Hai Jing Zhang | B30: 0.28125 | C30: =B30/1500*1609 -> 0.3016875 | D30: 0.62708333333333333 | E30: 37
A31: Jessica Mikhail | B31: 0.2902777777777778 | C31: =B31/1500*1609 -> 0.31137129629629634 | D31: 0.62777777777777777 | E31: 38
A32: Ana Vega | B32: 0.2951388888888889 | C32: =B32/1500*1609 -> 0.31658564814814816 | D32: 0.65347222222222223 | E32: 58
A33: Melissa Coyle | B33: 0.30416666666666664 | C33: =B33/1500*1609 -> 0.32626944444444445 | D33: 0.65486111111111112 | E33: 59
A34: Katy Benito | B34: 0.30416666666666664 | C34: =B34/1500*1609 -> 0.32626944444444445 | D34: 0.66319444444444442 | E34: 60

A1: NAME | B1: 1500 | C1: MILE | D1: TIME | E1: PACE | F1: PL | G1: PREV
A3: 8:20 FROSH BOYS
A5: O'MIN QWON | D5: 0.50416666666666665 | F5: 18
A6: STEVEN KAMEN | D6: 0.50763888888888886 | F6: 22
A7: AVI REUBEN | D7: 0.52013888888888882 | F7: 40
A8: ANT NOREN | D8: 0.52500000000000002 | F8: 46
A9: GERALD GOLDEN | D9: 0.51875000000000004 | F9: 36
A10: CHRIS HARRIS | D10: 0.62361111111111112 | F10: 94
A11: RYOSUKE SAIKA | D11: 0.54791666666666672 | F11: 65
A12: VATSAL SHAH | D12: 0.66597222222222219 | F12: 97
A14: 9:00 JV BOYS
A16: DAVID CARLSON | B16: 0.20208333333333331 | C16: =B16/1500*1609 -> 0.21676805555555551 | D16: 0.45277777777777778 | E16: =D16/2 -> 0.22638888888888889 | F16: 2 | G16: 0.50347222222222221
A17: QUENTIN LAMICQ | B17: 0.22916666666666666 | C17: =B17/1500*1609 -> 0.24581944444444445 | D17: 0.48194444444444445 | E17: =D17/2 -> 0.24097222222222223 | F17: 23
A18: MATT STANISLAWSKI | B18: 0.22013888888888888 | C18: =B18/1500*1609 -> 0.23613564814814816 | D18: 0.4770833333333333 | E18: =D18/2 -> 0.23854166666666665 | F18: 16 | G18: 0.51388888888888895
A19: ALEX RYDEN | B19: 0.21666666666666667 | C19: =B19/1500*1609 -> 0.2324111111111111 | D19: 0.47847222222222219 | E19: =D19/2 -> 0.23923611111111109 | F19: 18
A20: CHRIS RUBADUE | B20: 0.22847222222222222 | C20: =B20/1500*1609 -> 0.24507453703703705 | D20: 0.49513888888888885 | E20: =D20/2 -> 0.24756944444444443 | F20: 41
A21: JOSH GILL | B21: 0.22916666666666666 | C21: =B21/1500*1609 -> 0.24581944444444445 | D21: 0.51249999999999996 | E21: =D21/2 -> 0.25624999999999998 | F21: 62
A22: SO ADACHI | B22: 0.23611111111111113 | C22: =B22/1500*1609 -> 0.25326851851851856 | D22: 0.51041666666666663 | E22: =D22/2 -> 0.25520833333333331 | F22: 61 | G22: 0.53541666666666665
A23: WILL SOMERVELL | B23: 0.23958333333333334 | C23: =B23/1500*1609 -> 0.25699305555555557 | D23: 0.51736111111111105 | E23: =D23/2 -> 0.25868055555555552 | F23: 72 | G23: 0.5854166666666667
A24: JOE HUNTER | B24: 0.22361111111111109 | C24: =B24/1500*1609 -> 0.23986018518518518 | D24: 0.50763888888888886 | E24: =D24/2 -> 0.25381944444444443 | F24: 60
A25: STEVEN WANCEWICZ | B25: 0.23333333333333331 | C25: =B25/1500*1609 -> 0.25028888888888884 | D25: 0.51527777777777783 | E25: =D25/2 -> 0.25763888888888892 | F25: 68 | G25: 0.54513888888888895
A26: AARON BERCOVITCH | B26: 0.23958333333333334 | C26: =B26/1500*1609 -> 0.25699305555555557 | D26: 0.53263888888888888 | E26: =D26/2 -> 0.26631944444444444 | F26: 91 | G26: 0.58402777777777781
A27: PETER BENTIO | B27: 0.24930555555555556 | C27: =B27/1500*1609 -> 0.26742175925925926 | D27: 0.53472222222222221 | E27: =D27/2 -> 0.2673611111111111 | F27: 97 | G27: 0.65069444444444446
A28: TAYLOR DAVIS | B28: 0.22916666666666666 | C28: =B28/1500*1609 -> 0.24581944444444445 | D28: 0.48680555555555555 | E28: =D28/2 -> 0.24340277777777777 | F28: 34
A29: BRANDON LAVORGNA | B29: 0.24930555555555556 | C29: =B29/1500*1609 -> 0.26742175925925926 | D29: 0.54236111111111118 | E29: =D29/2 -> 0.27118055555555559 | F29: 104
A30: BRETT RAMIN | B30: 0.27916666666666667 | C30: =B30/1500*1609 -> 0.29945277777777779 | D30: 0.59375 | E30: =D30/2 -> 0.296875 | F30: 130 | G30: 0.70833333333333337
A31: DANNY NELSON | B31: 0.25972222222222224 | C31: =B31/1500*1609 -> 0.27859537037037041 | D31: 0.55625000000000002 | E31: =D31/2 -> 0.27812500000000001 | F31: 114
A32: BRENT HARVEY | B32: 0.27152777777777776 | C32: =B32/1500*1609 -> 0.29125879629629625 | D32: 0.5805555555555556 | E32: =D32/2 -> 0.2902777777777778 | F32: 123
A34: 9:40 VARSITY BOYS
A36: COLTON TULLY-DOYLE | B36: 0.19236111111111112 | C36: =B36/1500*1609 -> 0.20633935185185187 | D36: 0.4069444444444445 | E36: =D36/2 -> 0.20347222222222225 | F36: 2 | G36: 0.43125000000000002
A37: CARL DARGITZ | B37: 0.19236111111111112 | C37: =B37/1500*1609 -> 0.20633935185185187 | D37: 0.40763888888888888 | E37: =D37/2 -> 0.20381944444444444 | F37: 3 | G37: 0.45208333333333334
A38: JAKE WERTNER | B38: NR | G38: 0.45624999999999999
A39: JARED FENLASON | B39: 0.20138888888888887 | C39: =B39/1500*1609 -> 0.2160231481481481 | D39: 0.42777777777777781 | E39: =D39/2 -> 0.21388888888888891 | F39: 23 | G39: 0.47083333333333338
A40: BRYCE HOLEWINSKI | B40: 0.20347222222222219 | C40: =B40/1500*1609 -> 0.21825787037037037 | D40: 0.43541666666666662 | E40: =D40/2 -> 0.21770833333333331 | F40: 28 | G40: 0.46388888888888885
A41: SEAN PROEHL | B41: 0.20624999999999999 | C41: =B41/1500*1609 -> 0.22123749999999998 | D41: 0.44027777777777777 | E41: =D41/2 -> 0.22013888888888888 | F41: 33 | G41: 0.49027777777777781
A42: DREW FLOOD | B42: 0.20416666666666669 | C42: =B42/1500*1609 -> 0.2190027777777778 | D42: 0.44305555555555554 | E42: =D42/2 -> 0.22152777777777777 | F42: 39 | G42: 0.49027777777777781
A43: CHRIS NOREN | D43: 0.4513888888888889 | E43: =D43/2 -> 0.22569444444444445 | F43: 46 | G43: 0.47152777777777777