A1: 8:00 D1 GIRLS VARSITY | B1: 10:00 D II GIRLS VARSITY
A2: 8:20 D1 BOYS VARSITY | B2: 10:20 D II BOYS VARSITY
A3: 8:40 D1 GIRLS 9/10 | B3: 10:40 D II GIRLS 9/10
A4: 9:00 D1 BOYS 9/10 | B4: 11:00 D II BOYS 9/10
A5: 9:20 D1 GIRLS 11/12 | B5: 11:20 D II GIRLS 11/12
A6: 9:40 D1 BOYS 11/12 | B6: 11:40 D II BOYS 11/12

A1: 1 | B1: KATY ANDREWS | C1: LCC | D1: 0.48402777777777778
A2: 2 | B2: MEGAN MORGAN | C2: TP | D2: 0.48819444444444443
A3: 3 | B3: ERIN GILLINGHAM | C3: TP | D3: 0.48888888888888887
A4: 4 | B4: CAROLINE DRAPER | C4: RB | D4: 0.4909722222222222
A5: 5 | B5: ALLI BILLMEYER | C5: TP | D5: 0.49236111111111108
A6: 6 | B6: MOLLY GRABILL | C6: RB | D6: 0.49375000000000002
A7: 7 | B7: PAIGE RACKLEY | C7: LCC | D7: 0.49722222222222223
A8: 8 | B8: ANA PRIM | C8: TP | D8: 0.4993055555555555
A9: 9 | B9: KIRSTEN MOORE | C9: C'BAD | D9: 0.50763888888888886
A10: 10 | B10: EMILY OSGA | C10: PH | D10: 0.51041666666666663
A11: 11 | B11: ERIN MENEFEE | C11: MC | D11: 0.51111111111111118
A12: 12 | B12: ALICIA TRUJILLO | C12: WV | D12: 0.51111111111111118
A13: 13 | B13: LINDSAY VALDEZ | C13: MC | D13: 0.5131944444444444
A14: 14 | B14: CHELSEA MUMBY | C14: WV | D14: 0.51458333333333328
A15: 15 | B15: COURTNEY CLARK | C15: LCC | D15: 0.51458333333333328
A16: 16 | B16: SHELBY SIMS | C16: TP | D16: 0.51666666666666672
A17: 17 | B17: PHOEBE HARTNETT | C17: PH | D17: 0.52083333333333337
A18: 18 | B18: KATIE MARTIN | C18: EL CAP | D18: 0.52361111111111114
A19: 19 | B19: ALICIA PARK | C19: SP | D19: 0.52916666666666667
A20: 20 | B20: RACHEL OHMAN | C20: TP | D20: 0.52916666666666667
A21: 21 | B21: MICHELLE BLACK | C21: RB | D21: 0.53055555555555556
A22: 22 | B22: MCKENNA PLANT | C22: SP | D22: 0.53333333333333333
A23: 23 | B23: LILIANA INIESTRA | C23: SP | D23: 0.53333333333333333
A24: 24 | B24: KELSEY SHIELDS | C24: RAM | D24: 0.53402777777777777
A25: 25 | B25: ELISE RANKIN | C25: WV | D25: 0.53402777777777777
A26: 26 | B26: ROXY ALEI | C26: LCC | D26: 0.53541666666666665
A27: 27 | B27: CASSIE WICOFF | C27: RB | D27: 0.53888888888888886
A28: 28 | B28: KRISTA EGENSE | C28: RB | D28: 0.54166666666666663
A29: 29 | B29: JAMIE FERGUSEN | C29: EL CAP | D29: 0.54513888888888895
A30: 30 | B30: BRANDI ARREDONDO | C30: WV | D30: 0.54583333333333328
A31: 31 | B31: MICHELLE THOMPSON | C31: MC | D31: 0.54861111111111105
A32: 32 | B32: HEIDI SWANSON | C32: EL CAP | D32: 0.54861111111111105
A33: 33 | B33: SAM BELOM | C33: EL CAM | D33: 0.5493055555555556
A34: 34 | B34: BRITTANY BALCOM | C34: RAM | D34: 0.5493055555555556
A35: 35 | B35: COURTNEY HEDGECOCK | C35: MC | D35: 00.55
A36: 36 | B36: KATIE KANE | C36: WV | D36: 0.55069444444444449
A37: 37 | B37: KATHLEEN MCGREGOR | C37: POW | D37: 0.55069444444444449
A38: 38 | B38: CARLI KIERSTEAD | C38: PH | D38: 0.55208333333333337
A39: 39 | B39: RACHEL HARRINGTON | C39: LCC | D39: 0.55208333333333337
A40: 40 | B40: LEAH SANDOVAL | C40: SP | D40: 0.55347222222222225
A41: 41 | B41: RILEY YAHR | C41: TP | D41: 0.5541666666666667
A42: 42 | B42: MELANIE CONSIGLIO | C42: EL CAM | D42: 0.5541666666666667
A43: 43 | B43: CHELSEY CORTEZ | C43: RAM | D43: 0.55486111111111114
A44: 44 | B44: CAILA PILO | C44: SP | D44: 0.55625000000000002
A45: 45 | B45: NINA SCHEEPERS | C45: RB | D45: 0.55694444444444446
A46: 46 | B46: KELSEY MOYERS | C46: C'BAD | D46: 0.55833333333333335
A47: 47 | B47: LIZZY LORENTZ | C47: POW | D47: 0.55833333333333335
A48: 48 | B48: EMMA ARCHULETA | C48: POW | D48: 0.55833333333333335
A49: 49 | B49: KIERSTAN IWAI | C49: MC | D49: 0.56041666666666667
A50: 50 | B50: ROBIN KOTOW | C50: WV | D50: 0.56180555555555556
A51: 51 | B51: COURTNEY HANN | C51: C'BAD | D51: 0.56388888888888888
A52: 52 | B52: TARA SHOECRAFT | C52: WV | D52: 0.56458333333333333
A53: 53 | B53: DANI MATONIS | C53: POW | D53: 0.56458333333333333
A54: 54 | B54: KELSEE RAMSEY | C54: EL CAP | D54: 0.56597222222222221
A55: 55 | B55: OLIVIA KRZEMINSKI | C55: RB | D55: 0.56805555555555554
A56: 56 | B56: EMILY PARKER | C56: PH | D56: 0.56874999999999998
A57: 57 | B57: PATRICE WATSON | C57: TP | D57: 0.5708333333333333
A58: 58 | B58: LEAH ELKIND | C58: LCC | D58: 0.57152777777777775
A59: 59 | B59: LEIGH MARTIN | C59: PH | D59: 0.57430555555555551
A60: 60 | B60: ALEX MORGAN | C60: MC | D60: 0.57499999999999996
A61: 61 | B61: KALIN SOMMER | C61: TP | D61: 0.57499999999999996
A62: 62 | B62: KENDRA KEENAN | C62: LCC | D62: 0.57638888888888895
A63: 63 | B63: SARAH GEORGE | C63: MC | D63: 0.57777777777777783
A64: 64 | B64: MORGAN GOLUMBUK | C64: PH | D64: 0.57916666666666672
A65: 65 | B65: LINDSEY SPIKER | C65: RAM | D65: 0.57986111111111105
A66: 66 | B66: BROOKE BROWN | C66: EL CAM | D66: 0.5805555555555556
A67: 67 | B67: CHELSEA MAURER | C67: RAM | D67: 0.58402777777777781
A68: 68 | B68: LAURA DUENSING | C68: MC | D68: 0.5854166666666667
A69: 69 | B69: LINDSEY BAUER | C69: POW | D69: 0.58750000000000002
A70: 70 | B70: TESSA BALCOM | C70: RAM | D70: 0.58819444444444446
A71: 71 | B71: CUALLI HERNANDEZ | C71: EL CAP | D71: 0.58888888888888891
A72: 72 | B72: KARA YAP | C72: RB | D72: 0.58888888888888891
A73: 73 | B73: KAYLIE BELK | C73: C'BAD | D73: 0.59027777777777779
A74: 74 | B74: MILLIE BEETHAM | C74: C'BAD | D74: 0.59097222222222223
A75: 75 | B75: CECILIA BEAUCHAMP | C75: C'BAD | D75: 0.59652777777777777
A76: 76 | B76: HOLLY NGUYEN | C76: PH | D76: 0.59930555555555554
A77: 77 | B77: RACHEL RUPLE | C77: C'BAD | D77: 0.60416666666666663
A78: 78 | B78: LEIGHA SASSER | C78: POW | D78: 0.60555555555555551
A79: 79 | B79: MEGAN WALLER | C79: POW | D79: 0.60972222222222217
A80: 80 | B80: KIM FRANKLIN | C80: RAM | D80: 0.61250000000000004
A81: 81 | B81: KINSEY SHELBY | C81: RAM | D81: 0.61597222222222225

A1: 1 | B1: KENNETH RAEDEL | C1: SP | D1: 0.41805555555555557
A2: 2 | B2: PARKER STINSON | C2: RB | D2: 0.41875000000000001
A3: 3 | B3: SAM ST. LAURENT | C3: EL CAM | D3: 0.42222222222222222
A4: 4 | B4: DEAN MANLEY | C4: RAM | D4: 0.42708333333333331
A5: 5 | B5: ADRIAN RAFIEE | C5: PH | D5: 0.4284722222222222
A6: 6 | B6: GREGOR LLOYD-SMITH | C6: TP | D6: 0.42986111111111108
A7: 7 | B7: KYLE PHIPPS | C7: EL CAP | D7: 0.43055555555555558
A8: 8 | B8: DIEGO VEGA | C8: OG | D8: 0.43055555555555558
A9: 9 | B9: KELLEN BLUMBERG | C9: PH | D9: 0.43194444444444446
A10: 10 | B10: SEAN PROEHL | C10: RB | D10: 0.43263888888888885
A11: 11 | B11: ZAC COMER | C11: EL CAM | D11: 0.43611111111111112
A12: 12 | B12: TAYLOR TURNER | C12: C'BAD | D12: 0.4381944444444445
A13: 13 | B13: CASPER JAKOBSEN | C13: C'BAD | D13: 0.43888888888888888
A14: 14 | B14: DREW FLOOD | C14: RB | D14: 0.44027777777777777
A15: 15 | B15: CHRIS FABIAN | C15: RAM | D15: 0.44166666666666665
A16: 16 | B16: DILLON JACK | C16: TP | D16: 0.44374999999999998
A17: 17 | B17: ERIK FIGGE | C17: PH | D17: 0.4458333333333333
A18: 18 | B18: MATT LENEHAN | C18: TP | D18: 0.4458333333333333
A19: 19 | B19: KYLE STEPHAN | C19: WV | D19: 0.4458333333333333
A20: 20 | B20: DEXTER WOOD | C20: EL CAM | D20: 0.44722222222222219
A21: 21 | B21: JEREMY BLACK | C21: TP | D21: 0.44791666666666669
A22: 22 | B22: CHRIS TORRES | C22: EL CAP | D22: 0.44861111111111113
A23: 23 | B23: MIKE GREER | C23: SP | D23: 0.44930555555555557
A24: 24 | B24: OLIVER ORTLIEB | C24: SP | D24: 00.45
A25: 25 | B25: JOHN FOSTER | C25: SP | D25: 0.45069444444444445
A26: 26 | B26: JACOB WOOD | C26: MC | D26: 0.45069444444444445
A27: 27 | B27: NICK BEDROSIAN | C27: EL CAP | D27: 0.4513888888888889
A28: 28 | B28: DANIEL CLARK | C28: C'BAD | D28: 0.45208333333333334
A29: 29 | B29: MICHEAL ROMERO | C29: POW | D29: 0.45277777777777778
A30: 30 | B30: ALEX JAFEK | C30: TP | D30: 0.45347222222222222
A31: 31 | B31: ANDREW COCHRAN | C31: C'BAD | D31: 0.45347222222222222
A32: 32 | B32: ROSS CANDALORE | C32: RB | D32: 0.45416666666666666
A33: 33 | B33: KYLE UEYAMA | C33: MC | D33: 0.45416666666666666
A34: 34 | B34: JESUS PASCUAL | C34: EL CAM | D34: 0.4548611111111111
A35: 35 | B35: RYAN KEEGAN | C35: C'BAD | D35: 0.4548611111111111
A36: 36 | B36: UNKNOWN RUNNER | D36: 0.45555555555555555
A37: 37 | B37: CHRIS PERFILI | C37: SP | D37: 0.45555555555555555
A38: 38 | B38: AARON FENLASON | C38: RB | D38: 0.45624999999999999
A39: 39 | B39: ANDREW COCHRAN? | C39: C'BAD | D39: 0.45624999999999999
A40: 40 | B40: ALEC WEBSTER | C40: TP | D40: 0.45694444444444443
A41: 41 | B41: RYAN AUGST | C41: MC | D41: 0.45763888888888887
A42: 42 | B42: KYLE MORAN | C42: EL CAP | D42: 0.45763888888888887
A43: 43 | B43: DAVID MCEACHERN | C43: MC | D43: 0.45833333333333331
A44: 44 | B44: FELIX MARTINEZ | C44: PH | D44: 0.45833333333333331
A45: 45 | B45: WILL MUMBY | C45: WV | D45: 0.45833333333333331
A46: 46 | B46: EDWIN GONZALEZ | C46: EL CAM | D46: 0.45902777777777781
A47: 47 | B47: MORGAN HARPENAU | C47: MC | D47: 0.4604166666666667
A48: 48 | B48: COSTNER MCINTOSH | C48: PH | D48: 0.4604166666666667
A49: 49 | B49: MATT COOK | C49: EL CAM | D49: 0.46111111111111108
A50: 50 | B50: CHRIS EGGETT | C50: PH | D50: 0.46180555555555558
A51: 51 | B51: DAN MALONE | C51: MC | D51: 0.46180555555555558
A52: 52 | B52: RYAN MCMONIGLE | C52: PH | D52: 0.46180555555555558
A53: 53 | B53: JAMES PEASE | C53: C'BAD | D53: 0.46250000000000002
A54: 54 | B54: KEVIN SCHUBERT | C54: RB | D54: 0.46250000000000002
A55: 55 | B55: ROBERT SMITH | C55: WV | D55: 0.46319444444444446
A56: 56 | B56: MATT JOHNSON | C56: MC | D56: 0.46319444444444446
A57: 57 | B57: NATHAN DANCHER | C57: TP | D57: 0.46319444444444446
A58: 58 | B58: ANDREW MCCLANAHAN | C58: MC | D58: 0.46319444444444446
A59: 59 | B59: RYAN MOUREY | C59: POW | D59: 0.46319444444444446
A60: 60 | B60: ADAM MAXWELL | C60: PH | D60: 0.46319444444444446
A61: 61 | B61: DANA WALTERS | C61: LCC | D61: 0.46597222222222223
A62: 62 | B62: JAMES PATTERSON | C62: TP | D62: 0.46666666666666662
A63: 63 | B63: MARK EDSTROM | C63: POW | D63: 0.46666666666666662
A64: 64 | B64: MASON WESTPHAL | C64: RAM | D64: 0.46736111111111112
A65: 65 | B65: ZACK TEAL | C65: POW | D65: 0.46736111111111112
A66: 66 | B66: PAUL REYNOLDS | C66: RAM | D66: 0.4680555555555555
A67: 67 | B67: MIKE DEVAN | C67: EL CAP | D67: 0.46875
A68: 68 | B68: MAX HUGHES | C68: RAM | D68: 0.47152777777777777
A69: 69 | B69: RYAN ADAMS | C69: POW | D69: 0.47291666666666665
A70: 70 | B70: MILES SEGNI | C70: EL CAP | D70: 0.47361111111111115
A71: 71 | B71: CHRIS NOBLE | C71: EL CAM | D71: 0.47361111111111115
A72: 72 | B72: KENNY STEVENSON | C72: EL CAP | D72: 0.47361111111111115
A73: 73 | B73: JORDAN WESTLEY | C73: POW | D73: 0.47430555555555554
A74: 74 | B74: JOSEPH LYON | C74: TP | D74: 0.47569444444444442
A75: 75 | B75: DOMINIC RENTZ | C75: MC | D75: 0.47569444444444442
A76: 76 | B76: NICK HAINES | C76: PH | D76: 0.4777777777777778
A77: 77 | B77: NATHAN NAREVSKY | C77: POW | D77: 0.4777777777777778
A78: 78 | B78: DAVID GARFINKEL | C78: LCC | D78: 0.47847222222222219
A79: 79 | B79: VASTAL SHAH | C79: RB | D79: 0.47986111111111113
A80: 80 | B80: ERIC SHEN | C80: WV | D80: 0.48541666666666666
A81: 81 | B81: SPENCER DYER | C81: LCC | D81: 0.4861111111111111
A82: 82 | B82: ERIC ALLEN | C82: WV | D82: 0.48680555555555555
A83: 83 | B83: JOSH HAGER | C83: RAM | D83: 0.48749999999999999
A84: 84 | B84: JOSH BLESSING | C84: WV | D84: 0.50694444444444442
A85: 85 | B85: MATT NEWMAN | C85: LCC | D85: 0.5131944444444444
A86: 86 | B86: CRAIG WISON | C86: POW | D86: 0.52986111111111112

A1: 1 | B1: MICHELLE | C1: LEROUX | D1: RB | E1: 0.53680555555555554
A2: =A1+1 -> 2 | B2: ADRIANA | C2: RODRIGUEZ | D2: EL CAMINO | E2: 0.54097222222222219
A3: =A2+1 -> 3 | B3: MELLISA | C3: LEROUX | D3: RB | E3: 0.54236111111111118
A4: =A3+1 -> 4 | B4: JENNA | C4: BELKNAP | D4: POWAY | E4: 0.54583333333333328
A5: =A4+1 -> 5 | B5: ALLISON | C5: PROEHL | D5: RB | E5: 0.54861111111111105
A6: =A5+1 -> 6 | B6: SARA | C6: SEACAT | D6: TP | E6: 0.5493055555555556
A7: =A6+1 -> 7 | B7: LEAH | C7: STAMER | D7: TP | E7: 0.55138888888888882
A8: =A7+1 -> 8 | B8: HALEY | C8: STEELE | D8: POWAY | E8: 0.55277777777777781
A9: =A8+1 -> 9 | B9: HILLARY | C9: HALL | D9: WESTVIEW | E9: 0.55486111111111114
A10: =A9+1 -> 10 | B10: ANA | C10: MOHAMED-ZADEH | D10: RB | E10: 0.55625000000000002
A11: =A10+1 -> 11 | B11: AIMEE | C11: TRUJILLO | D11: POWAY | E11: 0.56319444444444444
A12: =A11+1 -> 12 | B12: KIMBERLEY | C12: MONROE | D12: POWAY | E12: 0.56388888888888888
A13: =A12+1 -> 13 | B13: N | C13: MARTINS-BOYTE | D13: WESTVIEW | E13: 0.56458333333333333
A14: =A13+1 -> 14 | B14: KELLI | C14: HALL | D14: SAN PASQUAL | E14: 0.56666666666666665
A15: =A14+1 -> 15 | B15: HEIDEE | C15: ORTIZ | D15: POWAY | E15: 0.58194444444444449
A16: =A15+1 -> 16 | B16: HANNAH | C16: KUESSNER | D16: SAN PASQUAL | E16: 0.58333333333333337
A17: =A16+1 -> 17 | B17: JENNIFER | C17: THOMPSON | D17: POWAY | E17: 0.58333333333333337
A18: =A17+1 -> 18 | B18: HANNAH | C18: KATKOV | D18: TP | E18: 0.58402777777777781
A19: =A18+1 -> 19 | B19: SAMANTHA | C19: GORDON | D19: CARLSBAD | E19: 0.5854166666666667
A20: =A19+1 -> 20 | B20: KASIE | C20: KENTON | D20: POWAY | E20: 0.58680555555555558
A21: =A20+1 -> 21 | B21: CIARA | C21: ROBILLARD | D21: PH | E21: 0.58958333333333335
A22: =A21+1 -> 22 | B22: KATIE | C22: RUPP | D22: EL CAMINO | E22: 0.59236111111111112
A23: =A22+1 -> 23 | B23: SIERRA | C23: HALL | D23: WESTVIEW | E23: 0.59444444444444444
A24: =A23+1 -> 24 | B24: CAROLINA | C24: REYES | D24: EL CAPITAN | E24: 0.59791666666666665
A25: =A24+1 -> 25 | B25: ERIN | C25: LENGERKE | D25: CARLSBAD | E25: 0.59930555555555554
A26: =A25+1 -> 26 | B26: GABI | C26: AL-SHAMMA | D26: LCC | E26: 0.60069444444444442
A27: =A26+1 -> 27 | B27: AMANDA | C27: LEE | D27: MC | E27: 0.60138888888888886
A28: =A27+1 -> 28 | B28: KELLY | C28: CRABS | D28: TP | E28: 0.60138888888888886
A29: =A28+1 -> 29 | B29: ERIN | C29: FINK | D29: PH | E29: 0.6020833333333333
A30: =A29+1 -> 30 | B30: JESSICA | C30: TAMAYO | D30: EL CAMINO | E30: 0.6020833333333333
A31: =A30+1 -> 31 | B31: MADELINE | C31: WAHL | D31: RB | E31: 0.60277777777777775
A32: =A31+1 -> 32 | B32: SYDNIE | C32: GREENFIELD | D32: SAN PASQUAL | E32: 0.60555555555555551
A33: =A32+1 -> 33 | B33: JACLYN | C33: GUTIERREZ | D33: PH | E33: 0.60624999999999996
A34: =A33+1 -> 34 | B34: NICOLE | C34: WYPYCHOWSKI | D34: TP | E34: 0.6069444444444444
A35: =A34+1 -> 35 | B35: ANNIE | C35: DHANENS | D35: TP | E35: 0.60763888888888895
A36: =A35+1 -> 36 | B36: ASHLEY | C36: NESTOJKO | D36: MC | E36: 0.60902777777777783
A37: =A36+1 -> 37 | B37: NICHOLETTE | C37: CASTRO | D37: POWAY | E37: 0.6118055555555556
A38: =A37+1 -> 38 | B38: CARA | C38: PURCELL | D38: TP | E38: 0.61319444444444449
A39: =A38+1 -> 39 | B39: MARISA | C39: CARRION | D39: LCC | E39: 0.61388888888888882
A40: =A39+1 -> 40 | B40: CALLIE | C40: BARAMKI-AZAR | D40: WESTVIEW | E40: 0.61388888888888882
A41: =A40+1 -> 41 | B41: BROOKE | C41: HARTLEY BOYKO | D41: CARLSBAD | E41: 0.61597222222222225
A42: =A41+1 -> 42 | B42: JENNY | C42: BLACK | D42: TP | E42: 0.62222222222222223
A43: =A42+1 -> 43 | B43: DANIELLE | C43: HARA | D43: WESTVIEW | E43: 0.62222222222222223
A44: =A43+1 -> 44 | B44: ALICIA | C44: BARTICK | D44: MC | E44: 0.62222222222222223
A45: =A44+1 -> 45 | B45: ASHLEY | C45: ZUNIGA | D45: SAN PASQUAL | E45: 0.62291666666666667
A46: =A45+1 -> 46 | B46: CHIKA | C46: HIRAI | D46: TP | E46: 0.62291666666666667
A47: =A46+1 -> 47 | B47: BECCA | C47: DEHNEL | D47: EL CAPITAN | E47: 0.62361111111111112
A48: =A47+1 -> 48 | B48: GENEVIVE | C48: STONE | D48: POWAY | E48: 0.62430555555555556
A49: =A48+1 -> 49 | B49: KATIE | C49: BELL WHEELOCK | D49: SAN PASQUAL | E49: 0.62569444444444444
A50: =A49+1 -> 50 | B50: ZOE | C50: RHETT | D50: TP | E50: 0.62569444444444444
A51: =A50+1 -> 51 | B51: BRIANNA | C51: GIVAS | D51: CARLSBAD | E51: 0.62847222222222221
A52: =A51+1 -> 52 | B52: JORDAN | C52: SWEEZEY | D52: WESTVIEW | E52: 0.63124999999999998
A53: =A52+1 -> 53 | B53: TAYLOR | C53: DEISINEYER | D53: CARLSBAD | E53: 0.63194444444444442
A54: =A53+1 -> 54 | B54: JEN | C54: DUMIAK | D54: LCC | E54: 0.6333333333333333
A55: =A54+1 -> 55 | B55: MEGAN | C55: RIGBY | D55: WESTVIEW | E55: 0.63472222222222219
A56: =A55+1 -> 56 | B56: PAIGE | C56: FRANKLIN | D56: POWAY | E56: 0.63541666666666663
A57: =A56+1 -> 57 | B57: CECILIE | C57: ARCAMO | D57: EL CAPITAN | E57: 0.63541666666666663
A58: =A57+1 -> 58 | B58: SARAH | C58: CALLAN | D58: RAMONA | E58: 0.63680555555555551
A59: =A58+1 -> 59 | B59: SARAH | C59: LEAVITT | D59: WESTVIEW | E59: 0.63680555555555551
A60: =A59+1 -> 60 | B60: LAUREN | C60: WAAGE | D60: TP | E60: 0.63888888888888895
A61: =A60+1 -> 61 | B61: CHRISTINE | C61: CARSON | D61: CARLSBAD | E61: 0.63958333333333328
A62: =A61+1 -> 62 | B62: SANA | C62: MARZOVQ | D62: RB | E62: 0.64027777777777783
A63: =A62+1 -> 63 | B63: DAWN | C63: JACKSON | D63: EL CAPITAN | E63: 0.64097222222222217
A64: =A63+1 -> 64 | B64: CARLY | C64: ANDLAVER | D64: CARLSBAD | E64: 0.64166666666666672
A65: =A64+1 -> 65 | B65: KIM | C65: MASON | D65: PH | E65: 0.64375000000000004
A66: =A65+1 -> 66 | B66: JASMINE | C66: FRYREAR | D66: PH | E66: 0.64444444444444449
A67: =A66+1 -> 67 | B67: SIDNEY | C67: VAN PUTTEN | D67: POWAY | E67: 0.64513888888888882
A68: =A67+1 -> 68 | B68: LIZ | C68: EDELMAN | D68: TP | E68: 0.64722222222222225
A69: =A68+1 -> 69 | B69: DORIT | C69: STEIN | D69: TP | E69: 0.64930555555555558
A70: =A69+1 -> 70 | B70: JACLYN | C70: HANSON | D70: RB | E70: 00.65
A71: =A70+1 -> 71 | B71: MARISA | C71: CLAUDIO | D71: POWAY | E71: 00.65
A72: =A71+1 -> 72 | B72: CYNTHIA | C72: FLORES | D72: MC | E72: 0.65069444444444446
A73: =A72+1 -> 73 | B73: CHELSEA | C73: SNOW | D73: LCC | E73: 0.65208333333333335
A74: =A73+1 -> 74 | B74: HANNA | C74: MOORE | D74: CARLSBAD | E74: 0.65277777777777779
A75: =A74+1 -> 75 | B75: YADIRA | C75: MOLINA | D75: POWAY | E75: 0.65416666666666667
A76: =A75+1 -> 76 | B76: BARBARA | C76: SUGARMAN | D76: WESTVIEW | E76: 0.65416666666666667
A77: =A76+1 -> 77 | B77: MALLORY | C77: MURPHY | D77: TP | E77: 0.65902777777777777
A78: =A77+1 -> 78 | B78: HANNAH | C78: LIECHTY | D78: EL CAMINO | E78: 0.65486111111111112
A79: =A78+1 -> 79 | B79: SHANNON | C79: MULDERIG | D79: PH | E79: 0.65763888888888888
A80: =A79+1 -> 80 | B80: LIV | C80: WILLIAMS | D80: TP | E80: 0.65902777777777777
A81: =A80+1 -> 81 | B81: LIZ | C81: MONTGOMERY | D81: PH | E81: 0.65972222222222221
A82: =A81+1 -> 82 | B82: MEGHAN | C82: WILLIS | D82: EL CAPITAN | E82: 0.66041666666666665
A83: =A82+1 -> 83 | B83: NICOLE | C83: GARCIA | D83: MC | E83: 0.66041666666666665
A84: =A83+1 -> 84 | B84: KARINA | C84: MUNOZ | D84: SAN PASQUAL | E84: 0.66111111111111109
A85: =A84+1 -> 85 | B85: KATHY | C85: CHUNG | D85: EL CAPITAN | E85: 0.66180555555555554
A86: =A85+1 -> 86 | B86: JAMIE | C86: KAPLAN | D86: LCC | E86: 0.66666666666666663
A87: =A86+1 -> 87 | B87: HANNAH | C87: QUINTO | D87: RB | E87: 0.66874999999999996
A88: =A87+1 -> 88 | B88: HAYLEY | C88: PILKINGTON | D88: LCC | E88: 0.67222222222222217
A89: =A88+1 -> 89 | B89: AMANDA | C89: PURCELL | D89: PH | E89: 0.67361111111111116
A90: =A89+1 -> 90 | B90: KRYSTA | C90: MORTLAND | D90: CARLSBAD | E90: 0.6743055555555556
A91: =A90+1 -> 91 | B91: ALLISON | C91: ZHAO | D91: TP | E91: 0.67847222222222225
A92: =A91+1 -> 92 | B92: MICHELLE | C92: CHEN | D92: TP | E92: 0.68263888888888891
A93: =A92+1 -> 93 | B93: HALEY | C93: PETERSON | D93: RB | E93: 0.68472222222222223
A94: =A93+1 -> 94 | B94: COURTNEY | C94: WILMERS | D94: PH | E94: 0.68472222222222223
A95: =A94+1 -> 95 | B95: KANDICE | C95: NELSON | D95: MC | E95: 0.68611111111111101
A96: =A95+1 -> 96 | B96: CASEY | C96: CHILSOM | D96: RB | E96: 0.68888888888888899
A97: =A96+1 -> 97 | B97: ELIZABETH | C97: GAMBOA | D97: PH | E97: 0.68958333333333333
A98: =A97+1 -> 98 | B98: NICOLE | C98: LOVE | D98: WESTVIEW | E98: 0.69444444444444453
A99: =A98+1 -> 99 | B99: MCALL | C99: MISHIER | D99: CARLSBAD | E99: 0.69513888888888886
A100: =A99+1 -> 100 | B100: RACHEL | C100: PAUL | D100: SAN PASQUAL | E100: 0.69791666666666663
A101: =A100+1 -> 101 | B101: LINDSAY | C101: PETTIJOHN | D101: RB | E101: 00.7
A102: =A101+1 -> 102 | B102: RUTH | C102: MALINA | D102: RB | E102: 0.70486111111111116
A103: =A102+1 -> 103 | B103: HAILEY | C103: ALBERTSON | D103: WESTVIEW | E103: 0.70763888888888893
A104: =A103+1 -> 104 | B104: ANDREA | C104: REYES | D104: SAN PASQUAL | E104: 0.70972222222222225
A105: =A104+1 -> 105 | B105: KASONDRA | C105: CAMBELL | D105: LCC | E105: 0.7104166666666667
A106: =A105+1 -> 106 | B106: MONICA | C106: WILLIAMS | D106: PH | E106: 0.7104166666666667
A107: =A106+1 -> 107 | B107: ALANA | C107: THYGESON | D107: RAMONA | E107: 0.71388888888888891
A108: =A107+1 -> 108 | B108: EMMA | C108: KELLMAN | D108: MC | E108: 0.72083333333333333
A109: =A108+1 -> 109 | B109: MICHELLE | C109: NICOLAS | D109: CARLSBAD | E109: 0.72291666666666676
A110: =A109+1 -> 110 | B110: RYLIE | C110: ROSS | D110: LCC | E110: 0.72638888888888886
A111: =A110+1 -> 111 | B111: ALYSSA | C111: WERTNER | D111: RB | E111: 0.72638888888888886
A112: =A111+1 -> 112 | B112: JENNIFER | C112: LEEDY | D112: SAN PASQUAL | E112: 0.73055555555555562
A113: =A112+1 -> 113 | B113: KATHERINE | C113: MCBRIDE | D113: TP | E113: 0.73333333333333339
A114: =A113+1 -> 114 | B114: VICTORIA | C114: YUEN RAN | D114: PH | E114: 0.73402777777777783
A115: =A114+1 -> 115 | B115: KATELIN | C115: LIGNAV | D115: SAN PASQUAL | E115: 0.73750000000000004
A116: =A115+1 -> 116 | B116: GIANA | C116: PARISI | D116: SAN PASQUAL | E116: 0.74444444444444446
A117: =A116+1 -> 117 | B117: BRANDI | C117: ANTHONY | D117: RAMONA | E117: 0.74513888888888891
A118: =A117+1 -> 118 | B118: AMY | C118: THOMPSON | D118: SAN PASQUAL | E118: 0.7597222222222223
A119: =A118+1 -> 119 | B119: RACHAEL | C119: SCHELLY | D119: SAN PASQUAL | E119: 0.77708333333333324
A120: =A119+1 -> 120 | B120: ABBY | C120: BARENHOLTZ | D120: CARLSBAD | E120: 0.77777777777777779
A121: =A120+1 -> 121 | B121: MIRANDA | C121: ANDREASON | D121: TP | E121: 0.78611111111111109
A122: =A121+1 -> 122 | B122: RACHEL | C122: ROBLES | D122: TP | E122: 0.79236111111111107
A123: =A122+1 -> 123 | B123: SONALI | C123: KUMAR | D123: WESTVIEW | E123: 0.88749999999999996
A124: =A123+1 -> 124 | B124: BRITTANY | C124: BAKER | D124: EL CAPITAN | E124: 0.90972222222222221

A1: 1 | B1: RYAN | C1: URIE | D1: PH | E1: 0.44861111111111113
A2: =A1+1 -> 2 | B2: DAVID | C2: VASKO | D2: MC | E2: 0.45277777777777778
A3: =A2+1 -> 3 | B3: DYLAN | C3: WINGROVE | D3: SAN PASQUAL | E3: 0.46319444444444446
A4: =A3+1 -> 4 | B4: NIC | C4: BERGUM | D4: TP | E4: 0.46597222222222223
A5: =A4+1 -> 5 | B5: DEREK | C5: HOLDEN | D5: POWAY | E5: 0.46736111111111112
A6: =A5+1 -> 6 | B6: MATT | C6: RICHARDS | D6: EL CAMINO | E6: 0.4680555555555555
A7: =A6+1 -> 7 | B7: KYLE | C7: PLUTCHAK | D7: WV | E7: 0.46875
A8: =A7+1 -> 8 | B8: CASEY | C8: DUGAN | D8: PH | E8: 0.4694444444444445
A9: =A8+1 -> 9 | B9: ULISES | C9: MARIN | D9: EL CAMINO | E9: 0.47222222222222227
A10: =A9+1 -> 10 | B10: CONNER | C10: MCBRIDE | D10: TP | E10: 0.4770833333333333
A11: =A10+1 -> 11 | B11: TRAVIS | C11: LINDER | D11: RB | E11: 0.47916666666666669
A12: =A11+1 -> 12 | B12: GABRIELD | C12: BERKLAND | D12: POWAY | E12: 0.48055555555555557
A13: =A12+1 -> 13 | B13: AARON | C13: BARRANEO | D13: PH | E13: 0.48125000000000001
A14: =A13+1 -> 14 | B14: KEVIN | C14: CHEN | D14: WV | E14: 0.48125000000000001
A15: =A14+1 -> 15 | B15: CREE | C15: FARNES | D15: WV | E15: 0.4826388888888889
A16: =A15+1 -> 16 | B16: MARVIN | C16: MEDINA | D16: MC | E16: 0.48402777777777778
A17: =A16+1 -> 17 | B17: RYLEY | C17: WEBB | D17: RB | E17: 0.48472222222222222
A18: =A17+1 -> 18 | B18: ANTHONY | C18: GIROLAMO | D18: RB | E18: 0.48472222222222222
A19: =A18+1 -> 19 | B19: ROSCOE | C19: MILNER | D19: TP | E19: 0.48472222222222222
A20: =A19+1 -> 20 | B20: LIAM | C20: ACOSKA | D20: EC | E20: 0.48541666666666666
A21: =A20+1 -> 21 | B21: NATHAN | C21: MORGAN | D21: RAMONA | E21: 0.48680555555555555
A22: =A21+1 -> 22 | B22: CHANCE | C22: VAMADO-RICHARDSON | D22: RAMONA | E22: 0.48749999999999999
A23: =A22+1 -> 23 | B23: KEVIN | C23: HAUN | D23: CHS | E23: 0.48749999999999999
A24: =A23+1 -> 24 | B24: AUSTIN | C24: GREY | D24: POWAY | E24: 0.48958333333333331
A25: =A24+1 -> 25 | B25: ANDREW | C25: RICHARDSON | D25: CHS | E25: 0.48958333333333331
A26: =A25+1 -> 26 | B26: JUAN | C26: REYNOSO | D26: ORANGE GLEN | E26: 0.49305555555555558
A27: =A26+1 -> 27 | B27: EVAN | C27: ADAMS | D27: LCC | E27: 0.49305555555555558
A28: =A27+1 -> 28 | B28: RYAN | C28: JOHNSTON | D28: SAN PASQUAL | E28: 0.49305555555555558
A29: =A28+1 -> 29 | B29: RIO | C29: GALLEGOS | D29: POWAY | E29: 0.49375000000000002
A30: =A29+1 -> 30 | B30: CASEY | C30: OLSON | D30: WV | E30: 0.49375000000000002
A31: =A30+1 -> 31 | B31: JOSH | C31: CERVANTES | D31: EL CAMINO | E31: 0.49375000000000002
A32: =A31+1 -> 32 | B32: ROBERT | C32: BUTLEY | D32: SAN PASQUAL | E32: 0.49444444444444446
A33: =A32+1 -> 33 | B33: LUKE | C33: PIEDRICH | D33: PH | E33: 0.49444444444444446
A34: =A33+1 -> 34 | B34: KYLE | C34: COATE | D34: SAN PASQUAL | E34: 0.49444444444444446
A35: =A34+1 -> 35 | B35: RYAN | C35: HELSON | D35: POWAY | E35: 0.49583333333333335
A36: =A35+1 -> 36 | B36: IAN | C36: CABLE | D36: RB | E36: 0.49583333333333335
A37: =A36+1 -> 37 | B37: NICK | C37: BOLELLI | D37: WV | E37: 0.49583333333333335
A38: =A37+1 -> 38 | B38: KEVIN | C38: PORTER | D38: SAN PASQUAL | E38: 0.49791666666666662
A39: =A38+1 -> 39 | B39: JON | C39: VAZQUEZ | D39: PH | E39: 0.49861111111111112
A40: =A39+1 -> 40 | B40: TONY | C40: GARDELLA | D40: PH | E40: 0.49861111111111112
A41: =A40+1 -> 41 | B41: CONNER | C41: LACHENBRUCH | D41: RB | E41: 0.5
A42: =A41+1 -> 42 | B42: ALEX | C42: SOWA | D42: POWAY | E42: 0.5
A43: =A42+1 -> 43 | B43: JARED | C43: SERVANTEZ | D43: MC | E43: 0.5
A44: =A43+1 -> 44 | B44: JORDON | C44: AHOSTROM | D44: RB | E44: 0.50069444444444444
A45: =A44+1 -> 45 | B45: DOMINIC | C45: LUCISANO | D45: WV | E45: 0.50208333333333333
A46: =A45+1 -> 46 | B46: NICK | C46: TAMINADGE | D46: PH | E46: 0.50208333333333333
A47: =A46+1 -> 47 | B47: CONNER | C47: WYNUEEN | D47: PH | E47: 0.50277777777777777
A48: =A47+1 -> 48 | B48: RYAN | C48: JENSEN | D48: POWAY | E48: 0.50347222222222221
A49: =A48+1 -> 49 | B49: TODD | C49: CLARKE | D49: EL CAPP | E49: 0.50416666666666665
A50: =A49+1 -> 50 | B50: DANIEL | C50: VERA | D50: ORANGE GLEN | E50: 0.50624999999999998
A51: =A50+1 -> 51 | B51: JOE | C51: BARRESI | D51: POWAY | E51: 0.50624999999999998
A52: =A51+1 -> 52 | B52: JON | C52: HAINES | D52: PH | E52: 0.50763888888888886
A53: =A52+1 -> 53 | B53: TANNER | C53: BOISJOLIE | D53: EL CAMINO | E53: 0.50763888888888886
A54: =A53+1 -> 54 | B54: CONNER | C54: SCHUENDTROER | D54: CHS | E54: 0.50972222222222219
A55: =A54+1 -> 55 | B55: STEVEN | C55: GAGNIERE | D55: PH | E55: 0.51041666666666663
A56: =A55+1 -> 56 | B56: TYLER | C56: DOWNS | D56: PH | E56: 0.51249999999999996
A57: =A56+1 -> 57 | B57: BOBBY | C57: HEYER | D57: LCC | E57: 0.51249999999999996
A58: =A57+1 -> 58 | B58: JEFF | C58: MEYER | D58: POWAY | E58: 0.51249999999999996
A59: =A58+1 -> 59 | B59: VINCENT | C59: DEMARCO | D59: POWAY | E59: 0.5131944444444444
A60: =A59+1 -> 60 | B60: GEIR | C60: PHILLIPS | D60: LCC | E60: 0.51458333333333328
A61: =A60+1 -> 61 | B61: RICARDO | C61: RIVAS | D61: EL CAMINO | E61: 0.51527777777777783
A62: =A61+1 -> 62 | B62: ADAM | C62: FAISON | D62: POWAY | E62: 0.51527777777777783
A63: =A62+1 -> 63 | B63: ZACHARY | C63: BARBER | D63: POWAY | E63: 0.51527777777777783
A64: =A63+1 -> 64 | B64: RYAN | C64: MATONIS | D64: POWAY | E64: 0.51527777777777783
A65: =A64+1 -> 65 | B65: BRIAN | C65: YEE | D65: POWAY | E65: 0.51736111111111105
A66: =A65+1 -> 66 | B66: JUSTIN | C66: STASIUK | D66: EL CAMINO | E66: 0.5180555555555556
A67: =A66+1 -> 67 | B67: MIKE | C67: BUSH | D67: POWAY | E67: 0.5180555555555556
A68: =A67+1 -> 68 | B68: BRETT | C68: OSMUS | D68: POWAY | E68: 0.51944444444444449
A69: =A68+1 -> 69 | B69: PAUL | C69: KIM | D69: POWAY | E69: 0.52013888888888882
A70: =A69+1 -> 70 | B70: CORRY | C70: MACDONALD | D70: TP | E70: 0.52013888888888882
A71: =A70+1 -> 71 | B71: DANIEL | C71: FLUD | D71: POWAY | E71: 0.52013888888888882
A72: =A71+1 -> 72 | B72: NATHAN | C72: WHITE | D72: POWAY | E72: 0.52083333333333337
A73: =A72+1 -> 73 | B73: TODD | C73: MYERS | D73: RB | E73: 0.52152777777777781
A74: =A73+1 -> 74 | B74: TANNER | C74: PERFECT | D74: RAMONA | E74: 0.52152777777777781
A75: =A74+1 -> 75 | B75: DAVID | C75: WATSON | D75: PH | E75: 0.52222222222222225
A76: =A75+1 -> 76 | B76: MATT | C76: SMITH | D76: MC | E76: 0.5229166666666667
A77: =A76+1 -> 77 | B77: TYLER | C77: HAMES | D77: CHS | E77: 0.52430555555555558
A78: =A77+1 -> 78 | B78: BLAKE | C78: KING | D78: MC | E78: 0.52569444444444446
A79: =A78+1 -> 79 | B79: RYAN | C79: COOK | D79: EL CAMINO | E79: 0.52638888888888891
A80: =A79+1 -> 80 | C80: FOOTE | D80: POWAY | E80: 0.52638888888888891
A81: =A80+1 -> 81 | B81: ALEC | C81: BURGESS | D81: RB | E81: 0.52708333333333335
A82: =A81+1 -> 82 | B82: SEVERNE | C82: HEREDIA | D82: POWAY | E82: 0.52916666666666667
A83: =A82+1 -> 83 | B83: REGGIE | C83: SUNG | D83: WV | E83: 0.52986111111111112
A84: =A83+1 -> 84 | B84: ANDREW | C84: CAPATINA | D84: MC | E84: 0.52986111111111112
A85: =A84+1 -> 85 | B85: MILES | C85: SKINNER | D85: TP | E85: 0.52986111111111112
A86: =A85+1 -> 86 | B86: BLAKE | C86: WILSON | D86: TP | E86: 0.53055555555555556
A87: =A86+1 -> 87 | B87: CONNER | C87: JARAMILLO | D87: POWAY | E87: 0.53125
A88: =A87+1 -> 88 | B88: SAM | C88: HIROAKA | D88: TP | E88: 0.53125
A89: =A88+1 -> 89 | B89: TOM | C89: BRUICE | D89: CHS | E89: 0.53263888888888888
A90: =A89+1 -> 90 | B90: JON | C90: MCALEXANDER | D90: POWAY | E90: 0.53402777777777777
A91: =A90+1 -> 91 | B91: PHILIP | C91: WALTERS | D91: LCC | E91: 0.53472222222222221
A92: =A91+1 -> 92 | B92: MIKE | C92: GOODGER | D92: CHS | E92: 0.53541666666666665
A93: =A92+1 -> 93 | B93: TYLER | C93: JORDAN | D93: RAMONA | E93: 0.53541666666666665
A94: =A93+1 -> 94 | B94: JAMES | C94: MCPHEARON | D94: SAN PASQUAL | E94: 0.53541666666666665
A95: =A94+1 -> 95 | B95: JOHN | C95: KRAJCAR | D95: EL CAP | E95: 0.53611111111111109
A96: =A95+1 -> 96 | B96: LOUW | C96: SCHEEPERS | D96: RB | E96: 0.53611111111111109
A97: =A96+1 -> 97 | B97: JOE | C97: LUCAS | D97: LCC | E97: 0.53680555555555554
A98: =A97+1 -> 98 | B98: JON | C98: PUTMAN | D98: PH | E98: 0.53680555555555554
A99: =A98+1 -> 99 | B99: DAVID | C99: CLARK | D99: POWAY | E99: 0.53888888888888886
A100: =A99+1 -> 100 | B100: ROBERT | C100: MCENTIRE | D100: RB | E100: 0.53888888888888886
A101: =A100+1 -> 101 | B101: GRANT | C101: DRAPER | D101: SAN PASQUAL | E101: 0.5395833333333333
A102: =A101+1 -> 102 | B102: JEREMY | C102: CHAN | D102: LCC | E102: 0.5395833333333333
A103: =A102+1 -> 103 | B103: TYLER | C103: BUGEH | D103: CHS | E103: 0.54236111111111118
A104: =A103+1 -> 104 | B104: ANTHONY | C104: CAPITO | D104: SAN PASQUAL | E104: 0.54374999999999996
A105: =A104+1 -> 105 | B105: COLE | C105: CANEDY | D105: TP | E105: 0.5444444444444444
A106: =A105+1 -> 106 | B106: HOWARD | C106: NGUYEN | D106: PH | E106: 0.5444444444444444
A107: =A106+1 -> 107 | B107: COLIN | C107: BUELL | D107: BUELL | E107: 0.54652777777777783
A108: =A107+1 -> 108 | B108: KEVIN | C108: GANELIN | D108: CHS | E108: 0.54652777777777783
A109: =A108+1 -> 109 | B109: ALEC | C109: TORRES | D109: ORANGE GLEN | E109: 0.54722222222222217
A110: =A109+1 -> 110 | B110: DEVAN | C110: AGUILAR | D110: PH | E110: 0.5493055555555556
A111: =A110+1 -> 111 | B111: JOSH | C111: HANSEN | D111: LCC | E111: 0.5493055555555556
A112: =A111+1 -> 112 | B112: JAMES | C112: JORDAN | D112: EL CAMINO | E112: 00.55
A113: =A112+1 -> 113 | B113: JOEL | C113: RUCKLE | D113: WV | E113: 00.55
A114: =A113+1 -> 114 | B114: ADAM | C114: BARTEL | D114: CHS | E114: 00.55
A115: =A114+1 -> 115 | B115: NICHOLAS | C115: CUSTIS | D115: POWAY | E115: 0.55069444444444449
A116: =A115+1 -> 116 | B116: MAX | C116: LATIFI | D116: MC | E116: 0.55208333333333337
A117: =A116+1 -> 117 | B117: JAMES | C117: LOGAN | D117: MC | E117: 0.5541666666666667
A118: =A117+1 -> 118 | B118: AARON | C118: SEWELL | D118: EL CAP | E118: 0.55486111111111114
A119: =A118+1 -> 119 | B119: BILLY | C119: GILMONT | D119: EL CAMINO | E119: 0.55694444444444446
A120: =A119+1 -> 120 | B120: FELIX | C120: CRUZ | D120: EL CAMINO | E120: 0.55763888888888891
A121: =A120+1 -> 121 | B121: ROBERT | C121: SHEEHAN | D121: RB | E121: 0.56041666666666667
A122: =A121+1 -> 122 | B122: ZACH | C122: KAUFMAN | D122: RB | E122: 0.56041666666666667
A123: =A122+1 -> 123 | B123: CHAISE | C123: HORTON | D123: LCC | E123: 0.56319444444444444
A124: =A123+1 -> 124 | B124: ERIK | C124: ZSUTLY | D124: EL CAMINO | E124: 0.56388888888888888
A125: =A124+1 -> 125 | B125: GARRETT | C125: RUBENSTEIN | D125: CHS | E125: 0.56388888888888888
A126: =A125+1 -> 126 | B126: ANDREW | C126: BENEDICT-PHILLIPP | D126: PH | E126: 0.56458333333333333
A127: =A126+1 -> 127 | B127: ROSS | C127: CARSON | D127: TP | E127: 0.56527777777777777
A128: =A127+1 -> 128 | B128: NICK | C128: HINCAPIE | D128: LCC | E128: 0.56597222222222221
A129: =A128+1 -> 129 | B129: JACOB | C129: AMAN | D129: PH | E129: 0.56666666666666665
A130: =A129+1 -> 130 | B130: RYAN | C130: WORDAN | D130: RB | E130: 0.56874999999999998
A131: =A130+1 -> 131 | B131: GRANT | C131: GLAZER | D131: POWAY | E131: 0.57013888888888886
A132: =A131+1 -> 132 | B132: LANCE | C132: CLOTHEY | D132: EL CAP | E132: 0.5708333333333333
A133: =A132+1 -> 133 | B133: JAKE | C133: BROCKBANK | D133: RB | E133: 0.57291666666666663
A134: =A133+1 -> 134 | B134: NILS | C134: OLSSON | D134: PH | E134: 0.57361111111111118
A135: =A134+1 -> 135 | B135: TYLER | C135: VANDERSTEL | D135: POWAY | E135: 0.57499999999999996
A136: =A135+1 -> 136 | B136: ALEC | C136: ADAMSON | D136: MC | E136: 0.5756944444444444
A137: =A136+1 -> 137 | B137: ALAN | C137: BARRY | D137: SAN PASQUAL | E137: 0.57638888888888895
A138: =A137+1 -> 138 | B138: AARON | C138: GEISEL | D138: EL CAP | E138: 0.57638888888888895
A139: =A138+1 -> 139 | B139: MARK | C139: AEBEL | D139: EL CAMINO | E139: 0.58125000000000004
A140: =A139+1 -> 140 | B140: OREN | C140: LEE | D140: POWAY | E140: NT
A141: =A140+1 -> 141 | B141: DAVID | C141: WINSLOW | D141: PH | E141: NT
A142: =A141+1 -> 142 | B142: MICHAEL | C142: MOULLER | D142: POWAY | E142: NT
A143: =A142+1 -> 143 | B143: SAM | C143: PIERZINA | D143: MC | E143: NT
A144: =A143+1 -> 144 | B144: JOSEF | C144: MERKER | D144: SAN PASQUAL | E144: NT
A145: =A144+1 -> 145 | B145: ALEX | C145: FLOOD | D145: RB | E145: NT
A146: =A145+1 -> 146 | B146: JOSH | C146: DUTTON | D146: TP | E146: NT
A147: =A146+1 -> 147 | B147: DAVID | C147: MARTINEZ | D147: POWAY | E147: NT
A148: =A147+1 -> 148 | B148: NATHAN | C148: EAZER | D148: POWAY | E148: NT
A149: =A148+1 -> 149 | B149: HARRISON | C149: TONG | D149: TP | E149: NT
A150: =A149+1 -> 150 | B150: P | C150: SUTHERLAND | D150: WV | E150: NT
A151: =A150+1 -> 151 | B151: SKYLER | C151: WARREN | D151: RB | E151: NT
A152: =A151+1 -> 152 | B152: RHETT | C152: BAYNES | D152: LCC | E152: NT
A153: =A152+1 -> 153 | B153: CHRIS | C153: LANSVILLE | D153: POWAY | E153: NT
A154: =A153+1 -> 154 | B154: BEN | C154: WANCEWICZ | D154: RB | E154: NT
A155: =A154+1 -> 155 | B155: WESLEY | C155: PINGEL | D155: PH | E155: NT
A156: =A155+1 -> 156 | B156: DANIEL | C156: GORIN | D156: POWAY | E156: NT
A157: =A156+1 -> 157 | B157: A.J. | C157: TADAYAN | D157: LCC | E157: NT
A158: =A157+1 -> 158 | B158: ERIC | C158: BALDEWEIN | D158: POWAY | E158: NT
A159: =A158+1 -> 159 | B159: PHIL | C159: BALISTERI | D159: PH | E159: NT
A160: =A159+1 -> 160 | B160: JACKSON | C160: AUTRY | D160: EL CAP | E160: NT
A161: =A160+1 -> 161 | B161: LUKE | C161: PREIBISIUS | D161: PH | E161: NT
A162: =A161+1 -> 162 | B162: ANDREW | C162: NOLAND | D162: LCC | E162: NT
A163: =A162+1 -> 163 | B163: ZACK | C163: GUTTROFF | D163: LCC | E163: NT
A164: =A163+1 -> 164 | B164: BOBBY | C164: TAYLOR | D164: LCC | E164: NT
A165: =A164+1 -> 165 | B165: NEIL | C165: KANE | D165: POWAY | E165: NT
A166: =A165+1 -> 166 | B166: TYLER | C166: WELSH | D166: POWAY | E166: NT
A167: =A166+1 -> 167 | B167: JOSH | C167: DUDE | D167: SAN PASQUAL | E167: NT
A168: =A167+1 -> 168 | B168: BRANDON | C168: LERMA | D168: EL CAP | E168: NT
A169: =A168+1 -> 169 | B169: KEELAN | C169: BERGUM | D169: RAMONA | E169: NT
A170: =A169+1 -> 170 | B170: NICK | C170: WISSMAN | D170: CHS | E170: NT
A171: =A170+1 -> 171 | B171: JORDAN | C171: WOODS | D171: SAN PASQUAL | E171: NT
A172: =A171+1 -> 172 | B172: KELVIN | C172: DEAN | D172: PH | E172: NT
A173: =A172+1 -> 173 | B173: BRANDON | C173: JACKSON | D173: ORANGE GLEN | E173: NT
A174: =A173+1 -> 174 | B174: ROSS | C174: URRY | D174: SAN PASQUAL | E174: NT
A175: =A174+1 -> 175 | B175: WILLIAM | C175: DIAZ | D175: TP | E175: NT
A176: =A175+1 -> 176 | C176: WALLER | D176: POWAY | E176: NT
A177: =A176+1 -> 177 | B177: ZACKEY | C177: SAYRES | D177: POWAY | E177: NT
A178: =A177+1 -> 178 | B178: BRANDON | C178: KIMBRELL | D178: SAN PASQUAL | E178: NT
A179: =A178+1 -> 179 | B179: JESSE | C179: DUPONT | D179: SAN PASQUAL | E179: NT
A180: =A179+1 -> 180 | B180: JUSTIN | C180: TODD | D180: RB | E180: NT

A1: 1 | B1: DIANA | C1: BECKER | D1: SAN PASQUAL | E1: 0.5625
A2: =A1+1 -> 2 | B2: JESSICA | C2: BOYLE | D2: SAN PASQUAL | E2: 0.56597222222222221
A3: =A2+1 -> 3 | B3: TAYLOR | C3: PARKER | D3: RANCHO BERNARDO | E3: 0.57708333333333328
A4: =A3+1 -> 4 | B4: NATALIE | C4: UDUWELA | D4: RANCHO BERNARDO | E4: 0.57847222222222217
A5: =A4+1 -> 5 | B5: DANA | C5: MOHAMED-ZADEH | D5: RANCHO BERNARDO | E5: 0.58750000000000002
A6: =A5+1 -> 6 | B6: STEPHANIE | C6: FARMER | D6: TORREY PINES | E6: 0.58819444444444446
A7: =A6+1 -> 7 | B7: NATALIE | C7: LUNA | D7: MOUNT CARMEL | E7: 0.58888888888888891
A8: =A7+1 -> 8 | B8: SUSI | C8: BLASEIO | D8: TORREY PINES | E8: 0.59375
A9: =A8+1 -> 9 | B9: REBECCA | C9: WAID | D9: EL CAMINO | E9: 0.59513888888888888
A10: =A9+1 -> 10 | B10: ALYSSA | C10: SEMERDJIAN | D10: TORREY PINES | E10: 0.59652777777777777
A11: =A10+1 -> 11 | B11: JENNY | C11: ZHAUNG | D11: RANCHO BERNARDO | E11: 0.59930555555555554
A12: =A11+1 -> 12 | B12: HANNAH | C12: BEEDE | D12: EL CAMINO | E12: 00.6
A13: =A12+1 -> 13 | B13: CASEY | C13: BURGESS | D13: RANCHO BERNARDO | E13: 0.60347222222222219
A14: =A13+1 -> 14 | B14: CINDY | C14: PERALTA | D14: MOUNT CARMEL | E14: 0.60486111111111118
A15: =A14+1 -> 15 | B15: SUMMER | C15: DEIBERT | D15: PATRICK HENRY | E15: 0.60624999999999996
A16: =A15+1 -> 16 | B16: JOYCE | C16: LEE | D16: TORREY PINES | E16: 0.6069444444444444
A17: =A16+1 -> 17 | B17: ASHLEY | C17: MURRAY | D17: LA COSTA CANYON | E17: 0.60833333333333328
A18: =A17+1 -> 18 | B18: MICHELLE | C18: CHOW | D18: TORREY PINES | E18: 0.61041666666666672
A19: =A18+1 -> 19 | B19: CHARLESE | C19: MATHEWS | D19: RANCHO BERNARDO | E19: 0.61250000000000004
A20: =A19+1 -> 20 | B20: ASHLEY | C20: NICHOLS | D20: TORREY PINES | E20: 0.6166666666666667
A21: =A20+1 -> 21 | B21: AMY | C21: SOENKSEN | D21: LA COSTA CANYON | E21: 0.61736111111111114
A22: =A21+1 -> 22 | B22: MEGAN | C22: REINER | D22: CARLSBAD | E22: 0.61805555555555558
A23: =A22+1 -> 23 | B23: BROOKE | C23: TAYLOR | D23: LA COSTA CANYON | E23: 0.61875000000000002
A24: =A23+1 -> 24 | B24: ANNA | C24: LEAL-AMARO | D24: MOUNT CARMEL | E24: 0.62013888888888891
A25: =A24+1 -> 25 | B25: LYNDSIE | C25: ARTIS | D25: RAMONA | E25: 0.62152777777777779
A26: =A25+1 -> 26 | B26: ROCHELLE | C26: LEAVITT | D26: EL CAPITAN | E26: 0.62152777777777779
A27: =A26+1 -> 27 | B27: NAOMI | C27: AMAKAWA | D27: LA COSTA CANYON | E27: 0.62222222222222223
A28: =A27+1 -> 28 | B28: CLAIRE | C28: MARTIN | D28: CARLSBAD | E28: 0.62291666666666667
A29: =A28+1 -> 29 | B29: KIMBERLEY | C29: MCNALlY | D29: TORREY PINES | E29: 0.62430555555555556
A30: =A29+1 -> 30 | B30: ANJE'LE | C30: ALSTON | D30: EL CAMINO | E30: 0.62986111111111109
A31: =A30+1 -> 31 | B31: ALY | C31: HAMILTON | D31: LA COSTA CANYON | E31: 0.63402777777777775
A32: =A31+1 -> 32 | B32: KELSEY | C32: ERSKINE | D32: RANCHO BERNARDO | E32: 0.63611111111111118
A33: =A32+1 -> 33 | B33: AMANDA | C33: ALDERTON | D33: RANCHO BERNARDO | E33: 0.6381944444444444
A34: =A33+1 -> 34 | B34: LAURA | C34: EMMERSON | D34: LA COSTA CANYON | E34: 0.63958333333333328
A35: =A34+1 -> 35 | B35: STACY | C35: ROOME | D35: PATRICK HENRY | E35: 0.64375000000000004
A36: =A35+1 -> 36 | B36: CARLY | C36: RIVEZZO | D36: LA COSTA CANYON | E36: 0.64930555555555558
A37: =A36+1 -> 37 | B37: NORMI | C37: RAMIREZ | D37: EL CAMINO | E37: 0.65347222222222223
A38: =A37+1 -> 38 | B38: KATHLEEN | C38: CAHILL | D38: WESTVIEW | E38: 0.65555555555555556
A39: =A38+1 -> 39 | B39: ELENA | C39: LAZO | D39: LA COSTA CANYON | E39: 0.6645833333333333
A40: =A39+1 -> 40 | B40: BIANCA | C40: REYNOSO | D40: WESTVIEW | E40: 0.6694444444444444
A41: =A40+1 -> 41 | B41: AMANDA | C41: SATTERWHITE | D41: CARLSBAD | E41: 0.67083333333333339
A42: =A41+1 -> 42 | B42: KARINA | C42: GARCIA | D42: EL CAMINO | E42: 0.67152777777777783
A43: =A42+1 -> 43 | B43: JESSICA | C43: CINARES | D43: EL CAMINO | E43: 0.67500000000000004
A44: =A43+1 -> 44 | B44: KATIE | C44: BLEVENS | D44: PATRICK HENRY | E44: 0.67500000000000004
A45: =A44+1 -> 45 | B45: ANNA | C45: OLSON | D45: SAN PASQUAL | E45: 0.6777777777777777
A46: =A45+1 -> 46 | B46: BRONTE | C46: BAYNES | D46: LA COSTA CANYON | E46: 0.67986111111111114
A47: =A46+1 -> 47 | B47: CELIA | C47: MACPHAIL | D47: TORREY PINES | E47: 0.68055555555555547
A48: =A47+1 -> 48 | B48: BARBARA | C48: ROMER | D48: TORREY PINES | E48: 0.68611111111111101
A49: =A48+1 -> 49 | B49: BIANCA | C49: VELEZ | D49: EL CAMINO | E49: 0.69097222222222221
A50: =A49+1 -> 50 | B50: REYN | C50: SAKAKIBARA | D50: TORREY PINES | E50: 0.69444444444444453
A51: =A50+1 -> 51 | B51: LAUREN | C51: MACSHANE | D51: MOUNT CARMEL | E51: 0.69930555555555562
A52: =A51+1 -> 52 | B52: VALECIA | C52: ESPINOZA | D52: CARLSBAD | E52: 0.70347222222222217
A53: =A52+1 -> 53 | B53: ANDREA | C53: HOWE | D53: LA COSTA CANYON | E53: 0.71666666666666667
A54: =A53+1 -> 54 | B54: ALLISON | C54: BRANCH | D54: PATRICK HENRY | E54: 0.72083333333333333
A55: =A54+1 -> 55 | B55: JERICA | C55: BERBERICH | D55: SAN PASQUAL | E55: 0.7284722222222223
A56: =A55+1 -> 56 | B56: LILY | C56: MALEK | D56: RANCHO BERNARDO | E56: 0.73055555555555562
A57: =A56+1 -> 57 | B57: RACHEL | C57: BURGESS | D57: RANCHO BERNARDO | E57: 0.7319444444444444
A58: =A57+1 -> 58 | B58: ELIZABETH | C58: GARCIA | D58: SAN PASQUAL | E58: 0.74652777777777779
A59: =A58+1 -> 59 | B59: MELISSA | C59: GOMEZ | D59: PATRICK HENRY | E59: 0.75277777777777777

A1: 1 | B1: JACOB | C1: BARTON | D1: SAN PASQUAL | E1: 0.46319444444444446
A2: =A1+1 -> 2 | B2: JAMES | C2: ALIAMUS | D2: TP | E2: 0.47152777777777777
A3: =A2+1 -> 3 | B3: MARK | C3: CHAN | D3: POWAY | E3: 0.47222222222222227
A4: =A3+1 -> 4 | B4: MAX | C4: BERWALD | D4: CARLSBAD | E4: 0.47986111111111113
A5: =A4+1 -> 5 | B5: MICHEAL | C5: CLOW | D5: POWAY | E5: 0.47986111111111113
A6: =A5+1 -> 6 | B6: ERIC | C6: MANSOUR | D6: MC | E6: 0.4826388888888889
A7: =A6+1 -> 7 | B7: MATTY | C7: WARD | D7: POWAY | E7: 0.48333333333333334
A8: =A7+1 -> 8 | B8: VINCENT | C8: HENG | D8: MC | E8: 0.48472222222222222
A9: =A8+1 -> 9 | B9: KWON | C9: O'MIN | D9: RB | E9: 0.48541666666666666
A10: =A9+1 -> 10 | B10: ARMANDO | C10: GONZALEZ | D10: EL CAMINO | E10: 0.48819444444444443
A11: =A10+1 -> 11 | B11: STEVEN | C11: KAMEN | D11: RB | E11: 0.48888888888888887
A12: =A11+1 -> 12 | B12: BRETT | C12: GUTIERREZ | D12: PH | E12: 0.48958333333333331
A13: =A12+1 -> 13 | B13: MATT | C13: GILK | D13: CHS | E13: 0.49027777777777781
A14: =A13+1 -> 14 | B14: ACHILLES | C14: SCHMELZER | D14: RB | E14: 0.4909722222222222
A15: =A14+1 -> 15 | B15: MARK | C15: WOLFSON | D15: TP | E15: 0.49375000000000002
A16: =A15+1 -> 16 | B16: MIKE | C16: DEAN | D16: PH | E16: 0.49444444444444446
A17: =A16+1 -> 17 | B17: SEAN | C17: WILBURN | D17: EL CAMINO | E17: 0.49444444444444446
A18: =A17+1 -> 18 | B18: KEVIN | C18: YANG | D18: TP | E18: 0.49861111111111112
A19: =A18+1 -> 19 | B19: PARESH | C19: DAVE | D19: MC | E19: 0.4993055555555555
A20: =A19+1 -> 20 | B20: SAMUEL | C20: BAIRD | D20: CHS | E20: 0.5
A21: =A20+1 -> 21 | B21: CODEY | C21: WHITE | D21: WV | E21: 0.5
A22: =A21+1 -> 22 | B22: KARL | C22: LEIDER | D22: CHS | E22: 0.50069444444444444
A23: =A22+1 -> 23 | B23: SCOTT | C23: ROBISON | D23: RB | E23: 0.50138888888888888
A24: =A23+1 -> 24 | B24: JUSTIN | C24: DAVIS | D24: EL CAMINO | E24: 0.50138888888888888
A25: =A24+1 -> 25 | B25: FRANCISCO | C25: ALVAREZ | D25: SAN PASQUAL | E25: 0.50138888888888888
A26: =A25+1 -> 26 | B26: STEVEN | C26: STERRETT | D26: MC | E26: 0.50416666666666665
A27: =A26+1 -> 27 | B27: CHRIS | C27: ROWLEY | D27: SAN PASQUAL | E27: 0.50416666666666665
A28: =A27+1 -> 28 | B28: RUDY | C28: YU | D28: TP | E28: 0.50555555555555554
A29: =A28+1 -> 29 | B29: TYLER | C29: STEMLEY | D29: EL CAMINO | E29: 0.50694444444444442
A30: =A29+1 -> 30 | B30: ZACH | C30: PERRY | D30: PH | E30: 0.50902777777777775
A31: =A30+1 -> 31 | B31: RICHARD | C31: ZEPEDA | D31: EL CAP | E31: 0.50972222222222219
A32: =A31+1 -> 32 | B32: KEVIN | C32: KEMMERRER | D32: WV | E32: 0.51180555555555551
A33: =A32+1 -> 33 | B33: KEVIN | C33: CULLEN | D33: PH | E33: 0.51180555555555551
A34: =A33+1 -> 34 | B34: ANDREW | C34: HALL | D34: WV | E34: 0.5131944444444444
A35: =A34+1 -> 35 | B35: GARRETT | C35: YAGADE | D35: RB | E35: 0.5131944444444444
A36: =A35+1 -> 36 | B36: MIKE | C36: LOVE | D36: WV | E36: 0.51597222222222217
A37: =A36+1 -> 37 | B37: ETHAN | C37: EDWARDS | D37: LCC | E37: 0.51736111111111105
A38: =A37+1 -> 38 | B38: BRIAN | C38: IE | D38: MC | E38: 0.5180555555555556
A39: =A38+1 -> 39 | B39: DANIEL | C39: THAN | D39: MC | E39: 0.51875000000000004
A40: =A39+1 -> 40 | B40: JEFF | C40: WARINER | D40: MC | E40: 0.51875000000000004
A41: =A40+1 -> 41 | B41: DUANE | C41: PALMER | D41: PH | E41: 0.52083333333333337
A42: =A41+1 -> 42 | B42: SKYLER | C42: KATZ | D42: PH | E42: 0.52152777777777781
A43: =A42+1 -> 43 | B43: MARCOS | C43: SANTIAGO | D43: EL CAMINO | E43: 0.52222222222222225
A44: =A43+1 -> 44 | B44: MOTOKI | C44: NAKAMURA | D44: TP | E44: 0.5229166666666667
A45: =A44+1 -> 45 | B45: BRANDON | C45: MITZUTANI | D45: LCC | E45: 0.52430555555555558
A46: =A45+1 -> 46 | B46: LUKE | C46: MIDDLEBROOK | D46: EL CAP | E46: 0.52500000000000002
A47: =A46+1 -> 47 | B47: DANNY | C47: STEFFY | D47: CARLSBAD | E47: 0.52569444444444446
A48: =A47+1 -> 48 | B48: GRAHAM | C48: IBANEZ | D48: LCC | E48: 0.52638888888888891
A49: =A48+1 -> 49 | B49: ELLIOT | C49: BENEDICT-PHILIPP | D49: PH | E49: 0.52708333333333335
A50: =A49+1 -> 50 | B50: SHANE | C50: O'SULLIVAN | D50: CHS | E50: 0.52708333333333335
A51: =A50+1 -> 51 | B51: TROY | C51: EDWARDS | D51: LCC | E51: 0.52847222222222223
A52: =A51+1 -> 52 | B52: TYLER | C52: ROEHO | D52: EL CAP | E52: 0.53055555555555556
A53: =A52+1 -> 53 | B53: JUAN | C53: AYALA | D53: PH | E53: 0.53194444444444444
A54: =A53+1 -> 54 | B54: NICK | C54: KOURIS | D54: WV | E54: 0.53472222222222221
A55: =A54+1 -> 55 | B55: RYOSUKE | C55: SAIKA | D55: RB | E55: 0.53888888888888886
A56: =A55+1 -> 56 | B56: ANDREW | C56: RHODES | D56: RB | E56: 0.54027777777777775
A57: =A56+1 -> 57 | B57: ANDREW | C57: GORDON | D57: PH | E57: 0.54097222222222219
A58: =A57+1 -> 58 | B58: JUSTIN | C58: WANG | D58: TP | E58: 0.54236111111111118
A59: =A58+1 -> 59 | B59: CASEY | C59: WOODLAND | D59: EL CAP | E59: 0.54305555555555551
A60: =A59+1 -> 60 | B60: ARIC | C60: CARRACINO | D60: CHS | E60: 0.54374999999999996
A61: =A60+1 -> 61 | B61: JAMES | C61: SANDERMAN | D61: EL CAP | E61: 0.54374999999999996
A62: =A61+1 -> 62 | B62: SEAN | C62: HAMILTON | D62: EL CAP | E62: 0.5444444444444444
A63: =A62+1 -> 63 | B63: PETER | C63: BENITO | D63: RB | E63: 0.54583333333333328
A64: =A63+1 -> 64 | B64: GARRETT | C64: LOW | D64: CHS | E64: 00.55
A65: =A64+1 -> 65 | B65: JESSE | C65: HILL | D65: PH | E65: 0.55277777777777781
A66: =A65+1 -> 66 | B66: JULIAN | C66: BLASEIO | D66: TP | E66: 0.55555555555555558
A67: =A66+1 -> 67 | B67: ERIC | C67: GARCIA | D67: EL CAP | E67: 0.55694444444444446
A68: =A67+1 -> 68 | B68: SEAN | C68: LETTS | D68: CHS | E68: 0.55833333333333335
A69: =A68+1 -> 69 | B69: MARIANO | C69: MOSQUERA | D69: CHS | E69: 0.56180555555555556
A70: =A69+1 -> 70 | B70: MATT | C70: MCCARTHY | D70: WV | E70: 0.56666666666666665
A71: =A70+1 -> 71 | B71: KYLE | C71: PORTS | D71: PH | E71: 0.56805555555555554
A72: =A71+1 -> 72 | B72: DANIEL | C72: NELSON | D72: RB | E72: 0.57013888888888886
A73: =A72+1 -> 73 | B73: AARON | C73: KASH | D73: SAN PASQUAL | E73: 0.57430555555555551
A74: =A73+1 -> 74 | B74: CHRIS | C74: VANN | D74: PH | E74: 0.5756944444444444
A75: =A74+1 -> 75 | B75: JOHNATHAN | C75: WILLIAMS | D75: EL CAP | E75: 0.57708333333333328
A76: =A75+1 -> 76 | B76: PETER | C76: STEUSLOFF | D76: RB | E76: 0.57847222222222217
A77: =A76+1 -> 77 | B77: CALVIN | C77: HENDRIX | D77: SAN PASQUAL | E77: 0.58472222222222225
A78: =A77+1 -> 78 | B78: KYLE | C78: HEGLAND | D78: POWAY | E78: 0.58680555555555558
A79: =A78+1 -> 79 | B79: CHRIS | C79: HOGSTROM | D79: MC | E79: 0.58819444444444446
A80: =A79+1 -> 80 | B80: T | C80: YANG | D80: WV | E80: 0.59861111111111109
A81: =A80+1 -> 81 | B81: NOAH | C81: TYE | D81: WV | E81: 0.60972222222222217
A82: =A81+1 -> 82 | B82: JOSH | C82: GORDON | D82: OG | E82: 0.61041666666666672
A83: =A82+1 -> 83 | B83: JORDAN | C83: FINNELL | D83: SAN PASQUAL | E83: 0.61111111111111105
A84: =A83+1 -> 84 | B84: LUCAS | C84: MATTOX | D84: SAN PASQUAL | E84: 0.62152777777777779
A85: =A84+1 -> 85 | B85: JEREMY | C85: HEONARD | D85: SAN PASQUAL | E85: 0.62291666666666667
A86: =A85+1 -> 86 | B86: ERIC | C86: TSAI | D86: TP | E86: 0.62569444444444444
A87: =A86+1 -> 87 | B87: VINCENT | C87: TRAN | D87: POWAY | E87: 0.63402777777777775
A88: =A87+1 -> 88 | B88: MATT | C88: GUHL | D88: LCC | E88: 0.66597222222222219
A89: =A88+1 -> 89 | B89: MAX | C89: JOHNSON | D89: RB | E89: 0.68263888888888891

A1: 1 | B1: NATALIE NIELD | C1: CATH | D1: 0.54166666666666663
A2: 2 | B2: LINDSEY DRAKE | C2: CATH | D2: 0.54166666666666663
A3: 3 | B3: KATRINA MECKLENBURG | C3: CATH | D3: 0.55069444444444449
A4: 4 | B4: TIMANUS | C4: WH | D4: 0.55625000000000002
A5: 5 | B5: MCNULTY | C5: WH | D5: 0.56111111111111112
A6: 6 | B6: TARAH KADING | C6: SFC | D6: 0.56736111111111109
A7: 7 | B7: MARITA BARGER | C7: CATH | D7: 0.56736111111111109
A8: 8 | B8: SACCONE | C8: WH | D8: 0.56736111111111109
A9: 9 | B9: SABLLE SCHEPPMANN | C9: GROSS | D9: 0.57013888888888886
A10: 10 | B10: L ARCE | C10: WH | D10: 0.57499999999999996
A11: 11 | B11: LOZANO | C11: WH | D11: 0.57777777777777783
A12: 12 | B12: KRISTIN SECCIANI | C12: GROSS | D12: 0.57986111111111105
A13: 13 | B13: KAILEY ALETO | C13: GROSS | D13: 0.5805555555555556
A14: 14 | B14: RAQUEL BURGETT | C14: MM | D14: 0.5805555555555556
A15: 15 | B15: LAURA FALKNER | C15: CATH | D15: 0.58125000000000004
A16: 16 | B16: MADONNA SAMIENTO | C16: MM | D16: 0.58125000000000004
A17: 17 | B17: THERSA CALDERON | C17: MM | D17: 0.5854166666666667
A18: 18 | B18: LAURA VAN VRANKEN | C18: SDA | D18: 0.59236111111111112
A19: 19 | B19: ELYA JASPER | C19: CATH | D19: 0.59513888888888888
A20: 20 | B20: RILEY SCHERER | C20: SDA | D20: 0.59791666666666665
A21: 21 | B21: GOMEZ | C21: WH | D21: 0.59861111111111109
A22: 22 | B22: OZUNA | C22: WH | D22: 0.60277777777777775
A23: 23 | B23: CHLOE FERRAROTH | C23: SDA | D23: 0.6069444444444444
A24: 24 | B24: MARNEY O'TOOLE | C24: CATH | D24: 0.60972222222222217
A25: 25 | B25: JULIA SEARLE | C25: SFC | D25: 0.61250000000000004
A26: 26 | B26: JACKIE SPIVEY | C26: GROSS | D26: 0.61250000000000004
A27: 27 | B27: NICOLE CRAVEN | C27: SFC | D27: 0.61805555555555558
A28: 28 | B28: MIRIAM ALPERT | C28: GROSS | D28: 0.62083333333333335
A29: 29 | B29: MARIAH AARON | C29: ECHS | D29: 0.62638888888888888
A30: 30 | B30: JACKIE REINAGEL | C30: CATH | D30: 0.62777777777777777
A31: 31 | B31: LAURA DUSHKIN | C31: SDA | D31: 0.62986111111111109
A32: 32 | B32: MORA SARAI | C32: MM | D32: 0.63194444444444442
A33: 33 | B33: LEIZA RENEE ABAD | C33: MM | D33: 0.63472222222222219
A34: 34 | B34: BROOKE WEISENBERGER | C34: SFC | D34: 0.63541666666666663
A35: 35 | B35: BRENDA GONZALES | C35: MORSE | D35: 0.63749999999999996
A36: 36 | B36: KATIE BROWN | C36: SFC | D36: 0.64097222222222217
A37: 37 | B37: ROWAN DIONISOPOULOS | C37: GROSS | D37: 0.6479166666666667
A38: 38 | B38: COURTNEY SWAN | C38: SDA | D38: 0.64930555555555558
A39: 39 | B39: ALISSA ROLAND | C39: GROSS | D39: 0.65208333333333335
A40: 40 | B40: MARISSA NAVAROO | C40: ECHS | D40: 0.65277777777777779
A41: 41 | B41: JACKIE MOSELEY | C41: SFC | D41: 0.66527777777777775
A42: 42 | B42: COURTNEY COLLINS | C42: SFC | D42: 0.66874999999999996
A43: 43 | B43: NICKY RUMBAWA | C43: ECHS | D43: 0.68263888888888891
A44: 44 | B44: KATE HOMER | C44: SFC | D44: 0.7006944444444444
A45: 45 | B45: MONICA CHUA | C45: MORSE | D45: 0.70347222222222217
A46: 46 | B46: ALEXANDRIA CUNANAN | C46: MORSE | D46: 0.71944444444444444
A47: 47 | B47: JESSICA NGUYEN | C47: MORSE | D47: 0.73402777777777783
A48: 48 | B48: SARAH BENNETT | C48: SFC | D48: 0.7368055555555556
A49: 49 | B49: CIARA D'AGUSTINO | C49: ECHS | D49: NT

A1: 1 | B1: PAUL ACHEE | C1: MORSE | D1: 0.43194444444444446
A2: 2 | B2: ALEX POYHONEN | C2: LJCD | D2: 0.43333333333333335
A3: 3 | B3: TRAVIS PEDERSON | C3: SDA | D3: 0.4368055555555555
A4: 4 | B4: GRANT LIEBERMAN | C4: GROSS | D4: 0.4375
A5: 5 | B5: JUSTIN HALEY | C5: CATH | D5: 0.43958333333333338
A6: 6 | B6: M. GONIA | C6: WH | D6: 0.44305555555555554
A7: 7 | B7: DENNIS ROTH | C7: LJCD | D7: 0.44444444444444442
A8: 8 | B8: TOMMY KROLL | C8: CATH | D8: 0.45069444444444445
A9: 9 | B9: WARREN FISHER | C9: CATH | D9: 0.45208333333333334
A10: 10 | B10: ALEX FLEISCHHACKER | C10: LJCD | D10: 0.4548611111111111
A11: 11 | B11: ANTHONY DEBARROWS | C11: SANT. | D11: 0.45902777777777781
A12: 12 | B12: BEN STILLINGER | C12: SDA | D12: 0.45902777777777781
A13: 13 | B13: KEITH MADSEN | C13: MM | D13: 0.46319444444444446
A14: 14 | B14: JARED GATES | C14: CATH | D14: 0.46319444444444446
A15: 15 | B15: TOM NEVILLE | C15: CATH | D15: 0.46458333333333335
A16: 16 | B16: JASON GORDON | C16: SANT. | D16: 0.46527777777777773
A17: 17 | B17: DOLAN | C17: WH | D17: 0.46875
A18: 18 | B18: PARRY THORNTON | C18: GROSS | D18: 0.47152777777777777
A19: 19 | B19: GEOFFREY AINSLIE | C19: SDA | D19: 0.47361111111111115
A20: 20 | B20: DEREK GILL | C20: CATH | D20: 0.4777777777777778
A21: 21 | B21: CABRAL | C21: WH | D21: 0.47916666666666669
A22: 22 | B22: DONELLAN | C22: WH | D22: 0.48055555555555557
A23: 23 | B23: JASON MCCALLUM | C23: LJCD | D23: 0.4826388888888889
A24: 24 | B24: ALEX CALTA | C24: CATH | D24: 0.4826388888888889
A25: 25 | B25: CHRIS STEINKE | C25: MORSE | D25: 0.48402777777777778
A26: 26 | B26: EVAN AMANO | C26: SDA | D26: 0.48472222222222222
A27: 27 | B27: CHRIS DE LA TORRE | C27: SDA | D27: 0.48888888888888887
A28: 28 | B28: JOSE RODRIQUES | C28: MORSE | D28: 0.48958333333333331
A29: 29 | B29: ERIK ANDERSON | C29: SDA | D29: 0.49444444444444446
A30: 30 | B30: NINTEMAN | C30: WH | D30: 0.49513888888888885
A31: 31 | B31: TYLER IWAMURA | C31: SFC | D31: 0.49513888888888885
A32: 32 | B32: MITCHELL DOMINGUES | C32: GROSS | D32: 0.49791666666666662
A33: 33 | B33: NICK CHRISTIE | C33: GROSS | D33: 0.49861111111111112
A34: 34 | B34: BERNIER | C34: WH | D34: 0.49861111111111112
A35: 35 | B35: FRITZ | C35: WH | D35: 0.4993055555555555
A36: 36 | B36: JOSEF HAUSER | C36: GROSS | D36: 0.50763888888888886
A37: 37 | B37: ALEXANDER FISCHER | C37: SDA | D37: 0.50902777777777775
A38: 38 | B38: VINNY PUJJI | C38: LJCD | D38: 0.51666666666666672
A39: 39 | B39: DANIEL SANTILLAN | C39: GROSS | D39: 0.5180555555555556
A40: 40 | B40: JACK DIGGS | C40: GROSS | D40: 0.51875000000000004
A41: 41 | B41: JACINTO DOMINGUES | C41: ECHS | D41: 0.51944444444444449
A42: 42 | B42: BRYCE NORTON | C42: SDA | D42: 0.52013888888888882
A43: 43 | B43: PHILLIP POYHONEN | C43: LJCD | D43: 0.5229166666666667
A44: 44 | B44: CHRIS CATON | C44: MORSE | D44: 0.52500000000000002
A45: 45 | B45: RYAN O'ROURKE | C45: SFC | D45: 0.52500000000000002
A46: 46 | B46: TERRANCE RILEY | C46: MORSE | D46: 0.52500000000000002
A47: 47 | B47: ADAM ALLY | C47: MORSE | D47: 0.52569444444444446
A48: 48 | B48: TRAVIS PELLETIER | C48: SANT. | D48: 0.52708333333333335
A49: 49 | B49: JESSE TORRES | C49: ECHS | D49: 0.52986111111111112
A50: 50 | B50: COLE HOLCOMB | C50: SDA | D50: 0.53125
A51: 51 | B51: KYLE GRANALI | C51: MORSE | D51: 0.54236111111111118
A52: 52 | B52: TODD DAVIS | C52: ECHS | D52: 0.5444444444444444
A53: 53 | B53: SEAN RADAK | C53: SFC | D53: 0.5541666666666667
A54: 54 | B54: TYLER HARMON | C54: ECHS | D54: 0.55555555555555558
A55: 55 | B55: YANNI DAMIANOS | C55: ECHS | D55: 0.55694444444444446
A56: 56 | B56: ALAN GACIAS | C56: MORSE | D56: 0.56458333333333333
A57: 57 | B57: PETER VALDES | C57: ECHS | D57: 0.57499999999999996
A58: 58 | B58: JAKE ELIASBERG | C58: LJCD | D58: 0.57986111111111105
A59: 59 | B59: JORDAN MUSSMAN | C59: ECHS | D59: 0.59097222222222223
A60: 60 | B60: BRIAN MOSELEY | C60: SFC | D60: 0.59652777777777777
A61: 61 | B61: CHRIS SCHAFER | C61: SFC | D61: 0.63124999999999998
A62: 62 | B62: EMAN ELLORIN | C62: MORSE | D62: 0.65416666666666667

A1: 1 | B1: MACKENZIE | C1: NORMAN | D1: CATHEDRAL CATHOLIC | E1: 0.5708333333333333
A2: =A1+1 -> 2 | B2: JANELLE | C2: SHELBY | D2: GROSSMONT | E2: 0.57499999999999996
A3: =A2+1 -> 3 | C3: THOMAS | D3: WEST HILLS | E3: 0.5756944444444444
A4: =A3+1 -> 4 | B4: ALYSSA | C4: RODRIGUEZ | D4: GUAJOME PARK ACAD. | E4: 0.58333333333333337
A5: =A4+1 -> 5 | C5: ALDERSON | D5: WEST HILLS | E5: 0.59305555555555556
A6: =A5+1 -> 6 | B6: HALEY | C6: NORDIN | D6: CATHEDRAL CATHOLIC | E6: 0.59375
A7: =A6+1 -> 7 | C7: KOLEH | D7: WEST HILLS | E7: 0.59583333333333333
A8: =A7+1 -> 8 | B8: VANESSA | C8: CALUZA | D8: CATHEDRAL CATHOLIC | E8: 0.59652777777777777
A9: =A8+1 -> 9 | B9: JULIA | C9: PEDERSON | D9: SAN DIEGUITO ACADAMY | E9: 0.60416666666666663
A10: =A9+1 -> 10 | B10: SARAH | C10: KNIGHT | D10: GROSSMONT | E10: 0.60833333333333328
A11: =A10+1 -> 11 | B11: MEGHAN | C11: KEITH | D11: CATHEDRAL CATHOLIC | E11: 0.61527777777777781
A12: =A11+1 -> 12 | C12: ROMERO | D12: WEST HILLS | E12: 0.61527777777777781
A13: =A12+1 -> 13 | B13: A | C13: BRUNT | D13: CCPAA | E13: 0.62083333333333335
A14: =A13+1 -> 14 | C14: RAMER | D14: WEST HILLS | E14: 0.62222222222222223
A15: =A14+1 -> 15 | B15: T | C15: SCOTT | D15: CCPAA | E15: 0.62291666666666667
A16: =A15+1 -> 16 | B16: THERESA | C16: PALAFOX | D16: MIRA MESA | E16: 0.62430555555555556
A17: =A16+1 -> 17 | B17: PHYLICIA | C17: HISEL | D17: MIRA MESA | E17: 0.62847222222222221
A18: =A17+1 -> 18 | B18: ALYSSA | C18: CELONES | D18: MIRA MESA | E18: 0.62986111111111109
A19: =A18+1 -> 19 | B19: MELISSA | C19: ANTONIO | D19: MIRA MESA | E19: 0.63124999999999998
A20: =A19+1 -> 20 | C20: GINI | D20: WEST HILLS | E20: 0.63680555555555551
A21: =A20+1 -> 21 | B21: BETH | C21: SMETANA | D21: CATHEDRAL CATHOLIC | E21: 0.64097222222222217
A22: =A21+1 -> 22 | B22: KAYLIN | C22: GREENE | D22: SAN DIEGUITO ACADAMY | E22: 0.64236111111111105
A23: =A22+1 -> 23 | B23: JULIE | C23: ADAMS | D23: GROSSMONT | E23: 0.64236111111111105
A24: =A23+1 -> 24 | B24: JANAI | C24: KERWIN | D24: CATHEDRAL CATHOLIC | E24: 0.64236111111111105
A25: =A24+1 -> 25 | B25: SARA | C25: ESTRADA | D25: GUAJOME PARK ACAD. | E25: 0.64513888888888882
A26: =A25+1 -> 26 | B26: CHRISTINA | C26: BAUER | D26: MIRA MESA | E26: 0.64583333333333337
A27: =A26+1 -> 27 | C27: FINNEY | D27: WEST HILLS | E27: 0.64722222222222225
A28: =A27+1 -> 28 | C28: POLSELLI | D28: WEST HILLS | E28: 0.64930555555555558
A29: =A28+1 -> 29 | C29: SENTER | D29: WEST HILLS | E29: 0.64930555555555558
A30: =A29+1 -> 30 | B30: LINDSAY | C30: KENDALL | D30: CATHEDRAL CATHOLIC | E30: 0.65347222222222223
A31: =A30+1 -> 31 | B31: LIZ | C31: MOCK | D31: CATHEDRAL CATHOLIC | E31: 0.65763888888888888
A32: =A31+1 -> 32 | B32: VANESSA | C32: ANK | D32: CATHEDRAL CATHOLIC | E32: 0.65763888888888888
A33: =A32+1 -> 33 | C33: JIRJIS | D33: WEST HILLS | E33: 0.66527777777777775
A34: =A33+1 -> 34 | B34: KELLY | C34: CONLIN | D34: CATHEDRAL CATHOLIC | E34: 0.6694444444444444
A35: =A34+1 -> 35 | B35: PAULA | C35: GODOY | D35: SAN DIEGUITO ACADAMY | E35: 0.67083333333333339
A36: =A35+1 -> 36 | B36: ELIZABETH | C36: SALMON | D36: GROSSMONT | E36: 0.67708333333333337
A37: =A36+1 -> 37 | B37: TAYLOR | C37: TINLEY | D37: CATHEDRAL CATHOLIC | E37: 0.68819444444444444
A38: =A37+1 -> 38 | B38: COURTNEY | C38: CAPE | D38: CATHEDRAL CATHOLIC | E38: 0.68958333333333333
A39: =A38+1 -> 39 | C39: HOUCK | D39: WEST HILLS | E39: 0.69027777777777777
A40: =A39+1 -> 40 | B40: KAREN | C40: LOPEZ | D40: GROSSMONT | E40: 0.69097222222222221
A41: =A40+1 -> 41 | B41: STEFANIE | C41: REED | D41: MIRA MESA | E41: 0.69236111111111109
A42: =A41+1 -> 42 | B42: MARY | C42: BUI | D42: MIRA MESA | E42: 0.69305555555555554
A43: =A42+1 -> 43 | B43: STACEY LOUISE | C43: RABANAL | D43: MIRA MESA | E43: 0.69374999999999998
A44: =A43+1 -> 44 | B44: MELANIE | C44: HOLOHAN | D44: CATHEDRAL CATHOLIC | E44: 0.70486111111111116
A45: 45 | B45: SHELBY | C45: CUMMINGS | D45: CATHEDRAL CATHOLIC | E45: 0.70486111111111116
A46: 46 | B46: NAYCARI | C46: DE LUNA | D46: GUAJOME PARK ACAD. | E46: 0.70486111111111116
A47: 47 | B47: ALEXA | C47: SHAPIRO | D47: SAN DIEGUITO ACADAMY | E47: 0.7055555555555556
A48: =A47+1 -> 48 | C48: DILLARD | D48: WEST HILLS | E48: 0.7055555555555556
A49: =A48+1 -> 49 | B49: CASEY | C49: GRANAHAN | D49: CATHEDRAL CATHOLIC | E49: 0.7055555555555556
A50: =A49+1 -> 50 | B50: SARA | C50: MILLER | D50: GUAJOME PARK ACAD. | E50: 0.70625000000000004
A51: =A50+1 -> 51 | B51: ZOE | C51: JACKSON | D51: CATHEDRAL CATHOLIC | E51: 0.70625000000000004
A52: =A51+1 -> 52 | B52: STERLING | C52: SIEBER | D52: CATHEDRAL CATHOLIC | E52: 0.70694444444444438
A53: =A52+1 -> 53 | B53: SARAH | C53: COMISKEY PARSON | D53: CATHEDRAL CATHOLIC | E53: 0.70763888888888893
A54: =A53+1 -> 54 | B54: MICHELLE | C54: STEVENSON | D54: MIRA MESA | E54: 0.71111111111111114
A55: =A54+1 -> 55 | B55: HALEY | C55: ORTMAN | D55: CATHEDRAL CATHOLIC | E55: 0.71180555555555547
A56: =A55+1 -> 56 | B56: ANDREA | C56: LY | D56: MIRA MESA | E56: 0.71250000000000002
A57: =A56+1 -> 57 | B57: MEGAN | C57: SANKER | D57: CATHEDRAL CATHOLIC | E57: 0.71319444444444446
A58: =A57+1 -> 58 | B58: VICTORIA | C58: THIESEN | D58: CATHEDRAL CATHOLIC | E58: 0.71388888888888891
A59: =A58+1 -> 59 | B59: GEN | C59: CRUZAN | D59: CATHEDRAL CATHOLIC | E59: 0.71458333333333324
A60: =A59+1 -> 60 | B60: BRIDGET | C60: MURPHY | D60: CATHEDRAL CATHOLIC | E60: 0.71527777777777779
A61: =A60+1 -> 61 | B61: TRAN | C61: NGUYEN | D61: MIRA MESA | E61: 0.71875
A62: =A61+1 -> 62 | B62: MCKENNA | C62: TAYLOR | D62: MIRA MESA | E62: 0.71944444444444444
A63: =A62+1 -> 63 | B63: RITA | C63: ARMENDARIZ | D63: GUAJOME PARK ACAD. | E63: 0.72013888888888899
A64: =A63+1 -> 64 | B64: JULIE | C64: DAO | D64: MIRA MESA | E64: 0.72569444444444453
A65: =A64+1 -> 65 | B65: NATALIE | C65: PARAISO | D65: GROSSMONT | E65: 0.72638888888888886
A66: =A65+1 -> 66 | B66: ASHLEY | C66: TA | D66: MIRA MESA | E66: 0.73750000000000004
A67: =A66+1 -> 67 | B67: NHU | C67: NGO | D67: MIRA MESA | E67: 0.74375000000000002
A68: =A67+1 -> 68 | B68: ATTIE | C68: HARRIS | D68: CATHEDRAL CATHOLIC | E68: 0.75624999999999998
A69: =A68+1 -> 69 | B69: ALEX | C69: JACKS | D69: GROSSMONT | E69: 0.75902777777777775
A70: =A69+1 -> 70 | B70: CATHY | C70: DE LA CRUZ | D70: MIRA MESA | E70: 0.76111111111111107
A71: =A70+1 -> 71 | B71: DANIELLE | C71: BEUER | D71: GUAJOME PARK ACAD. | E71: 0.76527777777777783
A72: =A71+1 -> 72 | C72: COUEY | D72: WEST HILLS | E72: 0.76736111111111116
A73: =A72+1 -> 73 | B73: MELANIE | C73: SUPPLE | D73: CATHEDRAL CATHOLIC | E73: 0.76875000000000004
A74: =A73+1 -> 74 | C74: DICKMAN | D74: WEST HILLS | E74: 0.76944444444444438
A75: =A74+1 -> 75 | B75: KRYSTAL | C75: MONA | D75: MIRA MESA | E75: 0.77569444444444446
A76: =A75+1 -> 76 | C76: SNYDER | D76: WEST HILLS | E76: 0.77777777777777779
A77: =A76+1 -> 77 | C77: LICHTENTHALER | D77: WEST HILLS | E77: 0.77847222222222223
A78: =A77+1 -> 78 | B78: SABRINA | C78: ESQUELA | D78: GUAJOME PARK ACAD. | E78: 0.77986111111111101
A79: =A78+1 -> 79 | B79: JORDAN | C79: MOORE | D79: GROSSMONT | E79: 0.78055555555555556
A80: =A79+1 -> 80 | B80: MICHELLE | C80: BUI | D80: MIRA MESA | E80: 0.78125
A81: =A80+1 -> 81 | B81: SHAKILA | C81: GUEVARA | D81: SAN DIEGUITO ACADAMY | E81: 0.78333333333333333
A82: =A81+1 -> 82 | B82: VICTORIA | C82: LY | D82: MIRA MESA | E82: 0.78541666666666676
A83: =A82+1 -> 83 | B83: CHENEE | C83: OLJOL | D83: MIRA MESA | E83: 0.78680555555555554
A84: =A83+1 -> 84 | B84: SHANNON | C84: STERBA | D84: GUAJOME PARK ACAD. | E84: 0.79305555555555562
A85: =A84+1 -> 85 | B85: CHESALIE | C85: LOACH | D85: GUAJOME PARK ACAD. | E85: 0.8041666666666667
A86: =A85+1 -> 86 | B86: ASHLEY | C86: KUMMER | D86: MIRA MESA | E86: 0.80486111111111114
A87: =A86+1 -> 87 | B87: LISA | C87: OCAMPO | D87: GUAJOME PARK ACAD. | E87: 0.80555555555555547
A88: =A87+1 -> 88 | C88: AULT | D88: WEST HILLS | E88: 0.80694444444444446
A89: =A88+1 -> 89 | B89: ABIGAIL | C89: NAZARENO | D89: MIRA MESA | E89: 0.80763888888888891
A90: =A89+1 -> 90 | C90: NINTEMAN | D90: WEST HILLS | E90: 0.80833333333333324
A91: =A90+1 -> 91 | B91: MICHELLE | C91: ABLES | D91: CATHEDRAL CATHOLIC | E91: 0.80902777777777779
A92: =A91+1 -> 92 | B92: OLIVIA | C92: BALMERT | D92: CATHEDRAL CATHOLIC | E92: 0.81319444444444444
A93: =A92+1 -> 93 | B93: JESSICA | C93: WILSON | D93: LA JOLLA COUNTRY DAY | E93: 0.81736111111111109
A94: =A93+1 -> 94 | B94: HALEY | C94: BEULIGMANN | D94: CATHEDRAL CATHOLIC | E94: 0.81874999999999998
A95: =A94+1 -> 95 | B95: CAILIN | C95: MCLAIN | D95: CATHEDRAL CATHOLIC | E95: 0.8222222222222223
A96: =A95+1 -> 96 | B96: MIEU | C96: BRY | D96: MIRA MESA | E96: 0.82638888888888884
A97: =A96+1 -> 97 | B97: NANCY | C97: HA | D97: MIRA MESA | E97: 0.82847222222222217
A98: =A97+1 -> 98 | B98: PHUONG | C98: BUI | D98: MIRA MESA | E98: 0.82916666666666661
A99: =A98+1 -> 99 | B99: LILY | C99: CHRISTY | D99: MIRA MESA | E99: 0.83819444444444446
A100: =A99+1 -> 100 | B100: BELA | C100: TORRES | D100: BORREGO SPRINGS | E100: 0.8520833333333333
A101: =A100+1 -> 101 | B101: NATALIE ROSE | C101: LAPADA | D101: MIRA MESA | E101: 0.8534722222222223
A102: =A101+1 -> 102 | B102: JESSICA | C102: KUYKENDALL | D102: CATHEDRAL CATHOLIC | E102: 0.8569444444444444
A103: =A102+1 -> 103 | B103: GINA | C103: CATALDO | D103: CATHEDRAL CATHOLIC | E103: 0.85763888888888884
A104: =A103+1 -> 104 | B104: KAITLYN | C104: KIGIN | D104: MIRA MESA | E104: 0.85833333333333339
A105: =A104+1 -> 105 | B105: SELINA | C105: CORTEZ | D105: ECONDIDO CHARTER | E105: 0.8618055555555556
A106: =A105+1 -> 106 | B106: CRISTINA | C106: ZUNIGA | D106: BORREGO SPRINGS | E106: 0.86944444444444446
A107: =A106+1 -> 107 | B107: KEIANNI | C107: DE LA ROSA | D107: MIRA MESA | E107: 0.8847222222222223
A108: =A107+1 -> 108 | B108: JENNIFER | C108: THOI | D108: MIRA MESA | E108: 0.88958333333333339
A109: =A108+1 -> 109 | B109: SAMANTHA | C109: ELLENA | D109: GUAJOME PARK ACAD. | E109: 0.89166666666666661
A110: =A109+1 -> 110 | B110: DEANNE | C110: LOPEZ | D110: MIRA MESA | E110: 0.89583333333333337
A111: =A110+1 -> 111 | B111: KAREN | C111: HESS | D111: GUAJOME PARK ACAD. | E111: 0.90138888888888891
A112: =A111+1 -> 112 | B112: CHARISSE | C112: OLJOL | D112: MIRA MESA | E112: 0.90138888888888891
A113: =A112+1 -> 113 | B113: ANTHEA | C113: SPICER | D113: MIRA MESA | E113: 0.90555555555555556
A114: =A113+1 -> 114 | B114: ANGELA | C114: RAMIREZ | D114: BORREGO SPRINGS | E114: NT
A115: 115 | B115: BRENDA | C115: CARMONA | D115: BORREGO SPRINGS | E115: NT
A116: =A115+1 -> 116 | B116: ARACELI | C116: SANCHEZ | D116: GUAJOME PARK ACAD. | E116: NT
A117: =A116+1 -> 117 | B117: AMANDA | C117: DEMOS | D117: MIRA MESA | E117: NT
A118: =A117+1 -> 118 | B118: ALYSSA | C118: SIMPELO | D118: MIRA MESA | E118: NT

A1: 1 | B1: DUSTIN | C1: TYLER | D1: SANTANNA | E1: 0.4680555555555555
A2: =A1+1 -> 2 | B2: K | C2: HAKAMIAN | D2: CCA | E2: 0.4777777777777778
A3: =A2+1 -> 3 | B3: A | C3: ORTEGA | D3: CCA | E3: 0.48055555555555557
A4: =A3+1 -> 4 | B4: DREW | C4: DIACHENLO | D4: CATHEDRAL | E4: 0.48333333333333334
A5: =A4+1 -> 5 | B5: NATE | C5: BURNS | D5: SDA | E5: 0.48472222222222222
A6: =A5+1 -> 6 | B6: MATT | C6: PALMER | D6: SANTANNA | E6: 0.48680555555555555
A7: =A6+1 -> 7 | B7: SANTIAGO | C7: ISLAS | D7: CATHEDRAL | E7: 0.48680555555555555
A8: =A7+1 -> 8 | C8: SAXER | D8: WEST HILLS | E8: 0.48958333333333331
A9: =A8+1 -> 9 | B9: TYLER | C9: ROBINSON | D9: CATHEDRAL | E9: 0.49375000000000002
A10: =A9+1 -> 10 | B10: CONNOR | C10: VALENZUELA | D10: CATHEDRAL | E10: 0.49513888888888885
A11: =A10+1 -> 11 | B11: DAN JAMES | C11: ALTO | D11: MIRA MESA | E11: 0.49583333333333335
A12: =A11+1 -> 12 | B12: GARRETT | C12: GORDON | D12: SANTANNA | E12: 0.49791666666666662
A13: =A12+1 -> 13 | B13: STEVEN | C13: FORSYTHE | D13: SDA | E13: 0.49861111111111112
A14: =A13+1 -> 14 | B14: TOM | C14: FIECHTNER | D14: CATHEDRAL | E14: 0.50277777777777777
A15: =A14+1 -> 15 | B15: GARRETT | C15: HARTSUYKER | D15: SANTANNA | E15: 0.50347222222222221
A16: =A15+1 -> 16 | B16: TOMMY | C16: BOCHMER | D16: CATHEDRAL | E16: 0.50416666666666665
A17: =A16+1 -> 17 | B17: AARON | C17: HEMPHILL | D17: SANTANNA | E17: 0.50416666666666665
A18: =A17+1 -> 18 | B18: AARON | C18: THOMAS | D18: GROSSMONT | E18: 0.50555555555555554
A19: =A18+1 -> 19 | C19: BORRERO | D19: WEST HILLS | E19: 0.5083333333333333
A20: =A19+1 -> 20 | B20: A | C20: HAITIN | D20: CCA | E20: 0.50902777777777775
A21: =A20+1 -> 21 | B21: NATE | C21: IZRA | D21: CCA | E21: 0.51041666666666663
A22: =A21+1 -> 22 | B22: DEVIN | C22: DRAKE | D22: CATHEDRAL | E22: 0.5131944444444444
A23: =A22+1 -> 23 | B23: JOEL | C23: PICO | D23: HORIZON | E23: 0.51388888888888895
A24: =A23+1 -> 24 | B24: EUGENE | C24: MALDONADO | D24: GUAJOME | E24: 0.51388888888888895
A25: =A24+1 -> 25 | B25: CARLOS | C25: CABRERA | D25: GUAJOME | E25: 0.51527777777777783
A26: =A25+1 -> 26 | C26: MARTORANA | D26: WEST HILLS | E26: 0.51736111111111105
A27: =A26+1 -> 27 | C27: ROSS | D27: WEST HILLS | E27: 0.52083333333333337
A28: =A27+1 -> 28 | C28: MCMANUS | D28: WEST HILLS | E28: 0.5229166666666667
A29: =A28+1 -> 29 | B29: JONNY | C29: HOOLKO | D29: CATHEDRAL | E29: 0.52638888888888891
A30: =A29+1 -> 30 | B30: JUSTIN | C30: BRACCI | D30: SDA | E30: 0.52708333333333335
A31: =A30+1 -> 31 | B31: BEN | C31: SACHS | D31: CATHEDRAL | E31: 0.52708333333333335
A32: =A31+1 -> 32 | B32: BEN | C32: HORVATH | D32: CATHEDRAL | E32: 0.52777777777777779
A33: =A32+1 -> 33 | B33: C | C33: CAPPEL | D33: CCA | E33: 0.52777777777777779
A34: =A33+1 -> 34 | C34: GREGORY | D34: WEST HILLS | E34: 0.52847222222222223
A35: =A34+1 -> 35 | B35: COREY | C35: NEHMITZ | D35: CATHEDRAL | E35: 0.53125
A36: =A35+1 -> 36 | B36: ERIC | C36: MCROSKEY | D36: CATHEDRAL | E36: 0.53263888888888888
A37: =A36+1 -> 37 | B37: CONNOR | C37: TOOHILL | D37: CATHEDRAL | E37: 0.53402777777777777
A38: =A37+1 -> 38 | B38: NICK | C38: BARTHELL | D38: CATHEDRAL | E38: 0.53541666666666665
A39: =A38+1 -> 39 | B39: TRAVIS | C39: NORTON | D39: SDA | E39: 0.53611111111111109
A40: =A39+1 -> 40 | B40: CONOR | C40: PARIS | D40: SDA | E40: 0.53749999999999998
A41: =A40+1 -> 41 | B41: MILES | C41: HIMMEL | D41: LJCD | E41: 0.5395833333333333
A42: =A41+1 -> 42 | B42: R | C42: SHANKS | D42: CATHEDRAL | E42: 0.54097222222222219
A43: =A42+1 -> 43 | B43: PARKER | C43: BARRETT | D43: CATHEDRAL | E43: 0.54166666666666663
A44: =A43+1 -> 44 | B44: LOGAN | C44: GALLAGHER | D44: SAN DIEGUITO | E44: 0.54236111111111118
A45: =A44+1 -> 45 | B45: JOSEPH | C45: RICHARDSON | D45: CATHEDRAL | E45: 0.54305555555555551
A46: =A45+1 -> 46 | B46: A | C46: PAUL | D46: CCA | E46: 0.54305555555555551
A47: =A46+1 -> 47 | B47: ADAMS | C47: E. | D47: CCA | E47: 0.5444444444444444
A48: =A47+1 -> 48 | C48: IVEY | D48: WEST HILLS | E48: 0.5444444444444444
A49: =A48+1 -> 49 | C49: WEBER | D49: WEST HILLS | E49: 0.54513888888888895
A50: =A49+1 -> 50 | B50: ULYSSES | C50: SAVAGE | D50: MIRA MESA | E50: 0.54652777777777783
A51: =A50+1 -> 51 | B51: RAY | C51: SAHAGUN | D51: GUAJOME | E51: 0.54722222222222217
A52: =A51+1 -> 52 | B52: CODY | C52: SCHEIWE | D52: SDA | E52: 0.54791666666666672
A53: =A52+1 -> 53 | B53: JOHN | C53: BLACK | D53: MIRA MESA | E53: 0.54861111111111105
A54: =A53+1 -> 54 | B54: CIPRIANO | C54: ZULUAGA | D54: GUAJOME | E54: 0.5493055555555556
A55: =A54+1 -> 55 | B55: CHRIS | C55: PAPAS | D55: MIRA MESA | E55: 0.55277777777777781
A56: =A55+1 -> 56 | C56: GONZALEZ | D56: WEST HILLS | E56: 0.55625000000000002
A57: =A56+1 -> 57 | B57: NATHAN | C57: CARR | D57: MIRA MESA | E57: 0.55833333333333335
A58: =A57+1 -> 58 | B58: ZACK | C58: MAYEDA | D58: SDA | E58: 0.55902777777777779
A59: =A58+1 -> 59 | B59: COLLIN | C59: FITZPATRICK | D59: CATHEDRAL | E59: 0.55902777777777779
A60: =A59+1 -> 60 | B60: CHRIS | C60: SAUQUILLO | D60: CATHEDRAL | E60: 0.56041666666666667
A61: =A60+1 -> 61 | B61: BRYAN | C61: O'CONNOR | D61: MIRA MESA | E61: 0.56180555555555556
A62: =A61+1 -> 62 | B62: KEVIN | C62: JOHNSON | D62: MIRA MESA | E62: 0.56319444444444444
A63: =A62+1 -> 63 | B63: C | C63: GARDNER | D63: CCA | E63: 0.56458333333333333
A64: =A63+1 -> 64 | B64: PATRICK | C64: TILLEY | D64: GROSSMONT | E64: 0.56527777777777777
A65: =A64+1 -> 65 | B65: DANNY | C65: SELF | D65: FOOTHILL CHR. | E65: 0.56527777777777777
A66: =A65+1 -> 66 | B66: HAVEL | C66: RESPES | D66: MIRA MESA | E66: 0.56527777777777777
A67: =A66+1 -> 67 | B67: TYLER | C67: JIMENO | D67: MIRA MESA | E67: 0.56597222222222221
A68: =A67+1 -> 68 | B68: ADAMS | C68: LAI FATT | D68: SAN DIEGUITO | E68: 0.56736111111111109
A69: =A68+1 -> 69 | B69: JOEY | C69: PETERSON | D69: GROSSMONT | E69: 0.56805555555555554
A70: =A69+1 -> 70 | C70: AVERY | D70: WEST HILLS | E70: 0.56944444444444442
A71: =A70+1 -> 71 | B71: BRENDAN | C71: SAPIEN | D71: MIRA MESA | E71: 0.57152777777777775
A72: =A71+1 -> 72 | B72: E | C72: MINTZ | D72: CCA | E72: 0.57222222222222219
A73: =A72+1 -> 73 | B73: M | C73: JORGE | D73: WEST HILLS | E73: 0.57430555555555551
A74: =A73+1 -> 74 | B74: TIM | C74: SKIPMORE | D74: GUAJOME | E74: 0.57430555555555551
A75: =A74+1 -> 75 | B75: JOHN CAVLOS | C75: CRUZ | D75: MIRA MESA | E75: 0.57499999999999996
A76: =A75+1 -> 76 | B76: DEVIN | C76: DAHLBERG | D76: MIRA MESA | E76: 0.57499999999999996
A77: =A76+1 -> 77 | B77: GUNNER | C77: GALLOWAY | D77: SAN DIEGUITO | E77: 0.57499999999999996
A78: =A77+1 -> 78 | B78: IAN | C78: STERNBERG | D78: GUAJOME | E78: 0.57638888888888895
A79: =A78+1 -> 79 | B79: G | C79: O'LEARY | D79: CCA | E79: 0.57708333333333328
A80: =A79+1 -> 80 | B80: SEAN | C80: RITCHEY | D80: GROSSMONT | E80: 0.57777777777777783
A81: =A80+1 -> 81 | B81: LANE | C81: JACKSON | D81: SDA | E81: 0.57916666666666672
A82: =A81+1 -> 82 | B82: S | C82: GOLDBERG | D82: WEST HILLS | E82: 0.5805555555555556
A83: =A82+1 -> 83 | B83: SEAN | C83: ROWLAND | D83: CATHEDRAL | E83: 0.58194444444444449
A84: =A83+1 -> 84 | B84: JERICHO | C84: GARICA-BATTS | D84: MIRA MESA | E84: 0.58263888888888882
A85: =A84+1 -> 85 | B85: CALVIN | C85: HA | D85: MIRA MESA | E85: 0.58402777777777781
A86: =A85+1 -> 86 | B86: BRANDON | C86: ROWLEY | D86: SDA | E86: 0.5854166666666667
A87: =A86+1 -> 87 | B87: PAXTON | C87: DEBOLT | D87: GROSSMONT | E87: 0.58958333333333335
A88: =A87+1 -> 88 | B88: ALAN | C88: HAMILTON | D88: GUAJOME | E88: 0.59097222222222223
A89: =A88+1 -> 89 | B89: MAX | C89: REINMAELLER | D89: MIRA MESA | E89: 0.59305555555555556
A90: =A89+1 -> 90 | B90: PAT | C90: MILLER | D90: WEST HILLS | E90: 0.59305555555555556
A91: =A90+1 -> 91 | B91: MICHAEL | C91: SIECKERMAN | D91: BORREGO SPR. | E91: 0.59375
A92: =A91+1 -> 92 | B92: BLAKE | C92: TURNER | D92: GUAJOME | E92: 0.59375
A93: =A92+1 -> 93 | B93: JUAN | C93: ROCHA | D93: BORREGO SPR. | E93: 0.59375
A94: =A93+1 -> 94 | C94: SCHOONOVER | D94: WEST HILLS | E94: 0.59722222222222221
A95: =A94+1 -> 95 | B95: SAMMY | C95: YOUNG | D95: SDA | E95: 0.59861111111111109
A96: =A95+1 -> 96 | B96: ANDREW | C96: DYSON | D96: GROSSMONT | E96: 0.59930555555555554
A97: =A96+1 -> 97 | B97: RYAN | C97: SCHRAMM | D97: CATHEDRAL | E97: 0.60069444444444442
A98: =A97+1 -> 98 | B98: JOSEPH | C98: CHARLOT | D98: MIRA MESA | E98: 0.60347222222222219
A99: =A98+1 -> 99 | B99: KAUEL | C99: BARAN | D99: SDA | E99: 0.60416666666666663
A100: =A99+1 -> 100 | B100: MICHAEL | C100: DEJESUS | D100: MIRA MESA | E100: 0.60555555555555551
A101: =A100+1 -> 101 | B101: BRIAN | C101: REGULAR | D101: MIRA MESA | E101: 0.60624999999999996
A102: =A101+1 -> 102 | B102: DANIEL | C102: PETERSON | D102: CATHEDRAL | E102: 0.60624999999999996
A103: =A102+1 -> 103 | B103: CHRISTIAN | C103: FARUS | D103: CATHEDRAL | E103: 0.60763888888888895
A104: =A103+1 -> 104 | B104: KYLE | C104: WILSON | D104: SANTANNA | E104: 0.60833333333333328
A105: =A104+1 -> 105 | B105: GARETH | C105: PARKER | D105: MIRA MESA | E105: 0.60902777777777783
A106: =A105+1 -> 106 | B106: DANIEL | C106: CLIFFE | D106: SANTANNA | E106: 0.6118055555555556
A107: =A106+1 -> 107 | B107: ANDREW | C107: GANZALES | D107: MIRA MESA | E107: 0.61458333333333337
A108: =A107+1 -> 108 | B108: JOSHUA | C108: EDWARDS | D108: FOOTHILL CHR. | E108: 0.61458333333333337
A109: =A108+1 -> 109 | B109: GARRETT | C109: SCHNEIDER | D109: LJCD | E109: 0.61458333333333337
A110: =A109+1 -> 110 | B110: J.D. | C110: ROBINSON | D110: GUAJOME | E110: 0.62222222222222223
A111: =A110+1 -> 111 | B111: CHRIS | C111: OLMSTEAD | D111: GROSSMONT | E111: 0.625
A112: =A111+1 -> 112 | B112: L | C112: IZRA | D112: CCA | E112: 0.62638888888888888
A113: =A112+1 -> 113 | B113: Z | C113: BROWN | D113: CCA | E113: 0.62708333333333333
A114: =A113+1 -> 114 | B114: TAM | C114: NGUYEN | D114: MIRA MESA | E114: 0.62708333333333333
A115: =A114+1 -> 115 | B115: VIET | C115: TRAN | D115: MIRA MESA | E115: 0.62777777777777777
A116: =A115+1 -> 116 | B116: JOSHUA | C116: CRUZ | D116: GUAJOME | E116: 0.62777777777777777
A117: =A116+1 -> 117 | B117: WESTIN | C117: LAHR | D117: ECHS | E117: 0.62916666666666665
A118: =A117+1 -> 118 | C118: CONSTANTINE | D118: WEST HILLS | E118: 0.63263888888888886
A119: =A118+1 -> 119 | B119: DANSON | C119: NGUYEN | D119: MIRA MESA | E119: 0.63402777777777775
A120: =A119+1 -> 120 | B120: EUGENE | C120: PHILLIPS | D120: MIRA MESA | E120: 0.6430555555555556
A121: =A120+1 -> 121 | B121: ROBERT | C121: JAVIER | D121: MIRA MESA | E121: 0.64513888888888882
A122: =A121+1 -> 122 | B122: R | C122: CARDOZA | D122: CCA | E122: 0.64652777777777781
A123: =A122+1 -> 123 | B123: GERALD | C123: CHACAN | D123: MIRA MESA | E123: 0.6479166666666667
A124: =A123+1 -> 124 | B124: JOESPH | C124: BRIDGEFORTH | D124: FOOTHILL CHR. | E124: 0.64861111111111114
A125: =A124+1 -> 125 | B125: DEUSSEIMAN | C125: ARCINUE | D125: MIRA MESA | E125: 0.65208333333333335
A126: =A125+1 -> 126 | B126: VINH | C126: NGUYEN | D126: MIRA MESA | E126: 0.65277777777777779
A127: =A126+1 -> 127 | B127: M | C127: BURBAUM | D127: CCA | E127: 0.65416666666666667
A128: =A127+1 -> 128 | B128: CHRIS | C128: BRAAMSE | D128: CATHEDRAL | E128: 0.65416666666666667
A129: =A128+1 -> 129 | B129: CAMERON | C129: YU | D129: MIRA MESA | E129: 0.65625
A130: =A129+1 -> 130 | B130: BRANDON | C130: EVANGELISTA | D130: MIRA MESA | E130: 0.65763888888888888
A131: =A130+1 -> 131 | B131: GABRIEL | C131: DELATORRE | D131: MIRA MESA | E131: 0.65972222222222221
A132: =A131+1 -> 132 | B132: MATTHEW | C132: GARRETT | D132: GUAJOME | E132: 0.66041666666666665
A133: =A132+1 -> 133 | B133: JAKE | C133: KRANZ | D133: GUAJOME | E133: 0.66111111111111109
A134: =A133+1 -> 134 | B134: BRIAN | C134: WRIGHT | D134: GUAJOME | E134: 0.66249999999999998
A135: =A134+1 -> 135 | C135: MCLAUGHLIN | D135: WEST HILLS | E135: 0.6791666666666667
A136: =A135+1 -> 136 | B136: TONY | C136: SAVAGE | D136: HORIZON | E136: 0.68194444444444446
A137: =A136+1 -> 137 | B137: K | C137: SIMMON | D137: CCA | E137: 0.68680555555555556
A138: =A137+1 -> 138 | B138: RYAN | C138: GALANG | D138: MIRA MESA | E138: 0.68680555555555556
A139: =A138+1 -> 139 | B139: JESSE | C139: CABRAL | D139: HORIZON | E139: 0.6958333333333333
A140: =A139+1 -> 140 | B140: M | C140: CLARK | D140: CCA | E140: 0.69791666666666663
A141: =A140+1 -> 141 | B141: SIMON | C141: STEWART | D141: ECHS | E141: 00.7
A142: =A141+1 -> 142 | B142: LANDON | C142: MILLARD | D142: FOOTHILL CHR. | E142: 0.70416666666666661
A143: =A142+1 -> 143 | B143: RAYNIER | C143: HEBRAN | D143: MIRA MESA | E143: 0.70625000000000004
A144: =A143+1 -> 144 | B144: JOSH | C144: MEALY | D144: SDA | E144: 0.71805555555555556
A145: =A144+1 -> 145 | B145: PRESTON | C145: PETERSON | D145: HORIZON | E145: 0.72916666666666663
A146: =A145+1 -> 146 | B146: BEN | C146: MCDUFF | D146: ECHS | E146: 0.73055555555555562
A147: =A146+1 -> 147 | B147: MIKE | C147: MAQNER | D147: GUAJOME | E147: 0.73611111111111116
A148: =A147+1 -> 148 | B148: NATHAN | C148: KING | D148: BORREGO SPR. | E148: 0.7402777777777777
A149: =A148+1 -> 149 | B149: YABES | C149: KE | D149: MIRA MESA | E149: 0.7416666666666667
A150: =A149+1 -> 150 | B150: KEVIN | C150: CLARK | D150: SANTANNA | E150: 0.75069444444444444
A151: =A150+1 -> 151 | B151: RICARDO | C151: GARCIA | D151: BORREGO SPR. | E151: 0.75694444444444453
A152: =A151+1 -> 152 | B152: HUYNH | C152: TONY | D152: MIRA MESA | E152: NT
A153: =A152+1 -> 153 | B153: EDUARDO | C153: JARMONA | D153: BORREGO SPR. | E153: NT
A154: =A153+1 -> 154 | B154: TREVOR | C154: PATTERSON | D154: GUAJOME | E154: NT
A155: =A154+1 -> 155 | B155: JORDAN | C155: BARKER | D155: GUAJOME | E155: NT
A156: =A155+1 -> 156 | B156: JAMES | C156: PAMPOLINA | D156: MIRA MESA | E156: NT
A157: =A156+1 -> 157 | B157: ANDREW | C157: RUBI | D157: MIRA MESA | E157: NT

A1: 1 | B1: ARIEL | C1: ABBOTT | D1: LA JOLLA COUNTRY DAY | E1: 0.58333333333333337
A2: =A1+1 -> 2 | B2: S | C2: ZLOTNIK | D2: CCPAA | E2: 0.60555555555555551
A3: =A2+1 -> 3 | B3: A | C3: ARREDONDO | D3: CCPAA | E3: 0.6069444444444444
A4: =A3+1 -> 4 | B4: SASHA | C4: BINDEROW | D4: LA JOLLA COUNTRY DAY | E4: 0.62083333333333335
A5: =A4+1 -> 5 | B5: C | C5: GEDEON | D5: WEST HILLS | E5: 0.63402777777777775
A6: =A5+1 -> 6 | B6: A | C6: JEFFERY | D6: WEST HILLS | E6: 0.63611111111111118
A7: =A6+1 -> 7 | B7: ASHLEY | C7: ARMSTRONG | D7: SAN DIEGUITO ACADAMY | E7: 0.6430555555555556
A8: =A7+1 -> 8 | B8: LANNA | C8: MURPHY | D8: SAN DIEGUITO ACADAMY | E8: 0.64375000000000004
A9: =A8+1 -> 9 | B9: STEPHANIE | C9: TUCKER | D9: CATHEDRAL CATHOLIC | E9: 0.64375000000000004
A10: =A9+1 -> 10 | B10: KELSEY | C10: CHIODO | D10: FOOTHILL CHRISTIAN | E10: 0.64444444444444449
A11: =A10+1 -> 11 | C11: OTTO | D11: WEST HILLS | E11: 0.64861111111111114
A12: =A11+1 -> 12 | B12: TALISSA | C12: LEARY | D12: GROSSMONT | E12: 0.65208333333333335
A13: =A12+1 -> 13 | B13: J | C13: HENMAN | D13: CCPAA | E13: 0.65277777777777779
A14: =A13+1 -> 14 | C14: VOLL | D14: WEST HILLS | E14: 0.65555555555555556
A15: =A14+1 -> 15 | C15: MCCONNELL | D15: WEST HILLS | E15: 0.65277777777777779
A16: =A15+1 -> 16 | B16: TAYLOR | C16: RAHLFS | D16: CATHEDRAL CATHOLIC | E16: 0.65972222222222221
A17: =A16+1 -> 17 | B17: TANYA | C17: KIM | D17: MIRA MESA | E17: 0.66249999999999998
A18: =A17+1 -> 18 | C18: WILLIAMS | D18: WEST HILLS | E18: 0.66249999999999998
A19: =A18+1 -> 19 | B19: BREANNA | C19: TRISKO | D19: CATHEDRAL CATHOLIC | E19: 0.6645833333333333
A20: =A19+1 -> 20 | B20: JESSICA | C20: SCOTT | D20: MIRA MESA | E20: 0.66527777777777775
A21: =A20+1 -> 21 | B21: S | C21: RAWI | D21: CCPAA | E21: 0.66527777777777775
A22: =A21+1 -> 22 | B22: ROSA | C22: THOMPSON | D22: HORIZON | E22: 0.66874999999999996
A23: =A22+1 -> 23 | B23: MEREDITH | C23: BREWSTER | D23: CATHEDRAL CATHOLIC | E23: 0.6694444444444444
A24: =A23+1 -> 24 | B24: AMELIA | C24: ROLAND | D24: GROSSMONT | E24: 0.67013888888888884
A25: =A24+1 -> 25 | B25: CAITLIN | C25: BYRNE | D25: CATHEDRAL CATHOLIC | E25: 0.67500000000000004
A26: =A25+1 -> 26 | C26: DECRESENTE | D26: WEST HILLS | E26: 0.67569444444444438
A27: =A26+1 -> 27 | B27: KATELYNN | C27: COLLINS | D27: GROSSMONT | E27: 0.67708333333333337
A28: =A27+1 -> 28 | B28: REBECCA | C28: WARD | D28: GROSSMONT | E28: 0.68333333333333324
A29: =A28+1 -> 29 | B29: SHELBY | C29: ROSS | D29: MIRA MESA | E29: 0.68472222222222223
A30: =A29+1 -> 30 | B30: LAUREN | C30: KENNEDY | D30: CATHEDRAL CATHOLIC | E30: 0.68680555555555556
A31: =A30+1 -> 31 | C31: ROBBINS | D31: WEST HILLS | E31: 0.6875
A32: =A31+1 -> 32 | B32: CECLIA | C32: ARETA | D32: MIRA MESA | E32: 0.69305555555555554
A33: =A32+1 -> 33 | B33: R | C33: THOMPSON | D33: CCPAA | E33: 0.70277777777777783
A34: =A33+1 -> 34 | B34: KELSEY | C34: SAAKE | D34: SAN DIEGUITO ACADAMY | E34: 0.70347222222222217
A35: =A34+1 -> 35 | B35: HAYLEY | C35: FLEISHMAN | D35: CATHEDRAL CATHOLIC | E35: 0.71597222222222223
A36: =A35+1 -> 36 | B36: LARA | C36: PEDE | D36: SAN DIEGUITO ACADAMY | E36: 0.71736111111111101
A37: =A36+1 -> 37 | B37: ABAD | C37: RACQUEL | D37: MIRA MESA | E37: 0.73541666666666661
A38: =A37+1 -> 38 | B38: CAMILLE | C38: PHILLIPS | D38: GROSSMONT | E38: 0.73888888888888893
A39: =A38+1 -> 39 | B39: LAUREL | C39: OOLIE | D39: GROSSMONT | E39: 0.74236111111111114
A40: =A39+1 -> 40 | B40: STACY | C40: WILKINSON | D40: MIRA MESA | E40: 0.74791666666666667
A41: =A40+1 -> 41 | B41: ASHLEY | C41: HAHN | D41: MIRA MESA | E41: 0.75277777777777777
A42: =A41+1 -> 42 | C42: WHITEMAN | D42: WEST HILLS | E42: 0.76597222222222217
A43: =A42+1 -> 43 | B43: ANN | C43: PATY | D43: MIRA MESA | E43: 0.77222222222222225
A44: =A43+1 -> 44 | B44: LAUREL | C44: VOZELY | D44: GROSSMONT | E44: 0.77569444444444446
A45: =A44+1 -> 45 | B45: VANESSA | C45: HINKLE | D45: SAN DIEGUITO ACADAMY | E45: 0.78125
A46: =A45+1 -> 46 | B46: K | C46: ARCE | D46: WEST HILLS | E46: 0.7909722222222223
A47: =A46+1 -> 47 | B47: KIMBERLY | C47: NICHOLS | D47: MIRA MESA | E47: 0.79166666666666663
A48: =A47+1 -> 48 | B48: TORI | C48: DUNBAR | D48: SAN DIEGUITO ACADAMY | E48: 0.80972222222222223
A49: =A48+1 -> 49 | B49: ALICIA | C49: PERCY | D49: MIRA MESA | E49: 0.81388888888888899
A50: =A49+1 -> 50 | B50: NICOLE | C50: WILLIAMS | D50: GUAJOME PARK ACAD. | E50: 0.81597222222222221
A51: =A50+1 -> 51 | B51: GENALYN | C51: RAPELO | D51: MIRA MESA | E51: 0.85277777777777775
A52: =A51+1 -> 52 | B52: SARAH | C52: PAULSON | D52: SANTANA | E52: 0.8618055555555556
A53: =A52+1 -> 53 | B53: NANCY | C53: VELARDE | D53: MIRA MESA | E53: 0.88680555555555562
A54: =A53+1 -> 54 | B54: EVA | C54: PAXTON | D54: SAN DIEGUITO ACADAMY | E54: 0.89027777777777783
A55: =A54+1 -> 55 | B55: BRIE | C55: HOCKENBERRY | D55: GUAJOME PARK ACAD. | E55: NT
A56: =A55+1 -> 56 | B56: JEN | C56: HERRING | D56: LA JOLLA COUNTRY DAY | E56: NT

A1: 1 | B1: A | C1: ROLPH | D1: CCA | E1: 0.45902777777777781
A2: =1+A1 -> 2 | B2: ISHMAEL | C2: ARMENTA | D2: GUAJOME | E2: 0.4604166666666667
A3: =1+A2 -> 3 | B3: MARCO | C3: RAMIREZ | D3: GUAJOME | E3: 0.46111111111111108
A4: =1+A3 -> 4 | B4: JEFF | C4: SUCHIL | D4: GROSSMONT | E4: 0.4777777777777778
A5: =1+A4 -> 5 | B5: ZACH | C5: BROWN | D5: MORSE | E5: 0.48819444444444443
A6: =1+A5 -> 6 | B6: JOSH | C6: SALMERON | D6: CATHEDRAL | E6: 0.48819444444444443
A7: =1+A6 -> 7 | B7: WILLIAM | C7: WOESK | D7: CATHEDRAL | E7: 0.49722222222222223
A8: =1+A7 -> 8 | C8: NELSON | D8: WEST HILLS | E8: 0.5
A9: =1+A8 -> 9 | B9: J | C9: RUCKER | D9: CCA | E9: 0.50555555555555554
A10: =1+A9 -> 10 | B10: N | C10: PIERCE | D10: WEST HILLS | E10: 0.50624999999999998
A11: =1+A10 -> 11 | B11: CHASE | C11: EDLETSON | D11: CATHEDRAL | E11: 0.51041666666666663
A12: =1+A11 -> 12 | B12: MATT | C12: BOEHMER | D12: CATHEDRAL | E12: 0.51180555555555551
A13: =1+A12 -> 13 | C13: CERVANTES | D13: WEST HILLS | E13: 0.51458333333333328
A14: =1+A13 -> 14 | B14: T | C14: DIAL | D14: CCA | E14: 0.51597222222222217
A15: =1+A14 -> 15 | B15: E | C15: NAIRE | D15: CCA | E15: 0.51736111111111105
A16: =1+A15 -> 16 | C16: RUSSO | D16: WEST HILLS | E16: 0.51736111111111105
A17: =1+A16 -> 17 | B17: K | C17: JORCE | D17: WEST HILLS | E17: 0.5180555555555556
A18: =1+A17 -> 18 | B18: CHRISTOPHER | C18: EGAN | D18: MIRA MESA | E18: 0.52013888888888882
A19: =1+A18 -> 19 | B19: M | C19: HARRIGAN | D19: CCA | E19: 0.52152777777777781
A20: =1+A19 -> 20 | B20: R | C20: HARRY | D20: CCA | E20: 0.52361111111111114
A21: =1+A20 -> 21 | B21: CHRIS | C21: BERGHAUSER | D21: CATHEDRAL | E21: 0.52500000000000002
A22: =1+A21 -> 22 | C22: READ | D22: WEST HILLS | E22: 0.52638888888888891
A23: =1+A22 -> 23 | C23: HENRY | D23: WEST HILLS | E23: 0.52847222222222223
A24: =1+A23 -> 24 | B24: ANTHONY | C24: FERRANDO | D24: CATHEDRAL | E24: 0.52847222222222223
A25: =1+A24 -> 25 | B25: OWEN | C25: LORD | D25: GROSSMONT | E25: 0.52986111111111112
A26: =1+A25 -> 26 | B26: MICHAEL | C26: SPELLACY | D26: CATHEDRAL | E26: 0.53055555555555556
A27: =1+A26 -> 27 | B27: WILL | C27: FORTIN | D27: SDA | E27: 0.53125
A28: =1+A27 -> 28 | B28: EVAN | C28: MORING | D28: SDA | E28: 0.53194444444444444
A29: =1+A28 -> 29 | B29: DANIEL | C29: BLAIR | D29: CATHEDRAL | E29: 0.53263888888888888
A30: =1+A29 -> 30 | B30: RYAN | C30: MURPHY | D30: CATHEDRAL | E30: 0.53333333333333333
A31: =1+A30 -> 31 | B31: C | C31: WU | D31: CCA | E31: 0.53472222222222221
A32: =1+A31 -> 32 | B32: HUNTER | C32: STEVENS | D32: GROSSMONT | E32: 0.53819444444444442
A33: =1+A32 -> 33 | B33: JOHN | C33: KRANZ | D33: GUAJOME | E33: 0.54027777777777775
A34: =1+A33 -> 34 | B34: BRYAN | C34: GRUNER | D34: MIRA MESA | E34: 0.54097222222222219
A35: =1+A34 -> 35 | C35: KRUMENACK | D35: WEST HILLS | E35: 0.54374999999999996
A36: =1+A35 -> 36 | C36: WILHELM | D36: WEST HILLS | E36: 0.54861111111111105
A37: =1+A36 -> 37 | C37: WHIIPS | D37: WEST HILLS | E37: 0.54861111111111105
A38: =1+A37 -> 38 | B38: NICK | C38: ARMSTRONG | D38: SDA | E38: 00.55
A39: =1+A38 -> 39 | C39: AULT | D39: WEST HILLS | E39: 0.55208333333333337
A40: =1+A39 -> 40 | B40: STEVEN | C40: KIMES | D40: CATHEDRAL | E40: 0.55694444444444446
A41: =1+A40 -> 41 | B41: ANDY | C41: BUI | D41: MIRA MESA | E41: 0.55833333333333335
A42: =1+A41 -> 42 | B42: ERIC | C42: COOK | D42: SDA | E42: 0.56111111111111112
A43: =1+A42 -> 43 | C43: QI | D43: WEST HILLS | E43: 0.56180555555555556
A44: =1+A43 -> 44 | B44: AARON | C44: ROWLEY | D44: SDA | E44: 0.56180555555555556
A45: =1+A44 -> 45 | B45: MIKE | C45: MUNOZ | D45: GROSSMONT | E45: 0.5625
A46: =1+A45 -> 46 | B46: RILEY | C46: BRORAIN | D46: SDA | E46: 0.56319444444444444
A47: =1+A46 -> 47 | C47: REINHART | D47: WEST HILLS | E47: 0.56388888888888888
A48: =1+A47 -> 48 | B48: DAN | C48: WITYAK | D48: SDA | E48: 0.56597222222222221
A49: =1+A48 -> 49 | B49: F | C49: VAHI | D49: WEST HILLS | E49: 0.57430555555555551
A50: =1+A49 -> 50 | B50: GAGE | C50: PROVENCHER | D50: FOOTHILLS CHR. | E50: 0.5756944444444444
A51: =1+A50 -> 51 | C51: BENNETT | D51: WEST HILLS | E51: 0.57638888888888895
A52: =1+A51 -> 52 | B52: PAUL | C52: MILLER | D52: WEST HILLS | E52: 0.57916666666666672
A53: =1+A52 -> 53 | B53: BRADLEY | C53: BURTON | D53: MIRA MESA | E53: 0.5805555555555556
A54: =1+A53 -> 54 | B54: BRANDON | C54: JEFFERY | D54: SDA | E54: 0.58263888888888882
A55: =1+A54 -> 55 | B55: PHI | C55: TON | D55: MIRA MESA | E55: 0.58333333333333337
A56: =1+A55 -> 56 | B56: ANTHONY | C56: COSTELLO | D56: MIRA MESA | E56: 0.58472222222222225
A57: =1+A56 -> 57 | C57: GEDEON | D57: WEST HILLS | E57: 0.58819444444444446
A58: =1+A57 -> 58 | B58: M | C58: SKERRITT | D58: CCA | E58: 0.58958333333333335
A59: =1+A58 -> 59 | B59: SKYLER | C59: CUNNINGHAM | D59: FOOTHILLS CHR. | E59: 0.58958333333333335
A60: =1+A59 -> 60 | B60: EDWARD | C60: CHIN | D60: MIRA MESA | E60: 0.58958333333333335
A61: =1+A60 -> 61 | B61: ALBERTO | C61: GUZMAN | D61: MIRA MESA | E61: 0.6020833333333333
A62: =1+A61 -> 62 | B62: LUIS | C62: ARCA | D62: CATHEDRAL | E62: 0.60347222222222219
A63: =1+A62 -> 63 | B63: X | C63: LI | D63: CCA | E63: 0.60347222222222219
A64: =1+A63 -> 64 | B64: TOMMY | C64: GOMEZ | D64: SANTANNA | E64: 0.60763888888888895
A65: =1+A64 -> 65 | B65: KHUA | C65: MAI | D65: MIRA MESA | E65: 0.60902777777777783
A66: =1+A65 -> 66 | B66: S | C66: MOSHER | D66: CCA | E66: 0.6118055555555556
A67: =1+A66 -> 67 | B67: JASON | C67: MCGOVERN | D67: MIRA MESA | E67: 0.61319444444444449
A68: =1+A67 -> 68 | B68: RYAN | C68: ZERKLE | D68: SANTANNA | E68: 0.62083333333333335
A69: =1+A68 -> 69 | B69: BRIAN | C69: TRUONG | D69: MIRA MESA | E69: 0.62291666666666667
A70: =1+A69 -> 70 | B70: LOI | C70: NGO | D70: MIRA MESA | E70: 0.62291666666666667
A71: =1+A70 -> 71 | B71: COLE | C71: WILSON | D71: SDA | E71: 0.62430555555555556
A72: =1+A71 -> 72 | B72: THEJA | C72: CHADALAWADA | D72: MIRA MESA | E72: 0.62916666666666665
A73: =1+A72 -> 73 | B73: ERIK | C73: OLSEN | D73: SDA | E73: 0.6333333333333333
A74: =1+A73 -> 74 | B74: DREW | C74: KUTILEK | D74: SDA | E74: 0.63749999999999996
A75: =1+A74 -> 75 | B75: WILLIAM | C75: MARTINES | D75: MIRA MESA | E75: 0.63888888888888895
A76: =1+A75 -> 76 | B76: DANIEL | C76: BILOTOA | D76: SDA | E76: 0.64444444444444449
A77: =1+A76 -> 77 | B77: ZACK | C77: IRWIN | D77: ECHS | E77: 0.65486111111111112
A78: =1+A77 -> 78 | B78: R | C78: FARMER | D78: CCA | E78: 0.65486111111111112
A79: =1+A78 -> 79 | B79: ERIC | C79: MEILANDER | D79: MIRA MESA | E79: 0.66666666666666663
A80: =1+A79 -> 80 | B80: SHAWN | C80: HOEBECK | D80: ECHS | E80: 0.68680555555555556
A81: =1+A80 -> 81 | B81: MARSHALL | C81: RAGSDALE | D81: FOOTHILLS CHR. | E81: 0.72013888888888899
A82: =1+A81 -> 82 | B82: FABIAN | C82: DIAZ | D82: GROSSMONT | E82: 0.75694444444444453
A83: =1+A82 -> 83 | B83: ROTTIE | C83: DUNN | D83: SDA | E83: 0.81736111111111109
A84: =1+A83 -> 84 | B84: KEITH | C84: BRIDGEFORTH | D84: FOOTHILLS CHR. | E84: 0.83472222222222225