A1: DOUBLE DUAL LCC SEPT 26TH 2007

A1: 1 | B1: Molly Grabill | C1: 0.63958333333333328 | E1: 1 | F1: Noah Resto | G1: 0.76388888888888884
A2: =A1+1 -> 2 | B2: Caroline Draper | C2: 0.65138888888888891 | E2: =E1+1 -> 2 | F2: Parker Stinson | G2: 0.76458333333333328
A3: =A2+1 -> 3 | B3: Michelle Black | C3: 0.6791666666666667 | E3: =E2+1 -> 3 | F3: Sean Proehl | G3: 0.76458333333333328
A4: =A3+1 -> 4 | B4: Allison Proehl | C4: 0.69097222222222221 | E4: =E3+1 -> 4 | F4: Drew Flood | G4: 0.76458333333333328
A5: =A4+1 -> 5 | B5: Michelle LeRoux | C5: 0.69166666666666665 | E5: =E4+1 -> 5 | F5: Kevin Schubert | G5: 0.76458333333333328
A6: =A5+1 -> 6 | B6: Melissa LeRoux | C6: 0.69305555555555554 | E6: =E5+1 -> 6 | F6: Ross Candelore | G6: 0.76458333333333328
A7: =A6+1 -> 7 | B7: Anna Mohamed-Zadeh | C7: 0.69722222222222219 | E7: =E6+1 -> 7 | F7: Tyler Davis | G7: 0.80694444444444446
A8: =A7+1 -> 8 | B8: Nina Scheepers | C8: 0.71250000000000002 | E8: =E7+1 -> 8 | F8: Vastal Shah | G8: 0.81597222222222221
A9: =A8+1 -> 9 | B9: Krista Egense | C9: 0.72638888888888886 | E9: =E8+1 -> 9 | F9: Peter Benito | G9: 0.88888888888888884
A10: =A9+1 -> 10 | B10: Olivia Krzeminski | C10: 0.72638888888888886 | E10: =E9+1 -> 10 | F10: Garrett Yagade | G10: 0.89097222222222228
A11: =A10+1 -> 11 | B11: Jenny Zhuang | C11: 0.73333333333333328 | E11: =E10+1 -> 11 | F11: Ryosuke Saika | G11: 0.8930555555555556
A12: =A11+1 -> 12 | B12: Darina Dinov | C12: 0.75 | E12: =E11+1 -> 12 | F12: Andrew Rhodes | G12: 0.93472222222222223
A13: =A12+1 -> 13 | B13: Natalie Uduwella | C13: 0.77013888888888893 | E13: =E12+1 -> 13 | F13: Daniel Nelson | G13: 0.98333333333333328
A14: =A13+1 -> 14 | B14: Taylor Parker | C14: 0.77638888888888891
A15: =A14+1 -> 15 | B15: Dana Mohammad-Zadeh | C15: 0.77708333333333335 | E15: =1 -> 1 | F15: Steven Kamen | G15: 0.6333333333333333
A16: =A15+1 -> 16 | B16: Chantae Reden | C16: 0.77708333333333335 | E16: =E15+1 -> 2 | F16: Travis Linder | G16: 0.64444444444444449
A17: =A16+1 -> 17 | B17: Madeline Wahl | C17: 0.78055555555555556 | E17: =E16+1 -> 3 | F17: Anthony Girolamo | G17: 0.64652777777777781
A18: =A17+1 -> 18 | B18: Casey Burgess | C18: 0.78819444444444442 | E18: =E17+1 -> 4 | F18: Conner Lachenbruch | G18: 00.65
A19: =A18+1 -> 19 | B19: Kara Yap | C19: 0.7895833333333333 | E19: =E18+1 -> 5 | F19: Ian Cable | G19: 0.65208333333333335
A20: =A19+1 -> 20 | B20: Tara Cowen | C20: 0.80833333333333335 | E20: =E19+1 -> 6 | F20: Jacob Fenlanson | G20: 0.65347222222222223
A21: =A20+1 -> 21 | B21: Charlese Matthews | C21: 0.80972222222222223 | E21: =E20+1 -> 7 | F21: O'min Kwon | G21: 0.66041666666666665
A22: =A21+1 -> 22 | B22: Amanda Alderton | C22: 0.83680555555555558 | E22: =E21+1 -> 8 | F22: Ryley Webb | G22: 0.66527777777777775
A23: =A22+1 -> 23 | B23: Sana Marzouq | C23: 0.85486111111111107 | E23: =E22+1 -> 9 | F23: Scott Robinson | G23: 0.67569444444444449
A24: =A23+1 -> 24 | B24: Alyssa Wertner | C24: 0.85555555555555551 | E24: =E23+1 -> 10 | F24: Jordan Ahostrom | G24: 0.68680555555555556
A25: =A24+1 -> 25 | B25: Kelsey Erskine | C25: 0.86805555555555558 | E25: =E24+1 -> 11 | F25: Robert McEntire | G25: 0.70416666666666672
A26: =A25+1 -> 26 | B26: Lindsay Pettijohn | C26: 0.86944444444444446 | E26: =E25+1 -> 12 | F26: Alec Burgess | G26: 0.7055555555555556
A27: =A26+1 -> 27 | B27: Casey Chilsom | C27: 0.87291666666666667 | E27: =E26+1 -> 13 | F27: Louw Scheepers | G27: 0.70763888888888893
A28: =A27+1 -> 28 | B28: Jaclyn Hanson | C28: 0.87430555555555556 | E28: =E27+1 -> 14 | F28: Zach Kaufman | G28: 0.70763888888888893
A29: =A28+1 -> 29 | B29: Michela Moneta | C29: 0.90763888888888888 | E29: =E28+1 -> 15 | F29: Todd Myers | G29: 0.71597222222222223
A30: =A29+1 -> 30 | B30: Chloe Leffas-Lopes | C30: 0.98472222222222228 | E30: =E29+1 -> 16 | F30: Skyler Warren | G30: 0.73958333333333337
A31: =A30+1 -> 31 | B31: Adrianna Sanchez | C31: 24:19 | E31: =E30+1 -> 17 | F31: Ryan Worden | G31: 0.74305555555555558
A32: =A31+1 -> 32 | B32: Ruth Malina | C32: 24:26 | E32: =E31+1 -> 18 | F32: James Rodriguez | G32: 0.74375000000000002
A33: =A32+1 -> 33 | B33: Haley Peterson | C33: 27:19 | E33: =E32+1 -> 19 | F33: Robert Sheehan | G33: 0.75763888888888886
A34: =A33+1 -> 34 | B34: Hannah Quinto | C34: 27:31 | E34: =E33+1 -> 20 | F34: Alex Flood | G34: 0.77916666666666667
E35: =E34+1 -> 21 | F35: Jake Brockbank | G35: 0.80694444444444446
E36: =E35+1 -> 22 | F36: Ben Wancewicz | G36: 0.81527777777777777
E37: =E36+1 -> 23 | F37: Jae Sang Oh | G37: 0.82291666666666663
E38: =E37+1 -> 24 | F38: Max Johnson | G38: 0.99930555555555556
E39: =E38+1 -> 25 | F39: Ben Wancewicz | G39: 0.81527777777777777
E40: =E39+1 -> 26 | F40: Jae Sang Oh | G40: 0.82291666666666663
E41: =E40+1 -> 27 | F41: Max Johnson | G41: 0.99930555555555556

A1: NAME | B1: PL | C1: FINISH
A2: Varsity Girls
A3: Melissa LeRoux | B3: 10 | C3: 0.69305555555555554 | F3: LCC | G3: RB
A4: Molly Grabill | B4: 2 | C4: 0.63958333333333328 | E4: 1 | F4: 1 | G4: 2
A5: Caroline Draper | B5: 4 | C5: 0.65138888888888891 | E5: 2 | F5: 3 | G5: 4
A6: Michelle Black | B6: 7 | C6: 0.6791666666666667 | E6: 3 | F6: 5 | G6: 7
A7: Michelle LeRoux | B7: 9 | C7: 0.69166666666666665 | E7: 4 | F7: 6 | G7: 8
A8: Krista Egense | B8: 13 | C8: 0.72638888888888886 | E8: 5 | F8: 12 | G8: 9
A9: Allison Proehl | B9: 8 | C9: 0.69097222222222221 | F9: 27 | G9: 30
A10: Anna Mohamed-Zadeh | B10: 11 | C10: 0.69722222222222219
A11: seniors
A12: Jenny Zhuang | B12: 14 | C12: 0.73333333333333328
A13: Taylor Parker | B13: 18 | C13: 0.77638888888888891
A14: Tara Cowen | B14: 22 | C14: 0.80833333333333335
A15: Natalie Uduwella | B15: 17 | C15: 0.77013888888888893
A16: Dana Mohammad-Zadeh | B16: 19 | C16: 0.77708333333333335
A17: Chloe Leffas-Lopes | B17: 25 | C17: 0.98472222222222228
A18: Lily Malek | C18: DNR
A19: Kara Yap | B19: 20 | C19: 0.7895833333333333
A20: Rachel Burgess | C20: DNR
A22: JV Girls
F23: LCC | G23: RB
E24: 1 | F24: 5 | G24: 1
A25: Madeline Wahl | B25: 7 | C25: 0.78055555555555556 | E25: 2 | F25: 6 | G25: 2
A26: Hannah Quinto | B26: 38 | C26: 27:31 | E26: 3 | F26: 9 | G26: 3
A27: Alyssa Wertner | B27: 18 | C27: 0.85555555555555551 | E27: 4 | F27: 10 | G27: 4
A28: Ruth Malina | B28: 36 | C28: 24:26 | E28: 5 | F28: 11 | G28: 7
A29: Ashley Alderton | C29: DNR | F29: 41 | G29: 17
A30: Lindsay Pettijohn | B30: 24 | C30: 0.86944444444444446
A31: Haley Peterson | B31: 37 | C31: 27:19
A32: Adrianna Sanchez | B32: 35 | C32: 24:19
A33: Nina Scheepers | B33: 1 | C33: 0.71250000000000002
A34: Jaclyn Hanson | B34: 26 | C34: 0.87430555555555556
A35: Casey Chilsom | B35: 25 | C35: 0.87291666666666667
A36: Darina Dinov | B36: 3 | C36: 0.75
A37: Sana Marzouq | B37: 17 | C37: 0.85486111111111107
A38: Katie Vargo | C38: DNR
A39: Casey Burgess | B39: 8 | C39: 0.78819444444444442
A40: Chantae Reden | B40: 4 | C40: 0.77708333333333335
A41: Cassie Wicoff | C41: DNR
A42: Kelsey Erskine | B42: 22 | C42: 0.86805555555555558
A43: Olivia Krzeminski | B43: 2 | C43: 0.72638888888888886
A44: Michela Moneta | B44: 28 | C44: 0.90763888888888888
A45: Amanda Alderton | B45: 16 | C45: 0.83680555555555558
A46: Charlese Matthews | B46: 13 | C46: 0.80972222222222223

A1: NAME | B1: PL | C1: FINISH
A2: Varsity Boys
A3: Parker Stinson | B3: 3 | C3: 0.76458333333333328
A4: Sean Proehl | B4: 2 | C4: 0.76458333333333328
A5: Noah Resto | B5: 1 | C5: 0.76388888888888884 | F5: LCC | G5: RB
A6: Drew Flood | B6: 4 | C6: 0.76458333333333328 | E6: 1 | F6: 7 | G6: 1
A7: Kevin Schubert | B7: 5 | C7: 0.76458333333333328 | E7: 2 | F7: 8 | G7: 2
A8: Aaron Fenlanson | C8: DNR | E8: 3 | F8: 10 | G8: 3
A9: Ross Candelore | B9: 6 | C9: 0.76458333333333328 | E9: 4 | F9: 11 | G9: 4
A10: seniors | E10: 5 | F10: 12 | G10: 5
A11: Tyler Davis | B11: 9 | C11: 0.80694444444444446 | F11: 48 | G11: 15
A12: Vastal Shah | B12: 12 | C12: 0.81597222222222221
A13: Ryosuke Saika | B13: 22 | C13: 0.8930555555555556
A14: Daniel Nelson | B14: 24 | C14: 0.98333333333333328
A15: Peter Benito | B15: 20 | C15: 0.88888888888888884
A16: Achilles Schmelzer | C16: DNR
A17: Garrett Yagade | B17: 21 | C17: 0.89097222222222228
A18: Andrew Rhodes | B18: 23 | C18: 0.93472222222222223
A19: Peter Steusloff | C19: DNR
A21: Frosh Boys
A22: Anthony Girolamo | B22: 1 | C22: 0.64652777777777781 | F22: LCC | G22: RB
A23: Jacob Fenlanson | B23: 4 | C23: 0.65347222222222223 | E23: 1 | F23: 8 | G23: 1
A24: Ian Cable | B24: 3 | C24: 0.65208333333333335 | E24: 2 | F24: 9 | G24: 2
A25: Jordan Ahostrom | B25: 5 | C25: 0.68680555555555556 | E25: 3 | F25: 10 | G25: 3
A26: Conner Lachenbruch | B26: 2 | C26: 00.65 | E26: 4 | F26: 11 | G26: 4
A27: Alec Burgess | B27: 6 | C27: 0.7055555555555556 | E27: 5 | F27: 12 | G27: 5
A28: Louw Scheepers | B28: 7 | C28: 0.70763888888888893 | F28: 50 | G28: 15
A29: Todd Myers | B29: 9 | C29: 0.71597222222222223
A30: Zach Kaufman | B30: 8 | C30: 0.70763888888888893
A31: Ryan Worden | B31: 11 | C31: 0.74305555555555558
A32: Jake Brockbank | B32: 16 | C32: 0.80694444444444446
A33: Robert Sheehan | B33: 14 | C33: 0.75763888888888886
A34: Justin Todd | C34: DNR
A36: JV Boys
A37: Travis Linder | B37: 2 | C37: 0.64444444444444449 | F37: LCC | G37: RB
A38: Ryley Webb | B38: 4 | C38: 0.66527777777777775 | E38: 1 | F38: 7 | G38: 1
A39: Tim Matsushita | C39: DNR | E39: 2 | F39: 9 | G39: 2
A40: Robert McEntire | B40: 6 | C40: 0.70416666666666672 | E40: 3 | F40: 10 | G40: 3
A41: Skyler Warren | B41: 8 | C41: 0.73958333333333337 | E41: 4 | F41: 11 | G41: 4
A42: Alex Flood | B42: 14 | C42: 0.77916666666666667 | E42: 5 | F42: 12 | G42: 5
A43: Ben Wancewicz | B43: 16 | C43: 0.81527777777777777 | F43: 49 | G43: 15
A44: James Rodriguez | B44: 9 | C44: 0.74375000000000002
A45: O'min Kwon | B45: 3 | C45: 0.66041666666666665
A46: Scott Robinson | B46: 5 | C46: 0.67569444444444449
A47: Steven Kamen | B47: 1 | C47: 0.6333333333333333
A48: Jae Sang Oh | B48: 19 | C48: 0.82291666666666663
A49: Max Johnson | B49: 23 | C49: 0.99930555555555556