A1: DOUBLE DUAL POWAY OCT 5TH 2007

A1: 1 | B1: Caroline Draper | C1: 0.63749999999999996 | E1: =1 -> 1 | F1: Parker Stinson | G1: 0.71388888888888891
A2: =A1+1 -> 2 | B2: Molly Grabill | C2: 0.6381944444444444 | E2: =E1+1 -> 2 | F2: Sean Proehl | G2: 0.72569444444444442
A3: =A2+1 -> 3 | B3: Michelle Black | C3: 0.65833333333333333 | E3: =E2+1 -> 3 | F3: Noah Resto | G3: 0.73333333333333328
A4: =A3+1 -> 4 | B4: Michelle LeRoux | C4: 0.66041666666666665 | E4: =E3+1 -> 4 | F4: Drew Flood | G4: 0.74097222222222225
A5: =A4+1 -> 5 | B5: Allison Proehl | C5: 0.66111111111111109 | E5: =E4+1 -> 5 | F5: Kevin Schubert | G5: 0.74236111111111114
A6: =A5+1 -> 6 | B6: Krista Egense | C6: 0.66180555555555554 | E6: =E5+1 -> 6 | F6: Ross Candelore | G6: 0.74722222222222223
A7: =A6+1 -> 7 | B7: Anna Mohamed-Zadeh | C7: 0.66666666666666663 | E7: =E6+1 -> 7 | F7: Aaron Fenlanson | G7: 0.76736111111111116
A8: =A7+1 -> 8 | B8: Nina Scheepers | C8: 0.6875 | E8: =E7+1 -> 8 | F8: Vastal Shah | G8: 0.81874999999999998
A9: =A8+1 -> 9 | B9: Melissa LeRoux | C9: 0.69791666666666663 | E9: =E8+1 -> 9 | F9: Tyler Davis | G9: 0.81944444444444442
A10: =A9+1 -> 10 | B10: Jenny Zhuang | C10: 0.71111111111111114 | E10: =E9+1 -> 10 | F10: Achilles Schmelzer | G10: 0.83611111111111114
A11: =A10+1 -> 11 | B11: Dana Mohammad-Zadeh | C11: 0.73472222222222228 | E11: =E10+1 -> 11 | F11: Garrett Yagade | G11: 0.87361111111111112
A12: =A11+1 -> 12 | B12: Natalie Uduwella | C12: 0.74722222222222223 | E12: =E11+1 -> 12 | F12: Peter Benito | G12: 0.89375000000000004
A13: =A12+1 -> 13 | B13: Tara Cowen | C13: 0.77569444444444446 | E13: =E12+1 -> 13 | F13: Ryosuke Saika | G13: 0.89513888888888893
A14: =A13+1 -> 14 | B14: Taylor Parker | C14: 0.83611111111111114 | E14: =E13+1 -> 14 | F14: Daniel Nelson | G14: 0.92708333333333337
A15: =A14+1 -> 15 | B15: Rachel Burgess | C15: 0.86736111111111114 | E15: =E14+1 -> 15 | F15: Peter Steusloff | G15: 0.94166666666666665
A16: =A15+1 -> 16 | B16: Lily Malek | C16: 0.86805555555555558
A17: =A16+1 -> 17 | B17: Chloe Leffas-Lopes | C17: 24:35 | F17: 2.5 miles
E18: 1 | F18: Travis Linder | G18: 0.58819444444444446
B19: 2 miles | E19: =E18+1 -> 2 | F19: Jacob Fenlanson | G19: 0.60277777777777775
A20: =1 -> 1 | B20: Cassie Wicoff | C20: 0.55555555555555558 | E20: =E19+1 -> 3 | F20: Anthony Girolamo | G20: 0.60416666666666663
A21: =A20+1 -> 2 | B21: Darina Dinov | C21: 0.55763888888888891 | E21: =E20+1 -> 4 | F21: Ryley Webb | G21: 0.6069444444444444
A22: =A21+1 -> 3 | B22: Olivia Krzeminski | C22: 0.56111111111111112 | E22: =E21+1 -> 5 | F22: O'min Kwon | G22: 0.6118055555555556
A23: =A22+1 -> 4 | B23: Chantae Reden | C23: 0.59166666666666667 | E23: =E22+1 -> 6 | F23: Conner Lachenbruch | G23: 0.62569444444444444
A24: =A23+1 -> 5 | B24: Casey Burgess | C24: 0.59652777777777777 | E24: =E23+1 -> 7 | F24: Ian Cable | G24: 0.63194444444444442
A25: =A24+1 -> 6 | B25: Madeline Wahl | C25: 0.59722222222222221 | E25: =E24+1 -> 8 | F25: Scott Robinson | G25: 0.63194444444444442
A26: =A25+1 -> 7 | B26: Charlese Matthews | C26: 0.6166666666666667 | E26: =E25+1 -> 9 | F26: Zach Kaufman | G26: 0.64166666666666672
A27: =A26+1 -> 8 | B27: Sana Marzouq | C27: 0.62361111111111112 | E27: =E26+1 -> 10 | F27: Robert McEntire | G27: 0.65763888888888888
A28: =A27+1 -> 9 | B28: Amanda Alderton | C28: 0.63958333333333328 | E28: =E27+1 -> 11 | F28: Jordan Ahostrom | G28: 0.66041666666666665
A29: =A28+1 -> 10 | B29: Alyssa Wertner | C29: 0.64097222222222228 | E29: =E28+1 -> 12 | F29: Todd Myers | G29: 0.66736111111111107
A30: =A29+1 -> 11 | B30: Haley Peterson | C30: 0.65555555555555556 | E30: =E29+1 -> 13 | F30: Alec Burgess | G30: 0.67083333333333328
A31: =A30+1 -> 12 | B31: Jaclyn Hanson | C31: 0.65555555555555556 | E31: =E30+1 -> 14 | F31: Louw Scheepers | G31: 0.68472222222222223
A32: =A31+1 -> 13 | B32: Kelsey Erskine | C32: 0.65972222222222221 | E32: =E31+1 -> 15 | F32: James Rodriguez | G32: 0.69374999999999998
A33: =A32+1 -> 14 | B33: Hannah Quinto | C33: 0.69652777777777775 | E33: =E32+1 -> 16 | F33: Jake Brockbank | G33: 0.6958333333333333
A34: =A33+1 -> 15 | B34: Ruth Malina | C34: 0.69652777777777775 | E34: =E33+1 -> 17 | F34: Robert Sheehan | G34: 0.7055555555555556
E35: =E34+1 -> 18 | F35: Ryan Worden | G35: 0.70833333333333337
E36: =E35+1 -> 19 | F36: Skyler Warren | G36: 0.72430555555555554
E37: =E36+1 -> 20 | F37: Alex Flood | G37: 0.72569444444444442
E38: =E37+1 -> 21 | F38: Ben Wancewicz | G38: 0.74791666666666667
E39: =E38+1 -> 22 | F39: Max Johnson | G39: 0.85763888888888884

A1: NAME | B1: PL | C1: 1 MILE | D1: FINISH | F1: PACE
A2: Varsity Girls 3:45
A3: Molly Grabill | B3: 2 | C3: 0.23749999999999999 | D3: 0.6381944444444444 | F3: 0.255 | H3: RB | I3: POW
A4: Caroline Draper | B4: 1 | C4: 0.23749999999999999 | D4: 0.63749999999999996 | F4: 0.25527777777777777 | G4: 1 | H4: 1 | I4: 3
A5: Michelle Black | B5: 4 | C5: 0.24374999999999999 | D5: 0.65833333333333333 | F5: 0.26333333333333331 | G5: 2 | H5: 2 | I5: 9
A6: Michelle LeRoux | B6: 5 | C6: 0.24583333333333332 | D6: 0.66041666666666665 | F6: 0.26416666666666666 | G6: 3 | H6: 4 | I6: 10
A7: Allison Proehl | B7: 6 | D7: 0.66111111111111109 | F7: 0.26444444444444443 | G7: 4 | H7: 5 | I7: 11
A8: Krista Egense | B8: 7 | D8: 0.66180555555555554 | F8: 0.26472222222222219 | G8: 5 | H8: 6 | I8: 12
A9: Anna Mohamed-Zadeh | B9: 8 | C9: 0.25208333333333333 | D9: 0.66666666666666663 | F9: 0.26666666666666666 | H9: 18 | I9: 45
A10: Nina Scheepers | B10: 10 | C10: 0.25277777777777777 | D10: 0.6875 | F10: 0.27500000000000002
A11: Melissa LeRoux | B11: 13 | D11: 0.69791666666666663 | F11: 0.27916666666666667
A12: seniors
A13: Jenny Zhuang | B13: 16 | C13: 0.26597222222222222 | D13: 0.71111111111111114 | F13: 0.28444444444444444
A14: Dana Mohammad-Zadeh | B14: 19 | D14: 0.73472222222222228 | F14: 0.29388888888888892
A15: Natalie Uduwella | B15: 22 | D15: 0.74722222222222223 | F15: 0.29888888888888887
A16: Tara Cowen | B16: 23 | C16: 0.27638888888888891 | D16: 0.77569444444444446 | F16: 0.31027777777777776
A17: Taylor Parker | B17: 25 | C17: 0.2638888888888889 | D17: 0.83611111111111114 | F17: 0.33444444444444443
A18: Rachel Burgess | B18: 26 | D18: 0.86736111111111114 | F18: 0.34694444444444444
A19: Lily Malek | B19: 27 | D19: 0.86805555555555558 | F19: 0.34722222222222221
A20: Chloe Leffas-Lopes | B20: 28 | D20: 24:35 | F20: 0.40972222222222221
A23: JV Girls 3:15
E24: projected 2.5 | H24: RB | I24: POW
A25: Cassie Wicoff | B25: 1 | D25: 0.55555555555555558 | E25: 0.69444444444444442 | F25: 0.27777777777777779 | G25: 1 | H25: 1 | I25: 4
A26: Darina Dinov | B26: 2 | D26: 0.55763888888888891 | E26: 0.69704861111111116 | F26: 0.27881944444444445 | G26: 2 | H26: 2 | I26: 5
A27: Olivia Krzeminski | B27: 3 | D27: 0.56111111111111112 | E27: 0.70138888888888884 | F27: 0.28055555555555556 | G27: 3 | H27: 3 | I27: 6
A28: Chantae Reden | B28: 9 | D28: 0.59166666666666667 | E28: 0.73958333333333337 | F28: 0.29583333333333334 | G28: 4 | H28: 9 | I28: 7
A29: Casey Burgess | B29: 10 | D29: 0.59652777777777777 | E29: 0.74565972222222221 | F29: 0.29826388888888888 | G29: 5 | H29: 10 | I29: 8
A30: Madeline Wahl | B30: 11 | D30: 0.59722222222222221 | E30: 0.74652777777777779 | F30: 0.2986111111111111 | H30: 25 | I30: 30
A31: Charlese Matthews | B31: 16 | D31: 0.6166666666666667 | E31: 0.77083333333333337 | F31: 0.30833333333333335
A32: Sana Marzouq | B32: 19 | D32: 0.62361111111111112 | E32: 0.77951388888888884 | F32: 0.31180555555555556
A33: Amanda Alderton | B33: 21 | D33: 0.63958333333333328 | E33: 0.79947916666666663 | F33: 0.31979166666666664
A34: Alyssa Wertner | B34: 22 | D34: 0.64097222222222228 | E34: 0.8012152777777779 | F34: 0.32048611111111114
A35: Haley Peterson | B35: 25 | D35: 0.65555555555555556 | E35: 0.81944444444444442 | F35: 0.32777777777777778
A36: Jaclyn Hanson | B36: 24 | D36: 0.65555555555555556 | E36: 0.81944444444444442 | F36: 0.32777777777777778
A37: Kelsey Erskine | B37: 27 | D37: 0.65972222222222221 | E37: 0.82465277777777779 | F37: 0.3298611111111111
A38: Hannah Quinto | B38: 28 | D38: 0.69652777777777775 | E38: 0.87065972222222221 | F38: 0.34826388888888887
A39: Ruth Malina | B39: 29 | D39: 0.69652777777777775 | E39: 0.87065972222222221 | F39: 0.34826388888888887

A1: NAME | B1: PL | C1: 1 MILE | D1: 2 MILE | E1: FINISH | F1: PACE
A2: Varsity Boys 4:15
A3: Parker Stinson | B3: 1 | C3: 0.21527777777777779 | D3: 0.4513888888888889 | E3: 0.71388888888888891 | F3: 0.22663139329805998
A4: Sean Proehl | B4: 2 | C4: 0.21527777777777779 | D4: 0.4513888888888889 | E4: 0.72569444444444442 | F4: 0.23037918871252205
A5: Noah Resto | B5: 3 | C5: 0.21527777777777779 | D5: 0.4513888888888889 | E5: 0.73333333333333328 | F5: 0.23280423280423279 | H5: P | I5: RB
A6: Drew Flood | B6: 4 | C6: 0.21527777777777779 | D6: 0.4513888888888889 | E6: 0.74097222222222225 | F6: 0.23522927689594358 | G6: 1 | H6: 7 | I6: 1
A7: Kevin Schubert | B7: 5 | C7: 0.22083333333333333 | D7: 0.46250000000000002 | E7: 0.74236111111111114 | F7: 0.23567019400352734 | G7: 2 | H7: 8 | I7: 2
A8: Ross Candelore | B8: 6 | C8: 0.21527777777777779 | D8: 0.49652777777777779 | E8: 0.74722222222222223 | F8: 0.23721340388007056 | G8: 3 | H8: 9 | I8: 3
A9: Aaron Fenlanson | B9: 12 | C9: 0.21805555555555556 | D9: 0.47013888888888888 | E9: 0.76736111111111116 | F9: 0.24360670194003531 | G9: 4 | H9: 10 | I9: 4
A10: seniors | G10: 5 | H10: 11 | I10: 5
A11: Vastal Shah | C11: 0.23055555555555557 | D11: 0.49513888888888891 | E11: 0.81874999999999998 | F11: 0.25992063492063494 | H11: 45 | I11: 15
A12: Tyler Davis | C12: 0.22916666666666666 | D12: 0.50069444444444444 | E12: 0.81944444444444442 | F12: 0.26014109347442682
A13: Achilles Schmelzer | C13: 0.24444444444444444 | D13: 0.51111111111111107 | E13: 0.83611111111111114 | F13: 0.26543209876543211
A14: Garrett Yagade | C14: 0.25486111111111109 | D14: 0.54374999999999996 | E14: 0.87361111111111112 | F14: 0.27733686067019403
A15: Peter Benito | C15: 0.25972222222222224 | D15: 0.54374999999999996 | E15: 0.89375000000000004 | F15: 0.28373015873015878
A16: Ryosuke Saika | C16: 0.25347222222222221 | D16: 0.54236111111111107 | E16: 0.89513888888888893 | F16: 0.28417107583774254
A17: Daniel Nelson | C17: 0.25763888888888886 | D17: 0.56319444444444444 | E17: 0.92708333333333337 | F17: 0.29431216931216936
A18: Peter Steusloff | C18: 0.25972222222222224 | D18: 0.57013888888888886 | E18: 0.94166666666666665 | F18: 0.29894179894179895
A21: Frosh Boys 4:45
A22: Jacob Fenlanson | B22: 1 | C22: 0.22291666666666668 | D22: 0.47986111111111113 | E22: 0.60277777777777775 | F22: 0.24111111111111111 | H22: P | I22: RB
A23: Anthony Girolamo | B23: 2 | C23: 0.23125000000000001 | D23: 0.48819444444444443 | E23: 0.60416666666666663 | F23: 0.24166666666666664 | G23: 1 | H23: 3 | I23: 1
A24: Conner Lachenbruch | B24: 8 | D24: 0.5 | E24: 0.62569444444444444 | F24: 0.25027777777777777 | G24: 2 | H24: 4 | I24: 2
A25: Ian Cable | B25: 10 | D25: 0.50486111111111109 | E25: 0.63194444444444442 | F25: 0.25277777777777777 | G25: 3 | H25: 5 | I25: 8
A26: Zach Kaufman | D26: 0.5083333333333333 | E26: 0.64166666666666672 | F26: 0.25666666666666671 | G26: 4 | H26: 6 | I26: 10
A27: Jordan Ahostrom | D27: 0.52083333333333337 | E27: 0.66041666666666665 | F27: 0.26416666666666666 | G27: 5 | H27: 7 | I27: 11
A28: Todd Myers | D28: 0.52708333333333335 | E28: 0.66736111111111107 | F28: 0.26694444444444443 | H28: 25 | I28: 32
A29: Alec Burgess | D29: 0.53055555555555556 | E29: 0.67083333333333328 | F29: 0.26833333333333331
A30: Louw Scheepers | D30: 0.54722222222222228 | E30: 0.68472222222222223 | F30: 0.2738888888888889
A31: Jake Brockbank | C31: 0.25 | E31: 0.6958333333333333 | F31: 0.27833333333333332
A32: Robert Sheehan | C32: 0.25 | D32: 0.56458333333333333 | E32: 0.7055555555555556 | F32: 0.28222222222222226
A33: Ryan Worden | D33: 0.56458333333333333 | E33: 0.70833333333333337 | F33: 0.28333333333333333
A35: JV Boys
A36: Travis Linder | B36: 1 | C36: 0.22222222222222221 | D36: 0.46805555555555556 | E36: 0.58819444444444446 | F36: 0.23527777777777778 | H36: P | I36: RB
A37: Ryley Webb | B37: 7 | C37: 0.23541666666666666 | D37: 0.4826388888888889 | E37: 0.6069444444444444 | F37: 0.24277777777777776 | G37: 1 | H37: 2 | I37: 1
A38: O'min Kwon | B38: 9 | C38: 0.23402777777777778 | D38: 0.53263888888888888 | E38: 0.6118055555555556 | F38: 0.24472222222222223 | G38: 2 | H38: 3 | I38: 5
A39: Scott Robinson | D39: 0.50347222222222221 | E39: 0.63194444444444442 | F39: 0.25277777777777777 | G39: 3 | H39: 4 | I39: 9
A40: Robert McEntire | D40: 0.5229166666666667 | E40: 0.65763888888888888 | F40: 0.26305555555555554 | G40: 4 | H40: 6 | I40: 11
A41: James Rodriguez | C41: 0.25277777777777777 | D41: 0.53055555555555556 | E41: 0.69374999999999998 | F41: 0.27750000000000002 | G41: 5 | H41: 7 | I41: 12
A42: Skyler Warren | C42: 0.25277777777777777 | D42: 0.57222222222222219 | E42: 0.72430555555555554 | F42: 0.28972222222222221 | H42: 22 | I42: 38
A43: Alex Flood | C43: 0.26666666666666666 | D43: 0.57291666666666663 | E43: 0.72569444444444442 | F43: 0.29027777777777775
A44: Ben Wancewicz | C44: 0.28749999999999998 | E44: 0.74791666666666667 | F44: 0.29916666666666669
A45: Max Johnson | C45: 0.30694444444444446 | E45: 0.85763888888888884 | F45: 0.34305555555555556