A1: =1 -> 1 | B1: Molly Grabill | C1: 0.66111111111111109 | E1: 1 | F1: Parker Stinson | G1: 0.65972222222222221
A2: =A1+1 -> 2 | B2: Caroline Draper | C2: 0.69166666666666665 | E2: =E1+1 -> 2 | F2: Sean Proehl | G2: 0.67986111111111114
A3: =A2+1 -> 3 | B3: Michelle Black | C3: 0.72916666666666663 | E3: =E2+1 -> 3 | F3: Noah Resto | G3: 0.70208333333333328
A4: =A3+1 -> 4 | B4: Michelle LeRoux | C4: 0.72986111111111107 | E4: =E3+1 -> 4 | F4: Drew Flood | G4: 0.70625000000000004
A5: =A4+1 -> 5 | B5: Krista Egense | C5: 0.73055555555555551 | E5: =E4+1 -> 5 | F5: Kevin Schubert | G5: 0.71805555555555556
A6: =A5+1 -> 6 | B6: Allison Proehl | C6: 0.73819444444444449 | E6: =E5+1 -> 6 | F6: Aaron Fenlanson | G6: 0.72152777777777777
A7: =A6+1 -> 7 | B7: Anna Mohamed-zadeh | C7: 0.76180555555555551 | E7: =E6+1 -> 7 | F7: Ross Candelore | G7: 0.73333333333333328
A8: =A7+1 -> 8 | B8: Nina Scheepers | C8: 0.77430555555555558 | E8: =E7+1 -> 8 | F8: Travis Linder | G8: 0.75624999999999998
A9: =A8+1 -> 9 | B9: Jenny Zhuang | C9: 0.78819444444444442 | E9: =E8+1 -> 9 | F9: Anthony Girolamo | G9: 0.76249999999999996
A10: =A9+1 -> 10 | B10: Natalie Uduwella | C10: 0.7944444444444444 | E10: =E9+1 -> 10 | F10: Achilles Schmelzer | G10: 0.77777777777777779
A11: =A10+1 -> 11 | B11: Olivia Krzeminski | C11: 0.79652777777777772 | E11: =E10+1 -> 11 | F11: O'min Kwon | G11: 0.78333333333333333
A12: =A11+1 -> 12 | B12: Taylor Parker | C12: 0.79722222222222228 | E12: =E11+1 -> 12 | F12: Jacob Fenlanson | G12: 0.78819444444444442
A13: =A12+1 -> 13 | B13: Madeline Wahl | C13: 0.82430555555555551 | E13: =E12+1 -> 13 | F13: Scott Robinson | G13: 0.80069444444444449
A14: =A13+1 -> 14 | B14: Dana Mohammad-zadeh | C14: 0.82986111111111116 | E14: =E13+1 -> 14 | F14: Ryley Webb | G14: 0.8041666666666667
A15: =A14+1 -> 15 | B15: Kara Yap | C15: 0.83402777777777781 | E15: =E14+1 -> 15 | F15: Ian Cable | G15: 0.81180555555555556
A16: =A15+1 -> 16 | B16: Tara Cowen | C16: 0.84027777777777779 | E16: =E15+1 -> 16 | F16: Tyler Davis | G16: 0.81736111111111109
A17: =A16+1 -> 17 | B17: Chantae Reden | C17: 0.86111111111111116 | E17: =E16+1 -> 17 | F17: Jordan Ahostrom | G17: 0.82222222222222219
A18: =A17+1 -> 18 | B18: Kelsey Erskine | C18: 0.89097222222222228 | E18: =E17+1 -> 18 | F18: Conner Lachenbruch | G18: 0.8256944444444444
A19: =A18+1 -> 19 | B19: Amanda Alderton | C19: 0.90138888888888891 | E19: =E18+1 -> 19 | F19: Vastal Shah | G19: 0.82708333333333328
A20: =A19+1 -> 20 | B20: Hannah Quinto | C20: 0.90902777777777777 | E20: =E19+1 -> 20 | F20: Steven Kamen | G20: 0.82847222222222228
A21: =A20+1 -> 21 | B21: Jaclyn Hanson | C21: 0.91319444444444442 | E21: =E20+1 -> 21 | F21: Garrett Yagade | G21: 0.84722222222222221
A22: =A21+1 -> 22 | B22: Casey Burgess | C22: 0.91388888888888886 | E22: =E21+1 -> 22 | F22: Alec Burgess | G22: 00.85
A23: =A22+1 -> 23 | B23: Alyssa Wertner | C23: 0.94166666666666665 | E23: =E22+1 -> 23 | F23: Tim Matsushita | G23: 0.85624999999999996
A24: =A23+1 -> 24 | B24: Michela Moneta | C24: 0.97152777777777777 | E24: =E23+1 -> 24 | F24: Ryosuke Saika | G24: 0.8618055555555556
A25: =A24+1 -> 25 | B25: Chloe Leffas-lopes | C25: 25:31 | E25: =E24+1 -> 25 | F25: Robert Mcentire | G25: 0.86597222222222225
A26: =A25+1 -> 26 | B26: Ruth Malina | C26: 25:37 | E26: =E25+1 -> 26 | F26: Andrew Rhodes | G26: 0.87430555555555556
E27: =E26+1 -> 27 | F27: Louw Scheepers | G27: 0.87916666666666665
E28: =E27+1 -> 28 | F28: Todd Myers | G28: 0.8833333333333333
E29: =E28+1 -> 29 | F29: Zach Kaufman | G29: 0.88680555555555551
E30: =E29+1 -> 30 | F30: Ryan Worden | G30: 0.89583333333333337
E31: =E30+1 -> 31 | F31: Peter Benito | G31: 0.89722222222222225
E32: =E31+1 -> 32 | F32: Daniel Nelson | G32: 0.93819444444444444
E33: =E32+1 -> 33 | F33: Peter Steusloff | G33: 0.93888888888888888
E34: =E33+1 -> 34 | F34: Jake Brockbank | G34: 0.95208333333333328
E35: =E34+1 -> 35 | F35: Alex Flood | G35: 0.9819444444444444
E36: =E35+1 -> 36 | F36: Robert Sheehan | G36: 0.99375000000000002
E37: =E36+1 -> 37 | F37: Ben Wancewicz | G37: 24:17
E38: =E37+1 -> 38 | F38: Jae Sang Oh | G38: 25:51

A1: NAME | B1: PL | C1: 1 MILE | D1: 2 MILE | E1: FINISH | F1: PACE | G1: PREV 06 | H1: PREV 05 | I1: PREV 04
A2: 2.75 Miles Frosh D1 - 11:50 AM
A3: Molly Grabill | B3: 1 | E3: 0.66111111111111109 | F3: 0.2404040404040404
A4: Allison Proehl | B4: 13 | E4: 0.73819444444444449 | F4: 0.26843434343434347
A5: Michelle LeRoux | B5: 11 | E5: 0.72986111111111107 | F5: 0.26540404040404036
A6: Anna Mohamed-zadeh | B6: 16 | E6: 0.76180555555555551 | F6: 0.277020202020202
A7: Madeline Wahl | B7: 36 | E7: 0.82430555555555551 | F7: 0.29974747474747471
A8: Hannah Quinto | B8: 75 | E8: 0.90902777777777777 | F8: 0.33055555555555555
A9: Alyssa Wertner | B9: 87 | E9: 0.94166666666666665 | F9: 0.34242424242424241
A10: Ruth Malina | B10: 120 | E10: 25:37 | F10: 0.39583333333333331
A12: 2.75 Miles Soph D1 - 12:40 PM
A13: Nina Scheepers | B13: 27 | E13: 0.77430555555555558 | F13: 0.28156565656565657 | G13: 0.78611111111111109
A14: Jaclyn Hanson | B14: 113 | E14: 0.91319444444444442 | F14: 0.33207070707070707
A16: 2.75 Miles Junior D1 - 1:30 PM
A17: Caroline Draper | B17: 4 | E17: 0.69166666666666665 | F17: 0.25151515151515152 | G17: 0.6791666666666667 | H17: 0.69097222222222221
A18: Olivia Krzeminski | B18: 45 | E18: 0.79652777777777772 | F18: 0.28964646464646465 | G18: 0.8666666666666667
A19: Casey Burgess | B19: 96 | E19: 0.91388888888888886 | F19: 0.3323232323232323 | G19: 0.85138888888888886 | H19: 0.75555555555555554
A20: Chantae Reden | B20: 76 | E20: 0.86111111111111116 | F20: 0.31313131313131315
A21: Amanda Alderton | B21: 93 | E21: 0.90138888888888891 | F21: 0.32777777777777778 | G21: 0.85347222222222219 | H21: 0.90347222222222223
A22: Kelsey Erskine | B22: 88 | E22: 0.89097222222222228 | F22: 0.32398989898989899 | G22: 0.86388888888888893 | H22: 0.94374999999999998
A23: Michela Moneta | B23: 119 | E23: 0.97152777777777777 | F23: 0.35328282828282825 | G23: 0.91527777777777775
A25: 2.75 Miles Senior D1 - 2:20 PM
A26: Krista Egense | B26: 19 | E26: 0.73055555555555551 | F26: 0.26565656565656565 | G26: 0.74444444444444446 | H26: 0.67500000000000004
A27: Michelle Black | B27: 18 | E27: 0.72916666666666663 | F27: 0.26540404040404036 | H27: 0.71875
A28: Jenny Zhuang | B28: 41 | E28: 0.78819444444444442 | F28: 0.2866161616161616 | G28: 0.73055555555555551
A29: Dana Mohammad-zadeh | B29: 61 | E29: 0.82986111111111116 | F29: 0.3017676767676768 | G29: 00.85 | H29: 0.90138888888888891
A30: Natalie Uduwella | B30: 44 | E30: 0.7944444444444444 | F30: 0.28888888888888886 | G30: 0.75763888888888886 | H30: 0.8041666666666667
A31: Kara Yap | B31: 63 | E31: 0.83402777777777781 | F31: 0.30328282828282832 | G31: 0.81111111111111112
A32: Tara Cowen | B32: 66 | E32: 0.84027777777777779 | F32: 0.30555555555555558 | G32: 0.79027777777777775
A33: Taylor Parker | B33: 46 | E33: 0.79722222222222228 | F33: 0.28989898989898993 | G33: 0.75486111111111109 | H33: 0.80277777777777781 | I33: 0.77777777777777779
A34: Chloe Leffas-lopes | B34: 110 | E34: 25:31 | F34: 0.39374999999999999 | G34: 0.9506944444444444 | H34: 0.94374999999999998

A1: NAME | B1: PL | C1: 1 MILE | D1: 2 MILE | E1: FINISH | F1: PACE | G1: PREV 06 | H1: PREV 05 | I1: PREV 04
A2: 2.95 Miles Frosh D1 - 12:15 PM
A3: Anthony Girolamo | B3: 14 | C3: 0.25069444444444444 | D3: 0.51597222222222228 | E3: 0.76249999999999996 | F3: 0.25847457627118642
A4: Jacob Fenlanson | B4: 26 | C4: 0.23749999999999999 | D4: 0.52083333333333337 | E4: 0.78819444444444442 | F4: 0.26718455743879471
A5: Ian Cable | B5: 34 | C5: 0.24722222222222223 | D5: 0.54236111111111107 | E5: 0.81180555555555556 | F5: 0.27518832391713743
A6: Jordan Ahostrom | B6: 44 | C6: 0.25347222222222221 | D6: 0.54861111111111116 | E6: 0.82222222222222219 | F6: 0.27871939736346513
A7: Conner Lachenbruch | B7: 47 | C7: 0.25347222222222221 | D7: 0.54722222222222228 | E7: 0.8256944444444444 | F7: 0.27989642184557434
A8: Alec Burgess | B8: 60 | C8: 0.27083333333333331 | D8: 0.57152777777777775 | E8: 00.85 | F8: 0.28813559322033894
A9: Louw Scheepers | B9: 74 | C9: 0.27430555555555558 | D9: 0.58333333333333337 | E9: 0.87916666666666665 | F9: 0.2980225988700565
A10: Todd Myers | B10: 76 | C10: 0.27430555555555558 | D10: 0.59305555555555556 | E10: 0.8833333333333333 | F10: 0.29943502824858753
A11: Zach Kaufman | B11: 79 | C11: 0.27430555555555558 | D11: 0.58958333333333335 | E11: 0.88680555555555551 | F11: 0.30061205273069674
A12: Ryan Worden | B12: 88 | C12: 0.28819444444444442 | D12: 0.6020833333333333 | E12: 0.89583333333333337 | F12: 0.3036723163841808
A13: Jake Brockbank | B13: 111 | C13: 0.2951388888888889 | D13: 0.63055555555555554 | E13: 0.95208333333333328 | F13: 0.32274011299435024
A14: Robert Sheehan | B14: 121 | C14: 0.28819444444444442 | D14: 0.63194444444444442 | E14: 0.99375000000000002 | F14: 0.33686440677966101
A16: 2.95 Miles Soph D1 - 1:05 PM
A17: Parker Stinson | B17: 1 | C17: 0.21736111111111112 | D17: 0.44166666666666665 | E17: 0.65972222222222221 | F17: 0.22363465160075327 | G17: 0.68263888888888891
A18: Noah Resto | B18: 4 | C18: 0.21736111111111112 | D18: 0.46458333333333335 | E18: 0.70208333333333328 | F18: 0.23799435028248583 | G18: 0.76388888888888884
A19: Kevin Schubert | B19: 9 | C19: 0.2361111111111111 | D19: 0.48333333333333334 | E19: 0.71805555555555556 | F19: 0.24340866290018831 | G19: 0.73472222222222228
A20: Ross Candelore | B20: 15 | C20: 0.2298611111111111 | D20: 0.48888888888888887 | E20: 0.73333333333333328 | F20: 0.24858757062146888 | G20: 0.75694444444444442
A21: Travis Linder | B21: 27 | C21: 0.24374999999999999 | D21: 0.5083333333333333 | E21: 0.75624999999999998 | F21: 0.25635593220338981
A22: Ryley Webb | B22: 55 | C22: 0.24305555555555555 | D22: 0.53194444444444444 | E22: 0.8041666666666667 | F22: 0.27259887005649719 | G22: 0.80763888888888891
A23: Tim Matsushita | B23: 82 | C23: 0.2638888888888889 | D23: 0.56180555555555556 | E23: 0.85624999999999996 | F23: 0.29025423728813554
A24: Robert Mcentire | B24: 89 | C24: 0.28541666666666665 | D24: 0.57986111111111116 | E24: 0.86597222222222225 | F24: 0.29354990583804141
A25: Alex Flood | B25: 131 | C25: 0.29166666666666669 | D25: 0.64375000000000004 | E25: 0.9819444444444444 | F25: 0.33333333333333331
A26: Ben Wancewicz | B26: 138 | C26: 0.3125 | D26: 0.68402777777777779 | E26: 24:17 | F26: 0.34305555555555556 | G26: 0.9506944444444444
A28: 2.95 Miles Junior D1 - 1:55 PM
A29: O'min Kwon | B29: 66 | C29: 0.24652777777777779 | D29: 0.51944444444444449 | E29: 0.78333333333333333 | F29: 0.2655367231638418 | G29: 0.84375 | H29: 0.7993055555555556
A30: Scott Robinson | B30: 83 | C30: 0.24027777777777778 | D30: 0.52847222222222223 | E30: 0.80069444444444449 | F30: 0.27142184557438792 | G30: 0.84791666666666665
A31: Steven Kamen | B31: 103 | C31: 0.24652777777777779 | D31: 0.54374999999999996 | E31: 0.82847222222222228 | F31: 0.28083804143126179 | G31: 0.78749999999999998 | H31: 0.88680555555555551
A32: Jae Sang Oh | B32: 173 | C32: 0.32013888888888886 | D32: 0.71736111111111112 | E32: 25:51 | F32: 0.36249999999999999 | G32: 0.95277777777777772
A34: 2.95 Miles Senior D1 - 2:45 PM
A35: Sean Proehl | B35: 8 | C35: 0.21666666666666667 | D35: 0.45347222222222222 | E35: 0.67986111111111114 | F35: 0.23046139359698681 | G35: 0.7006944444444444 | H35: 0.71388888888888891 | I35: 0.74583333333333335
A36: Drew Flood | B36: 16 | C36: 0.22152777777777777 | D36: 0.46458333333333335 | E36: 0.70625000000000004 | F36: 0.23940677966101695 | G36: 0.72152777777777777 | H36: 0.71736111111111112 | I36: 0.77152777777777781
A37: Aaron Fenlanson | B37: 29 | C37: 0.22916666666666666 | D37: 0.48125000000000001 | E37: 0.72152777777777777 | F37: 0.24458568738229752 | G37: 0.75069444444444444 | H37: 0.76249999999999996 | I37: 0.79583333333333328
A38: Achilles Schmelzer | B38: 72 | C38: 0.25416666666666665 | D38: 0.52222222222222225 | E38: 0.77777777777777779 | F38: 0.26365348399246702
A39: Tyler Davis | B39: 91 | C39: 0.24305555555555555 | D39: 0.54097222222222219 | E39: 0.81736111111111109 | F39: 0.27707156308851222 | G39: 0.76180555555555551
A40: Vastal Shah | B40: 98 | C40: 0.23958333333333334 | D40: 0.51527777777777772 | E40: 0.82708333333333328 | F40: 0.28036723163841804 | G40: 0.79166666666666663 | H40: 24:39
A41: Garrett Yagade | B41: 101 | D41: 0.58611111111111114 | E41: 0.84722222222222221 | F41: 0.2871939736346516 | I41: 0.84375
A42: Ryosuke Saika | B42: 109 | C42: 0.27083333333333331 | D42: 0.65833333333333333 | E42: 0.8618055555555556 | F42: 0.29213747645951038 | G42: 0.8979166666666667 | H42: 0.87847222222222221
A43: Andrew Rhodes | B43: 113 | C43: 0.27083333333333331 | D43: 0.58472222222222225 | E43: 0.87430555555555556 | F43: 0.29637476459510353
A44: Peter Benito | B44: 119 | C44: 0.26041666666666669 | D44: 0.58194444444444449 | E44: 0.89722222222222225 | F44: 0.30414312617702449 | H44: 0.88263888888888886 | I44: 0.95833333333333337
A45: Daniel Nelson | B45: 128 | C45: 0.28263888888888888 | D45: 0.66249999999999998 | E45: 0.93819444444444444 | F45: 0.31803201506591333 | G45: 0.92986111111111114 | H45: 0.9194444444444444 | I45: 0.89583333333333337
A46: Peter Steusloff | B46: 129 | C46: 0.27777777777777779 | D46: 0.61458333333333337 | E46: 0.93888888888888888 | F46: 0.31826741996233521