A1: 8:00 D1 GIRLS JV FR./SOPH | B1: 10:00 D II GIRLS VARSITY
A2: 8:20 D1 GIRLS JV, JR./SR | B2: 10:20 D II BOYS VARSITY
A3: 8:40 D1 GIRLS VARSITY | B3: 10:40 D II GIRLS JV
A4: 9:00 D1 BOYS VARSITY | B4: 11:00 D II BOYS JV/FROSH
A5: 9:20 D1 BOYS JV
A6: 9:40 D1 BOYS FROSH

A1: 1. Ashlin Yahr | B1: Torrey Pines | C1: 0.53055555555555556
A2: 2. Katie Rentz | B2: Mt. Carmel | C2: 0.53680555555555554
A3: 3. Kirsten Clemes | B3: West View | C3: 0.54722222222222217
A4: 4. Jamie Ferguson | B4: El Capitan | C4: 0.55347222222222225
A5: 5. Christy James | B5: El Capitan | C5: 0.55347222222222225
A6: 6. Caroline Shevlin | B6: West View | C6: 0.55625000000000002
A7: 7. Courtney Clark | B7: La Costa Canyon | C7: 0.56111111111111112
A8: 8. Gracie Shevlin | B8: West View | C8: 0.56180555555555556
A9: 9. Kerry Simmons | B9: Torrey Pines | C9: 0.56319444444444444
A10: 10.Jessica Schroeder | B10: Torrey Pines | C10: 0.56388888888888888
A11: 11.Kim Turner | B11: San Pasqual | C11: 0.57499999999999996
A12: 12.Kronenbitter | B12: Poway | C12: 0.57638888888888895
A13: 13.Skylar Middlebrook | B13: Torrey Pines | C13: 0.57777777777777783
A14: 14.Krista Egense | B14: Rancho Bernardo | C14: 0.57847222222222217
A15: 15.Blair Williams | B15: Torrey Pines | C15: 0.58263888888888882
A16: 16.Allison Leonard | B16: Rancho Bernardo | C16: 0.58402777777777781
A17: 17.R. Dexter | B17: Poway | C17: 0.58958333333333335
A18: 18.Taylor Parker | B18: Rancho Bernardo | C18: 0.59236111111111112
A19: 19.Julie Goetz | B19: West Hills | C19: 0.59236111111111112
A20: 20.Niki Marek | B20: Rancho Bernardo | C20: 0.59305555555555556
A21: 21.Susie Templeton | B21: San Pasqual | C21: 0.59444444444444444
A22: 22.Alicia Park | B22: San Pasqual | C22: 0.59583333333333333
A23: 23.Lauryn Sherman | B23: Torrey Pines | C23: 0.59861111111111109
A24: 24.Season Falkler | B24: West Hills | C24: 0.59930555555555554
A25: 25.Hannah Pilkington | B25: La Costa Canyon | C25: 0.59930555555555554
A26: 26.Claire Halter | B26: La Costa Canyon | C26: 0.6
A27: 27.B. Oplinger | B27: Patrick Henry | C27: 0.6020833333333333
A28: 28.Emma Patten | B28: Torrey Pines | C28: 0.60416666666666663
A29: 29.Liliana Iniestra | B29: San Pasqual | C29: 0.60555555555555551
A30: 30.Amanda Holley | B30: El Capitan | C30: 0.6069444444444444
A31: 31.Burley | B31: Poway | C31: 0.60763888888888895
A32: 32.Jessie Bodenhomer | B32: Torrey Pines | C32: 0.60763888888888895
A33: 33.Becky Rolph | B33: Torrey Pines | C33: 0.60763888888888895
A34: 34.Azvedo | B34: Poway | C34: 0.60902777777777783
A35: 35.Chelew | B35: Poway | C35: 0.61111111111111105
A36: 36.Veronika Anufreichtk | B36: Rancho Bernardo | C36: 0.6118055555555556
A37: 37.Harrington | B37: Poway | C37: 0.61250000000000004
A38: 38.Rachel Harrington | B38: La Costa Canyon | C38: 0.61250000000000004
A39: 39.Funk | B39: El Camino | C39: 0.61319444444444449
A40: 40.Mansour | B40: Mt. Carmel | C40: 0.61319444444444449
A41: 41.Kalin Sommer | B41: Torrey Pines | C41: 0.61527777777777781
A42: 42.M. Klap | B42: Patrick Henry | C42: 0.6166666666666667
A43: 43.Carrie Saccone | B43: West Hills | C43: 0.61736111111111114
A44: 44.Barbara Chani | B44: Torrey Pines | C44: 0.61736111111111114
A45: 45.Melendrez | B45: Poway | C45: 0.61805555555555558
A46: 46.Murrieta | B46: Poway | C46: 0.61875000000000002
A47: 47.Michelle Iavelli | B47: West Hills | C47: 0.62083333333333335
A48: 48.Dana Schaffer | B48: Rancho Bernardo | C48: 0.62083333333333335
A49: 49.Bauer | B49: Poway | C49: 0.62083333333333335
A50: 50.Jenny Zhuang | B50: Rancho Bernardo | C50: 0.62152777777777779
A51: 51.Mehgie Tabar | B51: Rancho Bernardo | C51: 0.62291666666666667
A52: 52.Krysten Walls | B52: Torrey Pines | C52: 0.625
A53: 53.Andrea Nuller | B53: Torrey Pines | C53: 0.62569444444444444
A54: 54.Kinsey Shelby | B54: Ramona | C54: 0.62708333333333333
A55: 55.Allison White | B55: La Costa Canyon | C55: 0.62708333333333333
A56: 56.Christine Fenton | B56: Ramona | C56: 0.62847222222222221
A57: 57.Sara Nayafi | B57: Mt. Carmel | C57: 0.63124999999999998
A58: 58.Emily Sullivan | B58: ECHS | C58: 0.63124999999999998
A59: 59.Jaqueline Collins | B59: La Costa Canyon | C59: 0.63194444444444442
A60: 60.Lana Herrington | B60: West Hills | C60: 0.63263888888888886
A61: 61.Lorena Zeppilli | B61: ECHS | C61: 0.6333333333333333
A62: 62.Taylorbalna | B62: UCHS?? | C62: 0.63402777777777775
A63: 63.Christy Shaw | B63: ECHS | C63: 0.63472222222222219
A64: 64.D. Buysse | B64: Patrick Henry | C64: 0.63541666666666663
A65: 65.Erika Brown | B65: Torrey Pines | C65: 0.63749999999999996
A66: 66.Corinna Heiberg | B66: West View | C66: 0.6381944444444444
A67: 67.Stueve | B67: Poway | C67: 0.6381944444444444
A68: 68.N. Engel | B68: Patrick Henry | C68: 0.64027777777777783
A69: 69.Depweg | B69: Poway | C69: 0.64027777777777783
A70: 70.Jasmine Burns | B70: San Pasqual | C70: 0.6430555555555556
A71: 71.Gigi Lowe | B71: West Hills | C71: 0.64722222222222225
A72: 72.Holly McCord | B72: West View | C72: 0.6479166666666667
A73: 73.Jessie Sluder | B73: El Capitan | C73: 0.64861111111111114
A74: 74.Gibbs | B74: Poway | C74: 0.65138888888888891
A75: 75.Fuhrmann | B75: Poway | C75: 0.65138888888888891
A76: 76.Alyssa Dault | B76: Rancho Bernardo | C76: 0.65208333333333335
A77: 77.Kim Franklin | B77: Ramona | C77: 0.65486111111111112
A78: 78.Rachel Ross | B78: Torrey Pines | C78: 0.65555555555555556
A79: 79.Alexis Waterhouse | B79: West Hills | C79: 0.65694444444444444
A80: 80.Sharlana Hose-Burner | B80: West Hills | C80: 0.65763888888888888
A81: 81.Shawna Dolinka | B81: Rancho Bernardo | C81: 0.65833333333333333
A82: 82.Madison Tybroski | B82: La Costa Canyon | C82: 0.65902777777777777
A83: 83.Kelsee Ramsy | B83: El Capitan | C83: 0.65902777777777777
A84: 84.Tara Cowen | B84: Rancho Bernardo | C84: 0.65972222222222221
A85: 85.Waller | B85: Poway | C85: 0.66041666666666665
A86: 86.Leavy | B86: Poway | C86: 0.66180555555555554
A87: 87.Zayda Ferniza | B87: West Hills | C87: 0.66249999999999998
A88: 88.A. Szafranski | B88: Patrick Henry | C88: 0.66388888888888886
A89: 89.Marie Shimansky | B89: West View | C89: 0.66805555555555562
A90: 90.Geniva Ozuna | B90: West Hills | C90: 0.6694444444444444
A91: 91.Ashley Murray | B91: La Costa Canyon | C91: 0.67361111111111116
A92: 92.Natalie Overson | B92: El Capitan | C92: 0.67500000000000004
A93: 93.Lauren Clement | B93: Rancho Bernardo | C93: 0.67569444444444438
A94: 94.Amy Gurley | B94: ECHS | C94: 0.67569444444444438
A95: 95.Katrina Toll | B95: Ramona | C95: 0.6791666666666667
A96: 96.Caitlin Sutherland | B96: West View | C96: 0.67986111111111114
A97: 97.Jamie Secrist | B97: Mt. Carmel | C97: 0.68194444444444446
A98: 98.Mone Barrios | B98: Ramona | C98: 0.68263888888888891
A99: 99.Rachel Jappe | B99: West Hills | C99: 0.68819444444444444
A100: 100.Monica Carillo | B100: Mt. Carmel | C100: 0.68888888888888899
A101: 101.Erb | B101: Poway | C101: 0.69027777777777777
A102: 102.Natalie Strohson | B102: Ramona | C102: 0.69097222222222221
A103: 103.Nevada Bodmer | B103: Torrey Pines | C103: 0.69236111111111109
A104: 104.K. Risser | B104: Patrick Henry | C104: 0.69374999999999998
A105: 105.Rebekah Logan | B105: Mt. Carmel | C105: 0.69513888888888886
A106: 106.Emily Weaver | B106: Ramona | C106: 0.69652777777777775
A107: 107.Leah Dwyer | B107: San Pasqual | C107: 0.7
A108: 108.Bates | B108: Poway | C108: 0.70277777777777783
A109: 109.M. Weber | B109: Patrick Henry | C109: 0.70347222222222217
A110: 110.Erica Schott | B110: La Costa Canyon | C110: 0.70416666666666661
A111: 111.Jillian Molin | B111: ECHS | C111: 0.70416666666666661
A112: 112.Diana Bender | B112: ECHS | C112: 0.70694444444444438
A113: 113.Chloe Leffas-Lopes | B113: Rancho Bernardo | C113: 0.71111111111111114
A114: 114.Lauren Mitchell | B114: West View | C114: 0.71736111111111101
A115: 115.Amanda Blass | B115: Mt. Carmel | C115: 0.72152777777777777
A116: 116.Brittany Walker | B116: Torrey Pines | C116: 0.72152777777777777
A117: 117.Megan Sheets | B117: West Hills | C117: 0.73055555555555562
A118: 118. Katie Dorenbush | B118: West View | C118: 0.73541666666666661
A119: 119.Megan Moffet | B119: Torrey Pines | C119: 0.73888888888888893
A120: 120.Anna Wong | B120: Torrey Pines | C120: 0.7402777777777777
A121: 121.Melissa Murray | B121: La Costa Canyon | C121: 0.74305555555555547
A122: 122.Justine Schott | B122: La Costa Canyon | C122: 0.74305555555555547
A123: 123.Linn Nguyen | B123: ECHS | C123: 0.74444444444444446
A124: 124.Carlie Stracka | B124: Torrey Pines | C124: 0.74791666666666667
A125: 125.Bonnie Schlotfeldt | B125: Ramona | C125: 0.76458333333333339
A126: 126.J. Geller | B126: Patrick Henry | C126: 0.76875000000000004
A127: 127.S. Johnson | B127: Patrick Henry | C127: 0.76944444444444438
A128: 128.Kali Vlahos | B128: La Costa Canyon | C128: 0.7909722222222223
A129: 129.Figuero | B129: El Camino | C129: 0.80972222222222223
A130: 130.Jessica Linares | B130: ECHS | C130: 0.81597222222222221
A131: 131.Nachbar | B131: La Costa Canyon | C131: 0.84861111111111109
A132: 132.T.Redlinger | B132: Patrick Henry

A1: 1. Olga Obraztsova | B1: Torrey Pines | C1: 0.55347222222222225
A2: 2. Sunshine Lirkness | B2: Torrey Pines | C2: 0.56874999999999998
A3: 3. Brittany Carson | B3: Torrey Pines | C3: 0.58194444444444449
A4: 4. Shara Darr | B4: Torrey Pines | C4: 0.5854166666666667
A5: 5. Deana Emmerson | B5: La Costa Canyon | C5: 0.58750000000000002
A6: 6. Danielle Martin | B6: Torrey Pines | C6: 0.58819444444444446
A7: 7. Sally Oishi | B7: Torrey Pines | C7: 0.58958333333333335
A8: 8. Kelly Henry | B8: Rancho Bernardo | C8: 0.59791666666666665
A9: 9. Sharon Matsuoka | B9: San Pasqual | C9: 0.59861111111111109
A10: 10.Dumoulin | B10: Poway | C10: 0.60347222222222219
A11: 11.Shiotani | B11: Poway | C11: 0.6069444444444444
A12: 12.Jessica Walters | B12: La Costa Canyon | C12: 0.60763888888888895
A13: 13.Heidi Redlitz | B13: Torrey Pines | C13: 0.61041666666666672
A14: 14.Nabor | B14: Poway | C14: 0.61319444444444449
A15: 15.Marinelle Camilon | B15: West View | C15: 0.61388888888888882
A16: 16.Sarah Ellis | B16: Rancho Bernardo | C16: 0.61527777777777781
A17: 17.Janet Oh | B17: Rancho Bernardo | C17: 0.62013888888888891
A18: 18.A. Teal | B18: Poway | C18: 0.62361111111111112
A19: 19.Wood | B19: Poway | C19: 0.62361111111111112
A20: 20.Katie Fisher | B20: Torrey Pines | C20: 0.62638888888888888
A21: 21.Ashley Hansen | B21: San Pasqual | C21: 0.63263888888888886
A22: 22.Melissa Eberle | B22: San Pasqual | C22: 0.63541666666666663
A23: 23.S. Vardakis | B23: Patrick Henry | C23: 0.63749999999999996
A24: 24.Taylor Bowme | B24: West Hills | C24: 0.63888888888888895
A25: 25.Svetlana Kozlovich | B25: West Hills | C25: 0.64027777777777783
A26: 26.Sanderson | B26: Poway | C26: 0.6430555555555556
A27: 27.Short | B27: Poway | C27: 0.64375000000000004
A28: 28.Kiley Green | B28: La Costa Canyon | C28: 0.64583333333333337
A29: 29.Stephanie Bustos | B29: West Hills | C29: 0.64722222222222225
A30: 30.Elise Kovi | B30: West Hills | C30: 0.64930555555555558
A31: 31.Kate Elwell | B31: Rancho Bernardo | C31: 0.65
A32: 32.Ogden | B32: Poway | C32: 0.65069444444444446
A33: 33.Knuth | B33: Poway | C33: 0.65138888888888891
A34: 34.A. Paur | B34: Poway | C34: 0.65208333333333335
A35: 35.Kristen Buckmecter | B35: Mt. Carmel | C35: 0.65208333333333335
A36: 36.Sparling | B36: Ramona | C36: 0.65277777777777779
A37: 37.Ahiza Garcia | B37: ECHS | C37: 0.65347222222222223
A38: 38.B.Johnson | B38: Patrick Henry | C38: 0.65486111111111112
A39: 39.YetMay Wong | B39: ECHS | C39: 0.65555555555555556
A40: 40. Meghan Lee | B40: San Pasqual | C40: 0.66666666666666663
A41: 41.Elise Evans | B41: San Pasqual | C41: 0.66736111111111107
A42: 42.Parrott | B42: Poway | C42: 0.67638888888888893
A43: 43.Creta Del Lano | B43: Ramona | C43: 0.67013888888888884
A44: 44.Oksana Sergeeva | B44: Torrey Pines | C44: 0.67222222222222217
A45: 45.Frisch | B45: Poway | C45: 0.67361111111111116
A46: 46.Lauren Ortega | B46: Ramona | C46: 0.6743055555555556
A47: 47.Ashley Ludlow | B47: West Hills | C47: 0.6743055555555556
A48: 48.Bonnie Brierton | B48: Ramona | C48: 0.67569444444444438
A49: 49.Allen | B49: Poway | C49: 0.67986111111111114
A50: 50.Ana Vega | B50: Rancho Bernardo | C50: 0.68611111111111101
A51: 51.Wetmore | B51: Poway | C51: 0.69166666666666676
A52: 52.Rachel Bollick | B52: ECHS | C52: 0.69374999999999998
A53: 53.Kelly Daberko | B53: La Costa Canyon | C53: 0.70416666666666661
A54: 54.Katy Benito | B54: Rancho Bernardo | C54: 0.7055555555555556
A55: 55.Kasey Tolbert | B55: West Hills | C55: 0.70694444444444438
A56: 56.Kristine McKinney | B56: ECHS | C56: 0.71458333333333324
A57: 57.Gabrielle Fierro | B57: San Pasqual | C57: 0.71458333333333324
A58: 58.Rachel Haberkern | B58: La Costa Canyon | C58: 0.71736111111111101
A59: 59.Christa Cavolina | B59: Mt. Carmel | C59: 0.72499999999999998
A60: 60.Troy | B60: Poway | C60: 0.7319444444444444
A61: 61.N. Lococo | B61: Patrick Henry | C61: 0.73541666666666661
A62: 62.Sara Buchner | B62: Mt. Carmel | C62: 0.74236111111111114
A63: 63.Lauren Parker | B63: Rancho Bernardo | C63: 0.74236111111111114
A64: 64.Krista Shirley | B64: West Hills | C64: 0.74791666666666667
A65: 65.G.Leenerts | B65: Patrick Henry | C65: 0.74861111111111101
A66: 66.Stephanie Gallegos | B66: West Hills | C66: 0.76527777777777783
A67: 67.Heather McPike | B67: West Hills | C67: 0.78472222222222221
A68: 68.Andrea Landis | B68: West Hills | C68: 0.78541666666666676
A69: 69.Becky Kersteen | B69: El Capitan | C69: 0.7944444444444444
A70: 70.Molly Alvarado | B70: ECHS | C70: 0.8
A71: 71.Ari Plascencia | B71: West Hills | C71: 0.81597222222222221
A72: 72.Laura Sccone | B72: West Hills | C72: 0.81666666666666676
A73: 73.Kelly Connors | B73: La Costa Canyon | C73: 0.82291666666666663
A74: 74.Kathy Weinrib | B74: El Capitan | C74: 0.82291666666666663
A75: 75.Alexis Basaldo | B75: ECHS | C75: 0.89166666666666661
A76: 76.Sam McMahon | B76: Ramona | C76: 0.92638888888888893

A1: 1 | B1: KATY ANDREWS | C1: LCC | D1: 0.49861111111111112
A2: 2 | B2: LINDSAY delaMONTAIGNE | C2: RB | D2: 0.49930555555555556
A3: 3 | B3: BROOKE KERBY | C3: SP | D3: 0.51458333333333328
A4: 4 | B4: KRISTEN BUONO | C4: PH | D4: 0.52569444444444446
A5: 5 | B5: GILLIAN FITCH | C5: LCC | D5: 0.52708333333333335
A6: 6 | B6: KRISTEN PETERS | C6: WH | D6: 0.52847222222222223
A7: 7 | B7: RENAE EATON | C7: SP | D7: 0.52916666666666667
A8: 8 | B8: JOJO FISHEROVA | C8: WH | D8: 0.52916666666666667
A9: 9 | B9: SARAH GILL | C9: TP | D9: 0.53125
A10: 10 | B10: MISSY BARCLAY | C10: WV | D10: 0.53472222222222221
A11: 11 | B11: STEPHANIE CONSIGLIO | C11: EL CAM | D11: 0.54097222222222219
A12: 12 | B12: BRIDGETTE DOCTOR | C12: TP | D12: 0.54166666666666663
A13: 13 | B13: SOPHIE DAVIDSON | C13: TP | D13: 0.54236111111111107
A14: 14 | B14: ERIN HEARN | C14: RAM | D14: 0.54374999999999996
A15: 15 | B15: JANA DRAKE | C15: RB | D15: 0.54513888888888884
A16: 16 | B16: LIZZIE VANCE | C16: WV | D16: 0.54513888888888884
A17: 17 | B17: J BUTLER | C17: MC | D17: 0.54583333333333328
A18: 18 | B18: BRITTANY KENNEDY | C18: EL CAM | D18: 0.54583333333333328
A19: 19 | B19: EMILY YOUNG | C19: LCC | D19: 0.54722222222222228
A20: 20 | B20: M. EVERETT | C20: PH | D20: 0.54791666666666672
A21: 21 | B21: KIYARA IRAVANIAN | C21: RB | D21: 0.54861111111111116
A22: 22 | B22: NINA FITCH | C22: LCC | D22: 0.55
A23: 23 | B23: KATIE WICKS | C23: LCC | D23: 0.55069444444444449
A24: 24 | B24: KELSEY SHIELDS | C24: RAM | D24: 0.55138888888888893
A25: 25 | B25: KAITLIN DANSSERT | C25: TP | D25: 0.55208333333333337
A26: 26 | B26: J. BEARD | C26: PWY | D26: 0.55277777777777781
A27: 27 | B27: STEPHANIE COOK | C27: EL CAP | D27: 0.55347222222222225
A28: 28 | B28: AMY MC CASLIN | C28: TP | D28: 0.55486111111111114
A29: 29 | B29: W. TURNER | C29: PH | D29: 0.55694444444444446
A30: 30 | B30: JULIE COY | C30: TP | D30: 0.55902777777777779
A31: 31 | B31: J. DEXTER | C31: PWY | D31: 0.56111111111111112
A32: 32 | B32: KERRY SONNENBURG | C32: RB | D32: 0.56180555555555556
A33: 33 | B33: CORI MARTE | C33: EL CAM | D33: 0.56180555555555556
A34: 34 | B34: MALLORY BAWKEY | C34: EL CAP | D34: 0.5625
A35: 35 | B35: KIM TAYLOR | C35: LCC | D35: 0.56527777777777777
A36: 36 | B36: KIM ANDREWS | C36: TP | D36: 0.56736111111111109
A37: 37 | B37: MARIANA GARCIA | C37: RAM | D37: 0.56736111111111109
A38: 38 | B38: AMANDA VULETICH | C38: EL CAP | D38: 0.56805555555555554
A39: 39 | B39: MICAELA HICHBORN | C39: TP | D39: 0.56805555555555554
A40: 40 | B40: SAMANTHA ESPINDOLA | C40: WH | D40: 0.57222222222222219
A41: 41 | B41: KIM KRIEGER | C41: TP | D41: 0.57361111111111107
A42: 42 | B42: AHNIE DRAPER | C42: RB | D42: 0.57430555555555551
A43: 43 | B43: LASATER | C43: PWY | D43: 0.57499999999999996
A44: 44 | B44: ALYSSA HOYLE | C44: MC | D44: 0.5756944444444444
A45: 45 | B45: CAITLYN PILKINGTON | C45: LCC | D45: 0.5756944444444444
A46: 46 | B46: CARLY BLISS | C46: RB | D46: 0.57777777777777772
A47: 47 | B47: JENNIFER REYNOLDS | C47: RAM | D47: 0.5805555555555556
A48: 48 | B48: S. RUEBEL | C48: PH | D48: 0.5805555555555556
A49: 49 | B49: NICKY GALLOWAY | C49: SP | D49: 0.58263888888888893
A50: 50 | B50: JESSICA FROST | C50: LCC | D50: 0.58472222222222225
A51: 51 | B51: CHRISTA AGUSTIN | C51: EL CAM | D51: 0.5854166666666667
A52: 52 | B52: KIRI GELHARD | C52: RB | D52: 0.58750000000000002
A53: 53 | B53: TIDWELL | C53: PWY | D53: 0.58888888888888891
A54: 54 | B54: JENNY CANN | C54: MC | D54: 0.58958333333333335
A55: 55 | B55: JESSICA WARD | C55: EL CAP | D55: 0.59166666666666667
A56: 56 | B56: AMANDA TRUJILLO | C56: WV | D56: 0.59166666666666667
A57: 57 | B57: EMILY CARNE | C57: RAM | D57: 0.59444444444444444
A58: 58 | B58: GIROUX | C58: PWY | D58: 0.59930555555555554
A59: 59 | B59: OSMUS | C59: PWY | D59: 0.6
A60: 60 | B60: CHELSEA MUMBY | C60: WV | D60: 0.60069444444444442
A61: 61 | B61: RENEY MCCORD | C61: WV | D61: 0.6020833333333333
A62: 62 | B62: ASHLEY TILLERY | C62: EL CAP | D62: 0.60486111111111107
A63: 63 | B63: LORENTZ | C63: PWY | D63: 0.60555555555555551
A64: 64 | B64: JEN HALL | C64: WV | D64: 0.60624999999999996
A65: 65 | B65: JENNA TENNESEN | C65: EL CAP | D65: 0.6069444444444444
A66: 66 | B66: L. WYNVEEN | C66: PH | D66: 0.60763888888888884
A67: 67 | B67: J. SZAFRANSKI | C67: PH | D67: 0.60763888888888884
A68: 68 | B68: M. WILLIAMS | C68: PWY | D68: 0.60902777777777772
A69: 69 | B69: NICO NONOMURA | C69: WC | D69: 0.61319444444444449
A70: 70 | B70: J. BURKE | C70: PH | D70: 0.62430555555555556
A71: 71 | B71: KYLIE COOK | C71: RAM | D71: 0.62777777777777777
A72: 72 | B72: ABBY RITZMAN | C72: WV | D72: 0.62916666666666665
A73: 73 | B73: DANIELLE HINES | C73: EL CAP | D73: 0.63124999999999998
A74: 74 | B74: RACHELLE HUBER | C74: EL CAP | D74: 0.63611111111111107
A75: 75 | B75: WENDY DORENBUSH | C75: WV | D75: 0.65625
A76: 76 | B76: NICOLE PATTERSON | C76: RAM. | D76: 0.66736111111111107

A1: 1 | B1: MATT SHAUGHNESSY | C1: LCC | D1: 0.42777777777777776
A2: 2 | B2: JAKE AINSWORTH | C2: WEST VW | D2: 0.42916666666666664
A3: 3 | B3: CJ HERSH | C3: TP | D3: 0.42916666666666664
A4: 4 | B4: CARL DARGITZ | C4: RB | D4: 0.43125000000000002
A5: 5 | B5: THOMAS WHITCOMB | C5: SAN PAS | D5: 0.43194444444444446
A6: 6 | B6: J. LEVIEX | C6: LCC | D6: 0.43333333333333335
A7: 7 | B7: KYLE BRUSER | C7: PH | D7: 0.43402777777777779
A8: 8 | B8: TEKESKY | C8: PWY | D8: 0.43680555555555556
A9: 9 | B9: JESSE O'BRIEN | C9: SP | D9: 0.4375
A10: 10 | B10: THOMAS | C10: PWY | D10: 0.43958333333333333
A11: 11 | B11: TRAVIS KUHLMAN | C11: WV | D11: 0.44097222222222221
A12: 12 | B12: DAN ILLINGSWORTH | C12: TP | D12: 0.44236111111111109
A13: 13 | B13: TOM HAMILTON | C13: LCC | D13: 0.44305555555555554
A14: 14 | B14: MARC NELSON | C14: WV | D14: 0.44305555555555554
A15: 15 | B15: BEN SCHUSTER | C15: TP | D15: 0.44444444444444442
A16: 16 | B16: ADRIAN HAYWAS | C16: ELCAM. | D16: 0.44513888888888886
A17: 17 | B17: ZACH PARIS | C17: TP | D17: 0.45
A18: 18 | B18: DAN GONIA | C18: WH | D18: 0.4513888888888889
A19: 19 | B19: COLTON TULLY-DOYLE | C19: RB | D19: 0.45208333333333334
A20: 20 | B20: SHALENDRA MAHARAJ | C20: EL CAM | D20: 0.45208333333333334
A21: 21 | B21: ALI RAMSEY | C21: LCC | D21: 0.45416666666666666
A22: 22 | B22: ROBERT COOK | C22: EL CAM | D22: 0.4548611111111111
A23: 23 | B23: EDWARDS | C23: PWY | D23: 0.4548611111111111
A24: 24 | B24: JAKE WERTNER | C24: RB | D24: 0.45624999999999999
A25: 25 | B25: MITCH PLEUGER | C25: MC | D25: 0.45624999999999999
A26: 26 | B26: SCHUMAN | C26: PWY | D26: 0.45694444444444443
A27: 27 | B27: DYLAN PIGEON | C27: WV | D27: 0.45694444444444443
A28: 28 | B28: R. O'NEAL | C28: PH | D28: 0.45833333333333331
A29: 29 | B29: RYAN MURPHY | C29: MC | D29: 0.4597222222222222
A30: 30 | B30: TRISTAN CORSON | C30: RAM. | D30: 0.46041666666666664
A31: 31 | B31: JEREMY ROOT | C31: WH | D31: 0.46180555555555558
A32: 32 | B32: AARON EVANS | C32: EL CAM | D32: 0.46180555555555558
A33: 33 | B33: BRYCE HOLEWINSKI | C33: RB | D33: 0.46388888888888891
A34: 34 | B34: MIKE SPITZ | C34: RB | D34: 0.46458333333333335
A35: 35 | B35: HUNTER MCNALLY | C35: EL CAP | D35: 0.46527777777777779
A36: 36 | B36: ALAN ROSTAMIJAM | C36: EL CAP | D36: 0.46666666666666667
A37: 37 | B37: JAMES SMITH | C37: RAM | D37: 0.46666666666666667
A38: 38 | B38: LOUIS BARRIOS | C38: RAM | D38: 0.46666666666666667
A39: 39 | B39: VICTOR KEVIN | C39: EL CAP | D39: 0.46736111111111112
A40: 40 | B40: RYAN BAIRD | C40: SP | D40: 0.46736111111111112
A41: 41 | B41: RYAN WILLIS | C41: TP | D41: 0.46944444444444444
A42: 42 | B42: RHETT STOUS | C42: EL CAP | D42: 0.47013888888888888
A43: 43 | B43: JARED FENLASON | C43: RB | D43: 0.47083333333333333
A44: 44 | B44: CHRIS NOREN | C44: RB | D44: 0.47152777777777777
A45: 45 | B45: SMITH | C45: PWY | D45: 0.47361111111111109
A46: 46 | B46: EVAN BROWN | C46: RAM | D46: 0.47499999999999998
A47: 47 | B47: TRENT | C47: WH | D47: 0.47569444444444442
A48: 48 | B48: FAISON | C48: PWY | D48: 0.47708333333333336
A49: 49 | B49: B. BALLARD | C49: PH | D49: 0.47847222222222224
A50: 50 | B50: BLAED DEUL | C50: RAM | D50: 0.47916666666666669
A51: 51 | B51: GILSON | C51: PWY | D51: 0.47986111111111113
A52: 52 | B52: DUSTIN DIVEN | C52: RAM | D52: 0.47986111111111113
A53: 53 | B53: KEVIN WATTERS | C53: EL CAP | D53: 0.47986111111111113
A54: 54 | B54: KREGG CASTILLO | C54: SP | D54: 0.48194444444444445
A55: 55 | B55: DAVID WESTON | C55: SP | D55: 0.48194444444444445
A56: 56 | B56: JASON AMBROSE | C56: TP | D56: 0.4826388888888889
A57: 57 | B57: NOAH TAYLOR | C57: RB | D57: 0.48333333333333334
A58: 58 | B58: BRIAN HUFF | C58: TP | D58: 0.48402777777777778
A59: 59 | B59: M PAUR | C59: PWY | D59: 0.4861111111111111
A60: 60 | B60: NEVAREZ | C60: PWY | D60: 0.48680555555555555
A61: 61 | B61: K RYAN | C61: PH | D61: 0.48819444444444443
A62: 62 | B62: JONATHON RUSSO | C62: RAM | D62: 0.48888888888888887
A63: 63 | B63: RINEHART | C63: LCC | D63: 0.48958333333333331
A64: 64 | B64: MENDOZA | C64: PWY | D64: 0.49027777777777776
A65: 65 | B65: C. SCHWEIHS | C65: PH | D65: 0.4909722222222222
A66: 66 | B66: RYAN TUNNELL | C66: TP | D66: 0.49166666666666664
A67: 67 | B67: MORENO | C67: RAM | D67: 0.49305555555555558
A68: 68 | B68: DAN MARTIN | C68: MC | D68: 0.49305555555555558
A69: 69 | B69: DEAN GUZMAN | C69: EL CAM | D69: 0.49305555555555558
A70: 70 | B70: BRENNAN LOEFFLER | C70: WV | D70: 0.49375000000000002
A71: 71 | B71: DANIEL OSEGUERA | C71: LCC | D71: 0.49513888888888891
A72: 72 | B72: CRAIG SPEICHER | C72: EL CAP | D72: 0.49513888888888891
A73: 73 | B73: J. MENDES | C73: PH | D73: 0.49583333333333335
A74: 74 | B74: STEPHEN PALENSKE | C74: WV | D74: 0.49652777777777779
A75: 75 | B75: JULIO RODRIQUEZ | C75: MC | D75: 0.49722222222222223
A76: 76 | B76: NICK VASQUEZ | C76: SP | D76: 0.49861111111111112
A77: 77 | B77: A BERLIN | C77: PH | D77: 0.49930555555555556
A78: 78 | B78: PATRICK HARRIGAN | C78: TP | D78: 0.49930555555555556
A79: 79 | B79: OCAMPO | C79: PWY | D79: 0.49930555555555556
A80: 80 | B80: J. GARDELLA | C80: PH | D80: 0.50347222222222221

A1: 1 | B1: Ty Hines | C1: San Pasqual | D1: 0.46736111111111112
A2: =A1+1 -> 2 | B2: Patrick Sheehan | C2: San Pasqual | D2: 0.4680555555555555
A3: =A2+1 -> 3 | B3: Mike Ferozzo | C3: MC | D3: 0.47847222222222219
A4: =A3+1 -> 4 | B4: Mike Poffenbarger | C4: El Cap | D4: 0.4826388888888889
A5: =A4+1 -> 5 | B5: Craig Love | C5: MC | D5: 0.48333333333333334
A6: =A5+1 -> 6 | B6: David Hernandez | C6: ECHS | D6: 0.48680555555555555
A7: =A6+1 -> 7 | B7: Conner O'Brien | C7: TP | D7: 0.48749999999999999
A8: =A7+1 -> 8 | B8: Ryan Butler | C8: San Pasqual | D8: 0.48819444444444443
A9: =A8+1 -> 9 | B9: J Cortez | C9: PH | D9: 0.49305555555555558
A10: =A9+1 -> 10 | B10: Chris Ertz | C10: El Cap | D10: 0.49513888888888885
A11: =A10+1 -> 11 | B11: Jon Kerby | C11: San Pasqual | D11: 0.49513888888888885
A12: =A11+1 -> 12 | B12: Stephen Abdo | C12: TP | D12: 0.49722222222222223
A13: =A12+1 -> 13 | B13: Grant Quackenbush | C13: LCC | D13: 0.49791666666666662
A14: =A13+1 -> 14 | B14: Omar Elaassaf | C14: MC | D14: 0.49791666666666662
A15: =A14+1 -> 15 | B15: Tim Black | C15: TP | D15: 0.50347222222222221
A16: =A15+1 -> 16 | B16: Bruan Dworsky | C16: TP | D16: 0.50416666666666665
A17: =A16+1 -> 17 | B17: Aleks Savovic | C17: RB | D17: 0.50555555555555554
A18: =A17+1 -> 18 | B18: Jonhnny Kremensky | C18: El Cap | D18: 0.50763888888888886
A19: =A18+1 -> 19 | B19: Tiedemann | C19: Poway | D19: 0.51111111111111118
A20: =A19+1 -> 20 | B20: Patrick Greeen | C20: El Cap | D20: 0.51180555555555551
A21: =A20+1 -> 21 | B21: Anthony Grow | C21: West Hills | D21: 0.51249999999999996
A22: =A21+1 -> 22 | B22: Trevor Countryman | C22: TP | D22: 0.5131944444444444
A23: =A22+1 -> 23 | B23: Matt Stanislawski | C23: RB | D23: 0.51388888888888895
A24: =A23+1 -> 24 | B24: Hiroki Sekine | C24: RB | D24: 0.51388888888888895
A25: =A24+1 -> 25 | B25: Zachary Wilson | C25: ECHS | D25: 0.51527777777777783
A26: =A25+1 -> 26 | B26: J Hemphill | C26: PH | D26: 0.51597222222222217
A27: =A26+1 -> 27 | B27: Jeff Wurzback | C27: TP | D27: 0.51736111111111105
A28: =A27+1 -> 28 | B28: Justin Archuletta | C28: El Cap | D28: 0.5180555555555556
A29: =A28+1 -> 29 | B29: Mike O'Donnell | C29: MC | D29: 0.51875000000000004
A30: =A29+1 -> 30 | B30: Mitch Brown | C30: RB | D30: 0.51875000000000004
A31: =A30+1 -> 31 | B31: Levine | C31: TP | D31: 0.52222222222222225
A32: =A31+1 -> 32 | B32: J Harley | C32: PH | D32: 0.52500000000000002
A33: =A32+1 -> 33 | B33: Bryan Lau | C33: TP | D33: 0.52569444444444446
A34: =A33+1 -> 34 | B34: David Zsutty | C34: ECHS | D34: 0.52569444444444446
A35: =A34+1 -> 35 | B35: Mean Bauer | C35: TP | D35: 0.52569444444444446
A36: =A35+1 -> 36 | B36: Gerson Lup | C36: LCC | D36: 0.52638888888888891
A37: =A36+1 -> 37 | B37: Shane Skelly | C37: LCC | D37: 0.52916666666666667
A38: =A37+1 -> 38 | B38: Ryan Walery | C38: San Pasqual | D38: 0.53333333333333333
A39: =A38+1 -> 39 | B39: Tim Bishop | C39: El Cap | D39: 0.53541666666666665
A40: =A39+1 -> 40 | B40: Doug Burbidge | C40: San Pasqual | D40: 0.53611111111111109
A41: =A40+1 -> 41 | B41: Eddie Scheehan | C41: San Pasqual | D41: 0.53680555555555554
A42: =A41+1 -> 42 | B42: Mike Dolan | C42: West Hills | D42: 0.53819444444444442
A43: =A42+1 -> 43 | B43: W Kintzele | C43: PH | D43: 0.53888888888888886
A44: =A43+1 -> 44 | B44: Evan Lee | C44: TP | D44: 0.53888888888888886
A45: =A44+1 -> 45 | B45: Jarred Atkinson | C45: El Cap | D45: 0.54166666666666663
A46: =A45+1 -> 46 | B46: Scott Nunes | C46: El Cap | D46: 0.54236111111111118
A47: =A46+1 -> 47 | B47: Jon Blue | C47: MC | D47: 0.5444444444444444
A48: =A47+1 -> 48 | B48: Steven Wancewicz | C48: RB | D48: 0.54513888888888895
A49: =A48+1 -> 49 | B49: Kevin Orr | C49: RHS | D49: 0.54583333333333328
A50: =A49+1 -> 50 | B50: Rick Lee | C50: El Cap | D50: 0.54652777777777783
A51: =A50+1 -> 51 | B51: Charles Seat | C51: RHS | D51: 0.54861111111111105
A52: =A51+1 -> 52 | B52: Kyle Keezer | C52: RHS | D52: 0.54861111111111105
A53: =A52+1 -> 53 | B53: K Carry | C53: PH | D53: 0.55
A54: =A53+1 -> 54 | B54: Rafe Gandola | C54: TP | D54: 0.55069444444444449
A55: =A54+1 -> 55 | B55: Luis Avalos | C55: LCC | D55: 0.55208333333333337
A56: =A55+1 -> 56 | B56: Brent Edmunds | C56: TP | D56: 0.55347222222222225
A57: =A56+1 -> 57 | B57: Alex Bray | C57: TP | D57: 0.55347222222222225
A58: =A57+1 -> 58 | B58: Trent Eason | C58: ECHS | D58: 0.5541666666666667
A59: =A58+1 -> 59 | B59: J.J. Ninteman | C59: West Hills | D59: 0.5541666666666667
A60: =A59+1 -> 60 | B60: Jose Lozaho | C60: West Hills | D60: 0.55625000000000002
A61: =A60+1 -> 61 | B61: Chris Wendle | C61: El Cap | D61: 0.55694444444444446
A62: =A61+1 -> 62 | B62: Jorge Lem | C62: San Pasqual | D62: 0.55763888888888891
A63: =A62+1 -> 63 | B63: Ken Wakabayashi | C63: WV | D63: 0.55763888888888891
A64: =A63+1 -> 64 | B64: J Katz | C64: PH | D64: 0.55972222222222223
A65: =A64+1 -> 65 | B65: Ben Barnes | C65: TP | D65: 0.56041666666666667
A66: =A65+1 -> 66 | B66: Hulse | C66: Poway | D66: 0.56111111111111112
A67: =A66+1 -> 67 | B67: Coleman | C67: Poway | D67: 0.56180555555555556
A68: =A67+1 -> 68 | B68: Schwab | C68: Poway | D68: 0.56458333333333333
A69: =A68+1 -> 69 | B69: Luke Adams | C69: MC | D69: 0.56458333333333333
A70: =A69+1 -> 70 | B70: Jarrad Kwok | C70: San Pasqual | D70: 0.56874999999999998
A71: =A70+1 -> 71 | B71: Aarron Manji | C71: LCC | D71: 0.57013888888888886
A72: =A71+1 -> 72 | B72: Kevin Chavarria | C72: West Hills | D72: 0.5708333333333333
A73: =A72+1 -> 73 | B73: Josh Madden | C73: RHS | D73: 0.5708333333333333
A74: =A73+1 -> 74 | B74: Dean | C74: Poway | D74: 0.5708333333333333
A75: =A74+1 -> 75 | B75: T.J.. Borkowski | C75: El Cap | D75: 0.5756944444444444
A76: =A75+1 -> 76 | B76: Ian Shevlin | C76: WV | D76: 0.57708333333333328
A77: =A76+1 -> 77 | B77: Yuan | C77: TP | D77: 0.57777777777777783
A78: =A77+1 -> 78 | B78: J Cook | C78: PH | D78: 0.57916666666666672
A79: =A78+1 -> 79 | B79: Aarron Bercovich | C79: RB | D79: 0.58402777777777781
A80: =A79+1 -> 80 | B80: Brian Danque | C80: San Pasqual | D80: 0.58402777777777781
A81: =A80+1 -> 81 | B81: Nic Pew | C81: San Pasqual | D81: 0.58680555555555558
A82: =A81+1 -> 82 | B82: Luke Pew | C82: San Pasqual | D82: 0.58680555555555558
A83: =A82+1 -> 83 | B83: Matt Leef | C83: MC | D83: 0.58750000000000002
A84: =A83+1 -> 84 | B84: Mike Gibson | C84: WV | D84: 0.58750000000000002
A85: =A84+1 -> 85 | B85: Brian Frost | C85: ECHS | D85: 0.59027777777777779
A86: =A85+1 -> 86 | B86: Daniel Borgattie | C86: San Pasqual | D86: 0.59097222222222223
A87: =A86+1 -> 87 | B87: Russell Lindsey | C87: West Hills | D87: 0.59236111111111112
A88: =A87+1 -> 88 | B88: David Boone | C88: LCC | D88: 0.59305555555555556
A89: =A88+1 -> 89 | B89: David Nelson | C89: RB | D89: 0.59375
A90: =A89+1 -> 90 | B90: Mike Biszak | C90: WV | D90: 0.59375
A91: =A90+1 -> 91 | B91: Grant Rinehart | C91: LCC | D91: 0.59444444444444444
A92: =A91+1 -> 92 | B92: D. Patterson | C92: PH | D92: 0.59444444444444444
A93: =A92+1 -> 93 | B93: Okai | C93: Poway | D93: 0.59791666666666665
A94: =A93+1 -> 94 | B94: Matt Balha | C94: ECHS | D94: 0.60624999999999996
A95: =A94+1 -> 95 | B95: Andrew Benson | C95: El Cap | D95: 0.6069444444444444
A96: =A95+1 -> 96 | B96: Garret Smith | C96: West Hills | D96: 0.60763888888888895
A97: =A96+1 -> 97 | B97: Cliff Freeman | C97: El Cap | D97: 0.6118055555555556
A98: =A97+1 -> 98 | B98: Ben Cannon | C98: MC | D98: 0.6118055555555556
A99: =A98+1 -> 99 | B99: Bryant Urry | C99: San Pasqual | D99: 0.61388888888888882
A100: =A99+1 -> 100 | B100: Someck | C100: TP | D100: 0.62222222222222223
A101: =A100+1 -> 101 | B101: Robert rivera | C101: West Hills | D101: 0.62569444444444444
A102: =A101+1 -> 102 | B102: Ablonski | C102: Poway | D102: 0.64027777777777783
A103: =A102+1 -> 103 | B103: C. Sedlar | C103: PH | D103: 0.64513888888888882
A104: =A103+1 -> 104 | B104: David Putnicki | C104: San Pasqual | D104: 0.65902777777777777
A105: =A104+1 -> 105 | B105: M. Andrews | C105: PH | D105: 0.65972222222222221
A106: =A105+1 -> 106 | B106: B. Sedlar | C106: PH | D106: 0.70763888888888893
A107: =A106+1 -> 107 | B107: Ivan Quirros | C107: San Pasqual | D107: 0.7104166666666667
A108: =A107+1 -> 108 | B108: Eric landrum | C108: San Pasqual | D108: 0.73055555555555562

A1: 1 | B1: Ian Merrin | C1: West Hills | D1: 0.4777777777777778
A2: =A1+1 -> 2 | B2: Z. Teal | C2: Poway | D2: 0.47916666666666669
A3: =A2+1 -> 3 | B3: Dean Manley | C3: RHS | D3: 0.48125000000000001
A4: =A3+1 -> 4 | B4: Mark Kennedy | C4: West Hills | D4: 0.48402777777777778
A5: =A4+1 -> 5 | B5: Gregor Lloyd-Smith | C5: TP | D5: 0.48402777777777778
A6: =A5+1 -> 6 | B6: Otavio Davila | C6: West Hills | D6: 0.4861111111111111
A7: =A6+1 -> 7 | B7: Brad Simmonds | C7: West Hills | D7: 0.48819444444444443
A8: =A7+1 -> 8 | B8: Sean Proehl | C8: RB | D8: 0.49027777777777781
A9: =A8+1 -> 9 | B9: Andrew Flood | C9: RB | D9: 0.49027777777777781
A10: =A9+1 -> 10 | B10: Blake Caricato | C10: West Hills | D10: 0.4916666666666667
A11: =A10+1 -> 11 | B11: Mudd | C11: Poway | D11: 0.49375000000000002
A12: =A11+1 -> 12 | B12: Caballerro | C12: PH | D12: 0.49444444444444446
A13: =A12+1 -> 13 | B13: David Carlson | C13: RB | D13: 0.50347222222222221
A14: =A13+1 -> 14 | B14: Brian Duong | C14: RB | D14: 0.50902777777777775
A15: =A14+1 -> 15 | B15: Russ Muncke | C15: San Pasqual | D15: 0.51111111111111118
A16: =A15+1 -> 16 | B16: Meebergen | C16: Poway | D16: 0.5131944444444444
A17: =A16+1 -> 17 | B17: Andy Shoepp | C17: RHS | D17: 0.51597222222222217
A18: =A17+1 -> 18 | B18: C. McIntosh | C18: PH | D18: 0.51666666666666672
A19: =A18+1 -> 19 | B19: O'Connell | C19: Poway | D19: 0.51736111111111105
A20: =A19+1 -> 20 | B20: M. Nguyen | C20: PH | D20: 0.51736111111111105
A21: =A20+1 -> 21 | B21: Miles Segni | C21: El Cap | D21: 0.52013888888888882
A22: =A21+1 -> 22 | B22: Mourey | C22: Poway | D22: 0.52152777777777781
A23: =A22+1 -> 23 | B23: Jeremy Black | C23: TP | D23: 0.52430555555555558
A24: =A23+1 -> 24 | B24: Aaron Fenlason | C24: RB | D24: 0.52569444444444446
A25: =A24+1 -> 25 | B25: Mike Devan | C25: El Cap | D25: 0.52847222222222223
A26: =A25+1 -> 26 | B26: Rudolph | C26: Poway | D26: 0.52986111111111112
A27: =A26+1 -> 27 | B27: Brian Lane | C27: TP | D27: 0.53055555555555556
A28: =A27+1 -> 28 | B28: Mitchell Coogan | C28: LCC | D28: 0.53125
A29: =A28+1 -> 29 | B29: Isaac Lew | C29: WV | D29: 0.53333333333333333
A30: =A29+1 -> 30 | B30: Chris Torres | C30: El Cap | D30: 0.53402777777777777
A31: =A30+1 -> 31 | B31: Nauersky | C31: Poway | D31: 0.53402777777777777
A32: =A31+1 -> 32 | B32: So Adachi | C32: RB | D32: 0.53541666666666665
A33: =A32+1 -> 33 | B33: Mike Gonia | C33: West Hills | D33: 0.53611111111111109
A34: =A33+1 -> 34 | B34: E. Benedict | C34: PH | D34: 0.53611111111111109
A35: =A34+1 -> 35 | B35: E. Rosman | C35: PH | D35: 0.53680555555555554
A36: =A35+1 -> 36 | B36: Brian Mitchell | C36: WV | D36: 0.53819444444444442
A37: =A36+1 -> 37 | B37: David McEachern | C37: MC | D37: 0.53888888888888886
A38: =A37+1 -> 38 | B38: Garrett Yagade | C38: RB | D38: 0.54027777777777775
A39: =A38+1 -> 39 | B39: Kevin Galloway | C39: San Pasqual | D39: 0.54097222222222219
A40: =A39+1 -> 40 | B40: Jackson | C40: Poway | D40: 0.54097222222222219
A41: =A40+1 -> 41 | B41: Brian Strout | C41: RHS | D41: 0.54652777777777783
A42: =A41+1 -> 42 | B42: Tom dolan | C42: West Hills | D42: 0.54722222222222217
A43: =A42+1 -> 43 | B43: Peterson | C43: West Hills | D43: 0.54722222222222217
A44: =A43+1 -> 44 | B44: Hussein alasady | C44: WV | D44: 0.5493055555555556
A45: =A44+1 -> 45 | B45: Edwin Gonzalez | C45: ECHS | D45: 0.55138888888888882
A46: =A45+1 -> 46 | B46: Micah Ninteman | C46: West Hills | D46: 0.55208333333333337
A47: =A46+1 -> 47 | B47: Dominic Rentz | C47: MC | D47: 0.55625000000000002
A48: =A47+1 -> 48 | B48: Jordan Chavrin | C48: San Pasqual | D48: 0.56111111111111112
A49: =A48+1 -> 49 | B49: Justin Carson | C49: TP | D49: 0.5625
A50: =A49+1 -> 50 | B50: Allen Zarifian | C50: LCC | D50: 0.56597222222222221
A51: =A50+1 -> 51 | B51: Brandon Hetecer | C51: MC | D51: 0.57361111111111118
A52: =A51+1 -> 52 | B52: Josh Hager | C52: RHS | D52: 0.57499999999999996
A53: =A52+1 -> 53 | B53: Jullian Blaseio | C53: TP | D53: 0.5756944444444444
A54: =A53+1 -> 54 | B54: Bryan Koci | C54: West Hills | D54: 0.92638888888888893
A55: =A54+1 -> 55 | B55: Christopher Patterson | C55: ECHS | D55: 0.58333333333333337
A56: =A55+1 -> 56 | B56: Steven Sterrett | C56: MC | D56: 0.58402777777777781
A57: =A56+1 -> 57 | B57: Will Somervell | C57: RB | D57: 0.5854166666666667
A58: =A57+1 -> 58 | B58: Whetstone | C58: West Hills | D58: 0.58611111111111114
A59: =A58+1 -> 59 | B59: James Bonner | C59: San Pasqual | D59: 0.59027777777777779
A60: =A59+1 -> 60 | B60: Collin Skausen | C60: TP | D60: 0.59027777777777779
A61: =A60+1 -> 61 | B61: Sean Donnellam | C61: West Hills | D61: 0.59097222222222223
A62: =A61+1 -> 62 | B62: Alex Bloomfield | C62: West Hills | D62: 0.59166666666666667
A63: =A62+1 -> 63 | B63: M Spelleberg | C63: PH | D63: 0.59305555555555556
A64: =A63+1 -> 64 | B64: Wilson | C64: Poway | D64: 0.59375
A65: =A64+1 -> 65 | B65: John Maheu | C65: WV | D65: 0.59652777777777777
A66: =A65+1 -> 66 | B66: Troy Edwards | C66: LCC | D66: 0.59791666666666665
A67: =A66+1 -> 67 | B67: Mason Westphal | C67: RHS | D67: 0.59930555555555554
A68: =A67+1 -> 68 | B68: A. Rathgeber | C68: PH | D68: 0.60138888888888886
A69: =A68+1 -> 69 | B69: Norman | C69: Poway | D69: 0.60416666666666663
A70: =A69+1 -> 70 | B70: S. Hatch | C70: PH | D70: 0.61041666666666672
A71: =A70+1 -> 71 | B71: Luke Middlebrook | C71: El Cap | D71: 0.6118055555555556
A72: =A71+1 -> 72 | B72: Kevin Yang | C72: TP | D72: 0.61250000000000004
A73: =A72+1 -> 73 | B73: Cory Orlansky | C73: WV | D73: 0.61458333333333337
A74: =A73+1 -> 74 | B74: Mike Ortega | C74: El Cap | D74: 0.61527777777777781
A75: =A74+1 -> 75 | B75: Mark Hardee | C75: TP | D75: 0.6166666666666667
A76: =A75+1 -> 76 | B76: S. Sloan | C76: PH | D76: 0.6166666666666667
A77: =A76+1 -> 77 | B77: Jimmy Thomas | C77: West Hills | D77: 0.61736111111111114
A78: =A77+1 -> 78 | B78: Dale Boerman | C78: MC | D78: 0.62083333333333335
A79: =A78+1 -> 79 | B79: Eric Surratt | C79: WV | D79: 0.62361111111111112
A80: =A79+1 -> 80 | B80: Justin Kinstle | C80: RHS | D80: 0.62638888888888888
A81: =A80+1 -> 81 | B81: Richard Zepeda | C81: El Cap | D81: 0.62777777777777777
A82: =A81+1 -> 82 | B82: Chris Loughlin | C82: RB | D82: 0.62916666666666665
A83: =A82+1 -> 83 | B83: Haidang Nguyen | C83: WV | D83: 0.63402777777777775
A84: =A83+1 -> 84 | B84: Paul Miller | C84: West Hills | D84: 0.63680555555555551
A85: =A84+1 -> 85 | B85: Scott Johnston | C85: San Pasqual | D85: 0.6381944444444444
A86: =A85+1 -> 86 | B86: Mike Slaughter | C86: West Hills | D86: 0.6430555555555556
A87: =A86+1 -> 87 | B87: Cora Lopez | C87: MC | D87: 0.64375000000000004
A88: =A87+1 -> 88 | B88: Justin Hermann | C88: San Pasqual | D88: 0.64444444444444449
A89: =A88+1 -> 89 | B89: Peter Benito | C89: RB | D89: 0.65069444444444446
A90: =A89+1 -> 90 | B90: Dana Walters | C90: LCC | D90: 0.65833333333333333
A91: =A90+1 -> 91 | B91: Carlsen | C91: West Hills | D91: 0.66597222222222219
A92: =A91+1 -> 92 | B92: Amos Gonzalez | C92: RHS | D92: 0.66805555555555562
A93: =A92+1 -> 93 | B93: Eric Garcia | C93: El Cap | D93: 0.67013888888888884
A94: =A93+1 -> 94 | B94: K. Cuadal | C94: PH | D94: 0.69236111111111109
A95: =A94+1 -> 95 | B95: Joseph Connolhy | C95: MC | D95: 0.70833333333333337
A96: =A95+1 -> 96 | B96: Brett Ramin | C96: RB | D96: 0.70833333333333337
A97: =A96+1 -> 97 | B97: D. Gilbreth | C97: PH | D97: 0.73472222222222217
A98: =A97+1 -> 98 | B98: E. Weintraub | C98: PH | D98: 0.73611111111111116
A99: =A98+1 -> 99 | B99: Daniel Downes | C99: RHS | D99: 0.8027777777777777

A1: 1 | B1: ALICIA NUGENT | C1: VAL | D1: 0.5229166666666667
A2: 2 | B2: MOLLY O'TOOLE | C2: USDHS | D2: 0.52777777777777779
A3: 3 | B3: NICOLE AURIGEMMA | C3: CARLS | D3: 0.52847222222222223
A4: 4 | B4: EMILY KERR | C4: ESC | D4: 0.53194444444444444
A5: 5 | B5: MEL BOWLES | C5: ESC | D5: 0.54652777777777772
A6: 6 | B6: ERICA ZAMBON | C6: CARLS | D6: 0.54861111111111116
A7: 7 | B7: RANDEE MEEK | C7: GROSS | D7: 0.56458333333333333
A8: 8 | B8: TESS WYNEE | C8: USDHS | D8: 0.5756944444444444
A9: 9 | B9: KRISTEN NELSON | C9: USDHS | D9: 0.57777777777777772
A10: 10 | B10: JENNY REINAGEL | C10: USDHS | D10: 0.57986111111111116
A11: 11 | B11: AFTON SIEBERN | C11: SANT. | D11: 0.58125000000000004
A12: 12 | B12: LEXIS MILISIC | C12: USDHS | D12: 0.58194444444444449
A13: 13 | B13: CHELSEA ELLWOOD | C13: MI. MESA | D13: 0.58194444444444449
A14: 14 | B14: AMY WILLIAMS | C14: ESC | D14: 0.58333333333333337
A15: 15 | B15: LISA LANE | C15: HILL | D15: 0.58333333333333337
A16: 16 | B16: KIRSTEN MOORE | C16: CARLS | D16: 0.58402777777777781
A17: 17 | B17: T. IZAGUIRRE | C17: GROSS | D17: 0.58680555555555558
A18: 18 | B18: KIM PREVOST | C18: MI. MESA | D18: 0.58750000000000002
A19: 19 | B19: BLOCH | C19: SDA | D19: 0.58958333333333335
A20: 20 | B20: KARA ATENSIO | C20: HILL | D20: 0.59027777777777779
A21: 21 | B21: MANDI LYONS | C21: ESC | D21: 0.59236111111111112
A22: 22 | B22: STEPHANIE SELLARS | C22: ESC | D22: 0.59583333333333333
A23: 23 | B23: CHELSEA FISCHER | C23: USDHS | D23: 0.60069444444444442
A24: 24 | B24: BRITTANY TUCKER | C24: CARLS | D24: 0.6020833333333333
A25: 25 | B25: JENNIFER VAN DYNE | C25: GROSS | D25: 0.6020833333333333
A26: 26 | B26: GARCIA | C26: SDA | D26: 0.60416666666666663
A27: 27 | B27: ANGELA KUZARA | C27: SAN MAR | D27: 0.60763888888888884
A28: 28 | B28: LAUREN VERTHY | C28: CARLS | D28: 0.61388888888888893
A29: 29 | B29: JENNY GILBREATH | C29: USDHS | D29: 0.61597222222222225
A30: 30 | B30: ANGELA FAUELA | C30: ESC | D30: 0.61944444444444446
A31: 31 | B31: JACKIE KLEIN | C31: CARLS | D31: 0.62152777777777779
A32: 32 | B32: KRISTEN TAKAGI | C32: ESC | D32: 0.62291666666666667
A33: 33 | B33: KATIE NICHOLSON | C33: CAL CHPL | D33: 0.62291666666666667
A34: 34 | B34: HANNAH ENGHOLM | C34: ESC | D34: 0.62361111111111112
A35: 35 | B35: GABRIELA AMPUDIA | C35: MI MESA | D35: 0.62777777777777777
A36: 36 | B36: AMY CARRACINO | C36: CARLS | D36: 0.63472222222222219
A37: 37 | B37: MELISSA HOSFORD | C37: SANT | D37: 0.63888888888888884
A38: 38 | B38: LAUREN COBBE | C38: SAN MAR | D38: 0.64097222222222228
A39: 39 | B39: IRENE AGUILAR | C39: SAN MAR | D39: 0.64236111111111116
A40: 40 | B40: HOLLY MEANS | C40: GROSS | D40: 0.65
A41: 41 | B41: JONES | C41: SDA | D41: 0.65347222222222223
A42: 42 | B42: TIFFANY LANDAAL | C42: GROSS | D42: 0.65694444444444444
A43: 43 | B43: AMY BADAMI | C43: SANT | D43: 0.65902777777777777
A44: 44 | B44: SERENA CLUNE | C44: USDHS | D44: 0.66597222222222219
A45: 45 | B45: CASSANDRA VAN DYNE | C45: GROSS | D45: 0.67777777777777781
A46: 46 | B46: JESSICA WAATKINS | C46: MI. MESA | D46: 0.68472222222222223
A47: 47 | B47: ALY TARLING | C47: SAN MAR | D47: 0.68472222222222223
A48: 48 | B48: LIBBY MADDOX | C48: SAN MAR | D48: 0.69236111111111109
A49: 49 | B49: SARAH WILLIAMS | C49: CAL CHPL | D49: 0.69722222222222219
A50: 50 | B50: CASTERLINE | C50: SDA | D50: 0.7006944444444444
A51: 51 | B51: MORGAN HEFLY | C51: CAL CHPL | D51: 0.73819444444444449
A52: 52 | B52: SHANNON CARTER | C52: CAL CHPL | D52: 0.77430555555555558

A1: 1 | B1: FERNANDO TORRES | C1: ESC | D1: 0.43263888888888891
A2: 2 | B2: TONY BARENO | C2: VAL | D2: 0.43819444444444444
A3: 3 | B3: SEAN SISK | C3: USDHS | D3: 0.44791666666666669
A4: 4 | B4: THOMAS THYS | C4: ESC | D4: 0.45
A5: 5 | B5: BRYANT ROSELL | C5: CARLS | D5: 0.45624999999999999
A6: 6 | B6: JORDAN MORE | C6: SAN MAR | D6: 0.45694444444444443
A7: 7 | B7: PATRICK JUAREZ | C7: USDHS | D7: 0.4597222222222222
A8: 8 | B8: BRANDON WILLIAMS | C8: ESC | D8: 0.46250000000000002
A9: 9 | B9: MATT KIELBASSA | C9: VAL. | D9: 0.46458333333333335
A10: 10 | B10: VINNY YORK | C10: ESC | D10: 0.46597222222222223
A11: 11 | B11: RYAN WHITHALL | C11: CARLS | D11: 0.46597222222222223
A12: 12 | B12: NICK MCCANN | C12: USDHS | D12: 0.46875
A13: 13 | B13: DIEGO SANTOS | C13: ESC | D13: 0.47013888888888888
A14: 14 | B14: FRANCIS KITRICK | C14: USDHS | D14: 0.47152777777777777
A15: 15 | B15: DOMINIC LOCKHART | C15: USDHS | D15: 0.47222222222222221
A16: 16 | B16: S. CHEULEN | C16: SDA | D16: 0.47222222222222221
A17: 17 | B17: JON PATINO | C17: MI MESA | D17: 0.47430555555555554
A18: 18 | B18: DOYLE FIRST | C18: SAN MAR | D18: 0.47916666666666669
A19: 19 | B19: STILLINGER | C19: SDA | D19: 0.48055555555555557
A20: 20 | B20: MARK KIELBASA | C20: VAL | D20: 0.48125000000000001
A21: 21 | B21: ALEX DECINO | C21: CARLS | D21: 0.48333333333333334
A22: 22 | B22: PING | C22: HILLTOP | D22: 0.48402777777777778
A23: 23 | B23: FIELDS | C23: SDA | D23: 0.48472222222222222
A24: 24 | B24: MORGAN | C24: SDA | D24: 0.48541666666666666
A25: 25 | B25: SP. SCHWERDTFEGER | C25: CARLS | D25: 0.48541666666666666
A26: 26 | B26: MAXIMINO ROSALES | C26: SAN MAR | D26: 0.4861111111111111
A27: 27 | B27: KYLE GERHARD | C27: CAL CHR. | D27: 0.48680555555555555
A28: 28 | B28: ANTHONY STRUNZ | C28: VAL | D28: 0.48680555555555555
A29: 29 | B29: JORDAN AHLE | C29: CARLS | D29: 0.48819444444444443
A30: 30 | B30: KEVIN SOARES | C30: USDHS | D30: 0.48888888888888887
A31: 31 | B31: DAVID CANSECO | C31: SAN MAR | D31: 0.4909722222222222
A32: 32 | B32: JASON MATTHEW | C32: USDHS | D32: 0.49236111111111114
A33: 33 | B33: MOHAMMED ALSASADAY | C33: GROSS | D33: 0.49305555555555558
A34: 34 | B34: DUSTY HENDERSON | C34: GROSS | D34: 0.49305555555555558
A35: 35 | B35: ANTHONY DEBARROWS | C35: SANT. | D35: 0.49375000000000002
A36: 36 | B36: MATT DOLLARD | C36: USDHS | D36: 0.49375000000000002
A37: 37 | B37: ROB LANGWORTHY | C37: CAL CHP | D37: 0.49444444444444446
A38: 38 | B38: RYAN SMAIL | C38: HILL | D38: 0.49722222222222223
A39: 39 | B39: ROBERT BOMAN | C39: USDHS | D39: 0.49791666666666667
A40: 40 | B40: MICHAEL ZAMBON | C40: CARLS | D40: 0.49861111111111112
A41: 41 | B41: DANIEL DUFOUR | C41: USDHS | D41: 0.5
A42: 42 | B42: KYLE JOHNSON | C42: CARLS | D42: 0.50069444444444444
A43: 43 | B43: CALE DORENIC | C43: ESC | D43: 0.50208333333333333
A44: 44 | B44: RYAN HARROD | C44: VAL | D44: 0.50208333333333333
A45: 45 | B45: MICHAEL TRUXTON | C45: USDHS | D45: 0.50486111111111109
A46: 46 | B46: CHRIS ELDER | C46: CAL CHP | D46: 0.50902777777777775
A47: 47 | B47: TIM FLEMING | C47: ESC | D47: 0.51111111111111107
A48: 48 | B48: CHRIS DROZD | C48: SAN MAR | D48: 0.5131944444444444
A49: 49 | B49: RAVI RATHOD | C49: SAN MAR | D49: 0.51666666666666672
A50: 50 | B50: IAN PETERSON | C50: CARLS | D50: 0.51666666666666672
A51: 51 | B51: AMANO | C51: SDA | D51: 0.51666666666666672
A52: 52 | B52: BARRETT TILLEY | C52: GROSS | D52: 0.5180555555555556
A53: 53 | B53: HOOD | C53: SDA | D53: 0.52152777777777781
A54: 54 | B54: PEDERSON | C54: SDA | D54: 0.52222222222222225
A55: 55 | B55: SEAN BROWN | C55: ESC | D55: 0.52222222222222225
A56: 56 | B56: CHRIS ROOT | C56: GROSS | D56: 0.5229166666666667
A57: 57 | B57: SCOTT CLEMONS | C57: ESC | D57: 0.53055555555555556
A58: 58 | B58: KEVIN COOPER | C58: SAN MAR | D58: 0.53611111111111109
A59: 59 | B59: LUNDBERG | C59: SDA | D59: 0.53680555555555554
A60: 60 | B60: GABRIEL CAJINA | C60: HILL | D60: 0.5395833333333333
A61: 61 | B61: DAVID WILD | C61: MI MESA | D61: 0.5395833333333333
A62: 62 | B62: ZAK WOOD | C62: GROSS | D62: 0.54097222222222219
A63: 63 | B63: NOBLET | C63: SDA | D63: 0.54374999999999996
A64: 64 | B64: PATRICK DUFOUR | C64: USDHS | D64: 0.55347222222222225
A65: 65 | B65: RANGEL | C65: GROSS | D65: 0.56319444444444444
A66: 66 | B66: LO | C66: SDA | D66: 0.57361111111111107
A67: 67 | B67: MANUEL GUITIERIZ | C67: SAN MAR | D67: 0.58750000000000002
A68: 68 | B68: GARRETT SHEAN | C68: CAL CHPL | D68: 0.59236111111111112
A69: 69 | B69: JEREMIAH WELLS | C69: CAL CHPL | D69: 0.59513888888888888
A70: 70 | B70: DANIEL PRICE | C70: SANT. | D70: 0.59583333333333333
A71: 71 | B71: AARON HARTMAN | C71: CCPAA | D71: 0.59861111111111109
A72: 72 | B72: JD WILKINS | C72: CCPAA | D72: 0.60486111111111107
A73: 73 | B73: HILARIO HARO | C73: GPA | D73: 0.62430555555555556
A74: 74 | B74: STEVEN KIRKISH | C74: SANT. | D74: 0.6381944444444444
A75: 75 | B75: BOBBY PRINE | C75: CCPAA | D75: 0.64027777777777772
A76: 76 | B76: BEN WEINER | C76: GPA | D76: 0.65

A1: 1. Michelle Dalton | B1: Valhalla | C1: 0.59791666666666665
A2: 2. Anna-Marie Hosking | B2: Valhalla | C2: 0.6069444444444444
A3: 3. Stephanie Riley | B3: Escondido | C3: 0.61388888888888882
A4: 4. Sylvia Rojas | B4: USDHS | C4: 0.6166666666666667
A5: 5. Kailyn Servis | B5: Escondido | C5: 0.61805555555555558
A6: 6. Cassie Miranda | B6: Mira Mesa | C6: 0.625
A7: 7. Robin Sollars | B7: Escondido | C7: 0.63194444444444442
A8: 8. Backman | B8: SDA | C8: 0.63680555555555551
A9: 9. Tori Morrison | B9: USDHS | C9: 0.63888888888888895
A10: 10.Katie Malinar | B10: Valhalla | C10: 0.63888888888888895
A11: 11.Jamie Johnson | B11: Escondido | C11: 0.64583333333333337
A12: 12.Stephanie Klein | B12: Carlsbad | C12: 0.65138888888888891
A13: 13.Maureen Truxton | B13: USDHS | C13: 0.65277777777777779
A14: 14.Camilb Teylor | B14: GPA | C14: 0.65347222222222223
A15: 15.Claire Pettengill | B15: USDHS | C15: 0.65555555555555556
A16: 16.Van Vranken | B16: SDA | C16: 0.65625
A17: 17.Megan Reiner | B17: Carlsbad | C17: 0.65625
A18: 18.Kelly Elliot | B18: Carlsbad | C18: 0.65763888888888888
A19: 19.Jill Scialabba | B19: Valhalla | C19: 0.65833333333333333
A20: 20.Rosie Rodriguez | B20: HH | C20: 0.65972222222222221
A21: 21.Roxanne Sebeny | B21: Valhalla | C21: 0.66111111111111109
A22: 22.Klimwicz | B22: SDA | C22: 0.66249999999999998
A23: 23.Nicole Chmlelewski | B23: Carlsbad | C23: 0.66388888888888886
A24: 24.Kelly McGrath | B24: Santana | C24: 0.66874999999999996
A25: 25.Chelsea Saake | B25: Valhalla | C25: 0.67083333333333339
A26: 26.Elizabeth Ryan | B26: GPA | C26: 0.67361111111111116
A27: 27.Veronica Leon | B27: Escondido | C27: 0.67500000000000004
A28: 28.Nicole Basham | B28: Mira Mesa | C28: 0.67847222222222225
A29: 29.Whalen | B29: SDA | C29: 0.68333333333333324
A30: 30.Summer Stevens | B30: Valhalla | C30: 0.68472222222222223
A31: 31.Salas | B31: SDA | C31: 0.6875
A32: 32.Janelle Lafontaine | B32: USDHS | C32: 0.68819444444444444
A33: 33.Pollock | B33: SDA | C33: 0.69166666666666676
A34: 34.Sarah Paulson | B34: Santana | C34: 0.69444444444444453
A35: 35.Ferrarohi | B35: SDA | C35: 0.69513888888888886
A36: 36.Amanda Mason | B36: Grossmont | C36: 0.69513888888888886
A37: 37.Rowley | B37: SDA | C37: 0.69861111111111107
A38: 38.Rochelle | B38: SDA | C38: 0.7006944444444444
A39: 39.Martin | B39: SDA | C39: 0.71388888888888891
A40: 40.Tiffany Snyder | B40: Mira Mesa | C40: 0.71597222222222223
A41: 41.Bridget Santos | B41: Escondido | C41: 0.71875
A42: 42.Gia Cappetta | B42: USDHS | C42: 0.72083333333333333
A43: 43.Ashley Schweitzer | B43: Mira Mesa | C43: 0.72152777777777777
A44: 44.Patsy Rico | B44: Escondido | C44: 0.7319444444444444
A45: 45.Scherer | B45: SDA | C45: 0.73888888888888893
A46: 46.Vanessa Narciso | B46: Escondido | C46: 0.74305555555555547
A47: 47.Cassie Mobley | B47: Calvary Christian | C47: 0.74444444444444446
A48: 48.Hannah Lisowsky | B48: Santana | C48: 0.74930555555555556
A49: 49.Sarah Wozniak | B49: USDHS | C49: 0.75069444444444444
A50: 50.Melanie Mashburn | B50: Grossmont | C50: 0.75416666666666676
A51: 51.Alissa Roland | B51: Grossmont | C51: 0.75416666666666676
A52: 52.Amelia Roland | B52: Grossmont | C52: 0.75902777777777775
A53: 53.Megan Hicks | B53: Escondido | C53: 0.75902777777777775
A54: 54.Cervantez | B54: SMHS | C54: 0.76041666666666663
A55: 55.Nicole Knapp | B55: USDHS | C55: 0.76527777777777783
A56: 56.Alexis Sebring | B56: Carlsbad | C56: 0.7729166666666667
A57: 57.Angelica Barrera | B57: Grossmont | C57: 0.7729166666666667
A58: 58.Meg Brekke | B58: Carlsbad | C58: 0.77638888888888891
A59: 59.Christa Miesner | B59: USDHS | C59: 0.78333333333333333
A60: 60.Emanuel Dwnitney | B60: Escondido | C60: 0.78402777777777777
A61: 61.Ellingsen | B61: SDA | C61: 0.79305555555555562
A62: 62.Jakie Prescott | B62: Escondido | C62: 0.79374999999999996
A63: 63.Rylee Balogh | B63: Escondido | C63: 0.79583333333333339
A64: 64.Yessica Torres | B64: Carlsbad | C64: 0.79652777777777783
A65: 65.Charlotte Erickson | B65: Escondido | C65: 0.79652777777777783
A66: 66.Ashley Hommel | B66: Calvary Christian | C66: 0.80625000000000002
A67: 67.Faith Dery | B67: Escondido | C67: 0.80694444444444446
A68: 68.Sarah Raifsnider | B68: Carlsbad | C68: 0.80763888888888891
A69: 69.Emily Gilje | B69: Santana | C69: 0.81944444444444453
A70: 70.Sara Benz | B70: SMHS | C70: 0.83194444444444438
A71: 71.Catherine Jonas | B71: GPA | C71: 0.84236111111111101
A72: 72.Sara Chaney | B72: Mira Mesa | C72: 0.84861111111111109
A73: 73.Emily Kirkman | B73: SDA | C73: 0.8520833333333333
A74: 74.Dulce Garcia | B74: Escondido | C74: 0.85624999999999996
A75: 75.Briana Hedge | B75: USDHS | C75: 0.87083333333333324
A76: 76.Elizabeth Sheehan | B76: GPA | C76: 0.87430555555555556
A77: 77.Kourtni Farmer | B77: Escondido | C77: 0.87569444444444444
A78: 78.Rebecca Kauma | B78: Escondido | C78: 0.89166666666666661
A79: 79.Parima Shah | B79: Canyon Crest | C79: 0.89861111111111114
A80: 80.Simone Lee | B80: Escondido | C80: 0.90277777777777779
A81: 81.Caitlin Egan | B81: USDHS | C81: 0.90416666666666667
A82: 82.Angela Zautcke | B82: USDHS | C82: 0.91041666666666676
A83: 83.Ariana De La Paz | B83: GPA | C83: 0.92291666666666661
A84: 84.Claire Asaro | B84: Grossmont | C84: 0.92708333333333337
A85: 85.Lavery | B85: SDA | C85: 0.94097222222222221
A86: 86.Molly Hanson | B86: GPA | C86: 0.9819444444444444
A87: 87.Sheena Aranda | B87: San Marcos | C87: 1.0006944444444443
A88: 88.Gelena Jablanovic | B88: San Marcos | C88: 1.0006944444444443
A89: 89.Kylie Coughlin | B89: GPA | C89: 1.1

A1: 1 | B1: Brett Johanson | C1: Valhalla | D1: 0.48819444444444443
A2: =A1+1 -> 2 | B2: Jesus Romo | C2: GPA | D2: 0.49444444444444446
A3: =A2+1 -> 3 | B3: T Pederson | C3: SDA | D3: 0.4993055555555555
A4: =A3+1 -> 4 | B4: Kendall Colosimo | C4: Grossmont | D4: 0.50069444444444444
A5: =A4+1 -> 5 | B5: Brian Rickards | C5: Valhalla | D5: 0.50486111111111109
A6: =A5+1 -> 6 | B6: Pat Dollaud | C6: USDHS | D6: 0.51111111111111118
A7: =A6+1 -> 7 | B7: Matt Vettel | C7: CBAD | D7: 0.51458333333333328
A8: =A7+1 -> 8 | B8: Brett Harnish | C8: Grossmont | D8: 0.52013888888888882
A9: =A8+1 -> 9 | B9: David Baca | C9: Escondido | D9: 0.52083333333333337
A10: =A9+1 -> 10 | B10: Roger Lewis | C10: USDHS | D10: 0.52222222222222225
A11: =A10+1 -> 11 | B11: Tony York | C11: Escondido | D11: 0.5229166666666667
A12: =A11+1 -> 12 | B12: Eric Fieklen | C12: CBAD | D12: 0.52361111111111114
A13: =A12+1 -> 13 | B13: John Kranz | C13: GPA | D13: 0.52430555555555558
A14: =A13+1 -> 14 | B14: Pedicini | C14: SDA | D14: 0.52500000000000002
A15: =A14+1 -> 15 | B15: Fields | C15: SDA | D15: 0.52569444444444446
A16: =A15+1 -> 16 | B16: Nathan Nelson | C16: USDHS | D16: 0.52638888888888891
A17: =A16+1 -> 17 | B17: Warren Fiscker | C17: USDHS | D17: 0.52847222222222223
A18: =A17+1 -> 18 | B18: Trinity Jones | C18: Escondido | D18: 0.53055555555555556
A19: =A18+1 -> 19 | B19: Brian Randlett | C19: Valhalla | D19: 0.53263888888888888
A20: =A19+1 -> 20 | B20: Ryan Fielden | C20: CBAD | D20: 0.53402777777777777
A21: =A20+1 -> 21 | B21: Patrick Roman | C21: Escondido | D21: 0.53819444444444442
A22: =A21+1 -> 22 | B22: Tyler Matthews | C22: USDHS | D22: 0.53819444444444442
A23: =A22+1 -> 23 | B23: Jericho Fabie | C23: Escondido | D23: 0.53888888888888886
A24: =A23+1 -> 24 | B24: Dustin Aguilar | C24: San Marcos | D24: 0.54097222222222219
A25: =A24+1 -> 25 | B25: Danny Padilla | C25: CBAD | D25: 0.54305555555555551
A26: =A25+1 -> 26 | B26: Moacanin | C26: SDA | D26: 0.54305555555555551
A27: =A26+1 -> 27 | B27: Luis Mondragon | C27: Escondido | D27: 0.54513888888888895
A28: =A27+1 -> 28 | B28: Derik Irvin | C28: Escondido | D28: 0.54583333333333328
A29: =A28+1 -> 29 | B29: Fortini | C29: SDA | D29: 0.5493055555555556
A30: =A29+1 -> 30 | B30: T.C. Coyle | C30: GPA | D30: 0.55069444444444449
A31: =A30+1 -> 31 | B31: Jeff Dulcat | C31: Escondido | D31: 0.55138888888888882
A32: =A31+1 -> 32 | B32: Kartik Katragadda | C32: San Marcos | D32: 0.55277777777777781
A33: =A32+1 -> 33 | B33: Mike Concannon | C33: Escondido | D33: 0.55347222222222225
A34: =A33+1 -> 34 | B34: Max Berwald | C34: CBAD | D34: 0.55347222222222225
A35: =A34+1 -> 35 | B35: Kyle Munroe | C35: HH | D35: 0.5541666666666667
A36: =A35+1 -> 36 | B36: Ryan Balderas | C36: Grossmont | D36: 0.55555555555555558
A37: =A36+1 -> 37 | B37: Andrew Hays | C37: San Marcos | D37: 0.55625000000000002
A38: =A37+1 -> 38 | B38: Raul Navairo | C38: Escondido | D38: 0.55625000000000002
A39: =A38+1 -> 39 | B39: Issac Zafuta | C39: CCA | D39: 0.55763888888888891
A40: =A39+1 -> 40 | B40: Michael Montgomery | C40: CBAD | D40: 0.55763888888888891
A41: =A40+1 -> 41 | B41: Morgan McDowell | C41: GPA | D41: 0.55972222222222223
A42: =A41+1 -> 42 | B42: Jimmy Greenblat | C42: Grossmont | D42: 0.56041666666666667
A43: =A42+1 -> 43 | B43: Ainslie | C43: SDA | D43: 0.56041666666666667
A44: =A43+1 -> 44 | B44: Cody Colegrove | C44: Escondido | D44: 0.56180555555555556
A45: =A44+1 -> 45 | B45: Matt Muller | C45: Escondido | D45: 0.5625
A46: =A45+1 -> 46 | B46: David Thomas | C46: USDHS | D46: 0.56458333333333333
A47: =A46+1 -> 47 | B47: Josh Geisinger | C47: Grossmont | D47: 0.56805555555555554
A48: =A47+1 -> 48 | B48: Michel Goodrich | C48: HH | D48: 0.56805555555555554
A49: =A48+1 -> 49 | B49: Charles Faust | C49: Grossmont | D49: 0.56874999999999998
A50: =A49+1 -> 50 | B50: Maisel | C50: SDA | D50: 0.57361111111111118
A51: =A50+1 -> 51 | B51: Kevin Spampinato | C51: CBAD | D51: 0.57430555555555551
A52: =A51+1 -> 52 | B52: Robbie Lyans | C52: Escondido | D52: 0.5756944444444444
A53: =A52+1 -> 53 | B53: Jeff Meilander | C53: MM | D53: 0.57638888888888895
A54: =A53+1 -> 54 | B54: Nevel Winter | C54: CBAD | D54: 0.57708333333333328
A55: =A54+1 -> 55 | B55: Steven Netherell | C55: USDHS | D55: 0.57847222222222217
A56: =A55+1 -> 56 | B56: Grant Lieberman | C56: Grossmont | D56: 0.57916666666666672
A57: =A56+1 -> 57 | B57: Sam Sparhawk | C57: Grossmont | D57: 0.57986111111111105
A58: =A57+1 -> 58 | B58: Hunter Goblman | C58: CBAD | D58: 0.57986111111111105
A59: =A58+1 -> 59 | B59: Ashford | C59: SDA | D59: 0.5805555555555556
A60: =A59+1 -> 60 | B60: Daniel Thomas | C60: USDHS | D60: 0.58125000000000004
A61: =A60+1 -> 61 | B61: Tyler Gates | C61: Grossmont | D61: 0.58125000000000004
A62: =A61+1 -> 62 | B62: Cook | C62: SDA | D62: 0.58402777777777781
A63: =A62+1 -> 63 | B63: Patrick Hearst | C63: USDHS | D63: 0.59027777777777779
A64: =A63+1 -> 64 | B64: Cassidy Magyar | C64: GPA | D64: 0.59166666666666667
A65: =A64+1 -> 65 | B65: Marcus Bitar | C65: CBAD | D65: 0.59305555555555556
A66: =A65+1 -> 66 | B66: Kyle Kearney | C66: USDHS | D66: 0.59513888888888888
A67: =A66+1 -> 67 | B67: Matt Guerro | C67: Grossmont | D67: 0.59513888888888888
A68: =A67+1 -> 68 | B68: Craig Zgraggen | C68: USDHS | D68: 0.59583333333333333
A69: =A68+1 -> 69 | B69: May Siegel | C69: USDHS | D69: 0.59583333333333333
A70: =A69+1 -> 70 | B70: David Van Horn | C70: San Marcos | D70: 0.59652777777777777
A71: =A70+1 -> 71 | B71: Kyle Haward | C71: Grossmont | D71: 0.59791666666666665
A72: =A71+1 -> 72 | B72: Close | C72: SDA | D72: 0.59861111111111109
A73: =A72+1 -> 73 | B73: Trey Hitchcock | C73: GPA | D73: 0.59930555555555554
A74: =A73+1 -> 74 | B74: Devin Wakefield | C74: Valhalla | D74: 0.60277777777777775
A75: =A74+1 -> 75 | B75: Ebentier | C75: SDA | D75: 0.60555555555555551
A76: =A75+1 -> 76 | B76: Hien Nguynen | C76: MM | D76: 0.61458333333333337
A77: =A76+1 -> 77 | B77: Danny Steffy | C77: CBAD | D77: 0.61736111111111114
A78: =A77+1 -> 78 | B78: Max Snaza | C78: CBAD | D78: 0.61944444444444446
A79: =A78+1 -> 79 | B79: Kevin Padilla | C79: HH | D79: 0.62013888888888891
A80: =A79+1 -> 80 | B80: Aaron Llindamoore | C80: San Marcos | D80: 0.62222222222222223
A81: =A80+1 -> 81 | B81: Kozel | C81: SDA | D81: 0.62291666666666667
A82: =A81+1 -> 82 | B82: A.J. Ellis | C82: CCA | D82: 0.62708333333333333
A83: =A82+1 -> 83 | B83: Breaden Walton | C83: Grossmont | D83: 0.63055555555555554
A84: =A83+1 -> 84 | B84: Andy Cornejo | C84: GPA | D84: 0.63124999999999998
A85: =A84+1 -> 85 | B85: Michael Harrigan | C85: CCA | D85: 0.63263888888888886
A86: =A85+1 -> 86 | B86: Eric Naire | C86: CCA | D86: 0.63402777777777775
A87: =A86+1 -> 87 | B87: Michael Zablit | C87: USDHS | D87: 0.64027777777777783
A88: =A87+1 -> 88 | B88: James Owens | C88: CBAD | D88: 0.64097222222222217
A89: =A88+1 -> 89 | B89: Jonah Paraiso | C89: Grossmont | D89: 0.64722222222222225
A90: =A89+1 -> 90 | B90: Tyler Donnelly | C90: Calvary Christian | D90: 0.64930555555555558
A91: =A90+1 -> 91 | B91: D. Cort Ayers | C91: Valhalla | D91: 0.64930555555555558
A92: =A91+1 -> 92 | B92: Andy Lopez | C92: CBAD | D92: 0.65
A93: =A92+1 -> 93 | B93: Cody Purcell | C93: Escondido | D93: 0.65277777777777779
A94: =A93+1 -> 94 | B94: Nick Guerrero | C94: Grossmont | D94: 0.65972222222222221
A95: =A94+1 -> 95 | B95: Frank Barrack | C95: USDHS | D95: 0.66319444444444442
A96: =A95+1 -> 96 | B96: Michael Elwood | C96: USDHS | D96: 0.66527777777777775
A97: =A96+1 -> 97 | B97: Rogers | C97: SDA | D97: 0.66527777777777775
A98: =A97+1 -> 98 | B98: Ian Koue | C98: GPA | D98: 0.6743055555555556
A99: =A98+1 -> 99 | B99: Kries | C99: SDA | D99: 0.67638888888888893
A100: =A99+1 -> 100 | B100: Wally Ruland | C100: HH | D100: 0.68125000000000002
A101: =A100+1 -> 101 | B101: Austen Moore | C101: GPA | D101: 0.68194444444444446
A102: =A101+1 -> 102 | B102: McQuerter | C102: SDA | D102: 0.69444444444444453
A103: =A102+1 -> 103 | B103: Jay Aquino | C103: USDHS | D103: 0.7006944444444444
A104: =A103+1 -> 104 | B104: Stephan Chiu | C104: CCA | D104: 0.72291666666666676
A105: =A104+1 -> 105 | B105: Jon Dominique | C105: Santana | D105: 0.73333333333333339
A106: =A105+1 -> 106 | B106: Chris Ryan | C106: GPA | D106: 0.73958333333333337
A107: =A106+1 -> 107 | B107: Micheal Walton | C107: USDHS | D107: 0.7402777777777777
A108: =A107+1 -> 108 | B108: Allen | C108: SDA | D108: 0.74097222222222225
A109: =A108+1 -> 109 | B109: Antwan Clark | C109: GPA | D109: 0.7680555555555556
A110: =A109+1 -> 110 | B110: Trent Rickey | C110: Santana | D110: 0.7715277777777777
A111: =A110+1 -> 111 | B111: Marc Ponseggi | C111: Valhalla | D111: 0.7729166666666667
A112: =A111+1 -> 112 | B112: Carson Paul | C112: Calvary Christian | D112: 0.78819444444444453
A113: =A112+1 -> 113 | B113: Jordan Anderson | C113: Santana | D113: 0.81874999999999998
A114: =A113+1 -> 114 | B114: Hauck | C114: SDA | D114: 0.8618055555555556
A115: =A114+1 -> 115 | B115: Xavier Richards | C115: GPA | D115: 25.29