B1: Name | C1: mile | D1: finish | E1: place
A2: 1 | B2: Lindsay de la Montaigne | C2: 0.20902777777777778 | D2: 0.67986111111111114 | E2: 1
A3: =1+A2 -> 2 | B3: Ahnie Draper | C3: 0.21597222222222223 | D3: 0.73888888888888893 | E3: 12
A4: =1+A3 -> 3 | B4: Krista Egense | C4: 0.21319444444444444 | D4: 0.71111111111111114 | E4: 13
A5: =1+A4 -> 4 | B5: Jana Drake | C5: 0.21875 | D5: 0.72777777777777775 | E5: 14
A6: =1+A5 -> 5 | B6: Kiyara Iravanian | C6: 0.22222222222222221 | D6: 0.73611111111111116 | E6: 15
A7: =1+A6 -> 6 | B7: Carly Bliss | C7: 0.22361111111111109 | D7: 0.74791666666666667 | E7: 18
A8: =1+A7 -> 7 | B8: Kerry Sonnenburg | C8: 0.22569444444444445 | D8: 0.75347222222222221 | E8: 61

B1: Name | C1: mile | D1: 2 mile | E1: finish | F1: place
A2: 1 | B2: Colton Tully-Doyle | C2: 0.20902777777777778 | D2: 0.4381944444444445 | E2: 0.67986111111111114 | F2: 10
A3: =1+A2 -> 2 | B3: Carl Dargitz | C3: 0.21597222222222223 | D3: 0.47361111111111115 | E3: 0.73888888888888893 | F3: 72
A4: =1+A3 -> 3 | B4: Jake Wertner | C4: 0.21319444444444444 | D4: 0.45833333333333331 | E4: 0.71111111111111114 | F4: 36
A5: =1+A4 -> 4 | B5: Mike Spitz | C5: 0.21875 | D5: 0.47013888888888888 | E5: 0.72777777777777775 | F5: 53
A6: =1+A5 -> 5 | B6: Jared Fenlason | C6: 0.22222222222222221 | D6: 0.47638888888888892 | E6: 0.73611111111111116 | F6: 68
A7: =1+A6 -> 6 | B7: Bryce Holewinski | C7: 0.22361111111111109 | D7: 0.47847222222222219 | E7: 0.74791666666666667 | F7: 82
A8: =1+A7 -> 7 | B8: Sean Proehl | C8: 0.22569444444444445 | D8: 0.4861111111111111 | E8: 0.75347222222222221 | F8: 87