B1: name | C1: finish | E1: name finish
A2: 1 | B2: Carl Dargitz | C2: 0.70208333333333339 | E2: 1.delaMontaigne 15:23
A3: =A2+1 -> 2 | B3: Colton Tully-Doyle | C3: 0.70347222222222217 | E3: 2.Bliss 16:42
A4: =A3+1 -> 3 | B4: Jake Wertner | C4: 0.72291666666666676 | E4: 3. Iravanian 16:51
A5: =A4+1 -> 4 | B5: Mike Spitz | C5: 0.72361111111111109 | E5: 4. Draper 16:56
A6: =A5+1 -> 5 | B6: Noah Taylor | C6: 0.73333333333333339 | E6: 5. Drake 16:57
A7: =A6+1 -> 6 | B7: Bryce Holewinski | C7: 0.73611111111111116 | E7: 6. Egense 17:19
A8: =A7+1 -> 7 | B8: Jared Fenlason | C8: 0.74236111111111114 | E8: 7. Sonnenburg 17:40
A9: =A8+1 -> 8 | B9: Sean Proehl | C9: 0.74722222222222223 | E9: 8.Leonard 17:59
A10: =A9+1 -> 9 | B10: Chris Noren | C10: 0.75624999999999998 | E10: 9. Marek 18:06
A11: =A10+1 -> 10 | B11: Mitchell Brown | C11: 0.76180555555555562 | E11: 10. Henry 18:37
A12: =A11+1 -> 11 | B12: David Carlson | C12: 0.76388888888888884 | E12: 11. Tabar 18:57
A13: =A12+1 -> 12 | B13: Andrew Flood | C13: 0.76944444444444438 | E13: 12. Ellis 19:07
A14: =A13+1 -> 13 | B14: Aleks Sovovic | C14: 0.79027777777777775 | E14: 13. Zhuang 19:12
A15: =A14+1 -> 14 | B15: Brian Duong | C15: 0.79027777777777775 | E15: 14. Oh 19:16
A16: =A15+1 -> 15 | B16: Josh Gill | C16: 0.80347222222222225 | E16: 15.Cowen 19:50
A17: =A16+1 -> 16 | B17: Matt Stanislawski | C17: 0.82013888888888886 | E17: 16.Schaffer 20:05
A18: =A17+1 -> 17 | B18: Hiroki Sekine | C18: 0.82499999999999996 | E18: 17. Zhang 20:19
A19: =A18+1 -> 18 | B19: Garrett Yagade | C19: 0.84097222222222223 | E19: 18. Dolinka 20:42
A20: =A19+1 -> 19 | B20: Aaron Fenlason | C20: 0.8520833333333333 | E20: 19. Vega 20:45
A21: =A20+1 -> 20 | B21: So Adachi | C21: 0.85624999999999996 | E21: 20. Anufrieschik 20:48
A22: =A21+1 -> 21 | B22: Yu Jiang Tham | C22: 0.88055555555555554 | E22: 21. Benito 21:53
A23: =A22+1 -> 22 | B23: Steven Wancewicz | C23: 0.88541666666666663 | E23: 22. Lefas-Lopes 22:28
A24: =A23+1 -> 23 | B24: Aaron Bercovitch | C24: 0.89027777777777783 | E24: 23 L. Parker 22:43
A25: =A24+1 -> 24 | B25: David Nelson | C25: 0.9
A26: =A25+1 -> 25 | B26: Nick Carmichael | C26: 0.91111111111111109
A27: =A26+1 -> 26 | B27: Chris Loughlin | C27: 0.9291666666666667
A28: =A27+1 -> 27 | B28: Will Somervell | C28: 0.93888888888888899
A29: =A28+1 -> 28 | B29: Brandon LaVorgna | C29: 0.96180555555555547
A30: =A29+1 -> 29 | B30: Peter Benito | C30: 0.98750000000000004
A31: =A30+1 -> 30 | B31: Brent Harvey | C31: 1.0034722222222221
A32: =A31+1 -> 31 | B32: Brett Ramin | C32: 1.0131944444444445
A33: =A32+1 -> 32 | B33: Daniel Nelson | C33: 1.0673611111111112
A34: =A33+1 -> 33 | B34: Nathan Yang | C34: 1.0868055555555556

C1: name | D1: mile | E1: 2 mile | F1: finish | G1: previous
A2: V | B2: 1 | C2: Carl Dargitz | E2: 0.43194444444444446 | F2: 0.70208333333333339 | G2: 0.71111111111111114
B3: 2 | C3: Colton Tully-Doyle | E3: 0.43055555555555558 | F3: 0.70347222222222217 | G3: 0.70694444444444438 | J3: RB | K3: LCC | N3: RB | O3: MC
B4: 3 | C4: Jake Wertner | E4: 0.44444444444444442 | F4: 0.72291666666666676 | G4: 0.72222222222222221 | I4: 1 | J4: 3 | K4: 1 | M4: 1 | N4: 1 | O4: 3
B5: 4 | C5: Mike Spitz | E5: 0.45 | F5: 0.72361111111111109 | G5: 0.7284722222222223 | I5: 2 | J5: 4 | K5: 2 | M5: 2 | N5: 2 | O5: 5
B6: 5 | C6: Noah Taylor | E6: 0.45 | F6: 0.73333333333333339 | G6: 0.72291666666666676 | I6: 3 | J6: 6 | K6: 5 | M6: 3 | N6: 4 | O6: 10
B7: 6 | C7: Bryce Holewinski | E7: 0.4513888888888889 | F7: 0.73611111111111116 | G7: 0.7416666666666667 | I7: 4 | J7: 7 | K7: 8 | M7: 4 | N7: 6 | O7: 11
B8: 7 | C8: Jared Fenlason | E8: 0.45347222222222222 | F8: 0.74236111111111114 | G8: 0.74791666666666667 | I8: 5 | J8: 9 | K8: 12 | M8: 5 | N8: 7 | O8: 12
B9: 8 | C9: Chris Noren | E9: 0.46250000000000002 | F9: 0.75624999999999998 | G9: 0.74930555555555556 | I9: total | J9: 29 | K9: 28 | M9: total | N9: 20 | O9: 40
B10: 9 | C10: Aleks Sovovic | F10: 0.79027777777777775 | G10: 0.82708333333333339
B11: 10 | C11: Hiroki Sekine | E11: 0.49861111111111112 | F11: 0.82499999999999996 | G11: 0.8125
B12: 11 | C12: Yu Jiang Tham | F12: 0.88055555555555554 | G12: 0.87152777777777779
B13: 12 | C13: Mitchell Brown | E13: 0.4694444444444445 | F13: 0.76180555555555562 | G13: 0.77083333333333337
C14: name | D14: mile | E14: 2 mile | F14: finish | G14: previous
A15: JV | B15: 1 | C15: David Carlson | D15: 0.22569444444444445 | E15: 0.47152777777777777 | F15: 0.76388888888888884 | J15: RB | K15: LCC | N15: RB | O15: MC
B16: 2 | C16: Brian Duong | D16: 0.23611111111111113 | E16: 0.48749999999999999 | F16: 0.79027777777777775 | G16: 0.80833333333333324 | I16: 1 | J16: 1 | K16: 2 | M16: 1 | N16: 1 | O16: 3
B17: 3 | C17: Matt Stanislawski | D17: 0.23611111111111113 | E17: 0.49861111111111112 | F17: 0.82013888888888886 | G17: 0.8520833333333333 | I17: 2 | J17: 3 | K17: 5 | M17: 2 | N17: 2 | O17: 6
B18: 4 | C18: Josh Gill | D18: 0.23611111111111113 | E18: 0.49305555555555558 | F18: 0.80347222222222225 | G18: 0.79166666666666663 | I18: 3 | J18: 4 | K18: 6 | M18: 3 | N18: 4 | O18: 8
B19: 5 | C19: David Nelson | D19: 0.2638888888888889 | E19: 0.55555555555555558 | F19: 0.9 | I19: 4 | J19: 7 | K19: 8 | M19: 4 | N19: 5 | O19: x
B20: 6 | C20: Aaron Bercovitch | D20: 0.27083333333333331 | E20: 0.55555555555555558 | F20: 0.89027777777777783 | G20: 1.0375000000000001 | I20: 5 | J20: 9 | K20: x | M20: 5 | N20: 7 | O20: x
B21: 7 | C21: So Adachi | D21: 0.25069444444444444 | E21: 0.5229166666666667 | F21: 0.85624999999999996 | G21: 0.88402777777777775 | I21: total | J21: =SUM(J16:J20) -> 24 | K21: x | M21: total | N21: =SUM(N16:N20) -> 19 | O21: x
B22: 8 | C22: Steven Wancewicz | D22: 0.25069444444444444 | E22: 0.5229166666666667 | F22: 0.88541666666666663 | G22: 0.86458333333333337
B23: 9 | C23: Brandon LaVorgna | D23: 0.27916666666666667 | E23: 0.58680555555555558 | F23: 0.96180555555555547 | G23: 0.93402777777777779
B24: 10 | C24: Will Somervell | D24: 0.27777777777777779 | E24: 0.57291666666666663 | F24: 0.93888888888888899
B25: 11 | C25: Brett Ramin | D25: 0.30208333333333331 | E25: 0.61458333333333337 | F25: 1.0131944444444445
B26: 12 | C26: Nathan Yang | D26: 0.30208333333333331 | E26: 0.65277777777777779 | F26: 1.0868055555555556
B27: 13
C28: name | D28: mile | E28: 2 mile | F28: finish | G28: previous
A29: F | B29: 1 | C29: Sean Proehl | D29: 0.22569444444444445 | E29: 0.46180555555555558 | F29: 0.74722222222222223 | J29: RB | K29: LCC | N29: RB | O29: MC
B30: 2 | C30: Andrew Flood | D30: 0.23055555555555554 | E30: 0.47222222222222227 | F30: 0.76944444444444438 | I30: 1 | J30: 1 | K30: 3 | M30: 1 | N30: 1 | O30: 3
B31: 3 | C31: Garrett Yagade | D31: 0.25624999999999998 | E31: 0.5229166666666667 | F31: 0.84097222222222223 | I31: 2 | J31: 2 | K31: 5 | M31: 2 | N31: 2 | O31: 4
B32: 4 | C32: Aaron Fenlason | D32: 0.25694444444444448 | E32: 0.52916666666666667 | F32: 0.8520833333333333 | I32: 3 | J32: 4 | K32: 7 | M32: 3 | N32: 6 | O32: 5
B33: 5 | C33: Nick Carmichael | D33: 0.27916666666666667 | E33: 0.55972222222222223 | F33: 0.91111111111111109 | I33: 4 | J33: 6 | K33: 9 | M33: 4 | N33: 7 | O33: 8
B34: 6 | C34: Brent Harvey | D34: 0.30208333333333331 | E34: 0.61111111111111105 | F34: 1.0034722222222221 | I34: 5 | J34: 8 | K34: x | M34: 5 | N34: 10 | O34: 9
B35: 7 | C35: Peter Benito | D35: 0.28819444444444448 | E35: 0.60416666666666663 | F35: 0.98750000000000004 | I35: total | J35: 21 | K35: ns | M35: total | N35: 26 | O35: =SUM(O30:O34) -> 29
B36: 8 | C36: Daniel Nelson | D36: 0.30208333333333331 | E36: 0.63888888888888895 | F36: 1.0673611111111112
B37: 9 | C37: Chris Loughlin | D37: 0.27847222222222223 | E37: 0.59166666666666667 | F37: 0.9291666666666667
B38: 11