B1: Girls | C1: FINISH | E1: Boys | F1: FINISH
A2: 1 | B2: Lindsay delaMontaigne | C2: 0.67083333333333339 | D2: 1 | E2: Carl Dargitz | F2: 0.72083333333333333
A3: =A2+1 -> 2 | B3: Kiyara Iravanian | C3: 0.69513888888888886 | D3: =D2+1 -> 2 | E3: Jake Wertner | F3: 0.72222222222222221
A4: =A3+1 -> 3 | B4: Ahnie Draper | C4: 0.70347222222222217 | D4: =D3+1 -> 3 | E4: Bryce Holewinski | F4: 0.72291666666666676
A5: =A4+1 -> 4 | B5: Jana Drake | C5: 0.70347222222222217 | D5: =D4+1 -> 4 | E5: Mike Spitz | F5: 0.74097222222222225
A6: =A5+1 -> 5 | B6: Krista Egense | C6: 0.72291666666666676 | D6: =D5+1 -> 5 | E6: Jared Fenlason | F6: 0.74791666666666667
A7: =A6+1 -> 6 | B7: Kerry Sonnenburg | C7: 0.72777777777777775 | D7: =D6+1 -> 6 | E7: Chris Noren | F7: 0.75624999999999998
A8: =A7+1 -> 7 | B8: Carly Bliss | C8: 0.73402777777777783 | D8: =D7+1 -> 7 | E8: Noah Taylor | F8: 0.77638888888888891
A9: =A8+1 -> 8 | B9: Kiri Gelhard | C9: 0.74583333333333324 | D9: =D8+1 -> 8 | E9: Mitchell Brown | F9: 0.81111111111111101
A10: =A9+1 -> 9 | B10: Taylor Parker | C10: 0.78888888888888886 | D10: =D9+1 -> 9 | E10: Hiroki Sekine | F10: 0.8125
A11: =A10+1 -> 10 | B11: Niki Marek | C11: 0.79027777777777775 | D11: =D10+1 -> 10 | E11: Aleks Sovovic | F11: 0.82708333333333339
A12: =A11+1 -> 11 | B12: Sarah Ellis | C12: 0.79166666666666663 | D12: =D11+1 -> 11 | E12: Yu Jiang Tham | F12: 0.87152777777777779
A13: =A12+1 -> 12 | B13: Mehgie Tabar | C13: 0.79166666666666663
A14: =A13+1 -> 13 | B14: Janet Oh | C14: 0.79236111111111107 | D14: =D13+1 -> 1 | E14: Sean Proehl | F14: 0.6381944444444444
A15: =A14+1 -> 14 | B15: Dana Schaffer | C15: 0.81736111111111109 | D15: =D14+1 -> 2 | E15: Andrew Flood | F15: 0.64513888888888882
A16: =A15+1 -> 15 | B16: Jenny Zhuang | C16: 0.84444444444444444 | D16: =D15+1 -> 3 | E16: David Carlson | F16: 0.65069444444444446
A17: =A16+1 -> 16 | B17: Jing Jing Zhang | C17: 0.84444444444444444 | D17: =D16+1 -> 4 | E17: Matt Stanislawski | F17: 0.65208333333333335
A18: =A17+1 -> 17 | B18: Tara Cowen | C18: 0.84722222222222221 | D18: =D17+1 -> 5 | E18: Brian Duong | F18: 0.66249999999999998
A19: =A18+1 -> 18 | B19: Lauren Clement | C19: 0.85833333333333339 | D19: =D18+1 -> 6 | E19: Josh Gill | F19: 0.68125000000000002
A20: =A19+1 -> 19 | B20: Caroline Ponce | C20: 0.87152777777777779 | D20: =D19+1 -> 7 | E20: Aaron Fenlason | F20: 0.68958333333333333
A21: =A20+1 -> 20 | B21: Veronika Anufreichtk | C21: 0.87361111111111101 | D21: =D20+1 -> 8 | E21: Joseph Hunter | F21: 0.69236111111111109
A22: =A21+1 -> 21 | B22: Shauna Dolinka | C22: 0.88194444444444453 | D22: =D21+1 -> 9 | E22: So Adachi | F22: 0.69652777777777775
A23: =A22+1 -> 22 | B23: Ana Vega | C23: 0.88194444444444453 | D23: =D22+1 -> 10 | E23: Garrett Yagade | F23: 0.7284722222222223
A24: =A23+1 -> 23 | B24: Chloe Leffas-Lopes | C24: 1.0138888888888888 | D24: =D23+1 -> 11 | E24: David Nelson | F24: 0.73611111111111116
A25: =A24+1 -> 24 | B25: Katy Benito | C25: 1.0604166666666666 | D25: =D24+1 -> 12 | E25: Aaron Bercovitch | F25: 0.75208333333333333
A26: =A25+1 -> 25 | B26: Paisley Eddy | C26: 1.1131944444444444 | D26: =D25+1 -> 13 | E26: Nick Carmichael | F26: 0.75416666666666676
D27: =D26+1 -> 14 | E27: Will Somervell | F27: 0.78055555555555556
D28: =D27+1 -> 15 | E28: Chris Loughlin | F28: 0.78333333333333333
D29: =D28+1 -> 16 | E29: Brandon LaVorgna | F29: 0.78541666666666676
D30: =D29+1 -> 17 | E30: Peter Benito | F30: 0.82291666666666663
D31: =D30+1 -> 18 | E31: Patrick Martin | F31: 0.83125000000000004
D32: =D31+1 -> 19 | E32: Brent Harvey | F32: 0.84583333333333333
D33: =D32+1 -> 20 | E33: Nathan Yang | F33: 0.89930555555555547
D34: =D33+1 -> 21 | E34: Brett Ramin | F34: 0.98263888888888884

C1: Dual vs Westview
A2: Var | D2: 1 mile | E2: 2 mile | F2: Finish | G2: Place
B3: 1 | C3: Colton Tully-Doyle | D3: 0.22569444444444445 | E3: - | F3: DNF
B4: 2 | C4: Carl Dargitz | D4: 0.21875 | E4: 0.45347222222222222 | F4: 0.72083333333333333 | G4: 4
B5: 3 | C5: Mike Spitz | D5: 0.22361111111111109 | E5: 0.46875 | F5: 0.74097222222222225
B6: 4 | C6: Noah Taylor | D6: 0.22569444444444445 | E6: 0.47499999999999998 | F6: 0.77638888888888891 | I6: RB | J6: W
B7: 5 | C7: Jared Fenlason | D7: 0.22777777777777777 | E7: 0.47361111111111115 | F7: 0.74791666666666667 | H7: 1 | I7: 4 | J7: 1
B8: 6 | C8: Bryce Holewinski | D8: 0.22569444444444445 | E8: 0.46319444444444446 | F8: 0.72291666666666676 | H8: 2 | I8: 5 | J8: 2
B9: 7 | C9: Jake Wertner | D9: 0.22569444444444445 | E9: 0.46319444444444446 | F9: 0.72222222222222221 | H9: 3 | I9: 6 | J9: 3
B10: 8 | C10: Chris Noren | D10: 0.22569444444444445 | E10: 0.47361111111111115 | F10: 0.75624999999999998 | H10: 4 | I10: 8 | J10: 7
B11: 9 | C11: Mitchell Brown | D11: 0.24513888888888888 | E11: 0.51527777777777783 | F11: 0.81111111111111101 | H11: 5 | I11: 9 | J11: 12
B12: 10 | C12: Hiroki Sekine | D12: 0.23958333333333334 | E12: 0.51388888888888895 | F12: 0.8125 | I12: 32 | J12: 25
B13: 11 | C13: Aleks Sovovic | D13: 0.23194444444444443 | E13: 0.50972222222222219 | F13: 0.82708333333333339
B14: 12 | C14: Yu Jiang Tham | D14: 0.25694444444444448 | E14: 0.54097222222222219 | F14: 0.87152777777777779
A15: JV | D15: 1 mile | E15: 2 mile | F15: Finish | G15: Place
B16: 1 | C16: So Adachi | D16: 0.25694444444444448 | F16: 0.69652777777777775 | G16: 5
B17: 2 | C17: Josh Gill | D17: 0.24305555555555555 | F17: 0.68125000000000002 | G17: 2 | I17: RB | J17: W
B18: 3 | C18: Matt Stanislawski | D18: 0.24305555555555555 | F18: 0.65208333333333335 | G18: 1 | H18: 1 | I18: 1 | J18: 3
B19: 4 | C19: Joseph Hunter | D19: 0.25347222222222221 | F19: 0.69236111111111109 | G19: 4 | H19: 2 | I19: 2 | J19: 6
B20: 5 | C20: David Nelson | D20: 0.26527777777777778 | F20: 0.73611111111111116 | G20: 9 | H20: 3 | I20: 4 | J20: 7
B21: 6 | C21: Brandon LaVorgna | D21: 0.2673611111111111 | F21: 0.78541666666666676 | H21: 4 | I21: 5 | J21: 8
B22: 7 | C22: Aaron Bercovitch | D22: 0.26944444444444443 | F22: 0.75208333333333333 | H22: 5 | I22: 9 | J22: 12
A23: So/Fr | D23: 1 mile | E23: 2 mile | F23: Finish | G23: Place | I23: 21 | J23: 36
B24: 1 | C24: David Carlson | D24: 0.24305555555555555 | F24: 0.65069444444444446 | G24: 3
B25: 2 | C25: Brian Duong | D25: 0.24305555555555555 | F25: 0.66249999999999998 | G25: 4 | I25: RB | J25: W
B26: 3 | C26: Andrew Flood | D26: 0.23749999999999999 | F26: 0.64513888888888882 | G26: 2 | H26: 1 | I26: 1 | J26: 8
B27: 4 | C27: Sean Proehl | D27: 0.23680555555555557 | F27: 0.6381944444444444 | G27: 1 | H27: 2 | I27: 2 | J27: 9
B28: 5 | C28: Aaron Fenlason | D28: 0.26527777777777778 | F28: 0.68958333333333333 | G28: 5 | H28: 3 | I28: 3 | J28: 10
B29: 6 | C29: Garrett Yagade | D29: 0.27361111111111108 | F29: 0.7284722222222223 | G29: 6 | H29: 4 | I29: 4 | J29: 11
B30: 7 | C30: Nick Carmichael | D30: 0.27361111111111108 | F30: 0.75416666666666676 | G30: 7 | H30: 5 | I30: 5 | J30: 12
B31: 8 | C31: Peter Benito | D31: 0.29097222222222224 | F31: 0.82291666666666663 | I31: 15 | J31: 50
B32: 9 | C32: Chris Loughlin | D32: 0.27777777777777779 | F32: 0.78333333333333333
B33: 10 | C33: Brent Harvey | D33: 0.31944444444444448 | F33: 0.84583333333333333
B34: 11 | C34: Brett Ramin | D34: 0.33333333333333331 | F34: 0.98263888888888884
B35: 12 | C35: Will Somervell | D35: 0.28819444444444448 | F35: 0.78055555555555556
B36: 13 | C36: Nathan Yang | D36: 0.30694444444444441 | F36: 0.89930555555555547
B37: 14 | C37: Patrick Martin | D37: 0.2986111111111111 | F37: 0.83125000000000004