B1: Name | C1: finish | F1: Name | G1: Final
A2: 1 | B2: Colton Tully-Doyle | C2: 0.69652777777777775 | E2: 1 | F2: Lindsay delaMontaigne | G2: 0.63680555555555551
A3: =A2+1 -> 2 | B3: Carl Dargitz | C3: 0.70833333333333337 | E3: =E2+1 -> 2 | F3: Kiyara Iravanian | G3: 0.68125000000000002
A4: =A3+1 -> 3 | B4: Jake Wertner | C4: 0.7368055555555556 | E4: =E3+1 -> 3 | F4: Jana Drake | G4: 0.68333333333333324
A5: =A4+1 -> 4 | B5: Bryce Holewinski | C5: 0.75277777777777777 | E5: =E4+1 -> 4 | F5: Ahnie Draper | G5: 0.68402777777777779
A6: =A5+1 -> 5 | B6: Mike Spitz | C6: 0.75624999999999998 | E6: =E5+1 -> 5 | F6: Carly Bliss | G6: 0.68472222222222223
A7: =A6+1 -> 6 | B7: Chris Noren | C7: 0.76041666666666663 | E7: =E6+1 -> 6 | F7: Krista Egense | G7: 0.69861111111111107
A8: =A7+1 -> 7 | B8: Noah Taylor | C8: 0.76458333333333339 | E8: =E7+1 -> 7 | F8: Kerry Sonnenburg | G8: 0.71805555555555556
A9: =A8+1 -> 8 | B9: David Carlson | C9: 0.77430555555555547 | E9: =E8+1 -> 8 | F9: Allison Leonard | G9: 0.73333333333333339
A10: =A9+1 -> 9 | B10: Sean Proehl | C10: 0.77986111111111101 | E10: =E9+1 -> 9 | F10: Niki Marek | G10: 0.73750000000000004
A11: =A10+1 -> 10 | B11: Jared Fenlason | C11: 0.79236111111111107 | E11: =E10+1 -> 10 | F11: Janet Oh | G11: 0.76527777777777783
A12: =A11+1 -> 11 | B12: Mitchell Brown | C12: 0.79583333333333339 | E12: =E11+1 -> 11 | F12: Kelley Henry | G12: 0.76736111111111116
A13: =A12+1 -> 12 | B13: Andrew Flood | C13: 0.80555555555555547 | E13: =E12+1 -> 12 | F13: Sarah Ellis | G13: 0.77847222222222223
A14: =A13+1 -> 13 | B14: Brian Duong | C14: 0.80833333333333324 | E14: =E13+1 -> 13 | F14: Jenny Zhuang | G14: 0.78194444444444444
A15: =A14+1 -> 14 | B15: Josh Gill | C15: 0.83194444444444438 | E15: =E14+1 -> 14 | F15: Lauren Clement | G15: 0.80555555555555547
A16: =A15+1 -> 15 | B16: Matt Stanislawski | C16: 0.84722222222222221 | E16: =E15+1 -> 15 | F16: Mehgie Tabar | G16: 0.81805555555555554
A17: =A16+1 -> 16 | B17: Garrett Yagade | C17: 0.84722222222222221 | E17: =E16+1 -> 16 | F17: Tara Cowen | G17: 0.83125000000000004
A18: =A17+1 -> 17 | B18: Aaron Fenlason | C18: 0.86597222222222225 | E18: =E17+1 -> 17 | F18: Shawna Dolinka | G18: 0.83819444444444446
A19: =A18+1 -> 18 | B19: So Adachi | C19: 0.8847222222222223 | E19: =E18+1 -> 18 | F19: Ana Vega | G19: 0.85277777777777775
A20: =A19+1 -> 19 | B20: David Nelson | C20: 0.89583333333333337 | E20: =E19+1 -> 19 | F20: Veronika Anufreichtk | G20: 0.87916666666666676
A21: =A20+1 -> 20 | B21: Steven Wancewicz | C21: 0.90069444444444446 | E21: =E20+1 -> 20 | F21: Katy Benito | G21: 0.90625
A22: =A21+1 -> 21 | B22: Chris Loughlin | C22: 0.96527777777777779 | E22: =E21+1 -> 21 | F22: Lauren Parker | G22: 0.95138888888888884
A23: =A22+1 -> 22 | B23: Brett Ramin | C23: 0.99722222222222223 | E23: =E22+1 -> 22 | F23: Chloe Leffas-Lopes | G23: 0.95486111111111116
A24: =A23+1 -> 23 | B24: Will Somervell | C24: 0.99791666666666667
A25: =A24+1 -> 24 | B25: Brandon LaVorgna | C25: 1.0055555555555555
A26: =A25+1 -> 25 | B26: Peter Benito | C26: 1.0069444444444444
A27: =A26+1 -> 26 | B27: Brent Harvey | C27: 1.0513888888888889
A28: =A27+1 -> 27 | B28: Daniel Nelson | C28: 1.0631944444444443
A29: =A28+1 -> 28 | B29: Nathan Yang | C29: 1.1055555555555556

B1: Name | C1: Mile | D1: Final | E1: Place
A3: Varsity | B3: Lindsay delaMontaigne | D3: 0.63680555555555551 | E3: 1
B4: Kiyara Iravanian | D4: 0.68125000000000002 | E4: 4
B5: Jana Drake | D5: 0.68333333333333324 | E5: 5
B6: Ahnie Draper | D6: 0.68402777777777779 | E6: 6
B7: Carly Bliss | D7: 0.68472222222222223 | E7: 7
B8: Krista Egense | D8: 0.69861111111111107 | E8: 12
B9: Kerry Sonnenburg | D9: 0.71805555555555556 | E9: 15
B10: Name | C10: Mile | D10: Final | E10: Place
A11: JV | B11: Allison Leonard | C11: 0.2590277777777778 | D11: 0.73333333333333339 | E11: 3
B12: Niki Marek | C12: 0.25763888888888892 | D12: 0.73750000000000004 | E12: 4
B13: Janet Oh | C13: 0.27083333333333331 | D13: 0.76527777777777783 | E13: 10
B14: Kelley Henry | C14: 0.27083333333333331 | D14: 0.76736111111111116 | E14: 11
B15: Sarah Ellis | C15: 0.27152777777777776 | D15: 0.77847222222222223 | E15: 13
B16: Jenny Zhuang | C16: 0.27361111111111108 | D16: 0.78194444444444444 | E16: 14
B17: Lauren Clement | C17: 0.27777777777777779 | D17: 0.80555555555555547 | E17: 19
B18: Mehgie Tabar | C18: 0.27083333333333331 | D18: 0.81805555555555554 | E18: 22
B19: Tara Cowen | C19: 0.27569444444444446 | D19: 0.83125000000000004 | E19: 26
B20: Shawna Dolinka | C20: 0.3 | D20: 0.83819444444444446 | E20: 27
B21: Ana Vega | C21: 0.29097222222222224 | D21: 0.85277777777777775 | E21: 28
B22: Veronika Anufreichtk | C22: 0.2951388888888889 | D22: 0.87916666666666676 | E22: 31
B23: Katy Benito | C23: 0.30763888888888891 | D23: 0.90625 | E23: 33
B24: Lauren Parker | C24: 0.31111111111111112 | D24: 0.95138888888888884 | E24: 34
B25: Chloe Leffas-Lopes | C25: 0.31180555555555556 | D25: 0.95486111111111116 | E25: 35

C1: Name | D1: mile | E1: 2 mile | F1: finish | G1: place
A2: Var | B2: 1 | C2: Carl Dargitz | D2: 0.22500000000000001 | E2: 0.45763888888888887 | F2: 0.70833333333333337 | G2: 5
B3: 2 | C3: Colton Tully-Doyle | D3: 0.22361111111111109 | E3: 0.45763888888888887 | F3: 0.69652777777777775 | G3: 3 | I3: RB | J3: TP
B4: 3 | C4: Jake Wertner | D4: 0.23263888888888887 | E4: 0.48680555555555555 | F4: 0.7368055555555556 | G4: 7 | H4: 1 | I4: 3 | J4: 1
B5: 4 | C5: Mike Spitz | D5: 0.23749999999999999 | E5: 0.49375000000000002 | F5: 0.75624999999999998 | G5: 11 | H5: 2 | I5: 5 | J5: 2
B6: 5 | C6: Bryce Holewinski | D6: 0.23680555555555557 | E6: 0.48888888888888887 | F6: 0.75277777777777777 | G6: 10 | H6: 3 | I6: 7 | J6: 4
B7: 6 | C7: Jared Fenlason | D7: 0.24166666666666667 | E7: 0.51249999999999996 | F7: 0.79236111111111107 | G7: 18 | H7: 4 | I7: 10 | J7: 6
B8: 7 | C8: Noah Taylor | D8: 0.23680555555555557 | E8: 0.49652777777777773 | F8: 0.76458333333333339 | G8: 13 | H8: 5 | I8: 11 | J8: 8
B9: 8 | C9: Chris Noren | D9: 0.24236111111111111 | E9: 0.49583333333333335 | F9: 0.76041666666666663 | G9: 12 | H9: total | I9: 36 | J9: 20
B10: 9 | C10: Mitchell Brown | D10: 0.24444444444444446 | E10: 0.51944444444444449 | F10: 0.79583333333333339 | G10: 19
C11: Name | D11: mile | E11: 2 mile | F11: finish | G11: place
A12: JV | B12: 1 | C12: Matt Stanislawski | D12: 0.25833333333333336 | E12: 0.53749999999999998 | F12: 0.84722222222222221 | G12: 11
B13: 2 | C13: David Carlson | D13: 0.24583333333333335 | E13: 0.50416666666666665 | F13: 0.77430555555555547 | G13: 1 | I13: RB | J13: TP
B14: 3 | C14: Brian Duong | D14: 0.25416666666666665 | E14: 0.53333333333333333 | F14: 0.80833333333333324 | G14: 4 | H14: 1 | I14: 1 | J14: 2
B15: 4 | C15: Josh Gill | D15: 0.25486111111111109 | E15: 0.54027777777777775 | F15: 0.83194444444444438 | G15: 8 | H15: 2 | I15: 4 | J15: 3
B16: 5 | C16: David Nelson | D16: 0.28125 | E16: 0.58680555555555558 | F16: 0.89583333333333337 | G16: 13 | H16: 3 | I16: 8 | J16: 5
B17: 6 | C17: So Adachi | D17: 0.26944444444444443 | E17: 0.56944444444444442 | F17: 0.8847222222222223 | G17: 12 | H17: 4 | I17: 11 | J17: 6
B18: 7 | C18: Steven Wancewicz | D18: 0.26874999999999999 | E18: 0.58402777777777781 | F18: 0.90069444444444446 | G18: 15 | H18: 5 | I18: 12 | J18: 7
B19: 8 | C19: Will Somervell | D19: 0.3125 | E19: 0.64930555555555558 | F19: 0.99791666666666667 | G19: 18 | H19: total | I19: 36 | J19: 23
B20: 9 | C20: Brandon LaVorgna | D20: 0.3125 | E20: 0.65625 | F20: 1.0055555555555555 | G20: 19
B21: 10 | C21: Brett Ramin | D21: 0.30902777777777779 | E21: 0.64930555555555558 | F21: 0.99722222222222223 | G21: 17
B22: 11 | C22: Nathan Yang | D22: 0.33333333333333331 | E22: 0.71111111111111114 | F22: 1.1055555555555556 | G22: 20
C23: Name | D23: mile | E23: 2 mile | F23: finish | G23: place
A24: S/F | B24: 1 | C24: Sean Proehl | D24: 0.24583333333333335 | E24: 0.50624999999999998 | F24: 0.77986111111111101 | G24: 1 | I24: RB | J24: TP
B25: 2 | C25: Andrew Flood | D25: 0.24722222222222223 | E25: 0.52083333333333337 | F25: 0.80555555555555547 | G25: 2 | H25: 1 | I25: 1 | J25: 4
B26: 3 | C26: Garrett Yagade | D26: 0.2638888888888889 | E26: 0.55625000000000002 | F26: 0.84722222222222221 | G26: 3 | H26: 2 | I26: 2 | J26: 5
B27: 4 | C27: Aaron Fenlason | D27: 0.27847222222222223 | E27: 0.5708333333333333 | F27: 0.86597222222222225 | G27: 8 | H27: 3 | I27: 3 | J27: 6
B28: 5 | C28: Brent Harvey | D28: 0.32222222222222224 | E28: 0.68402777777777779 | F28: 1.0513888888888889 | G28: 13 | H28: 4 | I28: 8 | J28: 7
B29: 6 | C29: Daniel Nelson | D29: 0.32291666666666669 | E29: 0.68402777777777779 | F29: 1.0631944444444443 | G29: 14 | H29: 5 | I29: 10 | J29: 9
B30: 7 | C30: Peter Benito | D30: 0.30833333333333335 | E30: 0.64930555555555558 | F30: 1.0069444444444444 | G30: 12 | H30: total | I30: 24 | J30: 31
B31: 8 | C31: Chris Loughlin | D31: 0.30833333333333335 | E31: 0.64583333333333337 | F31: 0.96527777777777779 | G31: 10