B1: Girls | C1: FINISH | E1: Boys | F1: FINISH
A2: 1 | B2: Lindsay delaMontaigne | C2: 0.62083333333333335 | D2: 1 | E2: Carl Dargitz | F2: 0.6645833333333333
A3: =A2+1 -> 2 | B3: Ahnie Draper | C3: 0.65416666666666667 | D3: =D2+1 -> 2 | E3: Mike Spitz | F3: 0.67500000000000004
A4: =A3+1 -> 3 | B4: Kiyara Iravanian | C4: 0.65486111111111112 | D4: =D3+1 -> 3 | E4: Jake Wertner | F4: 0.68194444444444446
A5: =A4+1 -> 4 | B5: Carly Bliss | C5: 0.65625 | D5: =D4+1 -> 4 | E5: Jared Fenlason | F5: 0.68402777777777779
A6: =A5+1 -> 5 | B6: Jana Drake | C6: 0.6645833333333333 | D6: =D5+1 -> 5 | E6: Chris Noren | F6: 0.6875
A7: =A6+1 -> 6 | B7: Kerry Sonnenburg | C7: 0.67847222222222225 | D7: =D6+1 -> 6 | E7: Bryce Holewinski | F7: 0.70833333333333337
A8: =A7+1 -> 7 | B8: Krista Egense | C8: 0.68402777777777779 | D8: =D7+1 -> 7 | E8: Noah Taylor | F8: 0.71944444444444444
A9: =A8+1 -> 8 | B9: Taylor Parker | C9: 0.7104166666666667 | D9: =D8+1 -> 8 | E9: Mitchell Brown | F9: 0.76180555555555562
A10: =A9+1 -> 9 | B10: Niki Marek | C10: 0.71319444444444446 | D10: =D9+1 -> 9 | E10: Hiroki Sekine | F10: 0.76388888888888884
A11: =A10+1 -> 10 | B11: Allison Leonard | C11: 0.71458333333333324 | D11: =D10+1 -> 10 | E11: Aleks Sovovic | F11: 0.77083333333333337
A12: =A11+1 -> 11 | B12: Kiri Gelhard | C12: 0.72569444444444453 | D12: =D11+1 -> 11 | E12: Yu Jiang Tham | F12: 0.83611111111111114
A13: =A12+1 -> 12 | B13: Dana Schaffer | C13: 0.75555555555555554
A14: =A13+1 -> 13 | B14: Mehgie Tabar | C14: 0.75694444444444453 | D14: =D13+1 -> 1 | E14: Sean Proehl | F14: 0.57499999999999996
A15: =A14+1 -> 14 | B15: Sarah Ellis | C15: 0.7597222222222223 | D15: =D14+1 -> 2 | E15: David Carlson | F15: 0.58819444444444446
A16: =A15+1 -> 15 | B16: Kelley Henry | C16: 0.76388888888888884 | D16: =D15+1 -> 3 | E16: Andrew Flood | F16: 0.59305555555555556
A17: =A16+1 -> 16 | B17: Caroline Ponce | C17: 0.76458333333333339 | D17: =D16+1 -> 4 | E17: Brian Duong | F17: 0.59861111111111109
A18: =A17+1 -> 17 | B18: Jenny Zhuang | C18: 0.76597222222222217 | D18: =D17+1 -> 5 | E18: Matt Stanislawski | F18: 0.60138888888888886
A19: =A18+1 -> 18 | B19: Janet Oh | C19: 0.77847222222222223 | D19: =D18+1 -> 6 | E19: Josh Gill | F19: 0.625
A20: =A19+1 -> 19 | B20: Veronika Anufreichtk | C20: 0.78611111111111109 | D20: =D19+1 -> 7 | E20: Aaron Fenlason | F20: 0.62708333333333333
A21: =A20+1 -> 20 | B21: Shauna Dolinka | C21: 0.79236111111111107 | D21: =D20+1 -> 8 | E21: Garrett Yagade | F21: 0.63541666666666663
A22: =A21+1 -> 21 | B22: Lauren Clement | C22: 0.79374999999999996 | D22: =D21+1 -> 9 | E22: So Adachi | F22: 0.64375000000000004
A23: =A22+1 -> 22 | B23: Jing Jing Zhang | C23: 0.79513888888888884 | D23: =D22+1 -> 10 | E23: Joseph Hunter | F23: 0.67083333333333339
A24: =A23+1 -> 23 | B24: Tara Cowen | C24: 0.79652777777777783 | D24: =D23+1 -> 11 | E24: Steven Wancewicz | F24: 0.68125000000000002
A25: =A24+1 -> 24 | B25: Ana Vega | C25: 0.83125000000000004 | D25: =D24+1 -> 12 | E25: Aaron Bercovitch | F25: 0.69027777777777777
A26: =A25+1 -> 25 | B26: Katy Benito | C26: 0.87638888888888899 | D26: =D25+1 -> 13 | E26: Nick Carmichael | F26: 0.69930555555555562
A27: =A26+1 -> 26 | B27: Chloe Leffas-Lopes | C27: 0.90763888888888899 | D27: =D26+1 -> 14 | E27: David Nelson | F27: 0.70138888888888884
A28: =A27+1 -> 27 | B28: Lauren Parker | C28: 0.93125000000000002 | D28: =D27+1 -> 15 | E28: Will Somervell | F28: 0.7270833333333333
A29: =A28+1 -> 28 | B29: Paisley Eddy | C29: 1.0097222222222222 | D29: =D28+1 -> 16 | E29: Chris Loughlin | F29: 0.73263888888888884
D30: =D29+1 -> 17 | E30: Brandon LaVorgna | F30: 0.73819444444444438
D31: =D30+1 -> 18 | E31: Peter Benito | F31: 0.74305555555555547
D32: =D31+1 -> 19 | E32: Patrick Martin | F32: 0.78888888888888886
D33: =D32+1 -> 20 | E33: Brent Harvey | F33: 0.79166666666666663
D34: =D33+1 -> 21 | E34: Brett Ramin | F34: 0.8027777777777777
D35: 22 | E35: Nathan Yang | F35: 0.85486111111111107

A1: Var | D1: 1 mile | E1: Finish | F1: Place
B2: 1 | C2: Carl Dargitz | D2: 0.21319444444444444 | E2: 0.6645833333333333 | F2: 5
B3: 2 | C3: Mike Spitz | D3: 0.22361111111111109 | E3: 0.67500000000000004 | F3: 8
B4: 3 | C4: Noah Taylor | D4: 0.22708333333333333 | E4: 0.71944444444444444
B5: 4 | C5: Jared Fenlason | D5: 0.22708333333333333 | E5: 0.68402777777777779 | F5: 10 | H5: RB | I5: P
B6: 5 | C6: Bryce Holewinski | D6: 0.22708333333333333 | E6: 0.70833333333333337 | G6: 1 | H6: 5 | I6: 1
B7: 6 | C7: Jake Wertner | D7: 0.22638888888888889 | E7: 0.68194444444444446 | F7: 9 | G7: 2 | H7: 8 | I7: 2
B8: 7 | C8: Chris Noren | D8: 0.22708333333333333 | E8: 0.6875 | F8: 11 | G8: 3 | H8: 9 | I8: 3
B9: 8 | C9: Mitchell Brown | D9: 0.24652777777777779 | E9: 0.76180555555555562 | G9: 4 | H9: 10 | I9: 4
B10: 9 | C10: Hiroki Sekine | D10: 0.24652777777777779 | E10: 0.76388888888888884 | G10: 5 | H10: 11 | I10: 6
B11: 10 | C11: Aleks Sovovic | D11: 0.24652777777777779 | E11: 0.77083333333333337 | H11: 43 | I11: 16
B12: 11 | C12: Yu Jiang Tham | D12: 0.26944444444444443 | E12: 0.83611111111111114
A13: JV | D13: 1 mile | E13: Finish | F13: Place
B14: 1 | C14: David Carlson | D14: 0.23958333333333334 | E14: 0.58819444444444446 | F14: 1
B15: 2 | C15: Brian Duong | D15: 0.24444444444444446 | E15: 0.59861111111111109 | F15: 2 | H15: RB | I15: P
B16: 3 | C16: So Adachi | D16: 0.25694444444444448 | E16: 0.64375000000000004 | F16: 6 | G16: 1 | H16: 1 | I16: 4
B17: 4 | C17: Josh Gill | D17: 0.23055555555555554 | E17: 0.625 | F17: 5 | G17: 2 | H17: 2 | I17: 7
B18: 5 | C18: Matt Stanislawski | D18: 0.24583333333333335 | E18: 0.60138888888888886 | F18: 3 | G18: 3 | H18: 3 | I18: 9
B19: 6 | C19: Joseph Hunter | D19: 0.24861111111111112 | E19: 0.67083333333333339 | G19: 4 | H19: 5 | I19: 10
B20: 7 | C20: David Nelson | D20: 0.27777777777777779 | E20: 0.70138888888888884 | G20: 5 | H20: 6 | I20: 12
B21: 8 | C21: Steven Wancewicz | D21: 0.22361111111111109 | E21: 0.68125000000000002 | H21: 17 | I21: 42
B22: 9 | C22: Brandon LaVorgna | D22: 0.28819444444444448 | E22: 0.73819444444444438
B23: 10 | C23: Aaron Bercovitch | D23: 0.27361111111111108 | E23: 0.69027777777777777
A24: So/Fr | D24: 1 mile | E24: Finish | F24: Place
B25: 1 | C25: Andrew Flood | D25: 0.24166666666666667 | E25: 0.59305555555555556 | F25: 4
B26: 2 | C26: Sean Proehl | D26: 0.23611111111111113 | E26: 0.57499999999999996 | F26: 1 | H26: RB | I26: P
B27: 3 | C27: Aaron Fenlason | D27: 0.24930555555555556 | E27: 0.62708333333333333 | F27: 8 | G27: 1 | H27: 1 | I27: 2
B28: 4 | C28: Garrett Yagade | D28: 0.26180555555555557 | E28: 0.63541666666666663 | F28: 10 | G28: 2 | H28: 4 | I28: 3
B29: 5 | C29: Nick Carmichael | D29: 0.27430555555555552 | E29: 0.69930555555555562 | F29: 12 | G29: 3 | H29: 8 | I29: 5
B30: 6 | C30: Peter Benito | D30: 0.2986111111111111 | E30: 0.74305555555555547 | G30: 4 | H30: 10 | I30: 6
B31: 7 | C31: Chris Loughlin | D31: 0.27708333333333335 | E31: 0.73263888888888884 | G31: 5 | H31: 12 | I31: 7
B32: 8 | C32: Brent Harvey | D32: 0.27152777777777776 | E32: 0.79166666666666663 | H32: 35 | I32: 23
B33: 9 | C33: Brett Ramin | D33: 0.27916666666666667 | E33: 0.8027777777777777
B34: 10 | C34: Will Somervell | D34: 0.28472222222222221 | E34: 0.7270833333333333
B35: 11 | C35: Nathan Yang | D35: 0.28333333333333333 | E35: 0.85486111111111107
B36: 12 | C36: Patrick Martin | D36: 0.28333333333333333 | E36: 0.78888888888888886

C1: 1 mile | D1: Finish
A2: 1 | B2: Lindsay delaMontaigne | C2: 0.25486111111111109 | D2: 0.62083333333333335
A3: 2 | B3: Ahnie Draper | C3: 0.26041666666666669 | D3: 0.65416666666666667
A4: 3 | B4: Kiyara Iravanian | C4: 0.25763888888888892 | D4: 0.65486111111111112
A5: 4 | B5: Carly Bliss | C5: 0.2673611111111111 | D5: 0.65625
A6: 5 | B6: Jana Drake | C6: 0.26319444444444445 | D6: 0.6645833333333333
A7: 6 | B7: Kerry Sonnenburg | C7: 0.26527777777777778 | D7: 0.67847222222222225
A8: 7 | B8: Krista Egense | C8: 0.28402777777777777 | D8: 0.68402777777777779
A9: 8 | B9: Taylor Parker | C9: 0.28333333333333333 | D9: 0.7104166666666667
A10: 9 | B10: Niki Marek | C10: 0.28263888888888888 | D10: 0.71319444444444446
A11: 10 | B11: Allison Leonard | C11: 0.28194444444444444 | D11: 0.71458333333333324
A12: 11 | B12: Kiri Gelhard | C12: 0.28125 | D12: 0.72569444444444453
A13: 12 | B13: Dana Schaffer | D13: 0.75555555555555554
A14: 13 | B14: Mehgie Tabar | C14: 0.29930555555555555 | D14: 0.75694444444444453
A15: 14 | B15: Sarah Ellis | C15: 0.29930555555555555 | D15: 0.7597222222222223
A16: 15 | B16: Kelley Henry | C16: 6:50ish | D16: 0.76388888888888884
A17: 16 | B17: Caroline Ponce | C17: 0.29166666666666669 | D17: 0.76458333333333339
A18: 17 | B18: Jenny Zhuang | D18: 0.76597222222222217
A19: 18 | B19: Janet Oh | D19: 0.77847222222222223
A20: 19 | B20: Veronika Anufreichtk | C20: 0.30416666666666664 | D20: 0.78611111111111109
A21: 20 | B21: Shauna Dolinka | D21: 0.79236111111111107
A22: 21 | B22: Lauren Clement | D22: 0.79374999999999996
A23: 22 | B23: Jing Jing Zhang | D23: 0.79513888888888884
A24: 23 | B24: Tara Cowen | D24: 0.79652777777777783
A25: 24 | B25: Ana Vega | C25: 0.31527777777777777 | D25: 0.83125000000000004
A26: 25 | B26: Katy Benito | C26: 0.33402777777777781 | D26: 0.87638888888888899
A27: 26 | B27: Chloe Leffas-Lopes | C27: 0.34513888888888888 | D27: 0.90763888888888899
A28: 27 | B28: Lauren Parker | C28: 0.34513888888888888 | D28: 0.93125000000000002
A29: 28 | B29: Paisley Eddy | C29: 0.35902777777777778 | D29: 1.0097222222222222