B1: name | C1: finish | F1: Name | G1: Final
A2: 1 | B2: Jake Wertner | C2: 0.6972222222222223 | E2: 1 | F2: Taylor Parker | G2: 0.73819444444444438
A3: =A2+1 -> 2 | B3: Carl Dargitz | C3: 0.6972222222222223 | E3: =E2+1 -> 2 | F3: Allison Leonard | G3: 0.73958333333333337
A4: =A3+1 -> 3 | B4: Colton Tully-Doyle | C4: 0.70694444444444438 | E4: =E3+1 -> 3 | F4: Niki Marek | G4: 0.7402777777777777
A5: =A4+1 -> 4 | B5: Jared Fenlason | C5: 0.7416666666666667 | E5: =E4+1 -> 4 | F5: Kelley Henry | G5: 0.76944444444444438
A6: =A5+1 -> 5 | B6: Sean Proehl | C6: 0.74305555555555547 | E6: =E5+1 -> 5 | F6: Janet Oh | G6: 0.77013888888888893
A7: =A6+1 -> 6 | B7: Bryce Holewinski | C7: 0.74444444444444446 | E7: =E6+1 -> 6 | F7: Sarah Ellis | G7: 0.77083333333333337
A8: =A7+1 -> 7 | B8: Noah Taylor | C8: 0.75 | E8: =E7+1 -> 7 | F8: Jenny Zhuang | G8: 0.77361111111111114
A9: =A8+1 -> 8 | B9: Chris Noren | C9: 0.76180555555555562 | E9: =E8+1 -> 8 | F9: Tara Cowen | G9: 0.78749999999999998
A10: =A9+1 -> 9 | B10: Andrew Flood | C10: 0.7715277777777777 | E10: =E9+1 -> 9 | F10: Lauren Clement | G10: 0.79652777777777783
A11: =A10+1 -> 10 | B11: Matt Stanislawski | C11: 0.77361111111111114 | E11: =E10+1 -> 10 | F11: Mehgie Tabar | G11: 0.79722222222222217
A12: =A11+1 -> 11 | B12: Brian Duong | C12: 0.77708333333333324 | E12: =E11+1 -> 11 | F12: Jing Jing Zhang | G12: 0.81388888888888899
A13: =A12+1 -> 12 | B13: David Carlson | C13: 0.78055555555555556 | E13: =E12+1 -> 12 | F13: Shawna Dolinka | G13: 0.82708333333333339
A14: =A13+1 -> 13 | B14: Aleks Sovovic | C14: 0.78263888888888899 | E14: =E13+1 -> 13 | F14: Veronika Anufreichtk | G14: 0.82916666666666661
A15: =A14+1 -> 14 | B15: Mitchell Brown | C15: 0.79166666666666663 | E15: =E14+1 -> 14 | F15: Ana Vega | G15: 0.85486111111111107
A16: =A15+1 -> 15 | B16: Nick Carmichael | C16: 0.80625000000000002 | E16: =E15+1 -> 15 | F16: Katy Benito | G16: 0.87777777777777777
A17: =A16+1 -> 16 | B17: Aaron Fenlason | C17: 0.85416666666666663 | E17: =E16+1 -> 16 | F17: Chloe Leffas-Lopes | G17: 0.89513888888888893
A18: =A17+1 -> 17 | B18: So Adachi | C18: 0.85555555555555562
A19: =A18+1 -> 18 | B19: Aaron Bercovitch | C19: 0.86875000000000002
A20: =A19+1 -> 19 | B20: David Nelson | C20: 0.87013888888888891
A21: =A20+1 -> 20 | B21: Steven Wancewicz | C21: 0.87777777777777777
A22: =A21+1 -> 21 | B22: Brandon LaVorgna | C22: 0.93680555555555556
A23: =A22+1 -> 22 | B23: Peter Benito | C23: 0.9375
A24: =A23+1 -> 23 | B24: Brent Harvey | C24: 0.98611111111111116
A25: =A24+1 -> 24 | B25: Brett Ramin | C25: 0.98750000000000004

B1: Name | C1: Mile | D1: 2 Mile | E1: Final | F1: Place | G1: Previous
A2: Varsity | B2: Taylor Parker | C2: 0.27638888888888885 | D2: 0.5708333333333333 | E2: 0.73819444444444438 | F2: 66 | G2: 0.75416666666666676 | H2: 1 | I2: Univ City | J2: 64
B3: Allison Leonard | C3: 0.27777777777777779 | D3: 0.57152777777777775 | E3: 0.73958333333333337 | F3: 68 | G3: 0.75694444444444453 | H3: 2 | I3: Valley C. | J3: 126
B4: Niki Marek | C4: 0.27638888888888885 | D4: 0.5708333333333333 | E4: 0.7402777777777777 | F4: 70 | G4: 0.75763888888888886 | H4: 3 | I4: Scripps | J4: 129
B5: Kelley Henry | C5: 0.28055555555555556 | D5: 0.58750000000000002 | E5: 0.76944444444444438 | F5: 89 | G5: 0.77916666666666667
B6: Janet Oh | C6: 0.28958333333333336 | D6: 0.59444444444444444 | E6: 0.77013888888888893 | F6: 90 | G6: 0.78333333333333333 | H6: 15 | I6: RB | J6: 383
B7: Sarah Ellis | C7: 0.28680555555555554 | D7: 0.59166666666666667 | E7: 0.77083333333333337 | F7: 91 | G7: 0.8041666666666667
B8: Mehgie Tabar | C8: 0.28680555555555554 | D8: 0.60972222222222217 | E8: 0.79722222222222217 | F8: 96 | G8: 0.80625000000000002
B9: Name | C9: Mile | D9: 2 Mile | E9: Final | F9: Place | G9: Previous
A10: JV | B10: Jenny Zhuang | C10: 0.3034722222222222 | D10: 0.60069444444444442 | E10: 0.77361111111111114 | F10: 30 | G10: 0.8208333333333333 | H10: 1 | I10: Poway | J10: 31
B11: Tara Cowen | C11: 0.28819444444444448 | D11: 0.60555555555555551 | E11: 0.78749999999999998 | F11: 42 | H11: 2 | I11: Scripps | J11: 83
B12: Lauren Clement | C12: 0.2902777777777778 | D12: 0.60763888888888895 | E12: 0.79652777777777783 | F12: 50 | G12: 0.84097222222222223 | H12: 3 | I12: Vista | J12: 83
B13: Jing Jing Zhang | C13: 0.30833333333333335 | D13: 0.62847222222222221 | E13: 0.81388888888888899 | F13: 65 | G13: 0.84930555555555554 | H13: 4 | I13: Univ City | J13: 86
B14: Shawna Dolinka | C14: 0.32361111111111113 | D14: 0.6381944444444444 | E14: 0.82708333333333339 | F14: 77 | H14: 5 | I14: Ramona | J14: 163
B15: Veronika Anufreichtk | C15: 0.29791666666666666 | D15: 0.63749999999999996 | E15: 0.82916666666666661 | F15: 82 | G15: 0.87361111111111101 | H15: 6 | I15: Fallbrook | J15: 190
B16: Ana Vega | C16: 0.31041666666666667 | D16: 0.65694444444444444 | E16: 0.85486111111111107 | F16: 100 | G16: 0.8534722222222223 | H16: 7 | I16: Diam Bar | J16: 192
B17: Katy Benito | C17: 0.3298611111111111 | D17: 0.67638888888888893 | E17: 0.87777777777777777 | F17: 120 | G17: 0.95277777777777783 | H17: 8 | I17: Westview | J17: 210
B18: Chloe Leffas-Lopes | C18: 0.3298611111111111 | D18: 0.68888888888888899 | E18: 0.89513888888888893 | F18: 129 | G18: 0.95277777777777783 | H18: 9 | I18: RB | J18: 215

C1: name | D1: mile | E1: 2 mile | F1: finish | G1: place | H1: previous
A2: Varisty Boys | B2: 1 | C2: Carl Dargitz | D2: 0.21666666666666667 | E2: 0.44027777777777777 | F2: 0.6972222222222223 | G2: 8 | H2: 0.70486111111111116 | I2: 1 | J2: Poway | K2: 96
A3: 0.15277777777777776 | B3: 2 | C3: Jake Wertner | D3: 0.21666666666666667 | E3: 0.44166666666666665 | F3: 0.6972222222222223 | G3: 7 | H3: 0.74722222222222223 | I3: 2 | J3: Monte Vista | K3: 102
B4: 3 | C4: Colton Tully-Doyle | D4: 0.22222222222222221 | E4: 0.4465277777777778 | F4: 0.70694444444444438 | G4: 20 | H4: 0.7104166666666667 | I4: 3 | J4: RB | K4: 136
B5: 4 | C5: Bryce Holewinski | D5: 0.23194444444444443 | E5: 0.47430555555555554 | F5: 0.74444444444444446 | G5: 54 | H5: 0.84236111111111101 | I5: 4 | J5: SP | K5: 144
B6: 5 | C6: Jared Fenlason | D6: 0.23194444444444443 | E6: 0.47083333333333338 | F6: 0.7416666666666667 | G6: 52 | H6: 0.74722222222222223
B7: 6 | C7: Noah Taylor | D7: 0.23263888888888887 | E7: 0.4770833333333333 | F7: 0.75 | G7: 62 | H7: 0.75486111111111109
B8: 7 | C8: Chris Noren | D8: 0.23402777777777781 | E8: 0.47916666666666669 | F8: 0.76180555555555562 | G8: 79 | H8: 0.74722222222222223
C9: name | D9: mile | E9: 2 mile | F9: finish | G9: place | H9: previous
A10: JV Boy 9-10 | B10: 1 | C10: Sean Proehl | F10: 0.74305555555555547 | G10: 5 | H10: 0.7597222222222223
A11: 0.1875 | B11: 2 | C11: David Carlson | F11: 0.78055555555555556 | G11: 24 | H11: 0.76736111111111116 | I11: 1 | J11: Sweetwater | K11: 71
B12: 3 | C12: Andrew Flood | F12: 0.7715277777777777 | G12: 19 | H12: 0.7715277777777777 | I12: 2 | J12: Chula Vista | K12: 111
B13: 4 | C13: Brian Duong | F13: 0.77708333333333324 | G13: 21 | H13: 0.78055555555555556 | I13: 3 | J13: RB | K13: 113
B14: 5 | C14: So Adachi | F14: 0.85555555555555562 | G14: 96 | H14: 0.83819444444444446 | I14: 4 | J14: Poway | K14: 117
B15: 6 | C15: Aaron Fenlason | F15: 0.85416666666666663 | G15: 92 | H15: 0.8569444444444444 | I15: 5 | J15: Vista | K15: 118
B16: 7 | C16: Nick Carmichael | F16: 0.80625000000000002 | G16: 45 | H16: 0.85972222222222217
B17: 8 | C17: Brent Harvey | F17: 0.98611111111111116 | G17: 161 | H17: 1.0298611111111111
B18: 9 | C18: Peter Benito | F18: 0.9375 | G18: 138 | H18: 0.9784722222222223
B19: 10 | C19: Brett Ramin | F19: 0.98750000000000004 | G19: 162 | H19: 1.0576388888888888
C20: name | D20: mile | E20: 2 mile | F20: finish | G20: place | H20: previous
A21: JV Boy 11-12 | B21: 1 | C21: Mitchell Brown | D21: 0.23472222222222219 | E21: 0.50763888888888886 | F21: 0.79166666666666663 | G21: 20 | H21: 0.8027777777777777 | I21: 1 | J21: Fallbrook | K21: 37
A22: 0.22222222222222221 | B22: 2 | C22: Aleks Sovovic | D22: 0.23819444444444446 | E22: 0.49444444444444446 | F22: 0.78263888888888899 | G22: 14 | H22: 0.79861111111111116 | I22: 2 | J22: Vista | K22: 104
B23: 4 | C23: Brandon LaVorgna | D23: 0.28125 | E23: 0.59305555555555556 | F23: 0.93680555555555556 | G23: 99 | H23: 0.96736111111111101 | I23: 3 | J23: Poway | K23: 112
B24: 5 | C24: David Nelson | D24: 0.26666666666666666 | E24: 0.55277777777777781 | F24: 0.87013888888888891 | G24: 74 | H24: 0.89375000000000004 | I24: 4 | J24: Monte Vista | K24: 117
B25: 6 | C25: Matt Stanislawski | D25: 0.23611111111111113 | E25: 0.48749999999999999 | F25: 0.77361111111111114 | G25: 10 | H25: 0.7895833333333333 | I25: 5 | J25: SP | K25: 119
B26: 7 | C26: Steven Wancewicz | D26: 0.25972222222222224 | E26: 0.55208333333333337 | F26: 0.87777777777777777 | G26: 78 | H26: 0.88611111111111107 | I26: 6 | J26: Diamond Bar | K26: 133
B27: 8 | C27: Aaron Bercovitch | D27: 0.2673611111111111 | E27: 0.55555555555555558 | F27: 0.86875000000000002 | G27: 72 | H27: 0.8881944444444444 | I27: 7 | J27: RB | K27: 138