B1: Boys | C1: FINISH | E1: Girls | F1: FINISH
A2: 1 | B2: Colton Tully-Doyle | C2: 0.68194444444444446 | D2: 1 | E2: Lindsay delaMontaigne | F2: 0.74583333333333324
A3: 2 | B3: Carl Dargitz | C3: 0.68611111111111101 | D3: 2 | E3: Kiyara Iravanian | F3: 0.7715277777777777
A4: 3 | B4: Mike Spitz | C4: 0.71250000000000002 | D4: =D3+1 -> 3 | E4: JANA DRAKE | F4: 0.7270833333333333
A5: =A4+1 -> 4 | B5: Jake Wertner | C5: 0.72152777777777777 | D5: =D4+1 -> 4 | E5: AHNIE DRAPER | F5: 0.73124999999999996
A6: =A5+1 -> 5 | B6: Bryce Holewinski | C6: 0.7368055555555556 | D6: =D5+1 -> 5 | E6: KIRI GELHARD | F6: 0.74861111111111112
A7: =A6+1 -> 6 | B7: Chris Noren | C7: 0.73750000000000004 | D7: =D6+1 -> 6 | E7: CARLY BLISS | F7: 0.75763888888888886
A8: =A7+1 -> 7 | B8: Noah Taylor | C8: 0.7416666666666667 | D8: =D7+1 -> 7 | E8: ALLISON LEONARD | F8: 0.77013888888888893
A9: =A8+1 -> 8 | B9: Sean Proehl | C9: 0.74583333333333324 | D9: =D8+1 -> 8 | E9: TAYLOR PARKER | F9: 0.77777777777777779
A10: =A9+1 -> 9 | B10: Jared Fenlason | C10: 0.75416666666666676 | D10: =D9+1 -> 9 | E10: NIKI MAREK | F10: 0.79583333333333328
A11: =A10+1 -> 10 | B11: David Carlson | C11: 0.76041666666666663 | D11: =D10+1 -> 10 | E11: KELLEY HENRY | F11: 0.7993055555555556
A12: =A11+1 -> 11 | B12: Andrew Flood | C12: 0.7715277777777777 | D12: =D11+1 -> 11 | E12: SARAH ELLIS | F12: 0.81111111111111112
A13: =A12+1 -> 12 | B13: Brian Doung | C13: 0.78194444444444444 | D13: =D12+1 -> 12 | E13: VERONIKA ANUFREICHTK | F13: 0.83333333333333337
A14: =A13+1 -> 13 | B14: Alek Savovic | C14: 0.78263888888888899 | D14: =D13+1 -> 13 | E14: TARA COWEN | F14: 0.85902777777777772
A15: =A14+1 -> 14 | B15: Mitch Brown | C15: 0.78333333333333333 | D15: =D14+1 -> 14 | E15: ALYSSA DAULT | F15: 0.86944444444444446
A16: =A15+1 -> 15 | B16: Hiroki Sekine | C16: 0.78680555555555554 | D16: =D15+1 -> 15 | E16: JENNY ZHUANG | F16: 0.87361111111111112
A17: =A16+1 -> 16 | B17: Aaron Fenlason | C17: 0.79583333333333339 | D17: =D16+1 -> 16 | E17: DANA SCHAFFER | F17: 0.87847222222222221
A18: =A17+1 -> 17 | B18: Matt Stanislawski | C18: 0.81666666666666676 | D18: =D17+1 -> 17 | E18: ANA VEGA | F18: 0.90486111111111112
A19: =A18+1 -> 18 | B19: Josh Gill | C19: 0.82847222222222217 | D19: =D18+1 -> 18 | E19: LAUREN CLEMENT | F19: 0.92777777777777781
A20: =A19+1 -> 19 | B20: So Adachi | C20: 0.83194444444444438 | D20: =D19+1 -> 19 | E20: KATY BENITO | F20: 0.93888888888888888
A21: =A20+1 -> 20 | B21: Garrett Yagade | C21: 0.84375 | D21: =D20+1 -> 20 | E21: CHLOE LEFFAS-LOPES | F21: 0.94166666666666665
A22: =A21+1 -> 21 | B22: Yu Jiang Tham | C22: 0.86458333333333337 | D22: =D21+1 -> 21 | E22: KIRSTEN OSZ | F22: 24:42
A23: =A22+1 -> 22 | B23: David Nelson | C23: 0.89583333333333337 | D23: =D22+1 -> 22 | E23: PAISLEY EDDY | F23: 25:15
A24: =A23+1 -> 23 | B24: Nick Carmichael | C24: 0.89930555555555547
A25: =A24+1 -> 24 | B25: Will Sommervell | C25: 0.9472222222222223
A26: =A25+1 -> 25 | B26: Peter Benito | C26: 0.95833333333333337
A27: =A26+1 -> 26 | B27: Brandon Lavorgna | C27: 0.97499999999999998
A28: =A27+1 -> 27 | B28: Chris Loughlin | C28: 0.99305555555555547
A29: =A28+1 -> 28 | B29: Brent Harvey | C29: 1.0673611111111112
A30: =A29+1 -> 29 | B30: Brett Ramin | C30: 1.0673611111111112

A1: 12:15 FROSH BOYS | C1: 1.0 MILE | D1: 2.0 MILE | E1: FINISH | F1: PLACE
A2: 1 | B2: Sean Proehl | C2: 0.24097222222222223 | D2: 0.50208333333333333 | E2: 0.74583333333333324 | F2: 11
A3: 2 | B3: Andrew Flood | C3: 0.24097222222222223 | D3: 0.50277777777777777 | E3: 0.7715277777777777 | F3: 16
A4: 3 | B4: Aaron Fenlason | C4: 0.26319444444444445 | D4: 0.54166666666666663 | E4: 0.79583333333333339 | F4: 33
A5: 4 | B5: Garrett Yagade | C5: 0.27638888888888885 | D5: 0.57499999999999996 | E5: 0.84375 | F5: 59
A6: 5 | B6: Peter Benito | C6: 0.2986111111111111 | D6: 0.63541666666666663 | E6: 0.95833333333333337
A7: 6 | B7: Chris Loughlin | C7: 0.28958333333333336 | D7: 0.6430555555555556 | E7: 0.99305555555555547
A8: 7 | B8: Nick Carmichael | C8: 0.28472222222222221 | D8: 0.59375 | E8: 0.89930555555555547
A9: 8 | B9: Brent Harvey | C9: 0.31944444444444448 | D9: 0.71527777777777779 | E9: 1.0673611111111112
A10: 1:05 SOPH BOYS | C10: 1.0 MILE | D10: 2.0 MILE | E10: FINISH | F10: PLACE
A11: 1 | B11: Jake Wertner | C11: 0.2298611111111111 | D11: 0.48472222222222222 | E11: 0.72152777777777777 | F11: 17
A12: 2 | B12: Bryce Holewinski | C12: 0.2298611111111111 | D12: 0.48888888888888887 | E12: 0.7368055555555556 | F12: 30
A13: 3 | B13: Jared Fenlason | C13: 0.23541666666666669 | D13: 0.50555555555555554 | E13: 0.75416666666666676 | F13: 46
A14: 4 | B14: Brian Doung | C14: 0.24652777777777779 | D14: 0.51666666666666672 | E14: 0.78194444444444444 | F14: 58
A15: 5 | B15: David Carlson | C15: 0.24305555555555555 | D15: 0.51041666666666663 | E15: 0.76041666666666663 | F15: 51
A16: 6 | B16: So Adachi | C16: 0.25972222222222224 | D16: 0.55138888888888882 | E16: 0.83194444444444438
A17: 7 | B17: Will Somervell | C17: 0.29236111111111113 | D17: 0.6430555555555556 | E17: 0.9472222222222223
A18: 8 | B18: Brett Ramin | C18: 0.3263888888888889 | D18: 0.71527777777777779 | E18: 1.0673611111111112
A19: 1:55 JR. BOYS | C19: 1.0 MILE | D19: 2.0 MILE | E19: FINISH | F19: PLACE
A20: 1 | B20: Carl Dargitz | C20: 0.21388888888888891 | D20: 0.45624999999999999 | E20: 0.68611111111111101 | F20: 13
A21: 2 | B21: Colton Tully-Doyle | C21: 0.21388888888888891 | D21: 0.4548611111111111 | E21: 0.68194444444444446 | F21: 10
A22: 3 | B22: Chris Noren | C22: 0.2298611111111111 | D22: 0.48819444444444443 | E22: 0.73750000000000004 | F22: 49
A23: 4 | B23: Josh Gill | C23: 0.24652777777777779 | D23: 0.54583333333333328 | E23: 0.82847222222222217
A24: 5 | B24: Matt Stanislawski | C24: 0.24652777777777779 | D24: 0.54305555555555551 | E24: 0.81666666666666676
A25: 6 | B25: David Nelson | C25: 0.26874999999999999 | D25: 0.58888888888888891 | E25: 0.89583333333333337
A26: 9 | B26: Brandon Lavorgna | C26: 0.28541666666666665 | D26: 0.64166666666666672 | E26: 0.97499999999999998
A27: 2:45 SR. BOYS | C27: 1.0 MILE | D27: 2.0 MILE | E27: FINISH | F27: PLACE
A28: 1 | B28: Mike Spitz | C28: 0.22638888888888889 | D28: 0.48125000000000001 | E28: 0.71250000000000002 | F28: 30
A29: 2 | B29: Noah Taylor | C29: 0.22708333333333333 | D29: 0.48749999999999999 | E29: 0.7416666666666667 | F29: 54
A30: 3 | B30: Alek Savovic | C30: 0.24444444444444446 | D30: 0.52013888888888882 | E30: 0.78263888888888899
A31: 4 | B31: Hiroki Sekine | C31: 0.24444444444444446 | D31: 0.52083333333333337 | E31: 0.78680555555555554
A32: 5 | B32: Yu Jiang Tham | C32: 0.26874999999999999 | D32: 0.57638888888888895 | E32: 0.86458333333333337
A33: 6 | B33: Mitch Brown | C33: 0.24444444444444446 | D33: 0.52708333333333335 | E33: 0.78333333333333333