A1: DIVISION 1 BOYS TEAM STANDINGS
B2: #1 | C2: #2 | D2: #3 | E2: #4 | F2: #5 | G2: #6 | H2: #7 | I2: TEAM
A3: 1El Camino | B3: 1.0625000000000001E-2 | C3: 1.0891203703703703E-2 | D3: 1.1527777777777777E-2 | E3: 1.1701388888888891E-2 | F3: 1.1851851851851851E-2 | G3: 1.1724537037037035E-2 | H3: 1.1956018518518517E-2 | I3: =SUM(B3:H3) -> 8.0277777777777781E-2
A4: 2Poway | B4: 1.1388888888888888E-2 | C4: 1.1574074074074075E-2 | D4: 1.1863425925925925E-2 | E4: 1.207175925925926E-2 | F4: 1.2349537037037039E-2 | G4: 1.2222222222222223E-2 | H4: 1.238425925925926E-2 | I4: =SUM(B4:H4) -> 8.3854166666666674E-2
A5: 3San Pasqual | B5: 1.1493055555555555E-2 | C5: 1.1666666666666667E-2 | D5: 1.2025462962962962E-2 | E5: 1.2106481481481482E-2 | F5: 1.2395833333333335E-2 | G5: 1.2511574074074073E-2 | H5: 1.2604166666666666E-2 | I5: 2:02:10.3
A6: 4Rancho Bernardo | B6: 1.1655092592592594E-2 | C6: 1.1967592592592592E-2 | D6: 1.2256944444444444E-2 | E6: 1.1666666666666667E-2 | F6: 1.2222222222222223E-2 | G6: 1.2430555555555554E-2 | H6: 1.2592592592592593E-2 | I6: 2:02:10.9

A1: DIVISION 1 GIRLS TEAM STANDINGS
B2: #1 | C2: #2 | D2: #3 | E2: #4 | F2: #5 | G2: #6 | H2: #7 | I2: TEAM
A3: 1La Costa Canyon | B3: 1.005787037037037E-2 | C3: 1.0138888888888888E-2 | D3: 1.0636574074074074E-2 | E3: 1.091435185185185E-2 | F3: 1.0925925925925924E-2 | G3: 1.1145833333333334E-2 | H3: 1.119212962962963E-2 | I3: =SUM(B3:H3) -> 7.5011574074074064E-2 | J3: 1st Place
A4: 2Rancho Bernardo | B4: 1.0150462962962964E-2 | C4: 1.0625000000000001E-2 | D4: 1.105324074074074E-2 | E4: 1.074074074074074E-2 | F4: 1.0937499999999999E-2 | G4: 1.0694444444444444E-2 | H4: 1.1284722222222222E-2 | I4: =SUM(B4:H4) -> 7.5486111111111101E-2 | J4: 2nd Place
A5: 3El Camino | B5: 1.0138888888888888E-2 | C5: 1.0300925925925927E-2 | D5: 1.082175925925926E-2 | E5: 1.1377314814814814E-2 | F5: 1.1377314814814814E-2 | G5: 1.1041666666666667E-2 | H5: 1.1539351851851851E-2 | I5: =SUM(B5:H5) -> 7.6597222222222219E-2 | J5: 3rd Place
A6: 4Poway | B6: 1.050925925925926E-2 | C6: 1.0983796296296297E-2 | D6: 1.1076388888888887E-2 | E6: 1.0706018518518517E-2 | F6: 1.1238425925925928E-2 | G6: 1.1226851851851854E-2 | H6: 1.1388888888888888E-2 | I6: =SUM(B6:H6) -> 7.7129629629629631E-2

B1: SoCal 2004
B2: name | C2: 1 mile | D2: Finish | E2: place | F2: previous
A3: 1 | B3: Lindsay DelaMontainge | C3: 0.24513888888888888 | D3: 0.60902777777777783 | E3: 3 | F3: 0.59722222222222221
A4: 2 | B4: Kiyara Iravanian | C4: 0.24930555555555556 | D4: 0.63749999999999996 | E4: 5 | F4: 0.65
A5: 3 | B5: Ahnie Draper | C5: 0.25694444444444448 | D5: 0.66319444444444442 | E5: 6 | F5: 0.63958333333333328
A6: 4 | B6: Jana Drake | C6: 0.25347222222222221 | D6: 0.64444444444444449 | E6: 2 | F6: 0.67500000000000004
A7: 5 | B7: Krista Egense | C7: 0.26527777777777778 | D7: 0.65625 | E7: 2
A8: 6 | B8: Carly Bliss | C8: 0.24861111111111112 | D8: 0.64166666666666672 | E8: 1 | F8: 0.6777777777777777
A9: 7 | B9: Kerry Sonnenburg | C9: 0.2673611111111111 | D9: 0.67708333333333337 | E9: 2 | F9: 0.67500000000000004
B13: name | C13: 1 mile | D13: Finish | E13: place | F13: previous
A14: 1 | B14: Carl Dargitz | C14: 0.21111111111111111 | D14: 0.69930555555555562 | E14: 9 | F14: 0.72916666666666663
A15: 2 | B15: Colton Tully-Dolye | C15: 0.21458333333333335 | D15: 0.71805555555555556 | E15: 7 | F15: 0.74861111111111101
A16: 3 | B16: Mike Spitz | C16: 0.22013888888888888 | D16: 0.73541666666666661 | E16: 7 | F16: 0.75763888888888886
A17: 4 | B17: Jake Wertner | C17: 0.21597222222222223 | D17: 0.7 | E17: 1
A18: 5 | B18: Bryce Holewinski | C18: 0.22222222222222221 | D18: 0.73333333333333339 | E18: 2
A19: 6 | B19: Jared Fenlason | C19: 0.22361111111111109 | D19: 0.75555555555555554 | E19: 7
A20: 7 | B20: Chris Noren | C20: 0.22500000000000001 | D20: 0.74583333333333324 | E20: 6