A1: Name | B1: Final | D1: Name | E1: Final
A2: Taylor Parker | B2: 0.75416666666666676 | D2: Noah Taylor | E2: 0.75486111111111109
A3: Allison Leonard | B3: 0.75694444444444453 | D3: Sean Proehl | E3: 0.7597222222222223
A4: Niki Marek | B4: 0.75763888888888886 | D4: David Carlson | E4: 0.76736111111111116
A5: Kelley Henry | B5: 0.77916666666666667 | D5: Andrew Flood | E5: 0.7715277777777777
A6: Janet Oh | B6: 0.78333333333333333 | D6: Brian Duong | E6: 0.78055555555555556
A7: Sarah Ellis | B7: 0.8041666666666667 | D7: Matt Stanislawski | E7: 0.7895833333333333
A8: Mehgie Tabar | B8: 0.80625000000000002 | D8: Aleks Sovovic | E8: 0.79861111111111116
A9: Jenny Zhuang | B9: 0.8208333333333333 | D9: Josh Gill | E9: 0.80138888888888893
A10: Lauren Clement | B10: 0.84097222222222223 | D10: Mitchell Brown | E10: 0.8027777777777777
A11: Jing Jing Zhang | B11: 0.84930555555555554 | D11: Hiroki Sekine | E11: 0.80486111111111114
A12: Ana Vega | B12: 0.8534722222222223 | D12: So Adachi | E12: 0.83819444444444446
A13: Veronika Anufreichtk | B13: 0.87361111111111101 | D13: Joseph Hunter | E13: 0.85277777777777775
A14: Lauren Parker | B14: 0.95138888888888884 | D14: Yu Jiang Tham | E14: 0.85416666666666663
A15: Chloe Leffas-Lopes | B15: 0.95277777777777783 | D15: Aaron Fenlason | E15: 0.8569444444444444
A16: Katy Benito | B16: 0.95277777777777783 | D16: Nick Carmichael | E16: 0.85972222222222217
D17: Garrett Yagade | E17: 0.86805555555555547
D18: Steven Wancewicz | E18: 0.88611111111111107
D19: Aaron Bercovitch | E19: 0.8881944444444444
D20: David Nelson | E20: 0.89375000000000004
D21: Brandon LaVorgna | E21: 0.96736111111111101
D22: Peter Benito | E22: 0.9784722222222223
D23: Chris Loughlin | E23: 1.0041666666666667
D24: Brent Harvey | E24: 1.0298611111111111
D25: Danny Nelson | E25: 1.0347222222222221
D26: Brett Ramin | E26: 1.0576388888888888

A1: Name | B1: Mile | C1: 2 Mile | D1: Final | E1: Place | F1: previous | G1: improvement
A2: Taylor Parker | B2: 0.27500000000000002 | C2: 0.57291666666666663 | D2: 0.75416666666666676 | E2: 2
A3: Allison Leonard | B3: 0.27777777777777779 | C3: 0.57916666666666672 | D3: 0.75694444444444453 | E3: 3 | F3: 0.78611111111111109 | G3: =F3-D3 -> 2.9166666666666563E-2
A4: Niki Marek | B4: 0.27777777777777779 | C4: 0.57916666666666672 | D4: 0.75763888888888886 | E4: 4
A5: Kelley Henry | B5: 0.27777777777777779 | C5: 0.59166666666666667 | D5: 0.77916666666666667 | E5: 5
A6: Janet Oh | B6: 0.29444444444444445 | C6: 0.60416666666666663 | D6: 0.78333333333333333 | E6: 6 | F6: 0.86388888888888893 | G6: =F6-D6 -> 8.0555555555555602E-2
A7: Sarah Ellis | B7: 0.29166666666666669 | C7: 0.61388888888888882 | D7: 0.8041666666666667 | E7: 8
A8: Mehgie Tabar | B8: 0.29166666666666669 | C8: 0.61388888888888882 | D8: 0.80625000000000002 | E8: 9
A9: Jenny Zhuang | B9: 0.30069444444444443 | C9: 0.62986111111111109 | D9: 0.8208333333333333 | E9: 12
A10: Lauren Clement | B10: 0.2986111111111111 | C10: 0.63749999999999996 | D10: 0.84097222222222223 | E10: 13
A11: Jing Jing Zhang | B11: 0.30763888888888891 | C11: 0.65277777777777779 | D11: 0.84930555555555554 | E11: 14
A12: Ana Vega | B12: 0.30972222222222223 | C12: 0.64930555555555558 | D12: 0.8534722222222223 | E12: 15 | F12: 0.8833333333333333 | G12: =F12-D12 -> 2.9861111111111005E-2
A13: Veronika Anufreichtk | B13: 0.32291666666666669 | C13: 0.66805555555555562 | D13: 0.87361111111111101 | E13: 16
A14: Lauren Parker | B14: 0.3347222222222222 | D14: 0.95138888888888884 | E14: 17
A15: Chloe Leffas-Lopes | B15: 0.34930555555555554 | D15: 0.95277777777777783 | E15: 18
A16: Katy Benito | B16: 0.34930555555555554 | D16: 0.95277777777777783 | E16: 19 | F16: 0.94097222222222221

B1: name | C1: 1 mile | D1: 2 mile | E1: Finish | F1: Last year | G1: improvement
A2: 1 | B2: Noah Taylor | C2: 0.22847222222222222 | D2: 0.47499999999999998 | E2: 0.75486111111111109 | F2: 0.8027777777777777 | G2: =F2-E2 -> 4.7916666666666607E-2
A3: =A2+1 -> 2 | B3: Mitchell Brown | C3: 0.24861111111111112 | D3: 0.51527777777777783 | E3: 0.8027777777777777 | F3: 0.8340277777777777 | G3: =F3-E3 -> 3.125E-2
A4: =A3+1 -> 3 | B4: Hiroki Sekine | C4: 0.24444444444444446 | D4: 0.50763888888888886 | E4: 0.80486111111111114 | F4: 0.85 | G4: =F4-E4 -> 4.513888888888884E-2
A5: =A4+1 -> 4 | B5: Josh Gill | C5: 0.24444444444444446 | D5: 0.50277777777777777 | E5: 0.80138888888888893 | F5: 0.85624999999999996 | G5: =F5-E5 -> 5.4861111111111027E-2
A6: =A5+1 -> 5 | B6: Brian Duong | C6: 0.24444444444444446 | D6: 0.49375000000000002 | E6: 0.78055555555555556 | F6: 0.86111111111111116 | G6: =F6-E6 -> 8.0555555555555602E-2
A7: =A6+1 -> 6 | B7: Joseph Hunter | C7: 0.25833333333333336 | D7: 0.54097222222222219 | E7: 0.85277777777777775 | F7: 0.91874999999999996 | G7: =F7-E7 -> 6.597222222222221E-2
A8: =A7+1 -> 7 | B8: So Adachi | C8: 0.25694444444444448 | D8: 0.52847222222222223 | E8: 0.83819444444444446 | F8: 0.93680555555555556 | G8: =F8-E8 -> 9.8611111111111094E-2
A9: =A8+1 -> 8 | B9: Steven Wancewicz | C9: 0.27083333333333331 | D9: 0.55555555555555558 | E9: 0.88611111111111107 | F9: 0.95 | G9: =F9-E9 -> 6.3888888888888884E-2
A10: =A9+1 -> 9 | B10: David Carlson | C10: 0.23402777777777781 | D10: 0.48541666666666666 | E10: 0.76736111111111116 | F10: 0.97361111111111109 | G10: =F10-E10 -> 0.20624999999999999
A11: =A10+1 -> 10 | B11: Brandon LaVorgna | C11: 0.29166666666666669 | D11: 0.59861111111111109 | E11: 0.96736111111111101 | F11: 1.0416666666666667 | G11: =F11-E11 -> 7.4305555555555736E-2
A12: =A11+1 -> 11 | B12: Aaron Bercovitch | C12: 0.2722222222222222 | D12: 0.56458333333333333 | E12: 0.8881944444444444 | F12: 1.163888888888889 | G12: =F12-E12 -> 0.27569444444444458
A13: =A12+1 -> 12 | B13: Brett Ramin | C13: 0.32500000000000001 | D13: 0.65694444444444444 | E13: 1.0576388888888888 | F13: 1.377777777777778 | G13: =F13-E13 -> 0.32013888888888919
A14: =A13+1 -> 13 | B14: Sean Proehl | C14: 0.23611111111111113 | D14: 0.4826388888888889 | E14: 0.7597222222222223
A15: =A14+1 -> 14 | B15: Andrew Flood | C15: 0.23819444444444446 | D15: 0.4861111111111111 | E15: 0.7715277777777777
A16: =A15+1 -> 15 | B16: Matt Stanislawski | C16: 0.24097222222222223 | D16: 0.49652777777777773 | E16: 0.7895833333333333
A17: =A16+1 -> 16 | B17: Aleks Sovovic | C17: 0.24374999999999999 | D17: 0.50486111111111109 | E17: 0.79861111111111116
A18: =A17+1 -> 17 | B18: Yu Jiang Tham | C18: 0.25694444444444448 | D18: 0.54027777777777775 | E18: 0.85416666666666663
A19: =A18+1 -> 18 | B19: Aaron Fenlason | C19: 0.26527777777777778 | D19: 0.55069444444444449 | E19: 0.8569444444444444
A20: =A19+1 -> 19 | B20: Nick Carmichael | C20: 0.26805555555555555 | D20: 0.54236111111111118 | E20: 0.85972222222222217
A21: =A20+1 -> 20 | B21: Garrett Yagade | C21: 0.27708333333333335 | D21: 0.55347222222222225 | E21: 0.86805555555555547
A22: =A21+1 -> 21 | B22: David Nelson | C22: 0.2722222222222222 | D22: 0.56458333333333333 | E22: 0.89375000000000004
A23: =A22+1 -> 22 | B23: Peter Benito | C23: 0.27361111111111108 | D23: 0.59444444444444444 | E23: 0.9784722222222223
A24: =A23+1 -> 23 | B24: Chris Loughlin | C24: 0.29444444444444445 | D24: 0.60486111111111118 | E24: 1.0041666666666667
A25: =A24+1 -> 24 | B25: Brent Harvey | C25: 0.31597222222222221 | D25: 0.65 | E25: 1.0298611111111111
A26: =A25+1 -> 25 | B26: Danny Nelson | C26: 0.30277777777777776 | D26: 0.64583333333333337 | E26: 1.0347222222222221